아이디,리뷰어 등급,작성 날짜,옵션1,옵션2,상품 사이즈,퀄리티,색감,키,몸무게,사이즈,리뷰내용
ZmyJPlBJ,상위 30%,24.12.08,아이보리(긴팔ver.),F(44~77),정사이즈예요,아주 만족해요,화면과 비슷해요,165cm,50kg,상의 44,제품 자체는 좋은데 뒤쪽에 작은 검정 오염 같은게 묻어왔었습니다! 다음 검수 때는 한 번 더 확인해 주시면 좋을 것 같고 어차피 세탁하고 입을 거라 별 상관없을 것 같긴 해요 :) 잘 입겠습니다!
26pGlQID,,24.12.07,아이보리(긴팔-U넥(기모ver.)),F(44~77),정사이즈예요,보통이에요,화면과 비슷해요,169cm,30kg 이하,상의 33 이하,"음 난 회색을 샀는데 내가 생각했던 회색은 아니워서 살짝 아쉬운 느낌 .. 이건 무슨색이지 .. 흠
블랙 화이트는 생각 했던 그대로
질이나 뭐 그런건 이너티로 잘 입을수 있을거같아용"
26pGlQID,,24.12.07,블랙(긴팔-U넥(기모ver.)),F(44~77),정사이즈예요,보통이에요,화면과 비슷해요,169cm,30kg 이하,상의 33 이하,"음 난 회색을 샀는데 내가 생각했던 회색은 아니워서 살짝 아쉬운 느낌 .. 이건 무슨색이지 .. 흠
블랙 화이트는 생각 했던 그대로
질이나 뭐 그런건 이너티로 잘 입을수 있을거같아용"
Qmr2jOmu,,24.12.06,아이보리(긴팔-U넥(기모ver.)),F(44~77),정사이즈예요,아주 만족해요,화면과 비슷해요,165cm,54kg,상의 55,"저 리뷰 진짜 안 쓰는데 이거 진짜 좋아요..
이거 사고 거의 매일 입습니다
촉감에 예민한데 까슬거리는 거 하나 없고..
두께가 얇지도 두껍지도 않아서 안에 받쳐입기 진짜 개좋음 아진짜나믿고한번만사봐
팔이랑 총장도 딱 적당해요 
이거 사서 입고 다니다가 검은색도 하나 더 샀어요 
저진짜재구매도잘안하거든요한번만잡숴봐"
srSZrhIe,상위 10%,24.12.06,아이보리(긴팔(기모ver.)),F(44~77),정사이즈예요,아주 만족해요,화면과 비슷해요,163cm,50kg,상의 55,왜 인기가 많은 지 알겠어요~ 보통 두께가 얇으면서 기모가 아주 살짝 들어가 있는 제품들이 많은데 이건 기본적으로 적당히 두께감도 있고 기모도 약간 있어서 딱 좋습니다~ 배송이 많아 느려질 줄 알았는데 생각보단 빨리 왔네요~ 다음엔 U넥으로 사려구요!
pZpgVtCH,,24.12.05,그레이(긴팔(기모ver.)),F(44~77),정사이즈예요,아주 만족해요,화면과 비슷해요,160cm,49kg,상의 55,역시 사람들이 많이 사는 데는 이유가 있군요… 기모라서 그런지 따뜻하고 그렇다고 생각보다 두껍지도 않아요. 그래서 핏이 망가지지 않는 거 같애요 ! 보 돌보 돌 해서 착용감도 좋구요. 아주 만족합니다.
dunhydOR,상위 20%,24.12.04,민트(긴팔-U넥(기모ver.)),F(44~77),정사이즈예요,보통이에요,화면과 비슷해요,168cm,60kg,상의 55,존예에요 아 하나를 u자 아닌 걸로 잘못시켜서 다시 반품 했는데 무조건 다시시키려구요 저는 무조건 u자가 이쁜 것 같아요 ㅜㅜ 핏존예구 색감도 이뽀요
zSNaWEWD,,24.12.03,블랙(긴팔-U넥ver.),F(44~77),정사이즈예요,아주 만족해요,화면과 비슷해요,166cm,66kg,상의 66,너무 좋아요!! 얇아보이는데 입고 다니니까 따뜻함 차이가 느껴지고 얇고 부드러워서 티 안에 입어도 좋아요 ㅎㅎ 다음에는 흰색으로도 살까 고민중입니다
연년생시녀,상위 5%,24.12.03,아이보리(긴팔ver.),F(44~77),정사이즈예요,아주 만족해요,화면과 비슷해요,163cm,59kg,상의 55,"건조기 가능이라 해서 막입으려고 샀는데,
배송받자마자 소중해졌어요. 
너무 부드러워서 계속 만지게 되네요. 
너무 붙지도 않고 너무 헐렁하지도 않아서 입기 딱 좋아요."
IeePYs7z,상위 25%,24.12.03,스카이블루(긴팔-U넥ver.),F(44~77),정사이즈예요,아주 만족해요,화면과 비슷해요,160cm,56kg,상의 55,"너무너무 만족한 기본 이너티에요!! 얼굴이 동그란 편이라 유넥으로 했고, 팔뚝 약간 통통한데 팔뚝 부각 잘 안돼서 좋아요!!ㅎㅎㅎ
처음에 흰색 검은색했는데 너무 만족햐서 아이보리 하늘색도 샀어여!! 세탁하고 건조기했는데도 줄어들지 않고 딱좋아요!! 목이 약간 쭈글햐지는데 그냥 입고다니면 원래대로 돌아옵니당!!
기본티 완전 추천이에여!!"
AhYenjjY,,24.12.02,아이보리(긴팔ver.),F(44~77),정사이즈예요,아주 만족해요,화면과 비슷해요,160cm,47kg,상의 55,"두 장씩 쟁여야 할 티셔츠입니다
소재도 부드럽고 무엇보다 목 시보리가 짱짱해서 늘어남 걱정 없을 것 같아요
티셔츠 살 때 목 늘어남이 싫어서 꼼꼼히 보는 편인데 이건 입자마자 추가구매 하려고 장바구니 담아뒀어요 
두께감은 생각보다 마냥 얇지 않아서 여러겹 껴입을 때 히트택 대체이너로 입기 좋을 것 같아요"
ji**,상위 20%,24.12.02,핑크(긴팔(기모ver.)),F(44~77),정사이즈예요,아주 만족해요,화면과 비슷해요,162cm,64kg,상의 77,"이너 필수템이에요.
U넥 사서 잘입었고, 추워져서 추가로 샀어요.
어떤 옷이든 이너로 필요해서 더 사려구요.

촉감 비교해보려고 일반긴팔이랑 기모 샀는데 촉감은 비슷하고, 약간 두툼한 정도에요."
ji**,상위 20%,24.12.02,아이보리(긴팔ver.),F(44~77),정사이즈예요,아주 만족해요,화면과 비슷해요,162cm,64kg,상의 77,"이너 필수템이에요.
U넥 사서 잘입었고, 추워져서 추가로 샀어요.
어떤 옷이든 이너로 필요해서 더 사려구요.

촉감 비교해보려고 일반긴팔이랑 기모도 샀는데 촉감은 비슷하고, 약간 얇은 정도에요."
gLsEO2CL,,24.12.02,아이보리(긴팔ver.),F(44~77),정사이즈예요,아주 만족해요,화면과 비슷해요,,,,"기모시키려다 일반으로 잘못시켰는데
단독으로 입었을 때 쫀쫀하고 목도 안늘어나는 재질이라
더 잘입을거같아요! 목이 높이올라오는 편이라
오히려 기모시켰으면 답답했을지도?"
M7gOIgIs,상위 20%,24.12.01,아이보리(긴팔(기모ver.)),F(44~77),정사이즈예요,아주 만족해요,화면과 비슷해요,160cm,50kg,상의 55,"너무 만족해요 !안에 이너로 입기 너무 좋고 사이즈도 딱 적당하고 기모로 따뜻해서 자주 애용하고닛어오 
다른 색산도 살려구요 !!!"
OFnZmkvg,,24.12.01,아이보리(긴팔(기모ver.)),F(44~77),정사이즈예요,보통이에요,화면과 비슷해요,161cm,53kg,상의 66,몸통 길이...? 그 부분이 조금 짧아서 저는 바지 속에 넣어입어도 계속 빠지더라구요 앉으면 그냥 빠져요 그치만 재질도 보들보들하고 얇은 것 같은데 따뜻해서 괜찮았어요! 짧은 부분만 괜찮았으면 정말 딱이였을 텐데ㅠㅠ
SOJHGZuS,,24.12.01,아이보리(긴팔(기모ver.)),F(44~77),정사이즈예요,별로예요,화면과 비슷해요,161cm,53kg,상의 55,목쪽 마감이 이상하대서 설마 내꺼도 그럴까? 하는 마음으로 시켰는데 제것도 그렇네요 ㅋㅋㅋ 목쪽이 붕 떠있음.. 그냥 싼마이 이너로 대충 입을때 입기 좋을만한?? 면은 진짜 부드럽고 쫀쫀하니 좋은데 목이 문제..
6X2Fsq17,상위 15%,24.11.30,크림(긴팔(기모ver.)),F(44~77),정사이즈예요,보통이에요,화면과 비슷해요,155cm,40kg,상의 44,기모가 있는 듯 없는 듯 해서 단독으론 추울 것 같아요ㅠㅠ 털도 은근 잘 빠짐... 쫀쫀한데 팔 쪽이 약간 까슬... 색은 상아빛? 아이보리 색입니다
j5q5EqQH,상위 25%,24.11.30,블랙(긴팔-U넥(기모ver.)),F(44~77),정사이즈예요,별로예요,화면과 비슷해요,155cm,52kg,상의 55,"겨울 이너티 찾다가 구매했어요
라운드넥은 목이 좁을거같아 유넥으로 샀는데 처음엔 너무 파였나싶었는데 입다보니 맘에 들더라구요
블랙은 세탁할땐 몰랐는데 입으니까 검은먼지들이 이너에 다붙더라고요.."
joal*****,상위 30%,24.11.29,아이보리(긴팔(기모ver.)),F(44~77),정사이즈예요,아주 만족해요,화면과 비슷해요,159cm,50kg,상의 55,겨울에 따뜻하게 입을 이너티를 구매했는데 재질도 너무 좋고 안에 기모가 있어서 따뜻하게 잘 입고 있어서 색깔별로 재구매 하려구요!!!!
7Bh5OvMN,상위 25%,24.11.29,핑크(긴팔-U넥(기모ver.)),F(44~77),생각보다 커요,보통이에요,화면보다 어두워요,164cm,57kg,,기모가… 거의 없어요.. 그리고 좀 박시한 느낌? 반팔 사고 맘에들어서 산건데 기모가 좀 아쉽네요..ㅠㅡㅠ 입어보고 따뜻하면 다행~~ 여유로운핏임
XZbzTLcs,상위 25%,24.11.29,아이보리(긴팔-U넥(기모ver.)),F(44~77),생각보다 커요,아주 만족해요,화면과 비슷해요,155cm,48kg,상의 55,너무 핏되는 느낌도 아니고 원단도 탄탄해서 이번 겨울 잘 입을거같아요~~ 넥라인이 유독 예쁜 티네요~! 속옷끈이 자칫하면 보일 수 있으니 신경써야하는 것 빼면 완벽합니다 매년 봄에 기모없는 버전 사입게 품절시키지마세요 ㅠㅠㅠ
6StVlBWy,,24.11.28,블랙(긴팔(기모ver.)),F(44~77),정사이즈예요,아주 만족해요,화면과 비슷해요,159cm,60kg,상의 55,"기모가 도톰하진 않지만 적당한 두께감이라 레이어드 해서 입으면 정말 따뜻할것같아요
또 배에 완전 딱 붙진 않아서 단독으로 입는것도 가능할것같아요~ 세탁도 해보고 줄어듦이나 보풀 등등 보고 재구매하려구요"
3XjFJiLn,상위 30%,24.11.28,아이보리(긴팔-U넥ver.),F(44~77),정사이즈예요,보통이에요,화면과 비슷해요,165cm,60kg,상의 66,사실 기본템이라 크게 좋다 안 좋다 할 건 없어용 갑자기 날씨가 추워져서 기모살 껄 그랫나 후회도 되네용 봄 가을 이너로 입기 좋을 듯용
Afc5aPIx,상위 30%,24.11.28,크림(긴팔ver.),F(44~77),정사이즈예요,아주 만족해요,화면과 비슷해요,,,,진짜 핏 너무 좋고 상체 살 커버 다되는데 색깔을 잘못시켜서 하나 더 샀습니다 ㅋㅋㅋㅋ 그정도로 가격에 비해 질도 너무너무 좋고 착용감이며 핏이며 맘에 안들 수가 없네여 품절되도 빨리 입고돼서 좋네요 크림색은 상세페이지랑 비슷한 거 같긴 한데 생각보다 노란끼가 좀 더 많이 돌아요
QBPqYoOl,,24.11.27,Gray (long-sleeved-U-neck(Gimo ver.)),F(44~77),정사이즈예요,보통이에요,화면과 비슷해요,166cm,61kg,상의 55,원단이 짱짱하네요 착용전에 세탁을 하려고 아직 입어보진 못했는데 일단은 만족합니다. 그런데 회색과 검정색 두 컬러를 구입했는데 사이즈가 조금 다른것 같아요. 검정색이 조금 작은 느낌입니다. 그래도 이너로 입을 거라 큰 문제가 될 정도는 아닙니다. 건조기에서 부디 살아남기를…
oQlQd2e8,상위 15%,24.11.27,아이보리(긴팔-U넥ver.),F(44~77),정사이즈예요,아주 만족해요,화면과 비슷해요,167cm,59kg,상의 55,가디건이나 다른 옷 입을 때 이너티로 입으려고 샀는데 딱 원하던 재질에 완전히 딱 붙는 핏 아니어서 더 좋은 거 같아용 ~ 보들보들하니 괜찮아요
pHs6lFHj,상위 20%,24.11.27,민트(긴팔-U넥(기모ver.)),F(44~77),정사이즈예요,보통이에요,화면과 비슷해요,159cm,47kg,상의 55,색이 제가 생각했던 것보다 조금 더 어두워요. 마감처리는 마음에 들어요. 입었을때 골반까지 내려오는 것 같아요. 라운드 넥은 생각보다 깊어요
광민아,,24.11.27,블랙(긴팔(기모ver.)),F(44~77),정사이즈예요,아주 만족해요,화면과 비슷해요,159cm,53kg,상의 66,"일단 따뜻하고, 세탁기를 돌려도 기모가 멀쩡하다는 점에서 저에겐 이번 겨울을 나기 위한 필수템으로 자리 잡았어요. 한번에 블랙이랑 크림을 같이 샀었는데, 개인적으로 크림 색상도 무척 맘에 들어서 나중에 하나씩 같은 색으로 또 사서 코디하기 귀찮을땐 매일 돌려입고 싶어요 ㅎㅎㅋ"
syCcGlCI,상위 20%,24.11.26,그레이(긴팔ver.),F(44~77),작아요,보통이에요,화면보다 어두워요,163cm,60kg,상의 66,"아니 그레이 색깔 개 후져요… 설명에 있는색 전혀 아니구 뭔 물 덜 빤 **색?? 반품하려고 보니까 만원 받는다길래 그냥 집에서 잘때나 입으려고요 아님 걍 이너로 입든가요
그리고 프리사이즈 44~77이라기엔 좀 작은 편입니다 제가 가슴이랑 팔 살 좀 있고 라운드숄더도 있는 상체비만 66인데 팔~어깨부분이 좀 작아여 스판 있어서 움직이기기가 불편한건 아닌디 작아보임 
솔직히 색이 이렇게까지만 안 구렸어도 좋았을것 같아요 ㅡㅡ별점 진짜 웬만하면 낮게 안 주겠는데이 색 진짜 너무 구리네요 이걸 뮤트?라고 해야하나.. 어쨌든상세설명에 있는색 절대 아니니까 그레이는 거르길 추천"
KQFtWvp7,상위 15%,24.11.25,크림(긴팔ver.),F(44~77),정사이즈예요,아주 만족해요,화면과 비슷해요,172cm,58kg,상의 55,"짱짱하고 좋아요
근데 크림색으로 구매하긴했는데
아이보리느낌보단 노란끼가 강해요
그래두 따뜻하고 어차피 이너로 입을거라
만족합니당 하얀색으루 하나 더 구매하려구요"
lHgHram4,,24.11.23,블랙(긴팔(기모ver.)),F(44~77),정사이즈예요,보통이에요,화면과 비슷해요,161cm,58kg,상의 55,"목이랑 손목이 쫀쫀해서 오래입을 수 있을 것 같아요. 기모는 생각보다 얇아서 겨울에 단독으로 입기엔 춥고, 봄가을에 입기 적당할 것 같아요."
VR8vVfke,,24.11.20,핑크(긴팔-U넥ver.),F(44~77),정사이즈예요,아주 만족해요,화면과 비슷해요,165cm,64kg,상의 66,"기본템으로 레이어드해서 입고싶어서 샀는데
66-77 사이즈 입는 터라 옷이 딱 붙고 안 맞을까봐 걱정했는데 여유있게 예쁘게 맞아서 좋아요! 
핏도 예뻐서 깔별로 쟁여둘 예정입니다 최고!"
광민아,,24.11.19,크림(긴팔(기모ver.)),F(44~77),정사이즈예요,보통이에요,화면과 비슷해요,159cm,50kg,상의 66,"엄청 두꺼운 느낌이 아니라서 내의로 가볍게 입기 좋고, 부드러워서 피부에 부담은 없는거 같아요. 피부가 예민해서 아무리 기모여도 털이 안 좋으면 간지럽고 그런데 이건 안 그래서 좋아요. 하얀색이랑 검은색 한벌씩만 산게 조금 아쉽습니다 ㅎ 여러 벌 쟁여두고 싶어요."
UK0VazJv,,24.11.19,아이보리(긴팔-U넥ver.),F(44~77),정사이즈예요,아주 만족해요,화면과 비슷해요,158cm,51kg,상의 55,"탄탄해보여서 이너로 입기좋아 구매해봤습니다! 
적당이 톡톡하고 목파임이 있지만 핏되어 부담없구요 
부드럽고 몸에 착감기는데 또 너무 타이트하진않아서 가디건, 니트, 집업에 잘입을거같아요"
쩡이는못말려,상위 5%,24.11.18,스카이블루(긴팔ver.),F(44~77),정사이즈예요,보통이에요,화면과 비슷해요,163cm,62kg,상의 55,"기본티가 너무없어서 구매했어요 
55사이즈인저에게 적당히 핏되는소재예요 엄청 여유있는건아니지만 소라색은 화면과같아서 쿨톤분들에게 어마어마하게 잘어울릴거같애요 길이감은 바지나치마안에 넣어입기에좋습니다 보풀도 많이 안날거같은 좋은 코튼소재라 만족입니다^"
HBtLGykR,상위 20%,24.11.17,아이보리(긴팔ver.),F(44~77),정사이즈예요,아주 만족해요,화면과 비슷해요,161cm,52kg,상의 55,"긴팔티 깔별로 사려고 지그재그에서 싸게 샀어요ㅠㅠ 색깔도 예뻐요, 이번 겨울 따뜻하게 날 수 있을 것 같아요 ㅎㅎ 길이감도 적당하고 역시 리뷰많은게 짱.."
HBtLGykR,상위 20%,24.11.17,블랙(긴팔ver.),F(44~77),정사이즈예요,아주 만족해요,화면과 비슷해요,161cm,52kg,상의 55,"긴팔티 고민 많이하다가 지그재그에서 싸게 샀어요ㅠㅠ 색깔도 예뻐요, 이번 겨울 따뜻하게 날 수 있을 것 같아요 ㅎㅎ 길이감도 적당하고 역시 리뷰많은게 짱.."
주해월,상위 10%,24.11.14,크림(긴팔-U넥(기모ver.)),F(44~77),정사이즈예요,보통이에요,화면과 비슷해요,173cm,63kg,상의 77,U넥이 좀 더 깊어서 쇄골이 보이게 하고 기모가 좀 더 잘되어 있음 좋았을텐데 아쉬워요ㅠㅠ 그냥저냥 입을만할듯요. 옷 비침도 좀 있어서 속옷 색 신경 써야될거 같습니다.
EuiwkuXL,상위 10%,24.11.13,아이보리(긴팔-U넥ver.),F(44~77),정사이즈예요,아주 만족해요,화면과 비슷해요,,,,기본 이너티로 찾고있었는데 소재도 좋고 디테일도 좋다라고요~ 착용감은 부드럽고 편해서 이너티로 넘 좋아용~ 다른 컬러도 구ㅐㅁ해야겠어영~^^
새새,,24.11.12,아이보리(긴팔ver.),F(44~77),정사이즈예요,보통이에요,화면과 비슷해요,158cm,38kg,상의 44,"그냥 휘뚜루마뚜루입기에 좋아요
질이 좋아서 일단 젤 맘에듭니다
세개 삿는데 부담없이 입기 좋아요
출근할때나 데일리로 강추
입자마자 뭐 묻어서 맘찢이지만 견뎌"
QUWstr76,,24.11.11,크림(긴팔ver.),F(44~77),정사이즈예요,아주 만족해요,화면과 비슷해요,158cm,60kg,상의 55,"어깡으로써 요즘 나오는 티 다 34정도라 들어가지도 않는 옷 때문에 열받았지만, 이 옷은 달라요. 입으면 어깨선 맞기에 깔끔해보입니다 이런 기본티를 찾고 있었어요🥺
재질은 부들부들하고 비침있어요"
yohkq1sS,,24.11.11,블랙(긴팔ver.),F(44~77),정사이즈예요,보통이에요,화면과 비슷해요,168cm,55kg,상의 55,"기본 이너티가 필요해서 검정색 ,흰색 두개 구매해보았어요
딱 적당히 이쁜 세미 크롭정도의 길이감이라 넣어입지 않아도 이쁜 기장감이 쫀쫀하면서 탄탄한 재질감이라 편하게 입을수있을것같습니다"
yohkq1sS,,24.11.11,아이보리(긴팔ver.),F(44~77),정사이즈예요,보통이에요,화면과 비슷해요,168cm,55kg,상의 55,"기본 이너티가 필요해서 검정색 ,흰색 두개 구매해보았어요
딱 적당히 이쁜 세미 크롭정도의 길이감이라 넣어입지 않아도 이쁜 기장감이 쫀쫀하면서 탄탄한 재질감이라 편하게 입을수있을것같습니다"
3vGU4s0b,,24.11.09,아이보리(긴팔-U넥ver.),F(44~77),정사이즈예요,아주 만족해요,화면과 비슷해요,163cm,60kg,상의 55,"세탁 후 건조기까지 돌려도 옷 변형이 없어서 너무너무 만족했어요 ㅠㅠ 재규매할겁니다!!. 유넥도 딱 원하던 만큼 파여있어서 넘 조아요.. 고민하지 말고 구매하세뇨!! 
저는 깔별로 구매할겁니다…. 진짜 사계절 이너로 너무 좋은 옷이에요!"
X0AWfqR9,상위 15%,24.11.09,그레이(긴팔-U넥ver.),F(44~77),생각보다 커요,아주 만족해요,화면과 비슷해요,165cm,55kg,상의 55,생각보다 널널하고 편해서 좋아요! 그런데 딱 봐도 이너티로 입어야 할 것 같은 비주얼?! 편하고 은근 도톰하고 널널해서 저는 마음에 들어요! 가격대비 추천합니당
ryu_*****,,24.11.05,아이보리(긴팔-U넥ver.),F(44~77),정사이즈예요,아주 만족해요,화면과 비슷해요,169cm,63kg,상의 66,"덩치가 있다보니 딱 핏하게 붙는데
부담스럽지 않고
이너로 입기 딱이에요!

U넥 했는데 개인적으로는 파임이 있는걸 좋아해서
파임 적당하고 좋았습니다! 

하나 샀는데 맘에 들어서 하나 더 샀어여!
추천입니다 👍🏻"
XgvzqVpj,상위 15%,24.11.04,아이보리(긴팔ver.),F(44~77),작아요,보통이에요,화면과 비슷해요,168cm,70kg,상의 66,처음 받았을때 옷이 작아보였는데 스판끼가좋아서 몸에 잘 맞아들어가요 적당한 두께감으로 너무얇지않아서 좋아요 이너로 입기 딱 좋습니다
dUhGFsEL,,24.11.04,크림(긴팔-U넥ver.),F(44~77),정사이즈예요,아주 만족해요,화면과 비슷해요,,,,면이 생각보다 부드러워서 맨몸에 닿아도 전혀 불편하지 않아요! 질이 좋아보여서 가격에 비해 꽤 오래 입을 수 있을거같아요 근데 이게 은근 파여있어서 팔을 모으거나 상체를 숙이면 가슴이 좀 보여요ㅜ
진뇨미,상위 20%,24.11.02,아이보리(긴팔ver.),F(44~77),정사이즈예요,보통이에요,화면과 비슷해요,,,,넹 제가 이런 기본티를 정말 마니머니 찾았다가 정착했습니다 다른 색상도 무조건 구매하려고 보고있어요 ! ㅠㅠ 팔길이도 적당하고 부들부들해서 입었을 때 기분아 조아지는 요 아이 ..
M2rwYwPo,,24.11.02,그레이(긴팔ver.),F(44~77),정사이즈예요,보통이에요,화면과 비슷해요,173cm,60kg,상의 55,소재자체도 넘 부들부들하고 좋아요 어깨가 어느정도 잡혀있어서 단독으로 입어도 좋을 것 같습니다 ~! 다른 색상도 구매할 예정이에요 ㅎㅎ
HSzLulaB,,24.11.01,민트(반팔ver.),F(44~77),정사이즈예요,보통이에요,화면보다 밝아요,163cm,50kg,상의 55,"소재도 말랑한 부드러운 느낌이어서 좋고, 핏도 그래도 무난히 예쁘게 괜찮아요! 다만 파스텔연두인 줄 알았는데, 사진으로는 잘 안보이지만 색이 생각보다 형광..?빛이 도는 연두색이라 좀 아쉬워요"
pyj3***,상위 15%,24.10.29,블랙(긴팔-U넥ver.),F(44~77),정사이즈예요,보통이에요,화면과 비슷해요,165cm,59kg,상의 55,가을 겨울에 자켓 안에 입으려고 샀는데 얇지 않고 두께감이 있어 만족합니다. 너무 많이 파지지 않은 U넥이라 부담없이 입을 수 있을 것 같습니다.
5wOKtshs,상위 25%,24.10.26,아이보리(긴팔ver.),F(44~77),정사이즈예요,아주 만족해요,화면과 비슷해요,155cm,50kg,상의 55,이너로 받쳐입으려고 고민하다 샀는데 저 왜 고민했죠? 진짜 짱짱하고 부드럽고 이 퀄에 이 가격이라니ㅠㅠ 앞으로 믿고 구매하겠슴다 잘 입을게요~!
dgDqe1Z8,,24.10.26,크림(긴팔ver.),F(44~77),정사이즈예요,보통이에요,화면보다 어두워요,157cm,60kg,상의 66,20수 버전 샀을 때 너무 마음에 들어서 재구매 하려고 보니 없어서 긴팔 버전으로 샀어요 면 부들 한 거는 동일한데 기장이 짧은 차이가 있네요 크림색이 화면보다 노르스름한 것 같아요ㅠ
화이트스타,상위 20%,24.10.25,아이보리(긴팔-U넥ver.),F(44~77),정사이즈예요,보통이에요,화면과 비슷해요,163cm,58kg,상의 55,"생각보다 깊네요…!
시원하게 트여져 있어서 목걸이 포인트 주기 좋아요
질도 너무 좋습니다
보들보들하고 딱 달라 붙는게 아니라서 부담없습니다"
H0OSPlYg,,24.10.24,블랙(반팔-U넥ver.),F(44~77),정사이즈예요,아주 만족해요,화면과 비슷해요,158cm,50kg,상의 55,"찰랑거리는 존예핏 ,, 제가 긴팔인줄 알고 잘못주문햇믄데;; 어차피 반팔도 필요햇거든요..긴팔로도 하나 더 사러구요 핏이 너무 예뻐요"
WpzsL56q,,24.10.23,아이보리(긴팔-U넥ver.),F(44~77),정사이즈예요,아주 만족해요,화면과 비슷해요,163cm,60kg,상의 55,"기본 티 마음에 드는 거 찾는 게 제일 어려운데 찾았네요… 만족해요 
항상 적당히 붙으면서도 너무 살들이 부각되지 않고 적당히 넥라인이 파여있는 티를 찾았었는데 다른 옷들은 너무 붙거나 넥라인이 별로거나… 그랬는데 모두 충족하는 티를 찾아서 좋아요 다른 색상도 구매예정이에요"
nrqUJ3aw,,24.10.23,블랙(긴팔-U넥ver.),F(44~77),정사이즈예요,보통이에요,화면과 비슷해요,158cm,46kg,상의 44,생각보다 좀 얇긴한데 핏은 나브지 않은것 같아요. 대신 어깨부분이 좀 솟아오르는 핏이에요 ㅜ 그래도 목이 시원하게 파여있어서 날씬해보여요
nmJE0WYz,,24.10.22,아이보리(긴팔-U넥ver.),F(44~77),정사이즈예요,아주 만족해요,화면과 비슷해요,160cm,56kg,,완전 부드럼구 좋아용 이너티로 입기짱좋아용 그리고 가격에비해 질이 좋아용 그리고 아이보리보다는 거의 완전 화이트에 가까워서 쿨톤분들 추천
ji**,상위 20%,24.10.21,아이보리(긴팔-U넥ver.),F(44~77),정사이즈예요,아주 만족해요,화면과 비슷해요,162cm,64kg,상의 77,"진짜 자주 손이가요.
흰색과 핑크 샀는데 가디건 이너로 입기 좋더라구요.
짱짱한 옷감이 좋아요.
맘에 들어서 일반 넥도 기본과 기모 추가 구매했어요."
ji**,상위 20%,24.10.21,핑크(긴팔-U넥ver.),F(44~77),정사이즈예요,아주 만족해요,화면과 비슷해요,162cm,64kg,상의 77,"진짜 자주 손이가요.
흰색과 핑크 샀는데 가디건 이너로 입기 좋더라구요.
짱짱한 옷감이 좋아요.
맘에 들어서 일반 넥도 기본과 기모 추가 구매했어요."
직린이,상위 20%,24.10.20,아이보리(긴팔ver.),F(44~77),정사이즈예요,보통이에요,화면과 비슷해요,155cm,52kg,상의 66,"통통족은 타이트한 핏이 나오긴하는데
이너로 입기엔 좋아요. 재질 부드럽고 신축성 좋아요. 그런데 실밥 검수 신경 써주셨으면 좋을 것 같아요. 크게 신경 안쓰긴 하는데 겨드랑이 바깥쪽으로 너무 많이 빠져나와있어서 조금 당황했습니다."
