아이디,리뷰어 등급,작성 날짜,옵션1,옵션2,상품 사이즈,퀄리티,색감,키,몸무게,사이즈,리뷰내용
,,,,,,,,,,,
상추싸먹는라푼젤,탑리뷰어,24.12.13,핑크(긴팔(기모ver.)),F(44~77),정사이즈예요,보통이에요,화면과 비슷해요,163cm,52kg,상의 44,"처음엔 솔직히 “그냥 무난한 내의 같은 옷” 정도로 생각하고 샀어요. 그런데 생각보다 훨씬 마음에 들더구먼요? 만져봤 때, 기모 안감 특유의 푹신하고 부드러운 느낌이 “이거 겨울에 이너로 입으면 진짜 따뜻하겠다♨️”라는 필을 빧았달까...

 핑크 컬러는 사실 화면에서 볼 때 조금 밝아 보여서 ‘단독으로 입으면 100% 아기돼지’라고 생각했어요. 하! 지! 만! 막상 받아보니 톤 다운된 핑크라 딱 제 취향이더군요?(이건 내 옷이다 얘) 너무 쨍하지 않고 은은해서 얼굴을 화사하게 밝혀주는 건 물론이고, 데님, 슬랙스, 조거 팬츠 등 뭘 입어도 쉽고 자연스럽게 어울려요✨✨ “오늘 뭐 입지?” 고민될 때 손이 저절로 간다는 게 이 티셔츠의 최대 장점 중 하나예요. 마치... 스티브 잡스가 365일 까만 목폴라 티만 입는 것처럼요. (아쉽게도 두뇌는 스티브 잡스가 안되더라고요) 핏도 적당히 여유 있어 몸에 딱 달라붙지 않으 매일 편하게 입을 수 있어요 👍

 스판 소재가 들어간 점도 한몫합니다. 팔을 들거나 몸을 움직일 때 옷이 전혀 거슬리지 않고 자연스럽게 늘어나니까, 일상생활에서 “아, 옷 불편하다 😒” 하는 순간이 없어요. 게다가 기모 안감 덕분에 피부에 닿는 느낌이 참 부드럽고 포근해서, 한겨울에도 이걸 안에 하나 껴입으면 든든하겠다는 생각이 들었어요. 하지만? 기모로 인해 두껍다는 느낌 또한 전혀 없답니다~

 세탁 후에도 줄지 않았어요. 울 코스나 미지근한 물로 조심스럽게 빨아주니 핏 변형 없이 그대로 유지되더라고요. “한두 번 빨면 늘어나나? 😟” 했는데 아직까지 그런 조짐도 없어서 앞으로도 오래 입을 수 있겠다 싶었죠. 색감도 여전히 예쁘고, 촉감도 변함없이 좋아서 뿌듯합니다.

 특히 이 핑크색은 제 일상을 조금 더 기분 좋게 만들러 줄 때가 있어요. 엄청 화려하지 않은데도 은근 얼굴 톤을 화사하게 만들어줘서, “오늘 좀 사랑스럽다?”라는 말을 들으면 기분이 째져요◠‿◠ 이런 사소한 칭찬 하나에 일상이 확 밝아지는 느낌이라 이 티셔츠가 몸도 마음도 따뜻한 세상을 만들어 줍니다💛🧡

 결국 이 옷은 “아무 생각 없이 샀는데 예상 밖으로 꽤나 아니 매우 괜찮은.” 기본 아이템이에요. 과하지 않은데도 존재감이 있고, 부드러운 촉감과 편안한 핏 덕분에 매일 입어도 질리지 않아요. 세탁하고 나면 다음날 또 꺼내 입게 되는, 데일리룩에서 단 벌 신사가 되어버린 옷이에요"
kmk0*****,상위 25%,25.01.13,아이보리(긴팔-U넥ver.),F(44~77),정사이즈예요,아주 만족해요,화면과 비슷해요,163cm,58kg,상의 66,"진짜 너무 잘입어서 하나 더 구매할 생각도 있어요!!
가디건 바람막이 집업 같은거 안에 받쳐입는 완전 휘뚤마뚤 기본티로 너무 좋아요
오래 입었는데 옷 변형도 없고 아주👍
근데 약간 단점은 유교걸 제 기준으로는 넥이 조금 깊게 파인 편이라 옷을 계속 뒤로 넘겨야해서 조금 귀찮다?"
ybjh***,상위 30%,25.01.09,크림(긴팔-U넥ver.),F(44~77),정사이즈예요,아주 만족해요,화면과 비슷해요,158cm,58kg,상의 55,예뻐요! 넥라인도 제가 생각했던 핏이고 소재도 좋고 이너로 입기 딱이에요! 살에 닿았을때 까실함 전혀 없고요 너무 부드럽고 좋아요! 목 쪽 마감이 도톰하고 잘 늘어나지 않을 것 같아요! 검정으로 하나 더 사려고욘~!!
lcGbuWul,상위 25%,25.01.08,크림(긴팔-U넥ver.),F(44~77),생각보다 커요,아주 만족해요,화면과 비슷해요,159cm,54kg,상의 55,"건조기 한 번 돌리고 입은 상태입니다
색감이 완전 크림색 그 자체로 페일하게 나와서 너무 이뻐요 재질도 쫀쫀하고 부드러워요. 동영상도 올리고 싶은데안올려지네요ㅠ 완전 쫀득하게 잘 늘어나는 재질입니다 앉아서 밑단 늘려본 사진 첨부합니다
아쉬운게 있다면 너무 커요 팔뚝이 커서 팔은 잘맞는데 허리가 너무 벙벙하게 남아서 핏이 내복핏이 돼벌임.. 넥 부분도 너무 넓어서 쫌매면 사진 상처럼넥이 우글우글해짐 뭐 그냥 넓게 빠진것도 괜찮긴한데 허리가 너무 넓어요 마지막 사진처럼 허리 조금만 라인들어가게 만들어주시면 너무 좋을 것같아요 지금은 이너로밖에 못입고 활용성이 좀 아쉬워서 별점 4점입니다"
gtDWbbNW,상위 5%,25.01.08,아이보리(긴팔ver.),F(44~77),정사이즈예요,아주 만족해요,화면과 비슷해요,158cm,40kg,상의 44,"리얼코코의 코튼스판 베이직 긴팔 티셔츠를 구매했는데 정말 만족스러워서 추천드리고 싶어요!
코튼과 스판이 섞여 있어 부드럽고 신축성이 뛰어나요. 피부에 자극 없이 편안하고, 적당히 두께감이 있어 비침 걱정 없이 입을 수 있어요. 고퀄이라 면소재 보이시는지요? 정말 만족 대만족이에요 ㅎ
몸에 너무 딱 붙지 않으면서도 깔끔하게 떨어지는 핏이라 체형 커버에도 좋아요. 레이어드로도 단독으로도 활용하기 딱이에요. 저는 같이 구매한 니트에 레이어드 하니 찰떡이에여 
베이직한 디자인이라 어디에나 매치하기 쉬워요. 심플하면서도 세련된 느낌이라 다양한 스타일링에 활용 가능해요.
캐주얼하게 데님 팬츠와 입어도 좋고, 자켓이나 코트 안에 이너로 매치해도 깔끔한 느낌이에요. 올 시즌 내내 자주 입게 될 것 같아요. 안에 기모있는거 하나 더 사고싶어요 
다양한 컬러가 있어 선택의 폭이 넓어요. 저는 아이보리를 선택했는데, 화면에서 보던 그대로라 더 만족스러웠어요.
이 정도 퀄리티에 이 가격이면 정말 가성비 최고예요. 기본템이라 하나쯤 꼭 소장해야 할 아이템 같아요.🤗"
턱시도짱구,상위 1%,25.01.08,민트(긴팔-U넥(기모ver.)),F(44~77),정사이즈예요,아주 만족해요,화면과 비슷해요,160cm,53kg,상의 55,"가장 마음에 드는건 기모가 아주 얇아서 부해보이는게 없는게 제일 마음에 들어요😍
촉감이 부들부들거려서 기부니가 좋습니다. 색감두 미지근톤이라 촌스럽지않고 제가 생각한 색감이라 아주 좋습니다. 미지근톤 잘받는 분들 사세요 웜 쿨 안가리는 색이라 아주그냥 사세요
아, 검정색이랑 같은 사이즈로 샀는데 민트색이 아주 쪼금더 여유있어요."
턱시도짱구,상위 1%,25.01.08,블랙(긴팔-U넥(기모ver.)),F(44~77),정사이즈예요,아주 만족해요,화면과 비슷해요,160cm,53kg,상의 55,"후기가 왜 많은지 알겠네요. 퀄이 엄청 좋다! 까진 아니지만 이 가격에 이퀄리티면 합격입니다.
남자친구가 보더니 히트텍 입었냐고 했지만 제 마음엔 듭니다. 이너로 입기도 좋아서 깔별로 쟁겨도 좋은 상품.
✔️퀄리티: 그격대비 만족. 뒤집어서 세탁기 돌렸는데 아직까진 보풀없고 만족입니다.
✔️안감: 기모라서 부들부들해요. 따끔거리는거 진짜 싫어하는데 이건 합격입니다. 
✔️핏: 팔뚝부자인데 살들 가려줍니다. 가격 대비 꽤 괜찮으니 다들 사세요
다만 검정색인만큼 먼지 잘보이는건 감수하세용"
래서판다,상위 1%,25.01.05,아이보리(긴팔ver.),F(44~77),정사이즈예요,보통이에요,화면과 비슷해요,163cm,49kg,,"163cm/49kg 
전에 리얼코코에서 기본 반팔티를 샀을때 마음에 들어서 기본 긴팔티도 샀습니다 
무난무난한 쫀쫀한 기본티이며 목도 쫀쫀해서 마음에 들어요
길이는 163기준 골반쪽까지 옵니다 
다만 소매나 어깨쪽 마감처리가 조금 아쉽지만 이정도면 만족합니다👍"
말많고키큰룰루랄라,탑리뷰어,25.01.04,스카이블루(긴팔ver.),F(44~77),작아요,아주 만족해요,화면과 비슷해요,173cm,60kg,상의 55,"세번째입니다
저번 세일기간에 화이트랑 핑크 사고 너무 만족해서 스카이블루도 샀어요 기모없는 버전으로 민트도 나오면 민트도 사려고요! 제발 민트 내주세요!
재질은 부들부들한데 되게 쫀쫀해서 약간 몸에 핏되게 붙는데 위에 가디건 입거나 포인트 아우터 걸치기에 좋은 것 같아요 운동할 때 단독으로 입거나 일상 시에 가벼운 산책에도 너무너무 잘 닙고 있어요 그리고 잘 안 늘어나요 제가 원래 하나 사고 맘에 들면 다른 색으로 여러 개 쟁이는 스타일인데 세일 기간 끝나서 고민했지만 다른 기본티 유명 맛집보다 만족도 좋아요

색깔도 화이트 핑크도 약간 파스텔 여리여리 뮤트느낌인데 스카이블루도 딱 사진 그대로 색감이에요 

길이는 키 큰 저한테 딱 골반 라인이에요 근데 어차피 아래에 오버핏 바지 입을 거여서 오히려 좋아요 길었다면 더 좋았을 것 같아욥 ㅎㅎ
민트도 내주세요!"
wing******,상위 1%,25.01.04,크림(긴팔ver.),F(44~77),정사이즈예요,아주 만족해요,화면과 비슷해요,,,,"저는 156/50이고, 팔뚝살이 있는 편인데 사진에서 보는 바와 같아요! 그리고 생각보다 길이가 짧아서 저는 맨투맨에 레이어드 해서 입으려고 했는데 아래 길이가 나오지 않아서 그건 조금 아쉬웠어요! 그래도 보들보들하고 크림색으로 구매했는데 색깔도 너무 마음에 들었어요!"
찰리초코브라운,상위 5%,25.01.03,크림(긴팔-U넥(기모ver.)),F(44~77),정사이즈예요,아주 만족해요,화면과 비슷해요,170cm,57kg,상의 55,맘에들어요!! 뭐랄까 난 흰티 입어도 아무거나 입지않아 그런느낌. 다른옷에 받쳐입으려고 샀는데 이게 뭐야 단독으로도 꿀리지 않아 이런느낌. 심플하게 이쁘고 재질도 굳굳. 긴팔원숭이도 살아남은 소매길이도 굳굳. 직잭 직진배송 미쳤나보ㅏ 이번에 산거 다성공했어요 번창하세요
sk01******,상위 1%,24.12.31,아이보리(긴팔(기모ver.)),F(44~77),정사이즈예요,아주 만족해요,화면과 비슷해요,152cm,47kg,상의 55,"두장이 같이 있는 사진 중 아래쪽 티셔츠가 리얼코코 기모 티셔츠에요.
겨울이라 이너용 기본티도 기모로 입는데요. 비침 있는 거 싫어서 고르고 골라 구매한건데 역시나 후기가 좋은 이유가 있네요
사진 보시면 아시겠지만 비침 없구요. 두께도 톡톡하고 핏도 딱 정사이즈에요. 팔만 아주 살짝 길어서 여리여리한 느낌도 납니다.ㅎㅎ 이너로 샀는데 너무 만족스러워서 단독으로도 입으려구요ㅎㅎ 강추합니다❤"
딩동댕동댕,상위 1%,24.12.31,아이보리(긴팔-U넥(기모ver.)),F(44~77),정사이즈예요,아주 만족해요,화면과 비슷해요,166cm,49kg,상의 55,"⭐️U넥 착용후기⭐️
휘뚜루마뚜루 입을 기본 템이 필요했는데 기모가 있어서 겨울에 입기 너무 좋아요 적당히 파여있고 적당한 길이감이라 넣어입기도 빼서 입기도 적당합니다!!
겨울에 편하게 입을 기본 템 찾으신다면 고민말고 고!!"
F1HfOr4p,상위 5%,24.12.28,크림(긴팔-U넥ver.),F(44~77),정사이즈예요,아주 만족해요,화면과 비슷해요,164cm,51kg,상의 55,리얼코코 아우터 위주로 구매 많이했었는데 이너 입으려고 산것 정말 최고입니당!! 늘어짐도 없고 부드러운 면에 스퀘어 넥이 몸이 가늘어보이게 해줘요!! 사이즈 m했는데 편하게 입을 사이즈여서 넘 조아요>< 그리고 화이트보단 크림이 조아서 크림으로 구매했는데 비치지 않고 쵝오 임당 ㅎ
F1HfOr4p,상위 5%,24.12.28,블랙(긴팔-U넥ver.),F(44~77),정사이즈예요,아주 만족해요,화면과 비슷해요,164cm,51kg,상의 55,리얼코코 아우터 위주로 구매 많이했었는데 이너 입으려고 산것 정말 최고입니당!! 늘어짐도 없고 부드러운 면에 스퀘어 넥이 몸이 가늘어보이게 해줘요!! 사이즈 m했는데 편하게 입을 사이즈여서 넘 조아요><
milch,상위 20%,24.12.27,아이보리(긴팔-U넥(기모ver.)),F(44~77),정사이즈예요,보통이에요,화면과 비슷해요,157cm,58kg,상의 66,"얇은 기모가 보돌보돌합니다. 입었을 때 편안하게 몸을 감싸요. 
통통한 편이라 팔이 붙지만 히트텍 하얀 버전이라고 생각하면 편할 것 같습니다. 단독으로 입기에는 내복 같아서 다른 상의 안에 받쳐입을 예정입니다. 가슴이 파여있어서 겉에 뭘 입어도 밖으로 튀어나오지 않을 것 같아서 좋습니다. 브라 끈이 보이지 않아요.
아쉬운 건 한 쪽 어깨 부분에 천이 만나면서 마무리 되는 부분이 있는데 거기가 깔끔하게 마무리 되지 않아서 울퉁불퉁하다는 점입니다."
mywl***,상위 5%,24.12.26,아이보리(긴팔(기모ver.)),F(44~77),정사이즈예요,아주 만족해요,화면과 비슷해요,165cm,57kg,상의 55,"이거 정말 너무 마음에 들어요! 인기있는 이유가 있네요. 깔별로 구매할 의향 있습니다. 속기모 적당히 있고 원단 톡톡하고 쫀쫀해요. 핏도 너무 달아붙지도 않아서 내복 느낌 없어요ㅋㅋ

약간 기장이 안맞는 점이 아쉬운데 그건 가격이 저렴하니 감수하려고요.
목 부분 박음질 한번 더 하는 걸로 리뉴얼되면 좋겠어요."
0gmlyYEr,상위 30%,24.12.25,아이보리(긴팔-U넥(기모ver.)),F(44~77),정사이즈예요,보통이에요,화면과 비슷해요,,,,처음에 받고 엥 이게 기모? 했는데 막상 입으니까 부들부들해요 재질이 쫀쫀해서 면 자체는 좋고 핏도 괜찮은데 목부분이 묘하게 대칭이 안맞는 느낌? 벗고 다시 보니까 오른쪽에만 박음질부분이 있어서 그쪽이 우는 느낌이더라구요 단독으로 입을 생각은 없어서 괜찮을 것 같긴 한데 박음질 부분이 미흡한게 너무 잘보여서 좀 아쉬웠어요
네가행복했으면조켄네,상위 1%,24.12.24,아이보리(긴팔-U넥ver.),F(44~77),정사이즈예요,아주 만족해요,화면과 비슷해요,160cm,50kg,상의 55,증명사진 찍을 때 입을 기본티가 필요해서 여기저기 찾아보다가 구매해요! 솔직히 기본티 많이 팔잖아요? 근데 다 뭔가 하나씩 마음에 안 들어서 사 본 적이 없었어요. 그래서 기대 안 했는데 입자마자 너무 부드러운 거예요! 이렇게 부드러운 티는 처음인 거 같아요. 너무 편해서 계속 입고 있었어요. 생각보다 넥라인도 파여있어서 속옷끈 신경 쓰셔야할 것 같아요. 저는 만족합니다~ 근데 단독은 조금 망설여져서 이너로 잘 입을 것 같아요.
2윰,탑리뷰어,24.12.24,아이보리(긴팔(기모ver.)),F(44~77),정사이즈예요,아주 만족해요,화면과 비슷해요,163cm,48kg,상의 44,"이너로 입을 기모소재에 탄탄한 면티 찾고 있었는데 가격이 저렴한데 퀄리티가 너무 좋아요! 왜 리뷰가 많은지
알 거 같아요 자칫 부해보일 수도 있는데 핏도 예쁘게 잡아주고 어디에든 매치하기 좋은 데일리템😙 넘 따닷하고 목 늘어짐 싫어하는데 딱 예쁘게 잡아줘서 좋아요 만족🫶🏻"
doco,상위 10%,24.12.24,아이보리(긴팔-U넥(기모ver.)),F(44~77),정사이즈예요,아주 만족해요,화면과 비슷해요,170cm,58kg,상의 55,부드러운 기모 소재라 착용감이 좋아요. 피부에 닿는 느낌도 편해서 겨울에 이너로 입기 좋을 것 같아요. 소재가 부들부들하고 핏도 예쁘게 떨어져서 기본 티로 활용하기도 좋을 것 같아요!
SUN_01,상위 5%,24.12.23,아이보리(긴팔-U넥ver.),F(44~77),정사이즈예요,아주 만족해요,화면과 비슷해요,162cm,45kg,상의 44,"티셔츠 맛집을 찾았습니다! 이제 리얼코코에서만 티셔츠 살 것 같아요. 이너로 입을 수도 있고 단독으로 입을 수도 있을만큼 쫀쫀해요! 아직 세탁해보지는 않았는데 일단, 처음 입어봤을 때 부드럽고 소매나 목 부분은 탄탄합니다. 기모가 없는데도 소재도 꽤 도톰해요!"
h021*,상위 5%,24.12.23,아이보리(긴팔(기모ver.)),F(44~77),정사이즈예요,보통이에요,화면과 비슷해요,159cm,45kg,상의 55,"✔️ 길이감
길이 딱 조음! 적당해요

✔️ 디자인
이너로 입을거라 넥라인 파인 것과 고민했었는데
넥라인이 많이 올라오지 않아서 이너로 입어도 굿~!

✔️ 두께감👌
이너로 입으려고 샀는ㄷ0 단독으로 입어도 춥지 않았어요
기모여서 라인이 안살면 어쩌나 걱정했는데
따뜻하면서도 안똥똥해보여서 좋아요😄

✔️ 소재🤭
보풀 잘 일어날거 같은 재질이에요
그래서 별 하나 뺐어요
근데 이뿜,,, 다른 흰색 이너티 많은데 요건 복실복실한 소재에요"
나자연,상위 5%,24.12.22,아이보리(긴팔(기모ver.)),F(44~77),정사이즈예요,아주 만족해요,화면과 비슷해요,166cm,55kg,상의 55,"리얼코코 라운드넥 긴팔 기모 아이보리 재구매한 사람? 저요!!✋️
✔️소재
얇지만 기모가 들어있어 이너로 입기 좋아요. 면티가 짱짱하면서 신축성이 좋아요. 착용감도 부드럽고 따듯해요.
✔️핏
166인데 팔길이가 넉넉해서 좋았어요. 팔이 너무 딱붙는 게 아니라 팔뚝이 부각되지 않아서 좋아요. 기장은 골반위에 걸쳐질 정도 떨어져요. 

겨울이너로 굿이에요!!"
2fLqVcis,상위 1%,24.12.21,아이보리(긴팔-U넥ver.),F(44~77),정사이즈예요,아주 만족해요,화면과 비슷해요,158cm,50kg,상의 44,따뜻하고 편하게 입을 수 있으면서도 핏이 정말 예뻐요! 다른 기본티보다 넥라인이 파져있는 부분이 여리여리해보여서 손이 자주 가는 티입니다 이 티셔츠 구매하면서 다른티도 여러장 샀는데 요게 젤 맘에 들어요 다른 색상으로 더 사고싶어요ㅎㅎ
말많고키큰룰루랄라,탑리뷰어,24.12.20,블랙(긴팔ver.),F(44~77),작아요,아주 만족해요,화면과 비슷해요,173cm,60kg,상의 55,"리얼코코 기본 반팔 사고 튼튼해서 너무 좋아서 다른 브랜드에서 사려다가 실망해서 여기에서 여러 가지 컬러로 샀어요! 

블랙컬러는 데일리한 컬러이다 보니 무난하게 이너로도 입고 그냥으로도 입고 운동할 때도 입기 좋은 것 닽아요! 
제가 키가 크다 보니 좀 짧긴 하더라고요 골반 라인에 걸쳐요그리고 살쪘다 보니 팔뚝살도 좀 신경쓰이고요 ㅎㅎ 상체가 이쁘시고 마르신 분이 잘 어울릴 것 같아요 
근데 재질은 튼튼하고 신축성도 있어서 바스트 상관없으실 것 같아요 데일리로 입기에 너무 이너같지도 않고 무난하게 입기에 재질이나 컬러나 신축성 모두 좋아요! 대만족입니다!😝"
말많고키큰룰루랄라,탑리뷰어,24.12.20,핑크(긴팔ver.),F(44~77),작아요,보통이에요,화면과 비슷해요,173cm,60kg,상의 55,"리얼코코 기본 반팔 사고 튼튼해서 너무 좋아서 다른 브랜드에서 사려다가 실망해서 여기에서 여러 가지 컬러로 샀어요! 
핑크컬러는 리뷰에서 색이 가늠이 안 갔는데 색의 채도가 좀 빠지고 웜한 딸기우유 느낌이에요 데일리로 입기에 포인트 컬러로 제격이에요 오히려 크림보다 맘에 들어요! 밝은 딸기우유였다면 더 이뻤을지도..?ㅎㅎ😊😊
제가 키가 크다 보니 좀 짧긴 하더라고요 그리고 살쪘다 보니 팔뚝살도 좀 신경쓰이고요 ㅎㅎ 상체가 이쁘시고 마르신 분이 잘 어울릴 것 같아요 근데 재질은 튼튼하고 신축성도 있어서 바스트 상관없으실 것 같아요 데일리로 입기에 너무 이너같지도 않고 무난하게 입기에 재질이나 컬러나 신축성 모두 좋아요!"
말많고키큰룰루랄라,탑리뷰어,24.12.20,크림(긴팔ver.),F(44~77),정사이즈예요,보통이에요,화면과 비슷해요,173cm,60kg,상의 55,"리얼코코 기본 반팔 사고 튼튼해서 너무 좋아서 다른 브랜드에서 사려다가 실망해서 여기에서 여러 가지 컬러로 샀어요! 

크림컬러는 리뷰에서 색이 가늠이 안 가서 제가 화이트 이불위에 올려봤는데 생각보다 많이 웜한 것 같아요 그래도 안에 이너로 입기에 좋아서 괜찮아요! 
제가 키가 크다 보니 좀 짧긴 하더라고요 그리고 살쪘다 보니 팔뚝살도 좀 신경쓰이고요 ㅎㅎ 상체가 이쁘시고 마르신 분이 잘 어울릴 것 같아요 근데 재질은 튼튼하고 신축성도 있어서 바스트 상관없으실 것 같아요 데일리로 입기에 너무 이너같지도 않고 무난하게 입기에 재질이나 컬러나 신축성 모두 좋아요! 화이트 내주시면 진짜 감사하겠슴다"
잔자니,상위 5%,24.12.19,아이보리(긴팔-U넥(기모ver.)),F(44~77),정사이즈예요,아주 만족해요,화면과 비슷해요,157cm,54kg,상의 66,일단 아이보리 색상이 따뜻함을 주니깐 지금 계절에 입기 좋네요. 어깨랑 팔뚝살이 좀 있는 편인데 신축성도 좀 있어서 마음에 듭니다. 전 소매가 손등을 조금 덮는 걸 좋아하는데 제 기준에서는 덮으니깐 조금 여리해보이더라구요~ 그리고 기모 버전이라 이너로 따뜻하게 입을 수 있어서 좋아요.
Bcontinue,,24.12.18,아이보리(긴팔-U넥(기모ver.)),F(44~77),정사이즈예요,아주 만족해요,화면과 비슷해요,170cm,53kg,상의 55,레이어드해서 입을 따뜻한 이너티 찾고 있었는데 완전완전 좋습니다!! 일단 입을 때부터 너무 부드럽구요 완전 딱 붙지도 않는 적당한 품이 너무 마음에 듭니다!! 보시다시피 죽죽 늘어날 수도 있는 옷이라 입을 때도 편해요 여기저기 구경하다가 골라서 샀는데 기가 막힌 선택이었네요!! 다른 색 또 구매할 예정입니다!! 가죽처럼 잘 입을게요:D
LmbA5gri,상위 10%,24.12.18,아이보리(긴팔(기모ver.)),F(44~77),정사이즈예요,보통이에요,화면과 비슷해요,163cm,50kg,상의 55,"색상 크기 핏 모두 맘에드는데 퀄리티가 아쉬워요 
하나 사보고 깔별로 추가 구매하려고 했는데
그 한개 산 제품 마감이 별로더라구요
바느질이 잘못된건지 목쪽 라운드가 매끄러워보이지않네요"
D4WfueOL,탑리뷰어,24.12.18,크림(긴팔-U넥ver.),F(44~77),정사이즈예요,아주 만족해요,화면보다 어두워요,160cm,50kg,상의 55,"생각보다 진짜 크림이 아이보리에 가깝고, 화이트와는 멀어요. 저는 그래도 크림이니 화이트겠거니 했지만. 어쨋든 유넥이 넓게 퍼져서 위에 티를 어떤걸 덧대어 입어도 안비쳐서 좋을것 같고요. 왜 건조기 가능이라고 써있는지 알 것 같아요. 만져보면 재질이 진짜 톡톡해요. 그리고 비침 정도가 밝은 색이라 그렇지 어두운 색은 안비칠것 같더라고요. 어두운색도 사보려고요!"
X3jE7704,상위 5%,24.12.18,핑크(긴팔-U넥ver.),F(44~77),정사이즈예요,아주 만족해요,화면보다 어두워요,,,,"쿨톤 얼굴 죽는 핑크 ,, 팥죽흐릿핑크임 
근데 핏 , 재질 , 기장 , 목 파임 싹 다 맘에 들어서
다른색으로 구매할거엥룡
기장 긴거 좋아하는 사람들에겐 조금 짧을 수 있음
근데 상의 짧게 입어야하는 내체형에 딱
크롭보다는 긴 적당 이너티임"
또아,상위 5%,24.12.17,아이보리(긴팔ver.),F(44~77),정사이즈예요,아주 만족해요,화면과 비슷해요,162cm,49kg,상의 55,"이너티로 입으려고 구매했는데 탄탄하고 좋아요! 날이 따듯해지면 단독으로 청바지에 입어도 예쁠거같아요
기본티라 아이보리 구매했는데 다른 컬러도 구매해야겠어요~ 평균 55사이즈 입는데 핏하지도 박시하지도 않은 적당한 핏이에요"
fdXa9Mc0,상위 15%,24.12.17,아이보리(긴팔-U넥(기모ver.)),F(44~77),정사이즈예요,아주 만족해요,화면과 비슷해요,170cm,57kg,상의 55,"후기가 정말많구 직진배송이 가능해서 구매해봤어요!!
기모가 있어서 겨울철에 따숩게 입을 수 있을 거 가타요🥰저는 가디건입을 때 목부분에 흰티가 보이는게 싫어서 U넥으로 구매했는데 대만족입니다!!👍👍👍하늘하늘한 느낌이라 몸매보정도 되는 것 같아요~ 두번째 사진처럼 레이어드티로 입기에는 짧은 느낌이 있지만 이너티로 잘 입을 것 같습니당💟다른색도 구매하려구욧!!"
