아이디,리뷰어 등급,작성 날짜,옵션1,옵션2,상품 사이즈,퀄리티,색감,키,몸무게,사이즈,리뷰내용,제품_사이즈
ttNbjDMk,,24.04.21,아이보리,FREE,정사이즈예요,보통이에요,화면과 비슷해요,,,,딱 예쁜 화이트 색이고 구김이 좀 가는 재질이긴 하지만 많이 심하진 않아요 ㅎㅎ 예쁩니다~!,FREE
v7K0ITmy,,24.04.06,아이보리,FREE,정사이즈예요,보통이에요,화면과 비슷해요,158,52,55,딱 사진이랑 같아요 바스락거리는 재질의 셔츠라 구김이 잘가긴해요 입을때마다 다려입어야할거같은데 바스락거리는느낌을 원한거라 잘입을 거 같습니다,FREE
tkdl******,상위 10%,24.03.29,아이보리,FREE,정사이즈예요,보통이에요,화면과 비슷해요,164,55,44,코디된 걸루 사서 입었는데 넘 잘어울리고 좋았어요!! 근데 구김이 가는 건 어쩔 수 옶는 듯 합니다….ㅋㅋ 그래도 이뻐서 다행,FREE
aTaU8a9M,,24.03.17,아이보리,FREE,작아요,보통이에요,화면과 비슷해요,160,49,55,조금더 날 풀리면 잘 입고 다니도 싶음 화이트라 비침은 쩔수ㅠㅠㅠ 그래도 결혼식이나 행사때 잘 입지 않을 기본템일거같아서 ㅎㄹ,FREE
DxlGJM6R,,24.03.04,베이지,FREE,정사이즈예요,보통이에요,화면과 비슷해요,166,65,66,"생각보다 베이지보단 어두워요 
그레이한방울 섞은 느낌 땀나면 큰일날거같은 소재지만 만족합니다",FREE
zRRbdPao,,24.02.24,스카이블루,FREE,정사이즈예요,아주 만족해요,화면과 비슷해요,173,60,55,"급하게 입을 옷이 없어서 직진으로 주문했는데 색이 뮤트톤이라 너무 취향 저격입니다! 
배송받고 벌써 2번이나 입었습니다",FREE
vLRLgJVl,,24.02.13,아이보리,FREE,정사이즈예요,보통이에요,화면과 비슷해요,158,55,55,살이 쪄서 그런지 약간 입었을때 더 아방한 느낌이 강해서 덩치 있어보이는거같아요 블라우스 질 자체는 딱 예상한 그런 질감이에요,FREE
VdeLrPCL,상위 15%,24.01.05,아이보리,FREE,정사이즈예요,별로예요,화면과 비슷해요,158,54,55,예뻐용 딱 생각했던 핏이라서 좋아요 뷔스티에 안에 받쳐입고 싶었는데 이렇게 입으니까 딱 좋아요 이거 예전부터 사고싶었는데 그냥 망설이다가 포기했거든요 근데 왜 이제 샀나 싶은..어디 나갈때마다 이거 입고 나갈거같아요 굿,FREE
b1AwPOfe,,23.11.26,아이보리,FREE,정사이즈예요,아주 만족해요,화면과 비슷해요,158,48,44,"아이보리 베이지 두개 구매했는데 베이지가 훨씬
이뻐요! 아이보리는 완전 새하얘요ㅠ 베이지는 사시사철 잘 입을거같습니다",FREE
0zseosVk,,23.11.23,아이보리,FREE,정사이즈예요,아주 만족해요,화면과 비슷해요,150,44,44,같이 샀던 니트와 같이 입으려고 샀어요! 단독으로 입어도 넘 사랑스럽고 얼굴이 화사해보여용~ 어디에도 매치해서 코디할 수 있어서 넘넘 맘에 들어요!!,FREE
lyy0***,,23.11.09,아이보리,FREE,정사이즈예요,보통이에요,화면과 비슷해요,163,58,66,니트 조끼랑 같이 입으니까 좋았습니당 사이즈늠 넉넉했구요 퀄리티도 나쁘지 않았어용 생각보다 안 구겨져서 나쁘지 않아ㅛ습니다,FREE
v3ZedCTG,,23.11.07,블랙,FREE,정사이즈예요,보통이에요,화면과 비슷해요,158,58,55,워낙 후기가 좋아서 기본템으로 하나 쟁였습니다 추워질땐 이너로 입기에도 충분하고 선선할때는 하나만 입어도 될것 같아요,FREE
jpCg4aH8,,23.10.28,아이보리,FREE,정사이즈예요,아주 만족해요,화면과 비슷해요,167,55,55,깔끔하고 넘 이뻐요! 여기저기 막 입기 좋아보여용 ㅎㅎ 두껍진않아서 더 추워지면 못입을거같아요 마니 입어야지 지금..,FREE
2pTPyWrZ,,23.10.24,블랙,FREE,정사이즈예요,보통이에요,화면과 비슷해요,168,60,66,핏이랑 길이감 다 맘에 들어서 지금 3개째 구매하네요 그냥 입어도 이쁘고 니트조끼랑 입어도 이뻐요 어디든 어울려서 잘입고 다닐것같아요,FREE
w35hA0NL,상위 30%,23.10.22,아이보리,FREE,정사이즈예요,아주 만족해요,화면과 비슷해요,162,53,55,이것저것 같이 코디하기 너무 좋아요~~~!! 그냥 입으면 부해보일 수 있는데 조끼랑 같이 코디하면 부해보이는 것도 없어요,FREE
lh4hZ3Nc,,23.10.06,아이보리,FREE,정사이즈예요,아주 만족해요,화면과 비슷해요,153,45,55,하얗고 깔끔하고 어디에나 잘 어울려서 손이 자주 갈 거 같아요 ! 가격도 딱 좋네요 잘 입겠습니다 아주 만족해요 ㅎㅎㅎ~~,FREE
OvvhL8pk,,23.10.06,아이보리,FREE,생각보다 커요,보통이에요,화면과 비슷해요,159,55,55,널널해서 진짜편하긴해요. 코디를 잘해서 입어야할거같아요. 그냥입으면너무편한스타일이라서 안으로넣어서 입던가해야겠어요.,FREE
9GYi7Gdp,,23.09.21,아이보리,FREE,생각보다 커요,별로예요,화면과 비슷해요,,,,"꼭 누가 입던 옷 같아요! 이정도 퀄리티를.. 이 가격에 팔다니 ㅠ.. 그냥 급하니까 입어요
옷은 생각보다 넉넉한데 핏이 이상하진 않아요~
퀄리티 기대하지 마시고 급할 때 구매하세요",FREE
JBqeXSCj,,24.10.16,아이보리(피치기모),FREE,정사이즈예요,아주 만족해요,화면과 비슷해요,163,51,,"예뻐요 소재도 굉장히 튼튼하고 조은 거 같아요!!
치마 같은 거랑 입으면 잘 어울릴 거 같아요
초겨울까지 입을 예정입니다~",FREE
nmh2***,,24.09.25,블랙,FREE,생각보다 커요,아주 만족해요,화면과 비슷해요,159,55,99 이상,가을에 입기 좋아보여서 샀어요 ㅎㅎ 사이즈가 넉넉해서 마음에 들어요 밝은 바지랑 입으면 잘어울릴 것 같아 구매했습니다,FREE
vAsRMokB,,24.09.12,블랙,FREE,정사이즈예요,보통이에요,화면과 비슷해요,161,58,66,"단독으로입어도되고 레이어드 해도 되요
라운드핏이라 어디든 잘 입어지네요
데님 슬랙스 치마 원피스 레이어드 다 잘어울려요",FREE
MIFFYv5p,,24.04.24,아이보리,FREE,정사이즈예요,아주 만족해요,화면과 비슷해요,162,53,66,"휘뚤마뚤 무난하게 입는 템입니다 세탁하고 나면 쪼글쪼글해져서 다림질 필수
너무 정장같지도 너무 추레하지도 않고 딱 좋아요",FREE
깜짜장,상위 20%,24.04.24,아이보리,FREE,정사이즈예요,별로예요,화면과 비슷해요,157,45,44,단독으로 입기에는 뭔가 쫌 애매해서 조끼랑 같이 매치해서 입었어요. 그런데 세탁하고나면 좀 쭈글쭈글해져서 모양새가 이상해져요 ㅠㅠ,FREE
O9vGJSot,,24.03.31,블랙,FREE,정사이즈예요,아주 만족해요,화면과 비슷해요,153,46,55,"생각보다 더 톱톱하고 맘에 듭니다 
좋은가격에 득템했어요 봐서 화이트도 하나
더 사서 봄에 이너티로 입을까 생각합니다",FREE
5tsfYPed,,24.03.28,아이보리,FREE,정사이즈예요,아주 만족해요,화면과 비슷해요,164,57,66,내일 모레 결혼식때매 자켓 안에 이너로 입으려고 샀는데 잘 산 것같아요!! 살이 많이 쪄서 생각한 핏이 아닐까 고민했는데 66까지 예쁘게 입을 수 있을 거 같아요!,FREE
토토미,상위 30%,24.03.21,아이보리,FREE,생각보다 커요,보통이에요,화면과 비슷해요,155,44,44,제 체구에는 생각보다 많이 크더라구요..! 그래도 레이어드용으로 샀으니 만족해요 글구 옷에서 냄새가 심하게 나더라구요 ㅎㅎ… 이거빼고는 만족합니당,FREE
aqQFRywX,,24.03.16,아이보리,FREE,생각보다 커요,보통이에요,화면과 비슷해요,152,49,55,생각보다 커서 아쉽기는 하지만 안에 이너로 입을 예정이라서 바지 안에 넣어서 입으면 괜찮을 거 같습니다! 색도 밝아서 만족합니다.,FREE
gvuhQ6cD,,24.03.12,아이보리,FREE,정사이즈예요,아주 만족해요,화면과 비슷해요,156,52,55,목주름 있어서 많이 파져있는 거 싫어하는데 목이 많이 안 파져있어서 좋아요ㅠㅜㅜ 단정하고 꾸안꾸 느낌에 귀엽기까지 해요,FREE
TuvCNpJv,,24.03.06,베이지,FREE,정사이즈예요,보통이에요,화면과 비슷해요,,,,뚱뚱해서그른가 손목 부분이 좀 껴요 ㅎ 근데 딱 화면에보이는 정석블라우스예요~ 면접 앞두고 직진배송이라 시켜봤는데 만족합니다,FREE
2777******,,24.02.20,아이보리,FREE,정사이즈예요,아주 만족해요,화면과 비슷해요,,,,뷔스티에랑 세트로 구매함 미니뽕 옷자체 퀄리티 나쁘지 않아요 무난무난하고 데일리한 디쟌이라 휘뚜루마뚜루 잘입을거 같음 바지던 스커트던 다 어울려요 ㅋㅋ,FREE
N6WdreSc,,24.02.14,아이보리,FREE,정사이즈예요,아주 만족해요,화면과 비슷해요,163,55,55,"하늘하늘 얇은 블라우스예요! 겨울에 단독으로는 당연히 못 입는데, 두꺼운 원피스랑 같이 입으면 짱 이쁠 것 같네요 ㅎㅎㅎ",FREE
CDXynF1D,,23.12.06,베이지,FREE,정사이즈예요,보통이에요,화면과 비슷해요,155,58,66,"블라우스가 봄,가을용이라 겨울에 입으려면
안에 얇은 티셔츠 입고 입어야해요!
하지만 블라우스가 여성스런 느낌 나면서 예뻐요",FREE
c0DuEs6B,,23.11.29,아이보리,FREE,정사이즈예요,아주 만족해요,화면과 비슷해요,157,52,44,생각보다 핏이 예뻤습니다! 적당한 크롭이라 겨울이래도 많이 춥지 않고 예뻐요! 약간 따가워서 안에 이너 같이 입어야 합니다!,FREE
rEW2cV1o,상위 10%,23.11.22,아이보리,FREE,정사이즈예요,아주 만족해요,화면과 비슷해요,158,57,66,블라우스 잘 안입어서 한동안 보지도 않았는데 보자마자 고민 없이 맘에 들어서 구매한 건 처음인 것 같아요!! 두번째 사진처럼 뷔스티에랑 같이 입어도 이쁠 것 같아 넣어봤어요ㅎㅎ 잘 입겠습니당~,FREE
8z4i3UIS,상위 25%,24.10.14,아이보리,FREE,정사이즈예요,보통이에요,화면과 비슷해요,167,57,55,원피스에 입으려고 구매했는 아주 만족합니다!! 다만 한번 세탁하면 많이 구겨지는 것은 유의하셔야 할 것 같습니다ㅠㅠ,FREE
nd1wPWG9,,24.05.22,핑크,FREE,정사이즈예요,보통이에요,화면과 비슷해요,160,57,55,색감이 생각보다 연보라에 가까워요 바시락대고 조금 꾸깃한감이잇는데 그느낌이또 그대로 이뻐요 ㅎㅎ잘샀어요,FREE
wnkCJSTM,,24.05.04,아이보리,FREE,생각보다 커요,아주 만족해요,화면과 비슷해요,159,60,66,"입으니까 엄청 부해보여요
치마에 넣어 입었는데 붕 떠서 뚱뚱해보이는 느낌이라 많이 아쉬워요. 급하게 입어야해서 그냥 입거나 다른옷 입어야할 것 같아요",FREE
cVyq8oE0,,24.04.06,아이보리,FREE,생각보다 커요,별로예요,화면과 비슷해요,159,53,66,"어벙벙해요 ㅠㅠㅠ
잘 구겨져서 다림질 잘 해야하는데
잘 다리고 몇시간지나면 구겨져있네요 ㅠㅠ
다음엔 재질 잘 보고 구매해야겠어요",FREE
sQ50lQEU,,24.03.20,스카이블루,FREE,정사이즈예요,아주 만족해요,화면과 비슷해요,,,,아이보리 색상을 사려고했는데 실수로 블루 구입했어요 근데 생각보다 이뻐서 반품 대신 또 주문하려고요 만족스러요!!,FREE
pQ6FgKMd,,23.12.13,아이보리,FREE,정사이즈예요,아주 만족해요,화면과 비슷해요,160,46,44,"조끼안에 레이어드 해서 입었는데
넘 귀엽고 착용감도 편해요! 기본템으로 추천👋🏻",FREE
spzLBY5D,,23.12.06,아이보리,FREE,정사이즈예요,아주 만족해요,화면과 비슷해요,,,,"원하던 디자인이 없어서 찾다가
드디어 맘에 드는걸 발견했어요!!ㅎㅎㅎ
배송도 빠르고 너무 예뻐요",FREE
p9t8tTIq,,23.11.08,아이보리,FREE,정사이즈예요,아주 만족해요,화면과 비슷해요,160,55,55,사이즈 딱 맞고 예쁘고 옷 좋아요! 생각보다 얇아서 겨울엔 못입을거같아요ㅠㅠ 봄 가을에서 초여름까지 많이입어야겠어요,FREE
BdaL5bM8,,23.10.19,아이보리,FREE,정사이즈예요,아주 만족해요,화면과 비슷해요,160,50,55,예뻐요! 진짜 엄청 예뻐요 제가 샀던 블라우스들 중에서 제일 예쁜 것 같아요! 바지나 치마 안에 넣어서 입어야할 기장이긴한데 그래듀 정말 여리여리해보이고 예뻐요 ㅎㅎ,FREE
서니3232,상위 30%,23.10.13,스카이블루,FREE,정사이즈예요,보통이에요,화면과 비슷해요,164,53,55,"예전에 삿던거 잃어버렷는데 그거랑 똑같은거같아서 삿믄뎅 더 파랗네용 ㅠ 코튼이라 빳빳하구
빨면 좀 더 나으려나! 오늘 처음 개시햇ㄴ데 벌써 단품으론 추워졋네용 ㅠ",FREE
2pTPyWrZ,,23.10.11,아이보리,FREE,정사이즈예요,보통이에요,화면과 비슷해요,168,60,66,그냥 단독으로 입어도 이쁘고 니트조끼랑 입어도 이뻐요 소매가 길지않고 길이감이 딱 좋아요,FREE
S73k0urc,,23.10.05,아이보리,FREE,정사이즈예요,아주 만족해요,화면과 비슷해요,160,46,55,면 재질이 정말 좋아요 . 구김은 좀 가겠지만서도 아주 얇지도 않고 톡톡합니다. 가을에 입기 딱이에요 얼른 입고 싶어요~,FREE
SeiykNKw,,23.10.05,아이보리,FREE,정사이즈예요,보통이에요,화면보다 밝아요,170,70,66,"블라유스의 정석입니다
이너로잊으면 티셔츠같기도해요 ㅎㅎㅎ
스카푸랑 매치하면 좋을거같어요
또 첮아보면 이런디자인 찾이어료워요 ㅋㅋㅋㅋ
무난하고 좋습니다",FREE
LQBQT7qP,상위 10%,24.12.25,아이보리(피치기모),FREE,정사이즈예요,보통이에요,화면과 비슷해요,163,54,55,잘 구겨지는데 예뻐요 너무 크지도 작지도 않은 딱 맞는 사이즈도 좋아요,FREE
qkrd******,,24.10.30,아이보리,FREE,정사이즈예요,아주 만족해요,화면과 비슷해요,159,55,55,"어디에나 받쳐입기 좋은 데일리 블라우스입니다
착용감 좋고 편해요",FREE
yuyu******,,24.09.24,아이보리,FREE,정사이즈예요,보통이에요,화면과 비슷해요,162,50,55,지금같은 환절기에 딱 좋아요! 깔끔하고 단정해서 출근할때도 입기 좋습니당!!,FREE
Lom0K1qc,,24.08.22,아이보리,FREE,정사이즈예요,아주 만족해요,화면과 비슷해요,165,50,55,조끼나 뷔에스트 안에 레이어드해서 입으려고 샀어요. 심플하면서도 포인트가 되는 디자인이라 여기저기 레이어드해서 잘 입을 거 같아요.,FREE
wW8bYPas,,24.05.04,블랙,FREE,정사이즈예요,보통이에요,화면과 비슷해요,173,55,44,소재특성상 구김이 잘 가지만 핏이 전체적으로 이뻐서 쁘띠스카프로 포인트 주면서 잘 입었어요!,FREE
c63tEJRh,,24.04.16,베이지,FREE,정사이즈예요,아주 만족해요,화면과 비슷해요,168,57,66,예쁘고 좋은데 뒤에 단추가 입기도 전에 떨어져버려서 오픈된 상태로 입고 있어용 이상하지는 않지만 아쉬운정도! 입었을때 수수해보인다고 예쁘단 소리 들었습니다!,FREE
미루니,상위 20%,24.04.09,아이보리,FREE,생각보다 커요,보통이에요,화면과 비슷해요,157,43,44,"사이즈가 좀 커서 어벙해요
ㄱ그래도 입을만하니까 봄에 자주 입어두려고합니다
바지나 스커트 안에 넣어서 입는게 이뻐요 ㅎㅎ",FREE
ZTOQIt4a,상위 15%,23.12.22,아이보리,FREE,정사이즈예요,보통이에요,화면과 비슷해요,162,57,55,직장에소 흰 옷으로 맞춰 입기로 해서 급하게 산건데 역기 많이 팔리는 이유가 있는 것 같아요 고급스럽고 아주 맘에 듭니다ㅎㅎ,FREE
mxLUTJCq,,23.12.03,베이지,FREE,정사이즈예요,아주 만족해요,화면과 비슷해요,,,,"크지도 작지도 않고 딱 잘 맞았어요 .
색도 사진이랑 차이 없었어요 .
결혼식 갈 때 안에 이너로 입었습니다 .
단정하고 좋아효 !!",FREE
8vtRW7pH,,23.12.03,베이지,FREE,정사이즈예요,아주 만족해요,화면과 비슷해요,150,40,44,"면접있어서 급하게 구매했는데,,진짜 퀼리티 무엇 다른 컬로도 색깔 별루 구매 할라구여 ㅠㅠ 진짜 너무 이뻐려ㅠㅠㅠㅠ안구매하면 손해라고 생각합니다",FREE
lyU2mAoA,상위 15%,23.11.30,베이지,FREE,생각보다 커요,보통이에요,화면보다 어두워요,158,43,44,색감이 화면보다 회끼가 돌아요 품은 넉넉해서 핏이 아방하게 귀엽습니다,FREE
y2HDF3Ud,,23.11.14,아이보리,FREE,정사이즈예요,아주 만족해요,화면과 비슷해요,160,49,44,무난무난 어디에나 입을 수 있는 블라우스예용 아무래도 구김이 많이가는 재질이긴하지만..! 어디에나 잘 어울려서 좋은 것 같아요,FREE
jVOm9ITZ,,23.11.08,아이보리,FREE,정사이즈예요,아주 만족해요,화면과 비슷해요,165,55,55,크기도 적당하고 퀄리티도 좋고 입었을때 너무 예뻐요! 단독으로 입어도 괜찮고 조끼랑 같이 입어도 예쁠것 같아요,FREE
UGgbmYKJ,,23.11.02,아이보리,FREE,정사이즈예요,아주 만족해요,화면과 비슷해요,,,,원피스 안에 입으려고 찾다가 발견했는데 너무 만족해요~^^ 어디에나 코디 할수있어서 좋구 지금 날씨에 입기 딱 좋습니당,FREE
eyKyR8Dt,상위 5%,23.10.27,아이보리,FREE,정사이즈예요,보통이에요,화면과 비슷해요,158,50,55,셔츠가 타이트 하지 않고 아방한 느낌이라 편하게 입고 나갈 수 있어요! 그리고 그냥 셔츠 하나만 입어도 되지만 니트 조끼랑 같이 입으면 더 좋을 것 같아요!,FREE
d99Y3vm4,,23.10.10,아이보리,FREE,정사이즈예요,보통이에요,화면과 비슷해요,,,,"조끼에 레이어드 해서 입웄는데
방방하니 귀여움
소매 좀 걷어서 입으니 더 예쁘네용 
뷔스티에 원피스에도 좋을 듯 해요
귀여움",FREE
oCRMNWSs,,23.09.20,아이보리,FREE,생각보다 커요,보통이에요,화면과 비슷해요,164,57,88,"배송도 빠르고 꼼꼼하게 포장되어 왔어요!
면이라서 구김이 걱정이지만 피부에 닿는 부분은 좋아요! 니트랑 얼른 같이 입어보고싶어요 ~",FREE
XtIoZ9Ii,,24.10.18,아이보리,FREE,생각보다 커요,아주 만족해요,화면과 비슷해요,160,50,55,일단 펑퍼짐한 핏입니당ㅎㅎ 하지만 어차피 스커트에 넣어 입을거라 괜찮아요 클래식하면서도 여성스러워 보여요,FREE
2yQhWiqs,,24.10.12,아이보리,FREE,정사이즈예요,아주 만족해요,화면과 비슷해요,158,56,66,"상체가 부해보이지않고 고급져요~
면 주름이 잘 가긴하지만 너무.얇지않아 지금 계절에 딱이예요~",FREE
aU5PUc6z,상위 15%,24.09.15,베이지,FREE,생각보다 커요,아주 만족해요,화면과 비슷해요,160,48,55,생각보다 품이 넓어서 괜찮네요.바지링 입어도 예뻐요.넣어입으려면 슬랙스랑 입으면 좋고 빼입으랴면 아래 청바지랑 입어도 예뻐요,FREE
59j2e3R2,상위 15%,24.04.25,아이보리,FREE,생각보다 커요,보통이에요,화면과 비슷해요,160,48,55,생각보다 조금 더 커서 아방한 느낌이긴 한데 그거대로 이뻐서 만족스러워용 기본템으로 딱입니당,FREE
dnmLwYac,,24.04.11,아이보리,FREE,정사이즈예요,아주 만족해요,화면과 비슷해요,,,,무난한 블라우스 같아요. 흰색하고 검은색 샀는데 둘 다 괜찮아서 잘 입을 것 같아요.,FREE
HPi15ZMO,,24.04.07,핑크,FREE,생각보다 커요,아주 만족해요,화면과 비슷해요,154,54,55,쿨톤스러운 핑크인데 누구든 잘 어울릴 것 같아요. 핑크에 보라색이 많이 섞인듯한 색입니다. 스커트에 입으면 더 예뻐요,FREE
u7tEFvqH,,24.04.06,아이보리,FREE,정사이즈예요,보통이에요,화면과 비슷해요,156,50,55,"셀프사진찍을때 입었는데 너무너무 맘에들었어요
딱 생각했던 옷 스타일이고 배송까지 직진배송이어서 너어어무 좋았습니덩",FREE
2Wfk9KxN,,24.03.29,아이보리,FREE,생각보다 커요,보통이에요,화면과 비슷해요,164,57,66,"품이 좀 커요 그래서 바지에 넣어서나 원피스랑 같이
입는거나 좋을 것 같아요 그래서 더 편하고 예쁘게
입을 수 있습니다 !!",FREE
J5fuBLcY,,24.03.21,아이보리,FREE,정사이즈예요,보통이에요,화면과 비슷해요,162,47,44,"소재때문에 승모근쪽이 뜨긴떠요 
근데 붕뜨는 느낌덕분에 넣어서 입으면 허리쪽이 이뻐요",FREE
OjTAY75p,,24.03.19,아이보리,FREE,정사이즈예요,아주 만족해요,화면과 비슷해요,165,55,66,"블라우스 넘 예뻐용
아무데나 어울리고 자주입게될 것 같아용!
흰색이라 약간 비침이 있지만 
그정도는 상관없을 정도로 휘뚤마뚤이에용",FREE
ZSNMNg69,,23.12.26,아이보리,FREE,정사이즈예요,아주 만족해요,화면과 비슷해요,158,55,55,"급해서 직진배송으로 시켰는데
생각보다 너무 질도 좋고 
구김도 생각보다 많이지지않아서
잘입었어요 
봄에도 단독으로 입어도 이쁠것같아요",FREE
8vtRW7pH,,23.12.18,블랙,FREE,정사이즈예요,아주 만족해요,화면과 비슷해요,150,40,44,너무 마음에 쏙쏙 들어여!! 아이보리색으로 구매했는데 너무 잘 입고 다며서 검은색으로도 구매했어여!! 진짜 자주애용할께여~!~,FREE
8vtRW7pH,,23.12.18,아이보리,FREE,정사이즈예요,아주 만족해요,화면과 비슷해요,150,40,44,너무 마음에 쏙쏙 들어여!! 검은색으로 구매했는데 너무 잘 입고 다며서 아이보리색으로도 구매했어여!! 진짜 자주애용할께여~!~,FREE
JRxHxGQR,,23.12.05,베이지,FREE,정사이즈예요,보통이에요,화면과 비슷해요,148,40,44,"하객룩으로 원피스 안에 입기 딱인 것 같아요
저렴한것치고 은은한 색감과 핏이 고급스러워 보이네요",FREE
zlzm******,,23.11.29,아이보리,FREE,정사이즈예요,아주 만족해요,화면과 비슷해요,163,70,77,"목 뒤에 단추 잠구는게 조금 어렵긴 한데, 살 많은 부위 다 가려주고 비침도 적어서 만족해요",FREE
lK1AONKk,,23.11.02,베이지,FREE,정사이즈예요,보통이에요,화면과 비슷해요,166,59,66,베이지 색상 살짝 브라운끼 더 돌면서 이뻐요 하객룩으로 입으려스고 샀는데 잘 산 것 같아요,FREE
8YasYKgN,,23.09.27,아이보리,FREE,정사이즈예요,아주 만족해요,화면과 비슷해요,165,54,55,코디 똑같이 샀는데 치마빼곤 다 이쁘네요 블라우스는 기본 그자체예요!! 이쁩니다!! 다른데에 받쳐입기 좋을거 같아요!!,FREE
CJwY2bYS,,24.12.29,베이지(피치기모),FREE,정사이즈예요,보통이에요,화면과 비슷해요,,,,겨울용 하객룩으로 구매했습니당 잘 입었어요 피치기모여도 겨울엔 얇긴해요~,FREE
FAH1KzP3,,24.11.14,아이보리(피치기모),FREE,정사이즈예요,보통이에요,화면과 비슷해요,160,50,55,"피치기모가 있는건지 없는건지 모를정도,, 레이어드해서 입으려고 샀는데 만족합니당",FREE
LoFNH542,,24.09.25,스카이블루,FREE,정사이즈예요,보통이에요,화면과 비슷해요,160,62,55,다리미질 필수 얇아서 가을에나 입을 수 있고 회사에 입고다닐 교복이 되었습니다,FREE
T7xt7kux,,24.04.08,블랙,FREE,생각보다 커요,아주 만족해요,화면과 비슷해요,170,60,66,가슴 큰 편인데도 적당히 낙낙해서 입기 좋아요 하객룩뿐망 아니라 데일리로도 좋을 듯,FREE
ARUyehls,,24.03.30,아이보리,FREE,생각보다 커요,보통이에요,화면과 비슷해요,155,50,55,봄맞이 흰블라우스 사고싶어 구매했어요~~세부사진 그대로 딱떨어지는건 아니지만 봄에 입기 좋아요~!추천해요!!,FREE
GvnTjCdL,,24.03.08,아이보리,FREE,정사이즈예요,보통이에요,화면과 비슷해요,,,,배송은 빠르구 약간 고급진느낌이라 구입했는데 제가입으니까..어울리는건가 잘 모르겠오요.. ㅋㅋ 생각보다 퍼진느낌이라 놀랐습니다,FREE
6kujPzLx,상위 10%,24.03.04,블랙,FREE,정사이즈예요,별로예요,화면과 비슷해요,163,52,55,"바스락거리는 블라우스인데,,,생각보다 저렴해보여요ㅜㅜ 환불하려다가 그냥,, 고이 접어서 보관할게요,, 아쉽네요!",FREE
YYP7hbCp,,24.01.13,아이보리,FREE,정사이즈예요,보통이에요,화면과 비슷해요,160,60,55,약간 헐렁한핏 좋아하는데 적당히 헐렁하고 위에 뷔스티에니트 같이 입으니 이뿌네용~ㅋㅋ 결혼식갈때 기본템이 될것 같습니다,FREE
pNRxTym2,,24.01.09,아이보리,FREE,정사이즈예요,아주 만족해요,화면과 비슷해요,168,60,66,기본적인 하얀블라우스이며 약간 사각재질이라 구김은 갑니다 핏은넘이뻐요 손목가늘어보임,FREE
nBDoaElJ,상위 20%,23.12.22,블랙,FREE,정사이즈예요,아주 만족해요,화면과 비슷해요,165,58,66,지금 입기에는 많이 얇지만 기본 디자인이라 오래 입을것 같아요~ 직진배송이라 하루만에 받았어요~ 직진배송 짱!! 👍,FREE
0ZhveELm,,23.12.06,베이지,FREE,생각보다 커요,보통이에요,화면과 비슷해요,152,52,55,마감이 퀄리티가 좋은편은 아니나 색이나 디자인이 넘 귀엽습니다 잘 입을 것 같아요,FREE
