아이디,리뷰어 등급,작성 날짜,옵션1,옵션2,상품 사이즈,퀄리티,색감,키,몸무게,사이즈,리뷰내용,제품_사이즈
긴소리,탑리뷰어,24.12.31,아이보리,S(44-66),생각보다 커요,아주 만족해요,화면과 비슷해요,155,53,55,"💬 155cm | 하체 통통 체형 | 클래식하고 페미닌한 아이템 선호
이번에 연말룩으로 선택한 아이템은 바로 타이 블라우스! 🌟
깔끔하면서도 여성스러운 디테일이 가득해서, 하객룩부터 출근룩, 데이트룩까지 활용도가 정말 높은 아이템이에요. 
저는 아이보리 컬러를 선택했는데, 얼굴을 환하게 밝혀주고 어디에나 잘 어울려서 매일 손이 갈 정도랍니다! 🤍

👚 입어보니 이런 점이 좋았어요!
- 부드럽고 가벼운 소재감 💨
피부에 닿는 느낌이 정말 부드럽고, 은은한 광택이 돌아 고급스러운 분위기를 연출해줘요.

- 여리여리한 핏 완성 💕
셔링 디테일과 볼륨감 있는 소매 덕분에 상체 군살이 커버되면서도 자연스럽고 우아한 실루엣이 만들어져요.

- 타이 디테일로 다양한 스타일링 🎀
단정하게 묶으면 격식 있는 자리에도 어울리고, 자연스럽게 늘어뜨리면 캐주얼한 무드까지 연출 가능해요.

- 탄탄하면서도 유연한 핏 👌
얇지만 흐물거리지 않는 원단이라 핏이 깔끔하게 잡히고, 활동하기도 편안했어요.

👗 오늘의 스타일링
저는 오늘 블라우스를 셋업과 매치했어요! 
✔ 신발은 롱부츠를 선택해서 우아함을 더해줬어요.
✔ 데일리로는 슬랙스, 데님과 매치하면 단정하면서도 캐주얼한 느낌으로 활용 가능!
✔ 오피스룩으로는 H라인 스커트와 함께 입어도 완벽!

💡 이 블라우스, 추천하는 이유는?
✔ 얼굴을 환하게 만들어주는 화사한 컬러
✔ 여성스러운 디테일로 체형 커버 효과까지!
✔ 다양한 스타일링 가능, 활용도 100%
✔ 부드러운 착용감과 고급스러운 광택감

👉 고급스러운 데일리 블라우스를 찾는 분들께 정말 추천드려요! 🌸 
저는 다음엔 다른 컬러도 구매하려고 찜해뒀어요. 이건 정말 실패 없는 선택일 듯해요! 😉
지그재그 체험단 이벤트로 상품을 무료로 제공받아 작성한 리뷰입니다.",S(44-66)
ㅋㅋㅈㄱ,상위 25%,24.12.01,블랙,M(66-77),생각보다 커요,아주 만족해요,화면과 비슷해요,169,58,66,"하하하 내가 이 후기 쓰는것만 기다렸다,,,사실 이 블라우스는 흰색 먼저 사고 좋아서 까만색도 산건데 이번에 친척 결혼식 갔다가 프로필찍고 맘에 들어서 그자리에서 바로 타이 바꿔매고 증사까지 뽕을 뽑고 왔습니다 ㅋ 이게 타이 매는 방식에 따라서 분위기가 휙휙 바껴서 넘 좋고요 앞으로 매면 캐쥬얼해서 출근룩 옆으로 넘기면 치명적인척 쌉가넝 여리여리 쌉가능 ㅠ 지방러 얼마전에 서울 출장간다고 안에 긴팔티 하나 입고 위에 입고 다녀왔는데도 살아돌아왔습니다.. (물론 그위에 트위드+코트입음) 아뮤튼 강추합니다.",M(66-77)
팩트요뎡,상위 10%,24.10.31,앨리스블루,S(44-66),생각보다 커요,별로예요,화면과 비슷해요,154,47,44,"가격대비 퀄이 너무나도.. 아쉬운제품이에요ㅠㅠ
다들보시라고 별다섯개로 올렸지만 
️⭐⭐️⭐️️가 적당할듯해요ㅠㅠ
🌼후기사진 꼭꼭 클릭해서 봐주세요ㅠ🌼
5:5로 찍은게아니라 착샷은 꼭 클릭해서👀

일단 어깨쪽셔링이 오른쪽왼쪽이달라요ㅠㅠ
사진에 보이실지 모르겠지만 묘하게 언발란스합니다..
그리고 유튭에서 후기본거처럼 단추부분이 매우 우글우글거려서 리본말고 사진처럼 가려주어야합니다
싼티 보세티 팍팍나서,,
담주결혼식에 입을지말지 고민이됩니다..
Tmi) 전남친이랑 겹지인이라 예쁘게하고갈거거든요^^
구매가많은이유는 일단 가격이 저렴하고
어깨퍼프로 얼굴이 작아보이고 
핏이예뻐요(존예는아님)
사이즈가 생각보다 커서 키크고 어깨넓은분들도
모두 착용할수있어서 인거같아요
다림질하면 나아질랑가 싶지만은..
📢저는 비추입니다..!!! 비슷한디자인으로
더 퀄이 좋은옷이 분명존재할거같아오..

리뷰가 너무많아서 누군가가 보실지모르겠지만
돈안아까운 쇼핑하시길 바라는마음에
솔직하게 작성해봅니다ㅜㅜ",S(44-66)
아리아리랑,상위 10%,24.09.13,아이보리,S(44-66),생각보다 커요,보통이에요,화면과 비슷해요,171,58,55,"저는 so so 입니당
댓글 보고 너무 많이 기대해버렸나봐요 ㅠㅠ

그래도 흰색인데 많이 안비치고
키가 큰편인데도 소매도 안짧고 좋았어요
댓글에서 리본 묶기 힘들다고 하던데 생각보다 금방 감 잡았어요

근데 아쉬운 점은 입으니까 s 인데도 생각보다 품이 커서 약간 부해보이는거 같아요 
총기장이 생각보다 길어서 빼서 입기 보다는 넣어서 입어야할거 같아요

++연주회때 입으니까 이쁘네요!
안에 넣어서 입으니까 부해 보이는 느낌도 덜하고
입으니까 샤랄라해서 기분 좋아졌어요!
저는 조심스레~ 추천드려요!",S(44-66)
xgxZd3Jp,,24.04.21,아이보리,M(66-77),생각보다 커요,보통이에요,화면과 비슷해요,167,60,66,"동생이 사진 보고 모조에스핀이냐 그랬는데 🤭 이 정도 가격에 이렇게 우아하고 이쁜 디테일이라니 ! 교회에서 반주할때 매번 입어야할 옷으로 급하게 필요해서 샀는데 역시 케이클럽은 옳았다 ,,, 친정처럼 찾게되는 케이클럽 😂

*디테일은
어깨에서 떨어지는 나비주름같은 셔링 타업체 상품의 민자 무늬 블라우스보다도 고급스럽게 느낌을 내줌. 목에 리본을 매는 게 제일 예뻐서 그렇게 입었어요!
보는 분들마다 어머! 하고 예쁘다고 해주셔요.

*사이즈
167/62 M사이즈 시키니 넉넉해요! 길이감 보여주려고 빼고 찍었는데 저정도 기장에서 엉덩이 약간 덮고 앞에는 넣어 입으면 차르르 이쁘게 떨어져요
(다만 단추부분의 세로 덧댐(?)이 약-간 억세서 단추부분은 착! 떨어지진않고 앞으로 어벙하게 뜰수 있으나 정면에서 보기엔 괜찮아요.

*퀄리티
위에도 말했듯 동생이 모조 에스핀 같다고 해주긴 했지만 자세히 보면 단추 부분에서 약간 고급스러운 느낌은 아니었어요. 근데 모조 에스 핀은 40-50만원인걸요? 2만원대의 블라우스에서 얼마나 퀄리티를 바라겠냐마는 전체적으로 떨어지는 퀄리티도 아니에요. 게다가 옷이 예뻐서 그런 것에 시선이 가지 않고 커버가 돼요. 예쁘다! 이것만 기억에 남는 :)

*옷 처음 받았을 때
쉬폰 커튼처럼 정전기가 나서 몸에 붙어서, 세면대에 물받아 섬유유연제 풀어서 헹궈주니 정전기가 나지 않았어요. 참고로 처음 옷 받았을 때 구겨짐이 있어서 스팀 다리미로 스팀 쏴줬더니 주름이 아주 쉽게 펴졌어요.

*비침이 심하지 않아요

*V넥 파임에, 
브라 나시를 입었는데 약간 나시가 보이더라구요. 이너가 좀 위로 올라오면 보일 거예요. 저는 맨윗단추 위쪽에 똑딱이 하나 달아 놓으려구요. 옆에서 봤을 때 벌어지면서도 나시가 약간 더 잘 보이는 게 있었거든요.

총평으로
전체적으로 참 만족스러워요. 남편이 너-무 예쁘대요. 올 봄에 너무나 즐겨 입을 것 같아요! 예쁜 옷 팔아 주셔서 감사합니다!",M(66-77)
둥글동글뚱글,탑리뷰어,25.01.06,블랙,S(44-66),생각보다 커요,아주 만족해요,화면과 비슷해요,152,45,55,"152cm 45kg 
어깨가 조금 넓은 체형입니다

가볍고 부드러운 소재로 피부에 닿았을때
사르르한 느낌으로 촉감이 너무 부드럽고 좋아요
몸에 실크를 덮는 듯한 느낌이더라구용
은은한 광택이 돌아서 고급져보이더라구요
그리고 옷이 부드러워서 만진다구 계속 쪼물딱거렸는데 옷이 크게 구겨지거나 하지않았어요

셔링과 볼록볼록 볼륨감있는 소매와 같은 디테일 
덕분에 상체 군살이 커버되며 여리여리해보이는 
느낌을 줍니다

저는 리본을 이쁘게 못 묶겠어서 타이를 길게 늘였는데 이렇게 입고다니는게 더 여성스럽고
고급져보이더라구요 

오피스룩으로 입어도 괜찮고 캐주얼하게
청바지에 입어도 깔끔해보여서 좋았어요

저는 할머니칠순잔치때 입고갔는데
다들 깔끔하게 입었다며 어른같다고 해주시더라구용 이미 어른이긴하지만...😏

사이즈는 생각보다 널널하기에 
자신의 몸을 과소평가해서 사이즈를 줄여서 사세용
지그재그 체험단 이벤트로 상품을 무료로 제공받아 작성한 리뷰입니다.",S(44-66)
azoo,탑리뷰어,25.01.05,블랙,S(44-66),정사이즈예요,아주 만족해요,화면과 비슷해요,,,,"블랙이라 사진상 디테일이 잘 안보이지만 넘 예쁜 블라우스입니다! 

🖤소재
부드럽고 적당히 결감이 보이는 제품이라 반지르르한 소재가 아닙니다! 그래서 더 고급스러워보이는 것 같아요 ㅎㅎ

🖤핏
붙는 블라우스가 아닌데도 말라보여요! 특히 넥쪽이 브이로 살짝 보여서 더 여리여리한 분위기로 연출되는 것 같습니다 또 타이를 앞으로 묶어도 옆쪽으로 묶어도 핏 흐트러짐 없이 예뻤어요!

🖤코디
블랙 블라우스라 데님이나 슬랙스 어디든 잘 어울리는건 당연하고 전 매트한 소재의 원피스랑 착용했더니 소재 대비되고 예뻤어요!
지그재그 체험단 이벤트로 상품을 무료로 제공받아 작성한 리뷰입니다.",S(44-66)
5wis******,상위 5%,25.01.05,아이보리,M(66-77),정사이즈예요,아주 만족해요,화면과 비슷해요,160,57,66,"목이 짧아서 타이 블라우스는 찜해두기만 했는데, 생각보다 나쁘지 않은 것 같아 개인적으로 만족해요!
바스트가 좀 있는 편이라 앞으로 묶으니까 너무 풍성해지더라구요! 그래서 한 줄은 뒤로 넘겼는데 저는 이게 더 편하고 예뻐 보이는 것 같아요!
완전 새하얗지 않고, 뽀얀 하얀색이라 둥둥 뜨는
느낌이 덜하고~ 단정한 치마나 바지랑 입으면 격식있는 자리에 입고 가기도 좋고, 청바지에 입으면 되게 캐쥬얼하게 입기 좋을 것 같아요!
전체적으로 주름도 잘 잡혀있어서 밋밋하지 않아 날 좋을 때는 단독으로 입어도 될 것 같아요!
지그재그 체험단 이벤트로 상품을 무료로 제공받아 작성한 리뷰입니다.",M(66-77)
Victoria,탑리뷰어,25.01.05,블랙,S(44-66),정사이즈예요,보통이에요,화면과 비슷해요,168,51,44,"리본 타이 블라우스는 여성스러운 매력을 한껏 끌어올려주는 아이템이에요. 핏은 살짝 여유 있는 실루엣으로, 편안하면서도 우아한 느낌을 줍니다. >.<

디자인
리본 타이는 블라우스의 가장 큰 포인트인데요, 목 부분에서 살짝 묶으면 고급스러운 느낌을 주고, 자연스럽게 늘어뜨려도 캐주얼하면서 멋스러운 스타일을 연출할 수 있어요! 리본을 어떻게 묶느냐에 따라 분위기가 달라지기 때문에, 다양한 방식으로 스타일링할 수 있는 장점이 있어요.

디자인
깔끔한 라인과 디테일이 돋보이며, 블랙 색상이 고급진 느낌을 줘요 ㅎㅎ 하이웨이스트 팬츠와 함께 매치하면 다리가 길어 보이고, 깔끔한 실루엣을 강조할 수 있답니다.

스타일리쉬한 데일리 룩으로도 추천드려용
지그재그 체험단 이벤트로 상품을 무료로 제공받아 작성한 리뷰입니다.",S(44-66)
귤희로그,상위 5%,25.01.05,앨리스블루,S(44-66),정사이즈예요,아주 만족해요,화면과 비슷해요,166,50,55,"[ 👩🏻 166/50 | 상체가 마른 체형 ]

요즘 이런 타이업 블라우스를 가지고 싶어서 많이 찾아봤었는데, 케이클럽 제품 정말 마음에 듭니다✨
나를 여리여리 여성으로 만들어 주는 핏..!
어깨의 셔링도 과하지않고, 찰랑거리는 소재와 적당한 넥 파임 세박자가 잘 맞아 떨어져 여리하게 만들어 줍니다
목부분 타이도 기장이 꽤 길어 리본으로 묶기도 가능!

모델 착용샷은 대부분 페미닌한 착장이길래 저는 와이드 팬츠와 매치해 보았는데요 잘 어울려서 이대로도 좋지만 자켓까지 걸치면 평소 출근룩으로도 아주 잘 입을 듯합니다. 하객룩으로도 딱 격식차린 느낌 낼 수 있을 듯!

그리고 앨리스블루 컬러 진짜 예뻐요 연한 하늘색에 그레이 한방울 툭 떨어트린 컬러 실물로 봐야하는 컬러ㅠㅠ
가격도 저렴한데 이 가격에 이 핏과 퀄리티.. 너무 만족스러워요! 저는 화이트 컬러 구매하러 갑니다 후후
지그재그 체험단 이벤트로 상품을 무료로 제공받아 작성한 리뷰입니다.",S(44-66)
써머진,탑리뷰어,25.01.04,아이보리,S(44-66),정사이즈예요,아주 만족해요,화면과 비슷해요,163,54,55,"🩶키 163 / 상의 55 / 하의 M 🩶
착용사이즈 : S

하객룩으로 아주 강추드이는 블라우스를 하나 데려왔습니다 .. 최근 결혼식이 꽤 많았는데 무엇을 입고 가야할지 .. 늘 고민이 되었거든요 ? 이 블라우스 하나만 있으면 아우터 어떤 걸 입어도 휘뚤마뚤 쌉가능! 

🖤소재
아주 얇은 레이온 혼방 소재였어요 후들후들 거리는 블라우스 재질이며 비침이 조금 있으니 제 사진 속 검정 옷걸이 기준 참고해주세요 ! 
다만, 착용시에 누드컬러 속옷을 착용하니 따로 비침은 없었습니다!

🖤디테일
앞에 타이처럼 된 디테일이 있어 원하는 방식으로 연출할 수 있단 장점이 있어요! 저는 리본으로 묶으니 너무 성가대 재질이라(?) 풀어 헤쳤구요! 
뭔가 옆으로 승무원처럼(?) 묶어서 연출해도 디테일하게 예쁠 느낌! 

🖤색상&사이즈
화이트에 가까운 아이보리 컬러라고 생각해주시면 됩니다! 사이즈는 상의 55기준 S 착용했을 때 널널했고 안에 넣입해서 입어도 충분하게 엉덩이까지 덮는 기장감이었어요!

하객룩 뿐만 아니라 출근룩, 상견례 등 중요한 자리에 격식있는 옷차림 필요할 때 하나만 가지고 있어도 유용하게 입을 수 있는 제품이라 생각됩니다 ! 🫶🏼
지그재그 체험단 이벤트로 상품을 무료로 제공받아 작성한 리뷰입니다.",S(44-66)
eoDn4e1R,상위 10%,25.01.04,네이비,S(44-66),정사이즈예요,보통이에요,화면과 비슷해요,164,51,55,옷 촤르르 한게 너무 이쁘고 디테일도 좋고 옷감도 ㄱ과한 광택이 아니라서 좋은 것 같아요! 너무 얇긴해서 겨울에 입을 옷은 아닌 것 같지만 그래도 이뻐서 히트텍 꾸역꾸역 입어가며 입었습니당!! 실밥이 조금 튀어나온 곳도 많고 그래서 정리를 한번씩 해주긴 해야하는데 그래도 좋습니다! 가슴부분이 조금 많이 파여있긴한데 그래도 끈 매듭을 묶으면 가려지기도하고 그래서 너무 좋아요! 예뻐요!,S(44-66)
zzangso,탑리뷰어,25.01.04,앨리스블루,S(44-66),정사이즈예요,아주 만족해요,화면과 비슷해요,157,45,44,"☻ 색상
앨리스블루 색상은 화면에서 처럼 차분한 소라색 + 그레이 느낌이에요 여쿨라 라면 그냥 사야하는 색이죠!! 어떻게보면 연그레이 같기도 한 아주 차분한 소라색이라 격식있는 자리에 어울릴 것 같아요
☻ 디자인
타이 블라우스라 타이를 어떻게 매는 지에 따라 느낌이 달라져서 티피오에 맞춰 입으면 될 것 같아요 저는 한번 툭 묶어서 길게 늘어뜨린게 맘에 들었는데 하객룩이나 데이트룩에선 리본으로 묶고 출근룩은 저처럼 한번 묶거나 뒤로 넘겨주는 것도 좋을 것 같아요
☻ 소재
생각보다 얇고 하늘하늘 거리는데 또 비침은 거의 없어요! 탄탄한 재질 보단 여리여리 하게 연출되는 얇은 재질이에요
☻ 활용도
하객룩, 출근룩, 데이트룩, 전시회룩 어디든 찰떡이에요 저는 슬랙스에 같은 톤 슬링백힐이 있어 매치했는데, 원피스 안에 입어도 롱스커트랑 매치해도 이쁠 것 같아요 ㅎㅎ
지그재그 체험단 이벤트로 상품을 무료로 제공받아 작성한 리뷰입니다.",S(44-66)
포지,탑리뷰어,24.12.28,앨리스블루,S(44-66),생각보다 커요,아주 만족해요,화면보다 밝아요,167,54,55,"167cm/54kg/55size/스트레이트 체형

제품: 일단 고급져보이고 색이 오묘해서 톤에 상관없이 다 잘 입을 수 있는 색상 같아요. 하객룩으로 딱이지 않을까.. 타이 블라우스가 가격대가 나가는 제품이 많아서 가성비 짱인것 같습니다.

디자인: 넉넉한데 직각 어깨로 보이게 어깨 부분 셔링이 잡혀있어서 몸매가 엄청 좋아보아요; 특히 넣입하면 짱… 블라우스인데 핏되지 않아서 정말 편하고 타이 기장도 딱 예뻐서 저는 주로 나풀나풀 풀러서 다닐것 같아요😆

사이즈: 정 55사이즈인데 넉넉합니다! 66까지는 다 잘 맞으실것 같고 편해서 여기저기 잘 입게 될 것같아요!
지그재그 체험단 이벤트로 상품을 무료로 제공받아 작성한 리뷰입니다.",S(44-66)
하이룬ㅁㅁㅁ,상위 5%,24.12.26,아이보리,S(44-66),정사이즈예요,아주 만족해요,화면과 비슷해요,165,47,44,"부드러운 실크같은 느낌의 블라우스입니다.
처음 배송 받았을 때 약간의 배송 구김이 있었음에도 보기 싫거나 그렇기 보단 자연스러운 느낌으로 주름져있었고 금방 펴지는 편이었습니다. (사진 또한 배송 받고 바로 착용한 사진으로, 구김이 눈에 띄지 않습니다.)
배송 올 때 블라우스 하나만 왔음에도 박스 포장에 옷걸이, 비닐 포장까지 최대한 옷의 구김에 신경 쓰신 듯한 느낌이었습니다.

개인적으로 흰색 타이 블라우스는 하나 정도 소장하고 있으면 결혼식 등 상황이나 일상 등에서 활용도가 높을 것이라고 생각합니다. 저는 단독으로 입기보단 레이어드 할 용도로 자주 사용할 듯합니다. 매듭 한 번만 지어 툭 떨어 뜨려 입거나 리본을 착용하여 목선에 맞추어 착용하니 옷에 포인트도 되고 좋았습니다. 목이 기신 분들은 목에 한 바퀴 감는 것도 예쁠 것 같습니다.
후기가 많고 검증된 만큼 옷의 퀄리티는 좋았습니다. 저는 블랙으로 하나 더 구매하여 청바지에 착용할 예정입니다.🥺

-
지그재그 체험단 이벤트로 상품을 무료로 제공받아 작성한 리뷰입니다.",S(44-66)
tal6PUws,상위 25%,24.12.14,앨리스블루,M(66-77),생각보다 커요,아주 만족해요,화면과 비슷해요,172,70,66,"블라우스가 크다는 후기를 보고 m사이즈 시켰는데 사이즈가 넉넉하니 딱 맞아서 좋네요
제가 팔길이가 조금 긴편인데 팔길이도 길어 좋았습니다!
색상이며 디자인이며 마음에 들어 블랙과 베이지도 추가 구매 예정입니다!",M(66-77)
dahe******,상위 10%,24.12.13,블랙,S(44-66),정사이즈예요,보통이에요,화면과 비슷해요,167,47,55,"단독으로 입기보단,뷔스티에 원피스와 조합해 입기를 추천드려요 🤍 특히 라이트베이지 색감의 뷔스티에 원피스와 아주 잘 어울려요 :)

제가 마른 체형이라 단독으로 입기엔 약간 헐렁한 느낌이 있는데, 원피스와 함께 입고 리본 매주면 핏도 딱 예쁘게 나옵니다! 착용감은 부드러워요~",S(44-66)
흘러흘러,상위 1%,24.12.07,네이비,M(66-77),정사이즈예요,아주 만족해요,화면과 비슷해요,166,53,55,"요즘 타이넥 블라우스가 유행인 것 같아
결혼식 갈 때 입으려고 하나 구매했습니다.

지그재그에서 타이블라우스 구경하다보면 비슷한 옷들이 많은데, 밝은색은 좀 부담스럽구 블랙은 다른 옷들도 많아서 네이비로 선택했어요! 어두운 네이비라 고급스럽고 예뻐요

약간의 광택감이 있어서 촤르르 흐르는 느낌이라
격식있는 자리에 어울리고 소매에도 핀턱포인트가 있어서 깔끔해요😁
슬랙스나 치마 둘다 잘어울려용

타이블라우스 잘못 구매하면 퀄리티 낮은 옷들도 많은데 가격도 적당한데 이정도면 잘산 것 같아요!",M(66-77)
Qh4niZkT,상위 25%,24.11.29,아이보리,S(44-66),정사이즈예요,아주 만족해요,화면과 비슷해요,166,64,66,너무너무 예쁩니다! 후기에서 조금 큰거같다고 하길래 에스 사이즈 주문했는데 정말 사이즈 너무 좋아요 어깨라인 정말 예쁘게 표현되서 만족스럽습니다 퀄리티 너무 좋아서 다른 색상도 구매하고싶어요 많이 얇긴하지만 누드톤 속옷입으면 안비치네요 세탁하고 주름없었으나 자켓 입고나니 팔쪽에 주름이 생기긴 해요 봄여름에 단독으로 입는게 베스트 인것 같습니다,S(44-66)
zKaA9IzP,상위 15%,24.11.27,아이보리,S(44-66),생각보다 커요,아주 만족해요,화면과 비슷해요,170,65,66,"생각했던 제질과 두께랑 동일 
원래 상의 90.95 입는데 크게 나왔다길래 S로 주문했어요 소매 짧은거 빼곤 사이즈 만족합니다 
얇아서 안에 이너 입고 다녀야될거 같아요 
정전기가 좀 심하지만 잘 입을거 같습니다",S(44-66)
Se00l,상위 5%,24.11.26,블랙,M(66-77),생각보다 커요,아주 만족해요,화면과 비슷해요,168,68,66,"와... 역시... 리뷰가 많고 인기 많은 건 이유가 있었음
진짜 대만족. 흰색 타이 블라우스 다른 브랜드껄로 있어서 블랙으로 한 번 사본건데 완전 마음에 들어요.
제가 고른 기준은 
1. 팔통이 넉넉해서 끼지 않아야 함
2. 브이넥의 깊이가 너무 짧거나 깊이 파이지 않을 것
3. 합리적인 가격과 너무 싼티나지 않을 것
4. 팔이 긴 편이기에 팔 길이가 짧지 않을 것

이 모든 조건을 충족해서 너무 마음에 쏙 들고 지금 바로 다른 컬러 구매하러 갈고임.
168에 69키로이고 팔뚝 살 많은데 비슷하신 분들은 미듐하세요!! 여리여리 쌉가능임 대만족",M(66-77)
jyr9*****,상위 10%,24.11.23,앨리스블루,M(66-77),생각보다 커요,보통이에요,화면과 비슷해요,175,130이상,77,친구 결혼식이 있는데 집에 어두컴컴한 옷밖에 없어서 찾아보다가 구매했어요! 전 진짜 대만족!! 블라우스라 얇지만 하늘하늘하고 촉감도 부드러워서 넘 좋아요!! 전 리본은 부담스러워서 앞에 한번만 묶었는데 뭔가 더 여성스러우면서 커리어우먼 느낌 뿜뿜해서 격식 있는 자리에서 입으면 바로 프리패스~! 넉넉하게 나왔다고 그래서 한 사이즈 다운했더니 딱 좋아여! 그리고 쿨톤언냐들한테 겁나 잘 어울리는 옷이니 당장 구매하세오❤️,M(66-77)
핫캣,상위 15%,24.11.17,베이지,S(44-66),생각보다 커요,아주 만족해요,화면보다 어두워요,155,46,44,"생각했던 베이지보다 조금더 오트밀에 가까운 색상인데 웜톤이라 뭔들 마음데 듭니다.. 실내랑 자연광색 받을때마다 조금씩 실제색상이 바뀌는 맛이 있네요
아이보리에 비해 비침이 적어서 데일리 출근룩으로 입기에도 좋아보입니다
비닐에 싸여와서그런지 정전기가 조금 심하고 약간 어깨에 내부 오버로크되면서 어깨뽕이 좀 있는것처럼 보여서 빈약한 실루엣이 보완이 되네요",S(44-66)
핫캣,상위 15%,24.11.17,아이보리,S(44-66),생각보다 커요,아주 만족해요,화면과 비슷해요,155,46,44,"하객룩 필요한데 다른 곳들이 배송이 자꾸 늦어져서 비상용으로 케이클럽에서 구매했습니다
역시나 빠른배송 👍👍
약간 비침이 있어서 실루엣 보이는거에 민감하신 분들은 내의를 받쳐입으셔야 할 것 같아요
두번째 사진에서 밑에 까만바지를 입고 착용했을 때 까만색이 거의다 비치는 걸로 봐서 색있는 속옷도 잘 비칠것 같아요.. 간절기엔 정말 좋을 거 같아요 옷걸이랑 같이와서 택배깡후 정리하기도 너무 편합니다",S(44-66)
Qq2mFsqH,상위 20%,24.11.14,아이보리,S(44-66),생각보다 커요,보통이에요,화면과 비슷해요,167,70,66,"가격대비 봉제 퀄리티 매우 좋아요!! 어디 울거나 씹힌부분 없이 깨끗합니다.
팔길고 어깨랑 흉통넓은 66이라 앵간한 블라우스는 핏 때문에 77하는데 M사이즈했다가 어깨선 너무 넓어보여서 s로 재주문했습니다. 70킬로대에 바스트 많으신분들 아니라면 S사이즈 충분해보여요!",S(44-66)
