아이디,리뷰어 등급,작성 날짜,옵션1,옵션2,상품 사이즈,퀄리티,색감,키,몸무게,사이즈,리뷰내용,제품_사이즈
GEFPXuvh,,23.11.27,블랙,M(66-77),정사이즈예요,아주 만족해요,화면과 비슷해요,167,56,55,잔치에 갈일이 있어서 구매했어요 브이넥이라 파임이 있긴한데 타이가 있어 리본 묶어주니 가려지고 단정해보이고 예뻐요!! 차르르 원단이라 예쁘네용,M(66-77)
SzebeOP8,상위 20%,23.11.26,블랙,L(77-88),생각보다 커요,아주 만족해요,화면과 비슷해요,,,,새벽배송 짱이에요. 화이트 사면서 같이 샀어요. 브이라인이라 생각보다 더 예뻐요. 타이 안 묶어도 예쁘고 묶어도 예쁘고 좋아요. 사이즈는 넉넉하니까 사이즈표 잘 보고 사세요.,L(77-88)
JBhwmTQl,,23.11.24,아이보리,S(44-66),생각보다 커요,아주 만족해요,화면과 비슷해요,160,46,44,"딱 이런 느낌의 부드러운 타이블라우스를 찾고 있었는데 마음에 들어요
생각보다 품이 커서 사이즈는 잘보고 사야할것같구요
재질은 부들부들한게 좋아요
이리저리 출근룩으로 활용하기 유용해요",S(44-66)
fEirDnHR,,23.11.23,아이보리,M(66-77),생각보다 커요,아주 만족해요,화면과 비슷해요,171,68,55,"스카이블루색깔 사고 맘에 들어서 아이보리도 하나 샀어요.
지난번에 샀을때보다 쿠폰먹여서 더 싸게 샀네요 ㅎㅎ
확실히 밝은색이 더 깔끔하고 여기저기 받쳐입기좋네요 👍",M(66-77)
K2DuZugd,상위 10%,23.10.19,아이보리,L(77-88),정사이즈예요,아주 만족해요,화면과 비슷해요,165,70,88,결혼식장에 입고가려고 샀어요 ! 일단 배송 하루만에 와서 좋았어요!! 케이클럽은 항상 옷걸이에 와서 너무 좋은거 같아요 ~~ 가격대비 질좋아요,L(77-88)
90Oj2Lma,,23.10.16,블랙,S(44-66),정사이즈예요,아주 만족해요,화면과 비슷해요,157,47,55,"약간 천이 빛 받으면 반질반질해보이기는 하는데, 입을 땐 느낌이 뭔가 달라요! 여리여리해 보이고 싶을 때 끈 하나 내리고 하나는 목에 둘러서 입기 좋습니다!",S(44-66)
C6BhfitP,상위 10%,23.09.29,블랙,M(66-77),정사이즈예요,보통이에요,화면과 비슷해요,,,,좀 크긴해요. 웬만하면 s해도 괜찮을 거 같구 박시하게 입고 싶으면 m 하면 될 듯. 가을 겨울 블라우스용으로 좋아요 두께가 있어서.,M(66-77)
26jsgr5W,,23.09.28,아이보리,M(66-77),생각보다 커요,별로예요,화면과 비슷해요,166,68,55,"배송빨랐어요
천도 가격대비 괜춘하고
리본만 이쁘게 묶음 이쁠 듯...
근데 한번빨고 한번입고 한번 더 빠니까
목 뒷부분이 뜯어졌어요ㅎㅎ...",M(66-77)
FUyLQPwd,상위 20%,23.09.20,아이보리,M(66-77),정사이즈예요,아주 만족해요,화면과 비슷해요,175,73,88,"진짜 이거 하나 있으면 나도 가을여신 가능
소재가 도톰하고 고급져보입니다
적당히 여리여리 핏 만들어주고 어깨라인도 일자처럼 보여요ㅠㅠ 진짜 너무 예쁩니다",M(66-77)
ahHSGBnW,,23.09.15,스카이블루,M(66-77),정사이즈예요,아주 만족해요,화면과 비슷해요,166,65,66,지그재그에서 산 옷 중에 가장 만족스러운 옷입니다. 재질 소재도 좋고 팔뚝살도 커버되서 좋고 배송도 빨라 좋아요 :) 앞으로도 이런 옷 많이 제작해 주세요❤️,M(66-77)
9A5Y1Cw0,,25.01.10,아이보리,S(44-66),정사이즈예요,보통이에요,화면과 비슷해요,157,47,55,"결혼식 갈 때 입으려고 급하게 샀는데 나쁘지 않았어요!
퀄리티는 저렴한 편이라서 기대 안했는데 고급진 느낌은 아니었습니다!",S(44-66)
QllJyTsG,,25.01.09,베이지,S(44-66),정사이즈예요,아주 만족해요,화면과 비슷해요,164,51,55,정핏이고 예뻐요 ㅎㅎ 웜톤이시면 찰떡이실듯 ㅋㅋ 결혼식 입고 가려고 하는데 지금은 좀 얇아도 여러모로 쓰임새가 많을 거 같네용,S(44-66)
Xob1Ao3H,상위 25%,24.12.16,블랙,M(66-77),정사이즈예요,아주 만족해요,화면과 비슷해요,168,60,55,"리본을 풀어도되고 묶어도 되는, 두가지 타잊으로 연출이 가능하므로 좋습니다~! 부들부들한 소재로 입었을때 촥 늘어져서 좋아용!",M(66-77)
ols5******,상위 20%,24.12.13,아이보리,S(44-66),정사이즈예요,보통이에요,화면과 비슷해요,159,47,44,"리뷰처럼 막 극찬할 정도는 아니구.. 일단 옷은 옷걸이에 걸려오는데 옷이 구김이 심해서 다리미질이 필수에요 
너무 구겨져서 보기 싫을 정도..? 옷 자체가 ㄹㅇ 엄청 얇아서 지금 하나 입고 돌아다니기엔 얼어요 
재구매는 안 할거 같아요 뭔가 아빠 옷 뺐어입은 거 같은 느낌도 나구ㅠㅠ 생각보다 핏이 벙~해서 ... 별로에요
모델핏 절대 안나와요 xx
그냥 돈 좀 더 주고 다른 블라우스 살 거 같습니다.",S(44-66)
G5LwkT5J,상위 30%,24.12.13,아이보리,S(44-66),생각보다 커요,보통이에요,화면과 비슷해요,162,59,55,"주문해서 받아보고 솔직히 조금 놀랐어요 블라우스라 하늘거리거 비침이 있는건 어느정도 예상은 했지만 살색 혹은 하얀색을 입고 입어도 다 비치고 입었을때 가슴때문에
떠서 그런지 너무 부해보였어요. 타이도 리본으로 묶어도 조금 애매해서 그냥 풀고 목도리 처럼 두르니 그나마 괜찮았어요..퀄리티는 가격대비 높은편이지만 핏은 모델분 핏은 전혀 나오지 않아서.. 조금 실망했습니다..",S(44-66)
쥼모잉,상위 15%,24.11.25,아이보리,S(44-66),정사이즈예요,보통이에요,화면과 비슷해요,162,52,55,"가격대비 만족이에요 !! 
원피스에 입고싶어서 샀는데 생각보다 타이가 커서 원피스에 입기에는 제가 느끼기에 좀 과하고 느끼한 느낌이 있어서 니트나 가디건에 넣어 입으니까 중화되고 예쁜 것 같아요 !!",S(44-66)
KX6keS1K,,24.11.18,앨리스블루,M(66-77),정사이즈예요,아주 만족해요,화면과 비슷해요,167,60,66,쇼핑몰 사진이랑 실제 색상이랑 거의 비슷하고 지금 살 많이 찐 상태인데도 사이즈가 널널해서 핏도 예뻐요~~~!!!!,M(66-77)
af6drsNe,,24.11.14,네이비,M(66-77),정사이즈예요,보통이에요,화면과 비슷해요,157,60,66,"생각보다 얇은 두께감도 아니고, 색감도 짙은 네이비색이라 너무 마음에 드네요ㅎㅎ
살까말까 엄청 고민했는데 괜히 고민했어요!!!",M(66-77)
dkfm*****,,24.11.13,아이보리,M(66-77),정사이즈예요,보통이에요,화면과 비슷해요,167,70,77,빠른배송 감사합니다. 제품도 상세설명 그대로입니다. 조금 구겨져서 왔지만 입을때 잘 다려입으면 될것같아요. 감사합니다,M(66-77)
pErlszfh,,24.11.11,블랙,L(77-88),정사이즈예요,아주 만족해요,화면과 비슷해요,153,60,77,"하객룩으로 급하게 구매했는데, 휘뚜루마뚜루 입을 수 있는 블라우스입니당!! 퀄리티듀 좋아서, 가을 겨울 봄까지 다 입을 수 있을 거 같아요",L(77-88)
0G1ZEzpw,,24.11.10,아이보리,S(44-66),정사이즈예요,아주 만족해요,화면과 비슷해요,160,67,77,피부에 닿는 결도 부드럽고 이뻤던것같아요 아이보리색으로 리본형태인데 정장류에도 잘어울리고 공식적인곳에도 좋았어요,S(44-66)
VKlYZNQ2,상위 30%,24.11.09,스카이블루,M(66-77),정사이즈예요,보통이에요,화면과 비슷해요,168,68,66,포멀한 자리가 급하게 생겨서 샀는데 너무 이뻐서 마음에 쏙 들어버렸어요 ㅎㅎ 주변에서도 이쁘다고 다 칭찬해주셨어요! 리본 묶는게 좀 어렵긴한데 잘 입을 것 같아요~,M(66-77)
GnSXmmcc,상위 10%,24.11.09,앨리스블루,S(44-66),정사이즈예요,아주 만족해요,화면과 비슷해요,167,49,55,"색깔도 오묘하고 맘에 쏙듭니다
포장도 너무 잘 되어 와서 만족스러어요!!
리본 묶는것보다 풀어서 연출하는게 훨씬 예뻐요",S(44-66)
nRJR1qVW,,24.11.07,아이보리,M(66-77),생각보다 커요,아주 만족해요,화면과 비슷해요,160,68,77,급하게 받아야해서 직진배송으로 시킨다구 m사이즈샀는데 상체통통이 입어도 완전 널널해요 s입어두 될거같아요! 그래두 옷은 차르륵 떨어지는핏이라 여리여리해보이구 고급져보여요!,M(66-77)
amaADJBQ,,24.11.01,스카이블루,S(44-66),정사이즈예요,보통이에요,화면보다 어두워요,162,68,66,새옷인데 올나간듯한 느낌..?왜 이런 옷이 헌것같은 느낌이 새옷인데 있는지 모르겠지만 급해서 그냥 입었습니다. 사이즈는 딱 제꺼로 사시길 바라고 하늘색에 회색?실버?섞은 느낌이라 좀더 탁해요!,S(44-66)
NgEVloQb,,24.10.31,스카이블루,M(66-77),정사이즈예요,아주 만족해요,화면과 비슷해요,161,60,66,사이즈딱 맞고 좋아요 화이트 구매했다가 너무 맘에 들어서 이색상으로 또 구매했습니다 굳굳 다른 색상도 구매 할 생각이에요,M(66-77)
2gGoJ1n2,,24.10.23,앨리스블루,M(66-77),정사이즈예요,보통이에요,화면과 비슷해요,165,60,77,"결혼식 갈 때 입으려고 샀는데 잘 산거 같아요
하객룩에 잘 어울리고 사이즈도 다양해서 저한테 맞는 핏으로 선택 할 수 있어서 좋았어요~",M(66-77)
DVMXNDQg,상위 20%,24.10.22,네이비,S(44-66),생각보다 커요,아주 만족해요,화면과 비슷해요,163,56,66,"퀄리티가 너무 좋고 실제로 입어보니 더욱 이쁩니다.
사이즈는 넉넉한편이여서 정사이즈로 시키셔도 될것 같습니다. 적극 추천합니다!",S(44-66)
cghP3xwj,상위 20%,24.10.20,아이보리,S(44-66),생각보다 커요,보통이에요,화면과 비슷해요,167,59,66,"결혼식 하객룩으로 잘 입었습니다!
167/58~9 정도 인데 하비체형이라 s사이즈인데도 굉장히 넉넉한 핏이였어요!",S(44-66)
TAWt736C,,24.10.19,아이보리,S(44-66),정사이즈예요,아주 만족해요,화면과 비슷해요,157,57,55,일단 옷걸이에 걸어서 배송온점이 맘에 들었고 가성비 짱 블라우스입니다! 싼티도 안나고 하객룩으로 아주 딱입니다!!,S(44-66)
0xIr7J3R,,24.10.19,스카이블루,L(77-88),정사이즈예요,아주 만족해요,화면과 비슷해요,162,72,77,어깨가 좀 크거 말고 너무 좋아요 맘에들오요 다른샛상도 구매하고 싶오요 리본 블라우스 찾고 있었는데 딱 원하는스타일에 사이즈도 넉넉해서 좋아요,L(77-88)
C6SlyKsp,,24.10.17,블랙,S(44-66),생각보다 커요,아주 만족해요,화면과 비슷해요,,,,"하객룩으로 골랐어요 ㅎㅎ 편하고 예뻐요
다만 줄을 어떻게 묶어야할지 애매했어요 저는 리본으로 묶은게 안어울리더라구요
그래도 가격대비 만족합니당",S(44-66)
ZZf8OyL7,,24.10.16,아이보리,L(77-88),정사이즈예요,아주 만족해요,화면과 비슷해요,160,68,77,옷이 진짜 너무 그냥 이쁜데요.. 이 가격에 이 소재면 진짜 고퀄인거 같아요 너무 이쁩니다 배송도 빠르고 요새 산 옷 중에서 제일 후회없는 옷인거같아요,L(77-88)
vgblqq06,,24.10.13,아이보리,S(44-66),생각보다 커요,아주 만족해요,화면과 비슷해요,154,55,55,"팔뚝도 왕두껍고 어깨도 넓은데 여리여리해보여요!
결혼식 겸 회사 행사 때 입으려고 샀는데 완전 맘에 들어요 옷걸이에 걸려서 배송와서 좋았어요!",S(44-66)
dRNz0MBK,,24.10.06,블랙,L(77-88),정사이즈예요,아주 만족해요,화면과 비슷해요,163,77,88,"핏이 이쁘네요
옷에서 냄새나긴 하는데 냅두면 빠질고같고
만족합니당
요즘 옷 다 작게 나오는데 여기 사이즈 여유있고 좋아요~ 자주 이용할듯 합니당",L(77-88)
auW9tUsr,,24.10.06,블랙,S(44-66),정사이즈예요,아주 만족해요,화면과 비슷해요,158,43,44,"대박이뻐여 하객룩입었는데 와 데이트때 입어도 이쁠거 같아여 짱이에요 
베이지색 바지에 입었구 같이 산 트위드자켓 찰떡이에요",S(44-66)
J9fydqgI,,24.10.05,스카이블루,S(44-66),정사이즈예요,아주 만족해요,화면과 비슷해요,159,46,44,똥손이라 사진을 잘 못찍는데 상세페이지랑 똑같아요 배송지연 한번 돼서 입으려했던 날에는 못입었지만 ㅠ 그래도 받아보니까 이뻐서 풀렸습니당! 케이클럽이 자체제작을 잘하는 듯...자체제작 다른 제품도 사보고 싶어용~!,S(44-66)
JU6Wfsbi,,24.10.05,블랙,S(44-66),정사이즈예요,보통이에요,화면과 비슷해요,160,48,44,"으으음 
받았을때 냄새가 너무 심하고 많이 구겨져서 와서 그게 아쉬웟어요
퀄리티는 괜찮은거같아요 간절기에 입기 좋아요!",S(44-66)
AbLnDkbF,상위 15%,24.10.01,베이지,S(44-66),정사이즈예요,아주 만족해요,화면과 비슷해요,163,59,66,"아 사진 없는게 아쉽네요.
완전 가을뇨자 스타일
결혼식 갈때 입을건데 너무 맘에 들어요
쵝오!
제가 어깨가 넓은데 여유롭게 나와서 S샀는데도
아주 찰떡같이 맞았슴다
너무 예뻐요 !",S(44-66)
V43I0TT0,상위 20%,24.09.29,앨리스블루,S(44-66),정사이즈예요,별로예요,화면과 비슷해요,160,50,44,배송은 빠르게받았습니다 제법 두툼한데 맨들맨질한 광택감 소재이고 합성섬유에 광택이라 조금 싼티가 나긴합니다 그래도 한철 잘 입겠지 하고 뒀다 입으려는데 다림질하다가 구멍났네요..ㅎ,S(44-66)
XaprVX72,,24.09.28,네이비,L(77-88),정사이즈예요,아주 만족해요,화면과 비슷해요,165,85,88,색깔도 핏도 너무이뻐여ㅠㅠㅠ네이비 색깔도 쨍하지않고 너무이쁘게 와서 회사에서 잘 입고 다닙니다~ 다른색깔있으면 구매할려고합니다ㅎ,L(77-88)
i914DI5r,,24.09.26,아이보리,M(66-77),생각보다 커요,아주 만족해요,화면과 비슷해요,165,65,55,"목 짧고 어깨 있는 편
넥라인 적당하고 핏이 블라우스 답게 우아한데
체형마다 핏이 다를 것 같음
사이즈 55-66입는데
적당히 잘 맞음",M(66-77)
qeen****,,24.09.24,스카이블루,S(44-66),정사이즈예요,아주 만족해요,화면과 비슷해요,160,53,55,너무이뻐요 옷걸이하고 같이주고 박스에 이쁘게 담아줘서 왔는데 이가격에 이퀄리티 만족합니다 어느옷에나 매치해도 이뻐요,S(44-66)
XkvmC0ya,,24.09.24,블랙,L(77-88),생각보다 커요,아주 만족해요,화면과 비슷해요,,,,평소 안입던 스타일이라 보는 눈이 없어 걱정했는데 대성공입니다! 단정해보이는데 편해서 좋아요. 소재도 부들부들하고 거슬리는 것 없어요,L(77-88)
IAaQEG11,,24.09.24,스카이블루,M(66-77),정사이즈예요,아주 만족해요,화면보다 어두워요,167,67,55,"생각보다 어두운 느낌인데 
막상 입으니까 딱 이쁜 색감이었어요 
너무 밝아서 튀지도 않고 결혼식 참석하려고 구매한거라격식차리는 장소에 입기에 좋았어요 
시원한 소재는 아니에요",M(66-77)
mrwJjKkX,,24.09.20,아이보리,M(66-77),정사이즈예요,아주 만족해요,화면과 비슷해요,164,57,55,"블라우스 참 이쁘네요
완전 하객룩 ! 리본을 옆으로 맬수있어서 참 좋아요😊
이쁘다는 말 많이들었네요 오늘!
재질도 좋아용",M(66-77)
JCa6SJNZ,,24.09.13,아이보리,XL(88-99),생각보다 커요,보통이에요,화면과 비슷해요,170,60,77,"사이즈를.. 제가 잘못샀네요 ㅎㅎㅎㅎ
많이 커요 ㅎㅎ 생각보다 구김도 적을 거 같고
퀄리티도 좋네요 다른 컬러로 사이즈좀 작게사면 
좋을 것 같네여",XL(88-99)
4208***,상위 15%,24.09.11,스카이블루,M(66-77),정사이즈예요,아주 만족해요,화면과 비슷해요,170,30이하,33 이하,"옷걸이랑 같이와서 더 좋았어요! 베이지색, 검정색 슬랙스랑 잘 어울릴 것 같아요 회사 출근룩으로도 예쁩니다 ㅎㅎ 하객룩으로도 최고!",M(66-77)
MfBySF9C,,24.09.08,스카이블루,S(44-66),정사이즈예요,보통이에요,화면과 비슷해요,158,49,44,"결혼식때 입으려고 급하게 샀어요
여름 쿨톤인데 색상도 잘 맞고
구김도 많이 안가고 무난 무난해서 아무데나 입기 좋은 블라우스입니다~",S(44-66)
O5RaJkVh,,24.09.07,아이보리,S(44-66),정사이즈예요,아주 만족해요,화면과 비슷해요,167,67,,"66에서77입는데 s사이즈 넉넉하게 잘맞네요
강추합니당 색도 넘 이뻐요
기장도 적당하고 팔도 잘 커버해줍니당
존예탱구리♡",S(44-66)
PMZOWX6k,,24.09.05,스카이블루,S(44-66),정사이즈예요,아주 만족해요,화면보다 어두워요,162,50,55,만족해요 소라색이 생각보다 약간 어두운데 가을이라 이게 더 나을듯 하고요..단추를 가리도록 타이를 내려 묶는게 더 예쁜듯해요,S(44-66)
upCg1Ipn,상위 5%,24.09.04,아이보리,L(77-88),정사이즈예요,아주 만족해요,화면과 비슷해요,,,,"이 가격에 퀄리티 너무 괜찮아여,,,,!! 다른 색도 사려구요!!! 가슴골도 적당히 브이넥이어서 이쁘고 리본 안묶어도 안 어정쩡한 타이에요",L(77-88)
U0EGHL70,,24.09.03,블랙,S(44-66),정사이즈예요,아주 만족해요,화면보다 어두워요,173,72,55,"아이보리 컬러 너무 잘입고 있어서 블랙도 샀어요
챠르르 떨어지는 재질이라 날씬해보이고
격식있는 자리에서 잘어울려요!",S(44-66)
vqDebmER,상위 10%,24.07.20,아이보리,S(44-66),생각보다 커요,아주 만족해요,화면과 비슷해요,170,60,66,분위기 내고싶을 때 찰떡입니다! 블라우스 하나 입었을 뿐인데 되게 꾸꾸꾸 하고 나온 것 같은 너낌 ㅎㅎㅎ 청바지에도 잘어울리고 슬랙스에도 잘 어울리고 치마에도 잘 어울릴 것 같아요! 하나쯤 소장하면 넘 좋을 듯해요~,S(44-66)
h1K2ALAJ,,24.06.12,스카이블루,M(66-77),정사이즈예요,보통이에요,화면과 비슷해요,158,68,66,하객룩으로 아주 잘입었습니다 넉넉하게 한사이즈 작게 사도 됬을듯 이뻐요 주름도 잘 안가고 배송도 매우 빠르게 왔습니당,M(66-77)
k5oQjhxo,,24.06.05,스카이블루,S(44-66),정사이즈예요,보통이에요,화면과 비슷해요,159,47,55,"결혼식용으로 샀어요 핏 이쁘네요 기대됩니다ㅎ
하늘색이 우아한느낌 주고 찰랑 부들해서 이뻐요
흰치마에 입으면 더 어울립니다요",S(44-66)
CpElxJx7,,24.06.04,스카이블루,S(44-66),정사이즈예요,아주 만족해요,화면과 비슷해요,164,55,55,"배송도 빨리왔구 재질도 부드러워서 좋아요!!
S사이즈 주문했는데 넉넉하고 딱 좋아오
근데 다림질은 하고 입으셔애힐것깉네영",S(44-66)
fVa9y5s5,상위 10%,24.05.29,블랙,S(44-66),정사이즈예요,아주 만족해요,화면과 비슷해요,157,46,55,"왕 급하게 주문해서 입었는데 넘넘 맘에 들었어요.
얇고 찰랑찰랑 거리능 소재로 고급진 느낌에 
타이까지 포인트가 되어 좋았어요!",S(44-66)
UGCc6MBp,,24.05.17,아이보리,S(44-66),정사이즈예요,아주 만족해요,화면과 비슷해요,160,56,66,배송도 빠르고 너무 이쁘고 편해요!! 퀄리티 짱짱이예요ㅎㅎ!! 다른색도 구매해야겠어요!! 감사합니다ㅎㅎ!!!,S(44-66)
mtUnqEBZ,,24.05.12,스카이블루,S(44-66),정사이즈예요,아주 만족해요,화면과 비슷해요,163,52,55,"짱친 결혼식때 급하게 입는다구 삿는데 댕만족이용 ㅎ
재질도 찰랑 재질이구 톤도 잘맞아서 잘입었어요!
배송도 하루만에 오구 최공",S(44-66)
MtbdX5sc,,24.05.01,스카이블루,S(44-66),정사이즈예요,아주 만족해요,화면과 비슷해요,170,54,55,넘 예뻐요!! 후기에 생각버다 어둡다해서 걱정했는데 예쁜 톤다운소라색!!! 하늘하늘 부드러워서 좋습니다!!!,S(44-66)
cjst*****,,24.04.27,스카이블루,M(66-77),정사이즈예요,아주 만족해요,화면과 비슷해요,172,72,66,차르르 떨어지는 부드러운 옷감에 깔끔하고 고급져 보입니다. 근데 좀 부해보이는 감이 있어요. 이거 입고 면접 봤습니다. ㅎㅎ,M(66-77)
R8VIITb7,,24.04.23,스카이블루,S(44-66),생각보다 커요,아주 만족해요,화면과 비슷해요,173,58,55,"색감 최고 예뻐요 ㅠㅠ
탄탄해서 흐물거리지 않아서 좋았고
저는 통이 좀 커서 줄였습니당 
봄애 화사하게 입기 딱 좋습니당 🫶",S(44-66)
TLBewVof,,24.04.20,스카이블루,M(66-77),정사이즈예요,아주 만족해요,화면과 비슷해요,156,65,66,소라색 상품사진과 동일하고 60키로대인데 사이즈딱맞아요~~ 하객룩으로입었는데 흔히입는 코디도아닌것같이 이뻤어요 ㅎㅎ,M(66-77)
GmTBvglA,상위 25%,24.04.10,블랙,S(44-66),생각보다 커요,아주 만족해요,화면과 비슷해요,156,44,44,생각보다 사이즈가 커서 당황했지만 그래도 여리여리한 핏이라 입으니깐 이뻐요!! 소재도 부드럽고 피부에 예민하지않고 좋습니당>_<,S(44-66)
4vfLcK8L,상위 5%,24.04.09,스카이블루,M(66-77),정사이즈예요,아주 만족해요,화면과 비슷해요,170,55,66,"너무이뻐요!!!! 기대했던거보다도 너무맘에들고 촉감이 부들부들,, 다른 블라우스랑 다른 느낌이에요 !! 다른색도 구매하고싶어요",M(66-77)
Nzz5riRT,,24.04.07,스카이블루,M(66-77),정사이즈예요,아주 만족해요,화면과 비슷해요,174,70,66,175에 팔다리 긴편인데 소매길이 딱 적당히 잘맞아요. 깔끔하고 단정해요. 하객룩으로 입었어요. 슬랙스랑 입었는데 너무 예쁘네요,M(66-77)
XZ3BJN2M,,24.04.04,스카이블루,M(66-77),생각보다 커요,보통이에요,화면보다 어두워요,156,70,77,"친구 결혼식에 입으려고 주문했어요!!
색감이 좀 더 밝았으면 더 예뻤을 것 같아서 조금 아쉽지만 소재도 부드럽고 예뻐요!",M(66-77)
2YP6FI66,,24.03.31,아이보리,M(66-77),정사이즈예요,아주 만족해요,화면과 비슷해요,,,,격식있는 자리에 입기 좋은 깔끔하고 예쁜옷이예요 후들하고 핏도 이뻐서 어깨가리기도 넘 좋아요 바지도 이쁘고 치마에도 잘어울려요,M(66-77)
hJS3lUo1,,24.03.30,스카이블루,M(66-77),생각보다 커요,보통이에요,화면과 비슷해요,173,64,66,"진짜 날씬해 보이고 넉넉해서 팔뚝살 다 가려지고 
싸구려느낌 안나고 넘 예뻐요 그리고 많이 얇지도 않아서 지금 입기 딱 좋아요",M(66-77)
3mkBJhB3,,24.03.30,스카이블루,S(44-66),생각보다 커요,보통이에요,화면보다 어두워요,160,60,66,생각보다 크고 어둡긴한데 그래도 출근룩으로 많이 튀지않규 괜찮은거같네용 차르르해서 핏도 나쁘지않고 맘에들어요!,S(44-66)
qkrc******,상위 20%,24.03.28,아이보리,M(66-77),정사이즈예요,보통이에요,화면과 비슷해요,165,64,66,"색감은 화면보다 어두워서 아쉬웠지만
그래도 핏은 역시 맘에들어요 
근데 생각보다는 많이 비쳐서 조금 아쉽네용
그래도 맘에들어용",M(66-77)
jITiwBmR,,24.03.21,아이보리,S(44-66),정사이즈예요,보통이에요,화면과 비슷해요,166,57,55,일단 질이 너무 좋고 사이즈도 잘 맞아요 다만 어깨 뽕이 이렇게 심할줄은 몰랐네요ㅠㅠ 제가 어깨가 넓은 편이라 더 돋보이는거같아요 어깨 넓으신 분들은 고민 해보시고 구매하시는게 좋을거같아요,S(44-66)
o3VO6A7q,,24.03.18,블랙,S(44-66),정사이즈예요,아주 만족해요,화면과 비슷해요,161,41,44,디자인도 이쁘고 소재도 괜찮습니다 하늘하늘하고요 고급스러워 보이네요 자주 입고 다녔습니다 하늘색도 사고 싶네요!,S(44-66)
THtEdHvc,상위 25%,24.03.13,아이보리,XL(88-99),정사이즈예요,아주 만족해요,화면과 비슷해요,165,59,66,하늘하늘한 소재인데 구김도 잘 가지않고 가벼워요 !! 사이즈도 넉넉하니 좋았고 핏도 스타일도 다 좋은 것 같습니당 ㅎㅎ,XL(88-99)
XpD6FEF4,,24.03.09,스카이블루,M(66-77),정사이즈예요,보통이에요,화면과 비슷해요,165,60,66,퍼스널컬러 여쿨라이트라서 하객룩으로 블랙은 너무 못생겨보이거든요! 이거 딱입니다 ㅎ너무 예쁘고 활용도 좋아여 강추,M(66-77)
Vm6Skyqa,상위 5%,24.02.19,스카이블루,XL(88-99),생각보다 커요,보통이에요,화면과 비슷해요,170,68,77,배송은 보통. 올 차르르하니 이쁘네요. 요새 살쪄서 88입는데 한사이즈 작게사도 됐을뻔했네요. 여성스럽고 질도 괜찮아요,XL(88-99)
jwVTc6Pz,,24.02.18,블랙,M(66-77),생각보다 커요,아주 만족해요,화면과 비슷해요,160,50,55,"생각보다 재질도 좋구요 
핏도이뻐요 넉넉해요
잘산거같아요 굳입니다 
ㅎㅎ 가격대비 재질 굳 핏 
만족스러워요 또 구매히러얼게에앵",M(66-77)
kUM0tfPo,,24.02.17,스카이블루,S(44-66),정사이즈예요,보통이에요,화면보다 어두워요,160,51,44,생각보다컬러가 어둡긴 한데 그래도 이뻐요!!! 배송 빨리왔어요. 고급스러운 디자인이라 좋아요. 리본 잘 묶으면 이쁠거같아요 ㅎㅎ,S(44-66)
