아이디,리뷰어 등급,작성 날짜,옵션1,옵션2,상품 사이즈,퀄리티,색감,키,몸무게,사이즈,리뷰내용,제품_사이즈
4gkzun1I,,24.09.15,블랙+화이트(-1000원추가할인),free,정사이즈예요,보통이에요,화면과 비슷해요,150,49,55,브라캡 있는 나시는 처음 입어보는데 흰색은 나 여기 브라캡있어! 하는 느낌이라 옆면 안 보이게 잘 가리고 입어야할 것 같아용 검은색은 티 안 나서 좋구 무엇보다 브라를 따로 안 입어도 된다는게 정말! 좋은 것 같아요,Free
Z40GLAho,,24.09.15,화이트 단품,free(롱버전),정사이즈예요,아주 만족해요,화면과 비슷해요,153,47,44,"이너로 입을만한 캡내장 나시 찾고 있었는데 너무 맘에 들었어용 면도 부들부들하구
근데 바스트 크신 분들은 캡이 작을 수도 있을 것 같고,
부유방 부각이 좀 있는 듯 합니닷...",Free
PI9ICiIz,상위 30%,24.09.13,화이트+화이트(-1000원추가할인),free,정사이즈예요,보통이에요,화면과 비슷해요,156,44,44,생각했던 재질은 아니지만 면 탄탄하고 패드도 안돌아가서 괜찮아요~ 연휴때문에 걱정했는데 배송도 다음날 바로 왔어요! 원쁠원이라 가성비도 굿 :),Free
bgjsPz9n,,24.09.13,블랙+화이트(-1000원추가할인),free(롱버전),정사이즈예요,아주 만족해요,화면과 비슷해요,160,46,44,"이너로 입은 착용샷입니다
정말 인생템이에요! 너무너무 마음에 들고 실용성 정말 좋고 저 이 리뷰 쓰고 또 장바구니 담으러 갑니다..
오래오래 판매해주세요!!!!",Free
F51190E4,,24.09.09,블랙+그레이(-1000원추가할인),free(롱버전),정사이즈예요,아주 만족해요,화면과 비슷해요,172,52,55,"🌷꼼꼼한 포장
🌷설명과 동일한 옷

이너로 입으려 한건데 맘에 듦 
동네 산책다닐때 요고에 남방 입으면 찰떡일듯
다른 색도 사고싶어짐👍",Free
EHTGuCtM,상위 25%,24.09.06,블랙+그레이(-1000원추가할인),free(롱버전),정사이즈예요,아주 만족해요,화면과 비슷해요,160,55,55,"이너로 입기 좋아요 
가격대비 소재도 굿굿
오자마자 일단 세탁망에 넣고 빨래했는데
캡 멀쩡하고 ㄱㅊ네요
좀 더 선선해지면 가디건 안에 입어야즵 ~~",Free
oJq24nt0,,24.09.06,블랙+그레이(-1000원추가할인),free(롱버전),정사이즈예요,아주 만족해요,화면과 비슷해요,,,,캡나시 찾다가 구입했는데 아주 마음에 듭니다~! 캡이 딱 고정되어있어서 아주이주 편하게 입기 좋아요ㅎㅎ 화이트랑 브라운도 구입하려구요!,Free
vEHyNEyP,,24.09.01,화이트 단품,free,정사이즈예요,아주 만족해요,화면과 비슷해요,160,48,44,이거 롱버전 샀었는데 살짝 긴 감이 없지 않아 있어서 일반버전으로 샀는데 딱 적당한 것 같아요! 근데 입으면 살짝 더움 근데 갠츈 낫벧,Free
S0fPc2oh,,24.08.30,블랙+블랙(-1000원추가할인),free,정사이즈예요,아주 만족해요,화면과 비슷해요,162,51,55,"진짜 매우 만족해서 여러장 구매해서 입는중 
너무 편하고 이너로 입기에 이거만한게 없음 진짜 이번 여름 내내 이거만 입은듯 합니다 지짜 색깔별로 쟁여서 입으세요",Free
j6ka1qXZ,,24.08.30,화이트+코코아(-1000원추가할인),free(롱버전),정사이즈예요,보통이에요,화면과 비슷해요,164,58,66,브라운은 캡도 괜찮고 색감도 괜찮은데 흰색은 캡 모양이 쭈글해서 ..어떻게 해야할 지 모르겠습니다. 그리고 캡이 좀 비치기는 해요.. 그거 말고는 브라운은 잘 입고 다니고 있어요.,Free
QjwB17kU,,24.08.28,블랙+화이트(-1000원추가할인),free(롱버전),정사이즈예요,보통이에요,화면과 비슷해요,159,64,66,항상 나시 입을 때 속옷 때문에 불편했는데 캡이 내장된 제품이 있길래 구매해봤습니다. 길이도 딱 좋고 재질도 나쁘지 않아서 추천합니다~,Free
LIduEfwj,,24.08.25,그레이 단품,free(롱버전),정사이즈예요,아주 만족해요,화면과 비슷해요,162,58,55,제가 처음으로 캡나시를 입어봤는데요 저는 브라자보다 편한게 있을 줄 몰랐습니다 빨래하기도 편하고 아주 좋네요 다른 곳에서 산 캡브라는 이미 빨래 한 번 돌리니 캡이 빠져서 사경을 헤매고 있습니다,Free
fUBSjueh,상위 5%,24.08.24,블랙+화이트(-1000원추가할인),free(롱버전),정사이즈예요,보통이에요,화면과 비슷해요,161,49,55,굿굿 좋아여! 회색으로 구매 후 회이트랑 블랙도 추기 구매했어요. 75B인데도 컵이 좀 뜨는 느낌이 드네요ㅜ 그래도 구매한 것 중에서는 가징 편해서 자주 입어요:),Free
KwNyn9VB,,24.08.19,코코아 단품,free(롱버전),정사이즈예요,아주 만족해요,화면과 비슷해요,160,63,66,쭉쭉 잘늘어ㅓ나서 모두 입을수 있음. 색상도 똑같고 머 아주 무난한 나시인것 같음. 그리고 패드가 있어서 따로 브라착용 안할수 있어서 너무 좋은듯ㅋ,Free
fN23vmND,상위 5%,25.01.01,블랙 단품,free(롱버전),정사이즈예요,아주 만족해요,화면과 비슷해요,162,52,44,니플패치만 붙이고 다니는 귀찮 편안 추구러인데 이거 완전 요물입니다! 니플패치보다 캡이 있어 가슴을 더 예쁘고 안정적이게 잡아줍니다! 사이즈가 프리라 불안했는데 엄~청 크신분들 아니면 다 두루두루 맞을듯?,Free
v0l31jzx,상위 30%,24.12.25,블랙 단품,free(롱버전),정사이즈예요,보통이에요,화면과 비슷해요,166,58,55,볼레노안에 입으려고 샀는데 생각보다 퀄리티있어서 기대이상으로 만족했어요. 검정샀는데 다음에는 흰색 살 의향 있어요.,Free
7WrDmD17,상위 25%,24.12.14,그레이 단품,free(롱버전),정사이즈예요,아주 만족해요,화면과 비슷해요,158,47,55,재구매입니당! 입이 아파요 그냥 사세요 패드 안 삐져나오게 바느질되어있어서 편하게입을 수 있는것이 너무너무 좋습니다!,Free
FfPVuQO8,상위 30%,24.12.12,블랙+화이트(-1000원추가할인),free,작아요,별로예요,화면과 비슷해요,163,50,55,"화이트랑 블랙 하나씩 구매했어요
화이트에 머리카락이 붙어있더라구요..색도 누리끼리함
반품한거 주신거 같은데 찝찝해서 반품하려다 입습니다
검수 똑바로 해주세요,,",Free
BaPnYrVV,상위 30%,24.12.01,화이트+코코아(-1000원추가할인),free(롱버전),작아요,보통이에요,화면과 비슷해요,163,59,55,기본이너도 유용하게 사용할수 있을것같아요 다만 밴딩이 앞에만있어서 잡아주는 느낌이 조금 덜한게 아쉬워요ㅜㅜㅜㅜ,Free
viol****,상위 25%,24.11.27,화이트+그레이(-1000원추가할인),free,정사이즈예요,아주 만족해요,화면과 비슷해요,170,67,66,블프라서 착한 가격에 한 번에 네 벌 구매했어요 브라하는 것보다 겨울엔 추워서 걍 아예 브라탑으로 입는 게 더 간편하고 젛아요,Free
imFPaa5c,,24.11.25,블랙+그레이(-1000원추가할인),free,정사이즈예요,아주 만족해요,화면과 비슷해요,155,47,44,"재구매입니다 :)
세탁해도 패드 돌아감 없고 스판 짱짱해요
이 캡나시가 너무 편해서 이젠 브라 못입겠어요 ,,, 🥹
캡나시는 이 제품으로 정착하려고요 !",Free
imFPaa5c,,24.11.25,블랙+화이트(-1000원추가할인),free,정사이즈예요,아주 만족해요,화면과 비슷해요,155,47,44,"재구매입니다 :)
세탁해도 패드 돌아감 없고 스판 짱짱해요
이 캡나시가 너무 편해서 이젠 브라 못입겠어요 ,,, 🥹
캡나시는 이 제품으로 정착하려고요 !",Free
DYUgJ9yZ,,24.11.15,화이트+화이트(-1000원추가할인),free,정사이즈예요,보통이에요,화면과 비슷해요,154,45,44,원래 갖고있던 타샵 세미크롭캡내장나시가 있는데 빨래 하다보니 화이트 색이 어둡게 변색되어서 구매한건데 색 변하지 않고 오래가쓰면 ㅜㅜ,Free
koDVgpJ3,,24.11.03,블랙+화이트(-1000원추가할인),free(롱버전),작아요,보통이에요,화면과 비슷해요,169,60,66,집앞 마실나갈때나 간편하게 브라 없이 입으려고 샀어요 근데 저한테는 좀 작네요 컵도 제가 75D인데 작아서 자꾸 올라가고 총장도 좀 더 길었으면 좋겠어요 그래서 집에서만 입고 있어요,Free
sequJtDB,,24.10.29,그레이 단품,free(롱버전),정사이즈예요,보통이에요,화면과 비슷해요,158,52,55,이런색이에요..! 패드가.. 조금 위로올라가잇달까.. 작달까.. 불편하진않아서 입고있어요! 퀄리티는 넘 좋아요,Free
W4aSxdWm,,24.10.29,블랙+그레이(-1000원추가할인),free(롱버전),정사이즈예요,보통이에요,화면과 비슷해요,130이하,30이하,33 이하,"퀄리티는 괜찮은데 내장된 패드가 자꾸 위로 딸려올라가서 불편해요 계속 잡아내려야해요 d컵 이상이신분들은 구매 신중하게 하세요
마르신 분들한테는 괜찮을것같아요 탄탄해요",Free
R1EKEl4c,,24.10.26,화이트 단품,free(롱버전),정사이즈예요,아주 만족해요,화면과 비슷해요,172,54,44,숨쉬기 너무 편해용 별기대 안했는데 왼전 만족함 재질도 좋고 핏도 굿굿 안에 나시입고 찍은 사진인데 ㄹㅇ자연스러움 나중에 또살게용,Free
빈비니빈,,24.10.15,블랙+화이트(-1000원추가할인),free(롱버전),정사이즈예요,보통이에요,화면과 비슷해요,162,55,66,캡이 흐느적거려서 가슴을 모아준다는 것은 전혀 없지만 그냥 주로 이너로 입을 거기 때문에 가성비는 좋은 것 같습니다 기장은 너무 길지 않아서 맘에 듭니다,Free
진주베,상위 10%,24.10.15,블랙+화이트(-1000원추가할인),free,정사이즈예요,아주 만족해요,화면과 비슷해요,159,47,55,"나시 흰색 검정색으로 샀어요
깔끔하고 안에 패드가 있어서 좋아요
전 그래도 불화자랑같이 입긴하는데
불화자없이도 입어도 충분해보야요",Free
xVx0fJZ4,,24.10.12,그레이+코코아(-1000원추가할인),free(롱버전),정사이즈예요,아주 만족해요,화면과 비슷해요,165,51,55,살짝 비치는 얇은 카디건 안에 받쳐 입을 만한 캡나시를 찾고있었는데 이게 딱이에요 뽕도 적당하고 몸에 챡 감겨요 너무너무 좋아요!!,Free
y3BtuxP5,,24.10.07,블랙+화이트(-1000원추가할인),free,정사이즈예요,보통이에요,화면과 비슷해요,163,55,55,사진은 뜯기전에 찍구 입어봤는데 완전 편해요! 배송돛빠루고 쫀쫀하고 이거때문에 요즘 속옷안입구 너무 좋습니다! 다른색도 구매할거에요,Free
xm1EXhmC,,24.10.07,화이트+화이트(-1000원추가할인),free,정사이즈예요,보통이에요,화면과 비슷해요,158,46,44,너무 편해요 한번 입고 흰색 더 구매함 많이 쳐져 보이지도 않고 캡도 안움직여서 진짜 조아요 완전 화이트 색상입니다 편해수 추천,Free
z6mp679M,,24.10.07,블랙 단품,free(롱버전),정사이즈예요,아주 만족해요,화면과 비슷해요,165,47,44,안에 이너로 입으려고 급하게 산건데 생각보다 퀄리티가 좋아서 놀랐어용 대신 끈 조절이 없어서 늘어나면 하나 더 사야될거같은데 가격이 저렴해서 가성비 좋슴니닷,Free
R1jvCXPS,,24.10.04,코코아 단품,free(롱버전),정사이즈예요,아주 만족해요,화면과 비슷해요,160,45,44,부유방을 완전히 가려주는 나시는 아니지만 이뻐용 가디건이랑 같이 입으먄 좋을듯 색감은 완전 맘에 들ㅇ어요 쇼핑몰 사진보다 예뻐요,Free
5ycfOKcz,상위 15%,24.10.04,화이트 단품,free(롱버전),정사이즈예요,아주 만족해요,화면과 비슷해요,165,55,55,셔츠안에 이너로 입으려고 구매했어용 쫀쫀해서 가슴을 잘 잡아줘서 좋운 거 같아요 ! 노란끼 하나도 없는 새 하얀 화이트라 더 조아용,Free
MuLF9egp,상위 20%,24.09.30,그레이 단품,free,정사이즈예요,보통이에요,화면과 비슷해요,160,50,55,이너템으로 진짜 잘 입고 있어요 늘어남 없고 보풀도 안생겨요 진짜 편해서 여름 내내 입었습니다 색별로 다 사고 싶어요 ㅎㅎ,Free
3Tlvy30m,,24.09.29,블랙+코코아(-1000원추가할인),free(롱버전),정사이즈예요,아주 만족해요,화면과 비슷해요,158,43,44,역시 언제나 실망시키지 않는 브랜드.. 진짜 여행 가서 휘뚜르 마뚜르 이너로 잘 입고 다녔습니당 !! 질이 너무 좋아요 진짜,Free
윰윰윰,상위 25%,24.09.27,화이트 단품,free,정사이즈예요,보통이에요,화면과 비슷해요,164,48,55,이너로 입기 너무 좋아요!! 길이도 적당하고 핏도 예뻐서 자주 입는것 같아요. 두번째 구매인데 그만큼 만족스러워요!!,Free
EEf66bJ0,,24.09.26,블랙 단품,free,생각보다 커요,아주 만족해요,화면과 비슷해요,157,48,55,제가 흉부랑 가슴이 작아서 브라탑이 제 가슴을 못 잡아주네요 그래도 편하고 질도 좋고 만족입니다! 다른 색상으로 또 구입할거예요,Free
YmVwc5l1,,24.09.25,블랙+화이트(-1000원추가할인),free(롱버전),작아요,보통이에요,화면과 비슷해요,163,51,55,"여름에 비치는 옷 입을때 브라 없이 입기 편해서 좋아요
다만 세탁기 계속 돌리면 옷이 줄어들어요 그래서 재구매 했습니다ㅋ",Free
jmIPSczk,,24.09.24,화이트+그레이(-1000원추가할인),free(롱버전),정사이즈예요,보통이에요,화면보다 밝아요,174,66,66,키크고 몸집있는사람한텐 조금 작을수 있을것같아요 마감 부분이 좀 뻣뻣해요 옷도 롱사이즈라해도 많이 짧은게 느껴졌어요 그래도 이너티로 입을거라 만족해요,Free
QWS2J5RW,상위 25%,24.09.24,그레이 단품,free,작아요,보통이에요,화면과 비슷해요,168,55,55,부유방 가려지는 대신 겨드랑이쪽으로 많이 올라와서 압박감은 조금 있어요 그래도 날씬하게 라인 만들어줘서 만족합니다,Free
xznYZHNR,상위 15%,24.09.24,화이트+그레이(-1000원추가할인),free(롱버전),정사이즈예요,아주 만족해요,화면과 비슷해요,162,52,55,스트레이트 체형이여서 이너에 나시 입고 항상 뭘 거치는데 소재 짱짱하니 좋아요 ㅎㅎ 회색이랑 번갈아가면서 잘 입습니다~!,Free
GaFyP2ya,,24.09.22,화이트 단품,free(롱버전),정사이즈예요,보통이에요,화면과 비슷해요,164,56,66,솔직히 부유방 커버는 안돼서 가디건 안에 입는 용도로 좋습니다요 퀄리티는 좋아요 길이는 그렇게 길지는 않고 골반 전까지만 오는 길이입니다,Free
Zg0I4tKv,,24.09.22,블랙+화이트(-1000원추가할인),free(롱버전),작아요,보통이에요,화면과 비슷해요,168,59,55,"롱버전인데도 짧구요
하의 안에 넣어입기엔 팔을 들면 계속 빠져요
캡이 울퉁불퉁하게 와서 드라이기로 말리면 돌아온다길래 뜨거운 바람으로 했지만 그래도 울퉁불퉁 거려요
겨드랑이 쪽이 쫌 낑겨서 편한느낌은 아니에요
그래도 입을 때 핏이 예뻐서 입습니다",Free
aFJpWJqd,,24.09.21,블랙 단품,free,작아요,아주 만족해요,화면과 비슷해요,164,49,44,롱버전이랑 기본 버전 두 개 샀는데 둘 다 제 생각보다 더 짧았어요 그래도 퀄리티가 너무 좋고 부드러워서 마음에 들어요 !!,Free
oSNNDkLA,,24.09.21,블랙 단품,free,작아요,아주 만족해요,화면과 비슷해요,160,50,55,"제가 가슴이조금 있어서 약간 작은느김이긴하지만
그래도 이너로 입을만 해요!
시스루 티 안에 입을거라 괜찮아요
퀄도 나쁘지않은것같네요",Free
TzuPA2Kc,,24.09.19,화이트 단품,free(롱버전),작아요,아주 만족해요,화면과 비슷해요,163,46,44,"보통 xs 아님 s입는 편인데 타이트하게
맞아요! 참고해서 구매하셔야 할거같아요! 그래도 다른후기보고 캡모양이 안맞거나 불편하면 어떡하지 했는데 걱정과달리 잘맞고 예뻐요! 사이즈만 좀 넉넉하면
데일리로도 좋을 것 같아요",Free
OOtRkX1E,,24.09.18,그레이 단품,free(롱버전),정사이즈예요,아주 만족해요,화면과 비슷해요,161,49,55,손 들면 잘 올라가긴 하는데 생각보다 편하고 캡도 엄청 두껍지 않아서 좋았어요 부유방은 좀 올려 입어야 가려지는 정도인 거 같아요,Free
LeuolPbH,,24.09.18,블랙+화이트(-1000원추가할인),free(롱버전),작아요,아주 만족해요,화면과 비슷해요,160,62,55,"패드가 작은 건 아닌 것 같은데 계속 올라가요. 입다 보면 언더붑 체험 가능해요. 애초에 나시만 입으려고 산건 아닌데, 아무리 겉에 뭘 걸쳐도 이 불편한 느낌은 지울 수가 없어요. 그렇다고 가슴이 큰 편도 아니거든요. 꽉찬 B? 헐렁한 C? 정돈데.. 참고 입을려고 해도 계속 내려줘야 하고 불편해서 못 입겠어요. 퀄리티는 좋은 편 같아요.",Free
fZOZTaFy,,24.09.15,블랙+화이트(-1000원추가할인),free(롱버전),정사이즈예요,보통이에요,화면과 비슷해요,169,54,55,"브라캡나시가 없어서 샀습니다
B컵인데 살짝은 작은감이 있어요 
롱버전이긴한데 짧은편이도 편하게 입기에 좋습니다!!",Free
8j0XgNrr,,24.09.15,블랙 단품,free,정사이즈예요,아주 만족해요,화면과 비슷해요,157,47,55,재구매였어요! 흰색 사고 괜찮아서 검은색도 샀어요!! 키 크신 분들은 많이 짧을 수도 있을 것 같아요. 저는 키가 작은 편이라서 이너로 입기 좋습니다👍,Free
5ef5vZHx,,24.09.15,블랙+화이트(-1000원추가할인),free,정사이즈예요,아주 만족해요,화면과 비슷해요,160,50,44,"완전 대만족합니다! 저는 흰+검으로 구매했어요!
가볍고 탄탄한 소재라서 너무 편하더라구요. 몇개 더 쟁겨놔야할것같습니다 ㅎㅎ",Free
Nl4OMIoj,,24.09.15,화이트+그레이(-1000원추가할인),free(롱버전),정사이즈예요,아주 만족해요,화면과 비슷해요,152,46,55,가슴 아래쪽 고무줄이 헐렁하긴 하지만 나머지는 너무 만족합니다. 가슴이 너무 크지만 않으면 크게 신경 안 쓰이실 것 같아요,Free
ZsR9siXt,,24.09.14,블랙+화이트(-1000원추가할인),free,정사이즈예요,아주 만족해요,화면과 비슷해요,158,52,55,여름에 하나 입을때 잘입었어요. 가을에 이너로 입기에도 좋을 것 같아서 흰검 둘다 사길 잘했네요. 길이는 너무 짧지 않고 적당해요.,Free
yK8AXPbz,,24.09.14,코코아 단품,free,정사이즈예요,보통이에요,화면과 비슷해요,157,50,55,화면에서 본거랑 같아요 ~ 사이즈도 딱 좋고 지금 착용하기 에도 딱좋네여 이번에 여행가서 편하게 잘 착용하고 왔습니다 ~ ~,Free
TdYXZ6jZ,,24.09.13,화이트 단품,free,정사이즈예요,보통이에요,화면과 비슷해요,164,56,66,"가격대비 좋아요! 사이즈도 적당합니다~
다만 부유방이 다른 나시에 비해 부각되는 느낌은 있어요 이너로 입거나 잘 보이지 않는 옷과 매치해서 입으면 좋을 것 같습니당",Free
cke0BLU2,,24.09.12,화이트 단품,free(롱버전),정사이즈예요,아주 만족해요,화면과 비슷해요,159,54,55,검정색 구매하고 맘에 들어서 하얀색도 구매했어요!! 생각보다 캡이 티가 안나서 더 만족하는 제품이에요! 재구매 의사 완전완전 있습니다 !! 고민하고 계신다면 언능 사십쇼!!,Free
vu6P27lQ,,24.09.11,화이트+화이트(-1000원추가할인),free,정사이즈예요,아주 만족해요,화면과 비슷해요,155,43,44,"아주 갓성비템 ! 
바로주문 가능해서 급하게 주문했어요. 
이너로도 그냥 입어도 너무 예쁘고 편해요. 
적당한 조임과 핏이 반바지랑도 잘 어울려요 !",Free
tuli******,,24.09.11,블랙 단품,free,정사이즈예요,아주 만족해요,화면과 비슷해요,160,47,44,생각보다 퀄리티가 좋아서 놀랐고여 사이즈도 적당해서 자주 입고 있습니더 브라 별도 착용없이 입을 수 있어서 아주 편합니다 체고,Free
hS0rmZcZ,,24.09.10,블랙+화이트(-1000원추가할인),free,작아요,보통이에요,화면과 비슷해요,167,55,55,"저렴한 가격에 편하게 잘 입을거같아요!
끈 부분이 타이트한감이 있지만 늘어나면 편하게 잘 입을거같아요 오히려 잘잡아주는 느낌이라 좋아요",Free
4ge6jhgT,,24.09.10,화이트 단품,free,정사이즈예요,아주 만족해요,화면과 비슷해요,154,52,44,아주아주 잘 쓰고 있습니다. 가슴이 조금 파여서 저는 조금 부끄럽지만 이너로 필요할 때가 무조건 있자나여. 레이어드해서 입으면 아주 굿입니다,Free
heezeee,,24.09.10,화이트+그레이(-1000원추가할인),free(롱버전),정사이즈예요,아주 만족해요,화면과 비슷해요,163,50,55,흰색이랑 회색 구매했습니당 흰색은 패드가 살짝 비치고 캡 모양이 티가 좀 나서 단독으로는 힘들거같구 이너로 입기엔 편하고 쫀쫀했어용,Free
naha******,상위 20%,24.09.06,블랙+그레이(-1000원추가할인),free(롱버전),정사이즈예요,아주 만족해요,화면과 비슷해요,154,44,,"기장을 롱으로 샀는데 제가 딱 원하는!! 허리에 걸치는 기장이라 맘에 들어요 ㅎ ㅡㅎ히히
캡있어서 너무 편하구 휘뚜루마뚜루 입을 수 있을 것 같아요 🥴ㅔ",Free
HI6bsj86,,24.09.04,화이트 단품,free(롱버전),정사이즈예요,아주 만족해요,화면과 비슷해요,164,54,55,하얀색 남방안에 받쳐입을 나시로 구매했어요 완전 화이트는 아니고ㅠ아이보리인데 캡 안뜨고 괜찮아요 휘뚜루마뚜루로 믾이 입을예정ㅇ에요,Free
JmWldQRi,,24.09.03,블랙+화이트(-1000원추가할인),free,정사이즈예요,아주 만족해요,화면과 비슷해요,164,57,55,탄탄하고 쫀쫀해서 많이 입을 슈 있어요! 다른 곳보다 패드가 얇아서 가볍습니다ㅠㅠ 길이 긴거로도 입어보고 싶에요!!,Free
JhhkYlav,,24.09.02,화이트+그레이(-1000원추가할인),free(롱버전),정사이즈예요,보통이에요,화면과 비슷해요,170,52,55,휘뚤마뚤 입기 좋아요!! 근데 롱버전이어도 전 좀 짧다고 느꼈어요~ 비침 있는 블라우스 안에 입으려고 산 거라 가격 대비 만족했어요,Free
NyynWd8C,상위 25%,24.09.02,화이트 단품,free(롱버전),정사이즈예요,아주 만족해요,화면과 비슷해요,153,47,44,와 질이 생각보다 좋더라구요. 살짝 더운 재질인것같긴한데 저는 탄탄해서 좋았어요. 다음에 또 재구매하려구요,Free
Jvh41mib,,24.08.30,블랙+화이트(-1000원추가할인),free,정사이즈예요,아주 만족해요,화면과 비슷해요,150,48,44,"일단 너무 편하고 롱 사이즈랑 기본이랑 고민하다가 기본으로 시켰는데도 안짧고 딱 좋은 것 같아요!
다들 저랑 비슷한 몸매, 키분들은 기본이 나을 것 같아요",Free
내옷장은아직비워있다,상위 5%,24.08.26,블랙+그레이(-1000원추가할인),free(롱버전),작아요,보통이에요,화면과 비슷해요,163,54,55,살짝 넉넉핏이어야 이쁜데 너무 딱 맞아서 아쉽네요. 몸이 찌부되는 느낌이지만 나쁘지 않아요. 롱버전 길지많이 길지 않아서 고려해서 주문 하셔요~ 배꼼 위로 스리슬쩍 올라갑니당,Free
4vBGyV9f,,24.08.26,블랙+화이트(-1000원추가할인),free,정사이즈예요,아주 만족해요,화면과 비슷해요,165,52,44,"남방 안에 입었어요 
흰색 검정 세트로 구매했구 저는 만족스럽습니다 ㅠ 핏도 이뿌고 부유방 가려주는 것 같아요 ㅋㅋ다들 규매하샤유",Free
xARDgf7a,상위 5%,24.08.24,화이트 단품,free,정사이즈예요,별로예요,화면과 비슷해요,154,46,55,진짜 3천원에 팔아야될거같은데 왜이렇게 평이 좋은 건지 이해가 안되네요 돈 아까우니까 제발 사지마세요 바스트가 없는 편인데 하나로 이어진 캡의 튀어나온 부분이 양옆으로 좀 동떨어져 있어서 가슴이 없는 부분에 캡이 있는 느낌입니다.. 봉제돼서 고정돼있어서 어떻게 할 수도 없어요. 더군다나 끈이 애매하게 길어서 꽉 잡아주는 느낌이 없고 숙이면 캡이 너무 떠서 안이 보여요; 허리 못 숙여요 신발끈도 못 묶음. 반품하려다가 배송비로 6000원 나가서 걍 3000원 주고 샀다고 생각하려고요. 근데 잘 입을거 같지도 않아서 그냥 반품할걸 후회되네요 캡이 이상해서 속옷으로 입기에도 불편합니다. 재질은 잘 늘어나는 재질이에요. 후기사진이 정확하고 쇼핑몰사진같은 재질 절대 아님 그냥 돈 더주고 제대로 된데서 사세요... 생각하면 생각할수록 돈 아까움,Free
vDUOkA6p,,24.08.24,블랙+화이트(-1000원추가할인),free(롱버전),정사이즈예요,보통이에요,화면과 비슷해요,160,46,55,편하고 이거 하나만 입어도 가능해서 좋아여!! 다만 흰색은 캡이 살짝 보입니다 셔츠안에 입으면 이쁠것 같아요 감사합니다,Free
