아이디,리뷰어 등급,작성 날짜,옵션1,옵션2,상품 사이즈,퀄리티,색감,키,몸무게,사이즈,리뷰내용,제품_사이즈
v7sq1kwA,상위 25%,24.09.20,화이트 단품,free(롱버전),정사이즈예요,보통이에요,화면과 비슷해요,164,48,55,"캡내장 나시 잘입어져서 구매했어요
가지고 있는건 다 어딘가에 셔링이 들어가있어서 깔끔한걸로..! 캡내장 잘못사면 패드 이상하고 다 보이고 그런거 많은데 괜찮네용
가디건 안에 입을용으로 짧은것도 하나 더 사야겠어요 ㅋㅋ",Free
hStSsXZN,상위 30%,24.09.20,블랙+화이트(-1000원추가할인),free,정사이즈예요,아주 만족해요,화면과 비슷해요,161,60,55,"구매했던 나시캡 제품 중에 제일 스탠다드에
가까워요. 세탁할때 캡이 돌아가는 제품이 있는데 이제품은 그렇지 않아서 좋아요.",Free
u43cPhRT,,24.09.19,화이트+화이트(-1000원추가할인),free,정사이즈예요,보통이에요,화면과 비슷해요,159,50,55,"N번째 주문입니당 입은 것 같지 않게 편하고 좋아요
근데 흰색은 끈부분이 빨면 좀 변색되는 것 같아욤",Free
M2hJo3k2,,24.09.18,화이트+화이트(-1000원추가할인),free,정사이즈예요,보통이에요,화면과 비슷해요,158,50,55,"편해요
밑가슴을 잘 잡아주는 느낌은 아니예요
그냥 여름에 편해서 입을거 같아요!
가디건에 입으니까 좋더라고요
그냥 평범해요!",Free
wA1A9wIh,,24.09.18,화이트+화이트(-1000원추가할인),free(롱버전),정사이즈예요,보통이에요,화면과 비슷해요,162,55,55,면이라서 땀 흡수도 잘되고 더운 날에 여행 가서 입었는데 되게 편했어요 ㅎ 흉통 좀 넓은 편인데 편했음,Free
Q3aEWzcv,,24.09.16,블랙+화이트(-1000원추가할인),free,정사이즈예요,아주 만족해요,화면과 비슷해요,160,47,44,너무 편하고 너무 깊게 파여있지도 않네요 생각보다 오래입을 수 있을거 같아여 가디건이나 셔츠에 입기 딱 좋아요ㅎㅎㅎㅎ,Free
bKELvNAY,,24.09.14,화이트+그레이(-1000원추가할인),free,정사이즈예요,아주 만족해요,화면과 비슷해요,153,46,55,생각햇던것보단 더 짧네용 근데 제가 키가 작으니깐 사이즈도 맞고 잘 입을듯해요 캡도 안불편해여 남방이랑 같이 잘 어울리는듯,Free
dttqcp0g,,24.09.13,블랙+화이트(-1000원추가할인),free(롱버전),작아요,보통이에요,화면과 비슷해요,162,63,55,"흉통있는사람은 좀 답답해요 ㅠ
제가 흉통이 큰데 답답해서 오래는 못입을거같고...
뭔가 더 잘 늘어날줄 알았능데 아쉬워요 ㅜㅜ",Free
g2zFIFjY,,24.09.12,화이트+코코아(-1000원추가할인),free(롱버전),정사이즈예요,아주 만족해요,화면과 비슷해요,162,58,,여름에 입기엔 조금 두껍긴한데 가을엔 단독에 입고 아우터나 난방 걸치구 겨울에 이너로 입기 좋을것같아요,Free
hdEFzUhO,,24.09.06,화이트 단품,free,정사이즈예요,아주 만족해요,화면과 비슷해요,158,51,55,쪽지와 함께 와서 기분 좋게 포장을 뜯었어요 흰색이라 비치긴 하지만 이너로 입으면 덜 비쳐서 잘 입고 다닐 수 있을 거 같습니다,Free
NbZRuY3A,,24.09.05,블랙+화이트(-1000원추가할인),free(롱버전),정사이즈예요,보통이에요,화면과 비슷해요,,,,"필라테스 할 때 입으려고 구매했습니다
몸 라인에 딱 맞게 나왔고 불편하지 않아요 좋아요👍🏻👍🏻",Free
VFpWfhkm,,24.09.05,화이트+그레이(-1000원추가할인),free(롱버전),정사이즈예요,보통이에요,화면과 비슷해요,172,64,66,"다른 후기들처럼 흰색은 옆부분 캡이 비치는데 이너로 입으니까 티 안나서 괜찮아요!
제가 키가 좀 있는 편인데 그렇게 작지도 않아요.",Free
K7oq89nb,,24.09.03,화이트 단품,free,정사이즈예요,보통이에요,화면과 비슷해요,166,50,55,이너용으로 구입했는데 딱이네요ㅎㅎ 캡도 잘 안비치고 모양도 나쁘지 않은거 같아요. 편하게 입기 딱 좋은 것 같습니당ㅎㅎ,Free
Kokomong,상위 20%,24.08.31,블랙 단품,free(롱버전),정사이즈예요,보통이에요,화면과 비슷해요,170,68,77,스판끼가 있어서 품은 맞는데 자꾸 말려 올라가더라구요ㅠㅠ 무엇보다 제가 aa컵인데도 불구하고 잘 맞았어요!! 좀더 긴버전이었으면 진짜 좋았을거 같아요,Free
bKlwTMZI,,24.08.29,화이트 단품,free,정사이즈예요,아주 만족해요,화면과 비슷해요,166,52,55,"질도 괜찮은 것 같고 입었을 때 편하고 좋습니당
부유방도 나름 괜찮게 가려주는 것 같아요!",Free
7hDnFMoI,,24.08.26,블랙+화이트(-1000원추가할인),free,정사이즈예요,보통이에요,화면과 비슷해요,157,47,44,"여름에 딱 편하긴 합니다!!
딱히 속옷 착용을 안해도 되니!
근데 흉통이 작은편인데도 널널하진 않아서
참고해야할듯해요",Free
tHSJ1Ibk,,24.08.25,블랙+코코아(-1000원추가할인),free,작아요,보통이에요,화면보다 밝아요,154,45,33 이하,브라 75c 입고 흉곽은 좁은 편이에요 앞판에 패드 자체가 작고 짧아서 윗가슴 눌리고 스포츠 브라한 느낌 들어요 옷 자체는 스판기 있습니다 !! 참고하셔요,Free
chch**,,24.08.21,블랙+화이트(-1000원추가할인),free(롱버전),정사이즈예요,아주 만족해요,화면과 비슷해요,,,,질이 좋다는 평이 많아서 기대 했었는데 정말로 질이 좋네요. 이너로 있기 아깝습니다. 여행 가서 단독으로 입으려구요.,Free
gejcxgUM,,24.08.19,화이트+화이트(-1000원추가할인),free(롱버전),작아요,아주 만족해요,화면과 비슷해요,164,60,66,크롭도 샀고 롱 버전도 샀는데 롱버전이 더 편하네요 바스트 좀 있으면 아래부분을 캡이 감싸주진못하지만 편해서 자주 이너로 입어요,Free
CidoftwB,상위 10%,25.01.06,블랙+화이트(-1000원추가할인),free(롱버전),정사이즈예요,아주 만족해요,화면과 비슷해요,165,57,55,캡내장이 아주 만족스러우ㅏ요 다만 부유방은 커버가 안될수도 있아요 가디건 걸치거나 머리가 기신분들은 머리 로 가리면 괜찮을거같아요 베이직템이니까 하나씩 쟁이세요 ㅎㅎ,Free
x57wo5Y5,상위 30%,24.12.19,화이트+화이트(-1000원추가할인),free,작아요,보통이에요,화면과 비슷해요,164,55,55,나쁘지 않은데 겨드랑이 쪽이 너무…불편해요..너무 끼는 느낌..?프리사이즈…면 조금더 신축성이 있어야 할거 같은데 아쉽네요..싼게 비지떡,Free
Hmm,,24.12.02,화이트 단품,free(롱버전),작아요,보통이에요,화면과 비슷해요,161,51,55,후기 열심히 보거 캡이 잘 안비치는것 같아 삿는데 캡모양이 좀 보이긴 해요ㅠ 이너로 입는 용으론 괜찮아요,Free
ZK45SkAS,,24.11.22,화이트 단품,free(롱버전),정사이즈예요,아주 만족해요,화면과 비슷해요,157,48,44,검정색 사고 엄청 잘입어서 흰색도 구매했어요! 다른 캡내장 나시도 많이 입어봤는데 여기가 젤 편했어용! 캡이 딱 붙어있어서 안 돌아다니고 좋아요☺️👍,Free
7g3WS5mW,상위 20%,24.11.05,블랙+화이트(-1000원추가할인),free(롱버전),정사이즈예요,보통이에요,화면과 비슷해요,160,58,55,브라끈 노출되는게 싫어서 삿는데 퀄리티 나쁘지 않아여 근데 뭔가 가슴 엄청 큰게 아니면 캡쪽이 밑으로 내려가는 느낌..? 그래서 계속 올려줘야 할 것 같아요,Free
Cj4mJp9t,,24.10.19,화이트 단품,free,정사이즈예요,보통이에요,화면과 비슷해요,160,55,66,"생각보다 너무 이너용같아요 ㅠㅠㅠㅠ
집업류 입을때 오픈하고 입을 생각이였는데
그렇게늠 안될것같아요 ㅠㅠ
그리고 가슴 크신분들도 좀 별로 ㅠ",Free
룰라,,24.10.19,블랙+코코아(-1000원추가할인),free,작아요,보통이에요,화면과 비슷해요,169,59,66,그냥 뭐 생각보다 너무 작습니다 제가 덩치가 큰건 맞지만 가슴도 너무 조이고 그래서 등살이 보이네요ㅠㅠ 그리고 한번 빨아서 입어야돠요,Free
g.ja******,,24.10.19,블랙+화이트(-1000원추가할인),free,작아요,별로예요,화면보다 밝아요,161,48,55,프리사이즈라해서 샀지만 가슴쪽이 꽉끼고 작아서 꼭g스가 그대로 자기 존재감을 드러내더라구요. 환불반품은 귀찮아서 그냥 같이 일하는 동생 줬네요 많이 아쉬워요,Free
h__b**,상위 30%,24.10.18,블랙+화이트(-1000원추가할인),free(롱버전),정사이즈예요,보통이에요,화면과 비슷해요,163,51,44,와.. 브라나시탑 여러군데꺼 입어봤는데 셀블리가 제일 편안하고 상체를 잡아주네요. 롱버전으로 주문했는데 길이가 살짝만 더 길었으면 하는 생각은 들어요.,Free
ZPaMZPH1,,24.10.11,블랙 단품,free,정사이즈예요,아주 만족해요,화면과 비슷해요,159,50,55,"편하고 생각했던 핏입니당
소재도 부드럽고 만족해욤",Free
xXTmEnKp,,24.10.11,블랙+그레이(-1000원추가할인),free,작아요,보통이에요,화면과 비슷해요,163,48,55,"음..
어깨끈이 짧은데 스판기가 별로 없어서 좀 불편하네요
색깔과 캡 두께는 맘에 드는데 총길이도 짧아요",Free
pilr*****,,24.10.06,블랙+화이트(-1000원추가할인),free(롱버전),정사이즈예요,보통이에요,화면과 비슷해요,161,50,55,사이즈는적당한데 가슴부분이좀작아요 색상도 좋아요 질감도부드럽고 몸에착감겨요 디자인 정말 예뻐요,Free
로니로니,상위 30%,24.10.04,블랙+화이트(-1000원추가할인),free(롱버전),정사이즈예요,아주 만족해요,화면과 비슷해요,162,55,55,"가슴사이즈 D컵입니다
아래에 언더붑처럼 자꾸 나와요ㅠ 가슴은 못잡아주는거 같아요 그래도 기본템으로 쓰기엔 좋아요",Free
zOLC6PAs,,24.09.28,블랙 단품,free(롱버전),정사이즈예요,보통이에요,화면과 비슷해요,163,53,55,편하게 입기 좋은 민소매에요. 길이도적당해서 딱 좋네요.,Free
uM4llaAv,,24.09.26,화이트 단품,free(롱버전),작아요,보통이에요,화면과 비슷해요,157,49,55,"아니 뽕은 좋고 다 맘애드는데
겨드랑이가 너무 불편해요!!
저 흉통 작은편인데도 불편하고
불편해서 반품하고 싶네요 ㅡㅡ",Free
f7fHvVvk,상위 30%,24.09.21,그레이 단품,free,정사이즈예요,보통이에요,화면과 비슷해요,150,47,55,사이즈 재질 다 맘에들고 빨래해도 캡이 망가지지않아서 너무 좋아요,Free
8lctQs08,,24.09.20,화이트+그레이(-1000원추가할인),free,작아요,보통이에요,화면과 비슷해요,158,46,44,어깨끈이 좀 짧아요ㅜ그래서 착용했을때 불편해요 근데 재질이나 패드는 적당해여..,Free
gUQ4iQCV,,24.09.12,블랙+화이트(-1000원추가할인),free(롱버전),정사이즈예요,보통이에요,화면과 비슷해요,164,48,55,땀이 안 차는 건 아니지만 여름에 두 겹 입는 것보단 나아요 편하게 입고 있습니다 다른 데서도 사봤는데 여기가 훨씬 짱짱하고 끈이 튼튼한 것 같아요,Free
XMbDgouD,,24.09.05,블랙+코코아(-1000원추가할인),free(롱버전),정사이즈예요,보통이에요,화면과 비슷해요,163,54,55,"색이 예뻐서 마음에 들어요
착용감은 무난한 편인 것 같고 가성비 굿",Free
고등어냥이,상위 10%,24.08.26,블랙+화이트(-1000원추가할인),free,정사이즈예요,아주 만족해요,화면과 비슷해요,164,63,55,"진짜 최애예여.. 더 사서 거의 맨날 입는중 ㅠㅠ
속옷 불편해하는데 캡 내장되어있어서 좋아요
길이도 적당해서 좋음 !",Free
ㅇㅅㅇ33,상위 30%,24.10.25,블랙+화이트(-1000원추가할인),free,정사이즈예요,보통이에요,화면과 비슷해요,,,,여름이라 껴입기 더워서 샀는데 나쁘지 않았어요 이너로 입기 딱입니당 근데 생각보다 잘 안 늘어나는 재질이고 패드 부분이 딱딱해서 조금 거슬려요ㅠ 그게 아쉬워서 별 하나 뺏습니다,Free
hy2nc54I,상위 20%,24.10.12,블랙+화이트(-1000원추가할인),free,정사이즈예요,아주 만족해요,화면과 비슷해요,160,52,55,평소에 와이어를 싫어해서 캡나시를 사서 캡이 망가질때까지 입는 사람입니다. 다른곳에서 구매해봤는데 한철이상 오래 입을수 있으면 좋을것같네요~,Free
smg8jYd6,상위 25%,24.10.12,화이트 단품,free,정사이즈예요,보통이에요,화면과 비슷해요,,,,안에 이너로 입었는데 부유방 커버는 안되지만 옷도 짱짱해서 무난하게 입기 좋아요☺️ 자주 입을거 같아요 맘에 들어용ㅎㅎ,Free
TEdl3b3S,상위 25%,24.10.08,화이트+그레이(-1000원추가할인),free(롱버전),정사이즈예요,보통이에요,화면과 비슷해요,158,47,44,"보드랍고 좋아요 탄탄해요
원래 있었던 나시탑들 구조가 이상하고 다 조이고짱났는데
이건 그런것도 없고 좋네요 👍👍👍👍",Free
복덕자,,24.10.02,블랙+그레이(-1000원추가할인),free,정사이즈예요,보통이에요,화면과 비슷해요,172,56,,아 진짜 제가 원했던거 입니다 너무 좋아요 제가 상체가 조금 긴 편인데도 그래도 배는 거의 다 덮었던거 같아요 항상 두개 입어서 불편했는데 이걸로 인해 불편함을 해결 했습니다!,Free
sx2a0xPR,,24.10.02,블랙 단품,free,생각보다 커요,보통이에요,화면과 비슷해요,161,48,44,아직 세탁기에 돌려보진 않았지만 캡이 고정되어 있어서 캡이 돌아다닐 것 같진 않아서 만족하고 캡이 별로 티도 안 나서 좋아요 !,Free
J6G2EOg0,,24.09.27,화이트+그레이(-1000원추가할인),free(롱버전),정사이즈예요,보통이에요,화면과 비슷해요,164,55,55,롱 버전으로 구매했는데 너무 맘에 들어요. 이거도 길이가 안길어요 근데 숏 버전은 어떻게 입고 다니죠??? 배 다 보일 거 같은데!,Free
evyzkRP0,,24.09.23,화이트 단품,free(롱버전),정사이즈예요,아주 만족해요,화면과 비슷해요,158,54,55,캡나시여서 따로 속옷착용 안해도되니까 너무 편해요~~ 입었을때 불편함이 없다보니 요즘 이너로도 자주 입고있습니다~~,Free
hanh****,,24.09.20,블랙+화이트(-1000원추가할인),free,생각보다 커요,아주 만족해요,화면과 비슷해요,159,48,44,휘뚜루마뚜루 잘입고있습니다! 생각보다 핏하게 딱붙는 사이즈는 아닌데 오히려 그래서 여름에 시원하게 잘 입었어요!ㅎㅎ 굿굿!!,Free
lgn0***,,24.09.20,화이트+화이트(-1000원추가할인),free,정사이즈예요,아주 만족해요,화면과 비슷해요,163,48,55,롱이랑 숏 둘다 구매했습니다.둘다 길이가 적당한 거수같아요! 숏은 입으면 배꼽이 살짝 아주 살짝 보이는 정도에요!!!,Free
lgn0***,,24.09.20,화이트+화이트(-1000원추가할인),free(롱버전),정사이즈예요,아주 만족해요,화면과 비슷해요,163,48,55,롱이랑 숏 둘다 구매했습니다.둘다 길이가 적당한 거수같아요! 숏은 입으면 배꼽이 살짝 아주 살짝 보이는 정도에요!!!,Free
FL3O8gvV,,24.09.19,블랙+블랙(-1000원추가할인),free(롱버전),정사이즈예요,아주 만족해요,화면과 비슷해요,166,61,,작을까봐 걱정했는대 생각보더 잘 맞는것같아요....! 색은 화면이랑 똑같고 검정색으로만 두개 구입했는데 잘 입을것같아요,Free
kXL4bzno,,24.09.18,화이트+그레이(-1000원추가할인),free(롱버전),정사이즈예요,보통이에요,화면과 비슷해요,168,65,66,"생각한대로 괜찮아요
좀 딱 붙는편인데 이너로 입기엔 좋아요
캡 있어서 날씨 더울 때도 부담었이 입을 수 있다는 점이 아주 나이스",Free
Xdpz5HDl,,24.09.17,코코아 단품,free(롱버전),정사이즈예요,아주 만족해요,화면과 비슷해요,160,42,44,캡이 내장된 나시를 처음 사봤는데 너무 편하고 좋았어요!!! 날씨가 너무 더워서 여러겹 입고싶지 않았는데 좋드라구요~~!,Free
OtgXdrDV,,24.09.16,블랙+화이트(-1000원추가할인),free,정사이즈예요,보통이에요,화면과 비슷해요,155,40,44,처음에는 좀 타이트하다 싶었는데 그만큼 잘 잡아줘서 여름에 속옷대용으로 잘썼어요 .. 속옷+나시를 한번에 해결해주는 제품이라 넘 좋았어요,Free
JvbaxdtP,상위 10%,24.09.14,화이트+화이트(-1000원추가할인),free(롱버전),정사이즈예요,아주 만족해요,화면과 비슷해요,164,58,66,캡이 내장은 되어있는데 고정?은 또 안 되어있어요ㅋㅋㅋㅋ롱 했는데도 딱 골반 위까지 와서 키 160대 이시면 롱 추천드려용 여기저기 휘뚤마뚤 하기 좋을듯!,Free
4lJ73HFj,,24.09.08,화이트 단품,free,정사이즈예요,아주 만족해요,화면과 비슷해요,163,48,44,"너무 편하고 핏도 예뻐요 
입었을 때 길이는 배꼽 위까지 였던 거 같아요 
너무 예뻐서 하나 세개째에요",Free
76gw2H7v,,24.08.31,화이트+그레이(-1000원추가할인),free,작아요,별로예요,화면과 비슷해요,153,48,55,"빨래하고나니 엄청 줄어들었네요..
긴 기장으로 구매했어야 했는데 짧은 걸로 잘못 선택했더니 지금은 엄청 작아져서 입기 힘드네요..",Free
yNmmyU3z,,24.08.30,블랙+화이트(-1000원추가할인),free,정사이즈예요,아주 만족해요,화면과 비슷해요,158,50,55,이거 진짜 사세요 브라 안입아도되구 나무 편하고 쫀쫀해요 !! 가을에는 이너로 지금 날씨에는 나시 하나 입고 얇은 가디건입으면 딱입니다,Free
왕당근,,24.08.28,화이트+화이트(-1000원추가할인),free(롱버전),정사이즈예요,보통이에요,화면과 비슷해요,165,51,55,"1000원더 추가하고 롱버전으로 2개샀는데 숏버전이 온거 같네요...?
이미 구매확정이랑 세탁까지 해버린 상태라 그냥 입으려구요... 천원은 좀 아깝네여ㅠㅠ",Free
1lzNXm4f,,24.08.22,화이트 단품,free,생각보다 커요,보통이에요,화면과 비슷해요,153,50,55,"이렇게 비치는 블라우스 안에 이너로 입기 좋았습니다.
가격대비 만족스러워요 속옷을 따로 착용하지 않늨 것도 넘 편하고 좋았습니다",Free
VaOCJQpZ,,25.01.04,블랙 단품,free(롱버전),정사이즈예요,아주 만족해요,화면과 비슷해요,160,50,55,"캡나시 일체형 브라탑을 즐겨입는편인데, 이건 캡나시부분을 잡아줘서 세탁할때도 캡부분이 빠지거나하지않고 너무 좋아요!ㅎㅎ",Free
83kQxaCR,,24.12.11,블랙+화이트(-1000원추가할인),free(롱버전),정사이즈예요,아주 만족해요,화면과 비슷해요,155,53,55,"예전에 구매 했었는데 여름엔 나시로, 겨울엔 이너티 안에 입기 좋아서 재구매 했습니당 많이 타이트 하지도 않고 좋어요!",Free
71Zug3Nr,,24.12.04,화이트 단품,free,정사이즈예요,별로예요,화면과 비슷해요,156,51,55,싼 맛에 샀는데 별로에용..ㅜ 패드가 뭔가 세로로 짧아서 가슴 위로 자꾸 올라와요. 가슴 작은 편인데도! 그래도 일체형인게 편해요,Free
웅앙잉앙웅,,24.12.03,화이트 단품,free(롱버전),정사이즈예요,보통이에요,화면과 비슷해요,160,60,66,캡달린 나시 사고싶어서 구매했어여 편해욤 근데 롱버전 시켰는데 별로 안길어욤 뱃살 때문인가 ㅋㅎ 근디 편해서 자주 입어요,Free
9dKoUc4S,상위 30%,24.12.02,화이트+화이트(-1000원추가할인),free(롱버전),정사이즈예요,아주 만족해요,화면과 비슷해요,164,52,55,유용해요 편해서 여러번 주문해서 잘 입고 있습니다 면도 짱짱해서 좋아요,Free
BRtZ47j4,,24.11.16,블랙 단품,free(롱버전),정사이즈예요,보통이에요,화면과 비슷해요,163,50,55,처음에는 캡이 불편한데 입다보면 엄청편하고 적은 돼서 이거만 입게 돼요 다음번에 흰색으로 하나사서 여름에 입고다녀야 겠어요,Free
VdUsj6UF,,24.11.13,블랙+코코아(-1000원추가할인),free,정사이즈예요,아주 만족해요,화면과 비슷해요,161,50,55,"마감은 좀 부실하지만
캡이 붙어있어 입기 넘 편하고 좋아요!!
잘 입고 다녔습니다!!",Free
onio******,,24.11.10,블랙+화이트(-1000원추가할인),free(롱버전),정사이즈예요,아주 만족해요,화면과 비슷해요,172,62,66,비침은 거의 없습니다 길이도 적당하고 잘 잡아줍니다 좋아요,Free
L0MKezP2,,24.10.31,블랙+화이트(-1000원추가할인),free,정사이즈예요,아주 만족해요,화면과 비슷해요,155,40,,검정하나 흰색하나 샀는데 좋습니다. 다만 하얀건 입었을때 캡이 보이긴해요,Free
bfDclcCK,,24.10.30,그레이 단품,free,정사이즈예요,보통이에요,화면과 비슷해요,,,,조금 짧은거같기도 하지만 어차피 안에 입으니까 괜찮은거같아요 캡 내장되어있어서 좋고 편해요!! 답답하지도 않고 편해서 좋아요,Free
옷가게사장뉨,,24.10.14,화이트+코코아(-1000원추가할인),free,정사이즈예요,아주 만족해요,화면과 비슷해요,155,61,66,"진짜 넘넘 좋아요.. 이거 하나만 입고 위에 가디건 걸치면 대박 편합니당💓
그리고 브라자 살 나오는 거 이 옷은 그냥 나시라서 딱히 신경쓰이지도 않ㅇ습니당",Free
happ******,,24.10.02,블랙 단품,free(롱버전),정사이즈예요,아주 만족해요,화면과 비슷해요,,,,오프숄더에 입으려고 샀어요! 입으면 허리가 가늘어보여서 자주 입을것같아요!! 그리고 안에 내장 캡이 있어서 편리하게 입을 수 있는것 같아요!! 완전 추천 추천!!,Free
m3CfXfvD,,24.09.25,블랙+화이트(-1000원추가할인),free,정사이즈예요,보통이에요,화면과 비슷해요,162,52,55,안에 캡 많이 티나지않고 좋아요 내장캡들어있는 나시가 오즘 너무편해져서 잘입고다닐거같아요 겨울에도 후드나 맨투맨안에 입으면 될거같아요,Free
fMRHI2Ki,,24.09.24,블랙+화이트(-1000원추가할인),free(롱버전),정사이즈예요,아주 만족해요,화면과 비슷해요,163,56,55,퀄리티 괜찮아요! 흰색은 아주 약간 캡 티나긴 하는데 괜찮은 정도입니당,Free
UHLMc770,상위 15%,24.09.17,블랙+그레이(-1000원추가할인),free,정사이즈예요,아주 만족해요,화면과 비슷해요,164,46,44,"진짜편하고 속옷같이 안생겨서
너무 더울땐 걍 까고 입어도 될 정도
그런데 최대 단점은 부유방 부각 심함 ㅠㅠ 껴요ㅠ
아우터 필수 단독으로 못입어잉 ㅜ",Free
Q3aEWzcv,,24.09.16,블랙+화이트(-1000원추가할인),free(롱버전),정사이즈예요,아주 만족해요,화면과 비슷해요,160,47,44,캡나시 처음 사봤는데 진작 살걸 그랬네요 엄청 편해요ㅠㅠㅠ나시에 가디건만 걸쳐도 이쁘네요 숏버전은 너무 짧아서 셔츠안에 입어야할거 같아요,Free
vMQRu8wq,,24.09.13,블랙+화이트(-1000원추가할인),free,정사이즈예요,아주 만족해요,화면과 비슷해요,160,46,44,너무 만족스러워요! 빨아도 질안떨어지고 물빠짐 전혀 없습니다! 불편한 감도 없고요,Free
0mL5dUX9,,24.09.13,화이트 단품,free(롱버전),정사이즈예요,별로예요,화면과 비슷해요,171,54,44,나시는 괜찮은데 부유방 많이 없는데도 좀 부각 더ㅣ는 느낌 있었구 캡이 일단 개이상함 캡이 누가봐도 티가 너무 많이 남 이 가격에 이 퀄리티는 좀 에바임 딴거 사셈,Free
ojTAPW4P,,24.09.09,블랙 단품,free(롱버전),정사이즈예요,아주 만족해요,화면과 비슷해요,170,53,44,캡이 달려있어서 세탁해도 괜찮고 짱편해요 !! 여름에 손이 잘 갑니다 !!,Free
INEVE7,,24.09.04,화이트+그레이(-1000원추가할인),free,정사이즈예요,보통이에요,화면과 비슷해요,162,58,66,너므너므 편하고 너므너므 쫀쫀하고 퀄리티 ㅁ쳐ㅛ고 가성비 ㅁ쳣고,Free
zgepedsp,,24.08.30,화이트+화이트(-1000원추가할인),free(롱버전),정사이즈예요,별로예요,화면과 비슷해요,163,53,55,"완전 이너 나시
급해서 잘 못알아본 것도 있겠지만 걍 속옷 나시인듯
겉에 가디건 걸칠때 입을 용도로 샀는데 나 속옷이요 하고 다 티남
그리고 캡 달려 있는 마감 부분 꺼칠거칠 따가움",Free
ncDnPElZ,상위 30%,24.08.20,블랙+그레이(-1000원추가할인),free,생각보다 커요,보통이에요,화면과 비슷해요,153,43,44,"올 여름은 너무 더워서 결국 나시탑을 처음 구매해봤네요~~
체구가 작아서 클까봐 걱정햤는데 살짝 뜨지만 그래도 생각햇덤것보다 너무 맘에들어요!!",Free
qP1kIfDg,,25.01.12,블랙+화이트(-1000원추가할인),free,정사이즈예요,아주 만족해요,화면과 비슷해요,168,56,55,배송이 빨라요! 보통은 크롭기장이에요. 배를 덮으려면 긴걸로 사세요,Free
WkCjZXIR,,24.12.17,블랙+그레이(-1000원추가할인),free(롱버전),정사이즈예요,보통이에요,화면과 비슷해요,163,55,55,"회색이랑 검정살는데 회색이 더 큼
핏 맘에 들어염",Free
