아이디,리뷰어 등급,작성 날짜,옵션1,옵션2,상품 사이즈,퀄리티,색감,키,몸무게,사이즈,리뷰내용,제품_사이즈
1YNFjnGX,,24.05.26,오트밀,1장만 구매,작아요,보통이에요,화면과 비슷해요,,,,"생각보다 엄청 딱 맞는 사이즈라 불편하긴 했어요
입고 벗을때 불편했지만 잘 입을 예정이에요
조금만 더 헐렁했음 좋겠지만요",Free
1aP6JzhW,,24.05.16,크림,블랙(1장 더 구매시 -2000원 할인!),정사이즈예요,아주 만족해요,화면과 비슷해요,163,55,55,쫀쫀하고 겨드랑이 잘 가려줘서 좋아요!!!!,Free
푸른하늘은하수,상위 10%,24.05.10,블랙,1장만 구매,작아요,보통이에요,화면과 비슷해요,,,,"직진배송이라 다음날 받아봤어요! 
생각보다 나시가 작아서 놀랬지만,, 신축성은 있구요 
하지만 조금만 더 길었음 좋겠어요,, 
167기준 배꼽위까지오네요!",Free
푸른하늘은하수,상위 10%,24.05.10,화이트,1장만 구매,작아요,보통이에요,화면과 비슷해요,,,,"직진배송이라 다음날 받아봤어요! 
생각보다 나시가 작아서 놀랬지만,, 신축성은 있구요 
하지만 조금만 더 길었음 좋겠어요,, 
167기준 배꼽위까지오네요!",Free
wv1eeD59,,24.04.11,크림,1장만 구매,정사이즈예요,보통이에요,화면보다 밝아요,160,54,55,"약간 생각했던 것보다 조금 더 노란빛이 돌긴 하는데, 입으면 예쁜것같아요! 잘 입겠습니당 ㅎㅎ",Free
BjxP4Lw8,상위 5%,24.04.10,블랙,크림(1장 더 구매시 -2000원 할인!),정사이즈예요,아주 만족해요,화면보다 밝아요,168,58,55,샤스커트 기존에 있는데 모델착샷보고 구매했어요 ㅎㅎ 베이지 치곤 밝아서 사진보단 조금 밝다고 생각하심 될거 같아용 ㅎㅎ 만족합니다!!,Free
eybIz3Cu,,24.04.08,화이트,블랙(1장 더 구매시 -2000원 할인!),정사이즈예요,보통이에요,화면과 비슷해요,161,53,55,생각보다 불편하구요 끈이 너무 끝에 있어서 자꾸 내려가요.. 브라끈이랑 위치가 안 맞아서 보이는 게 싫으시다면 탑브라나 끈을 투명으로 바꿔야 괜찮을 듯합니다..,Free
GfdhfIwG,,24.04.01,오트밀,1장만 구매,정사이즈예요,보통이에요,화면과 비슷해요,,,,확실히 다른 나시에 비해서는 부유방을 잘 가려줘요! 부유방 때문에 부담스러웠던 옷들 입을 때 조금 마음 편하게 입을 수 있을 것 같아요 ㅎㅎ,Free
d7rTXjQW,,24.03.20,화이트,1장만 구매,정사이즈예요,아주 만족해요,화면과 비슷해요,160,50,55,짱짱해서 아주 좋아요. 늘어남이 없어서 코디 된대로 입었을때 잘가리면 안보이고 살짝 풀면 보입니다. 속옷보일까 걱정하지 않아도 되어서 좋아요!,Free
조복태,상위 20%,24.03.08,화이트,1장만 구매,작아요,별로예요,화면과 비슷해요,172,59,66,"생각보다 그냥 그래요 소재도 그렇고 비치고 ㅠㅠ
후기보고 기대가 컷나봄 ㅠ 색다른걸로 살껄",Free
4mg9e619,,24.03.01,블랙,소프오트(1장 더 구매시 -2000원 할인!),정사이즈예요,아주 만족해요,화면과 비슷해요,164,54,66,"원 플러스 원(할인)으로 주문했는데 부유방을 가려준다는 문구에 꽂혀서 추가 주문했어요 ㅎㅎ 
아직 입어보지는 않았지만 자켓 안에 이너로 입을거라 살짝 작아도 괜찮을듯요",Free
4mg9e619,,24.03.01,크림,화이트(1장 더 구매시 -2000원 할인!),정사이즈예요,보통이에요,화면과 비슷해요,164,54,66,"원 플러스 원(할인)으로 주문했는데 부유방을 가려준다는 문구에 꽂혀서 추가 주문했어요 ㅎㅎ 
아직 입어보지는 않았지만 자켓 안에 이너로 입을거라 살짝 작아도 괜찮을듯요.",Free
ewKdQKIt,,24.10.19,크림,1장만 구매,정사이즈예요,보통이에요,화면과 비슷해요,167,47,44,귀엽고 예쁩니당 색감이 정말 제 취향이에요!!,Free
yFlgCHEo,,24.09.06,크림,화이트(1장 더 구매시 추가할인!),정사이즈예요,보통이에요,화면과 비슷해요,162,50,55,크림이 생각보다 어두워서 놀랐지만 막상 입으니까 잘 어울려요!! 안에 입기 좋을 것 같아용ㅎㅎ 잘 입겠습니당!!!!,Free
brBSHwn3,,24.07.22,화이트,1장만 구매,정사이즈예요,아주 만족해요,화면과 비슷해요,157,53,55,적당히 텐션 있고 길이감이 너무 짧지 않아서 좋습니다,Free
utNcRl9c,상위 25%,24.04.28,살구베이지,오트밀(1장 더 구매시 추가할인),정사이즈예요,보통이에요,화면과 비슷해요,160,55,55,"살구베이지는 생각보다 색이 탁해서 어떻게 입어야할지 고민이지만, 오트밀은 색이 여기저기 잘 받아서 너무 잘입고있습니다. 그리고 많이 파이징 않아서 부유방 커버 오ㅏㄴ벽해요",Free
sFB1uoWK,,24.04.25,오트밀,무드카키(1장 더 구매시 추가할인),정사이즈예요,아주 만족해요,화면과 비슷해요,158,48,55,쫀쫀한 원단이여서 몸에 탁 감겨요 색도 예뻐서 이너로 활용하기 좋아용,Free
vGPnnC4R,상위 25%,24.04.17,화이트,크림(1장 더 구매시 추가할인!),작아요,별로예요,화면과 비슷해요,168,52,44,"입고나서무슨 애기 옷인줄 알았어욬ㅋㅋ
진짜 꽉 낍니다 저 44입는데 안 들어가요 아무리 키가 잇다고 해도 그렇지 그리고 너무 작아서 불편해요...",Free
GivFsXJT,,24.04.11,오트밀,화이트(1장 더 구매시 추가할인!),정사이즈예요,보통이에요,화면과 비슷해요,165,51,55,배송은 많이 늦었지만 옷은 만족합니다!!저번에 핑크색사고 재구매 합니다,Free
0g6aGnnN,상위 25%,24.04.02,크림,화이트(1장 더 구매시 -2000원 할인!),작아요,별로예요,화면보다 밝아요,,,,"내가 아동복을 샀던가,, 
부유방을 가려주는게 아니라 찌부를 시켜서 겨드랑이가 아파요 
저는 정 55 사이즈인데 이정도면 
이건 말라깽깽분들만 입어야할듯 
근데 말라깽깽분들이 부유방이 있나..?",Free
O8pkA9ry,,24.03.29,블랙,오트밀(1장 더 구매시 -2000원 할인!),작아요,보통이에요,화면과 비슷해요,160,50,66,생각보단 핏이 조금 별로고 아쉬워요 저렴해서 좋긴한데 아쉬워요,Free
TaXGAcpp,,23.12.07,소프 오트,블랙(1장 더 구매시 -2000원 할인!),정사이즈예요,보통이에요,화면과 비슷해요,158,43,44,너무너무 이뻐요~~ 친구들이 이쁘대요! 항상 사는 쇼핑몰이에요! 다음에도 살게요!! 항상 이쁜 옷 팔아주셔서 감사합니다!,Free
qjHAsgE4,상위 20%,23.08.27,크림,소프오트(1장 더 구매시 -2000원 할인!),정사이즈예요,보통이에요,화면과 비슷해요,161,49,55,"크림이랑 소프오트 고민하다가 2장 샀어요 
크림은 노란끼있는 크림색이고 소프오트는 회끼 있어서 옷에 따라 입으면 될것 같아요",Free
vb3hpCGO,,23.08.10,화이트,블랙(1장 더 구매시 -2000원 할인!),정사이즈예요,아주 만족해요,화면과 비슷해요,168,53,55,짱짱하고 안에 자켓이나 셔츠 바쳐입기 아주좋고 착용해ㅛ을때도 편해요 위에 넓어서 안보이는거도 좋고 딱 좋아용 아주 잘입고있어용,Free
fFqSNHmq,상위 20%,24.06.20,화이트,블랙(1장 더 구매시 -2000원 할인!),정사이즈예요,보통이에요,화면과 비슷해요,164,54,44,입었을 때 옷이 끼지 않고 편하긴 한데 끈이 좀 몸 옆쪽으로? 있어서 좀 어색해요 나시가 엄청나게 예쁘진 않고 그냥저냥 괜찮습니다,Free
XdY4OoyJ,,24.05.11,화이트,블랙(1장 더 구매시 -2000원 할인!),정사이즈예요,아주 만족해요,화면과 비슷해요,158,46,66,잘안보이지만슬리브리스입은거구요겨안낑김여제기준ㅋㅋ그래도벗을때좀조심하긴해야할듯꽤만족스럽읍니다잘입고다니는중,Free
GN72N20E,상위 25%,24.05.08,화이트,1장만 구매,작아요,보통이에요,화면과 비슷해요,165,40,44,제가 엄청 마른편인데도 디게 쪼여서 답답하구요. 겨드랑이이랑 팔 안쪽이 닿을때 옷이 까끌거려서 되게 피부에 자극이 되어요...,Free
1b**,,24.05.07,블랙,오트밀(1장 더 구매시 -2000원 할인!),작아요,아주 만족해요,화면과 비슷해요,166,59,66,"부유방이 가려지는데 그래도 조금 티가 나긴하네용!
그래도 넘 이쁘고 짱짱하고 좋아요",Free
S62Q0cIO,,24.05.05,블랙,오트밀(1장 더 구매시 추가할인),정사이즈예요,아주 만족해요,화면과 비슷해요,155,38,44,너무 예쁘게 잘 입고 있어요!! 재질도 쫀쫀하고 늘어나는 재질도 아닙니다,Free
CsRATTDY,,24.05.02,블랙,1장만 구매,정사이즈예요,아주 만족해요,화면과 비슷해요,162,44,44,몸에 착 잘 달라 붙어요 길이도 적당하고 특히 부유방 가려주는거ㅠㅠ너무 좋습니다!,Free
KQFtWvp7,상위 15%,24.04.24,화이트,오트밀(1장 더 구매시 추가할인),작아요,아주 만족해요,화면과 비슷해요,172,58,55,생각보다 쫀쫀하고 타이트해서 부유방 커버에 좋을 것 같고 대신 안에 속옷이 보일수가 있어서 속옷 선택을 잘 히야될 것 같아용,Free
zBsf9N4x,,24.04.19,블랙,1장만 구매,작아요,보통이에요,화면과 비슷해요,166,67,66,"아주 작아보이는데 신축성이 좋아서 잘 들어가요
생각보다 도톰한 재질이에요",Free
N8L9wA0b,,24.04.09,크림,1장만 구매,정사이즈예요,아주 만족해요,화면과 비슷해요,158,50,44,쫀쫀하게 라인을 잘 잡아줘서 좋아요 재구매입니다!,Free
EHHmQSpE,상위 5%,24.04.04,오트밀,1장만 구매,정사이즈예요,보통이에요,화면과 비슷해요,162,47,44,쫀쫀하고 좋아요 많이 파이지않아서 좋네요 다른컬러도 구매하고싶어요,Free
5drjR9nJ,상위 15%,24.03.30,화이트,살구베이지(1장 더 구매시 -2000원 할인!),정사이즈예요,아주 만족해요,화면과 비슷해요,155,44,44,"기존 슬리브리스 잘 입고 있어서 깔별로 쟁였어요. 어디든 받쳐입기 편하고 예뻐서 손이
자주 갈 것 같네요 ㅎㅎ",Free
5drjR9nJ,상위 15%,24.03.30,오트밀,무드카키(1장 더 구매시 -2000원 할인!),작아요,아주 만족해요,화면과 비슷해요,155,44,44,"기존 슬리브리스 잘 입고 있어서 깔별로 쟁였어요. 어디든 받쳐입기 편하고 예뻐서 손이
자주 갈 것 같네요 ㅎㅎ",Free
PczbRkTa,,24.03.26,블랙,화이트(1장 더 구매시 -2000원 할인!),정사이즈예요,보통이에요,화면과 비슷해요,168,50,44,"생각보다 엄청 탄탄해서 오래입을 수 있을 것 같아요 
부유방 커버는 잘되지만 몸을 움직이면 나시도 상짝 움직여서 .. 근데 자켓에 입거나 이너에 입을거라 상관없어요 ㅎㅎ 그리구 숙여도 안보여서 조아용!",Free
JH4ghHOc,,24.03.21,크림,1장만 구매,정사이즈예요,아주 만족해요,화면과 비슷해요,163,55,55,퀄리티 괜찮고 나시지만 적당히 가려줘서 야해보이거나 그러지 않아여 이너로 입기 좋은듯,Free
비비안9,상위 25%,24.03.21,크림,화이트(1장 더 구매시 -2000원 할인!),정사이즈예요,아주 만족해요,화면과 비슷해요,160,47,44,"제가 최근에 없던 부유방이 생겨버려서 너무 거민이 많았는데, 안에속옷을 입고 나시를 입어도 부유방 부각 전혀 안되고 쫀쫀해서 살들을 잘 잡아주네요!! 앞으로 이뿌게 잘 입거다닐수있을거같아요 ㅎㅎ",Free
UgoUGA7b,,24.03.07,블랙,블랙(1장 더 구매시 -2000원 할인!),정사이즈예요,보통이에요,화면과 비슷해요,166,50,44,"두개에 할인해서 샀어요
배송은 빠른편은 아니였어요
당장 필요하시는거면 문의하시구
주문하셔야할듯해요
무난합니다~",Free
3eMzljKg,,24.03.01,크림,1장만 구매,정사이즈예요,보통이에요,화면과 비슷해요,157,45,44,적당한 두께 길이 편안함! 이너로 입기 좋고 가디건만 걸쳐도 좋을 것 같아요 😊,Free
U2Nw8sFo,,23.10.29,블랙,소프오트(1장 더 구매시 -2000원 할인!),작아요,보통이에요,화면과 비슷해요,161,57,55,골지인데 꽉 맞다보니 골지가 벌어져서 별로 예쁘게 보이진 않았어요 부유방은 잡아줍니더,Free
7zop4VD8,,23.10.04,크림,1장만 구매,정사이즈예요,보통이에요,화면과 비슷해요,,,,배송 빨리 왔구 화면이랑 똑같아요 잘 입을게요~!!,Free
HcLpHgl8,,23.09.07,화이트,블랙(1장 더 구매시 -2000원 할인!),정사이즈예요,아주 만족해요,화면과 비슷해요,158,52,55,"예전에 사서 주구장창 입어서 새로 장만하려고 샀어욤ㅎ
입으면 쫀쫀하게 잡아주는데 시간이 지나면 어쩔 수 없이 흘러내려서 계속 올려줘야되긴 해여..!",Free
ph6ITrWj,상위 30%,23.07.29,블랙,1장만 구매,작아요,아주 만족해요,화면과 비슷해요,159,51,55,나시가 필요해서 진짜 오랜만에 사봤네요 ㅎㅎ 159/50키로 개인적인 기준에선 살을 조금 더 빼서 입으면 너무 예쁠거 같아요 ㅎㅎ 빡세게 다이어트 해서 꼭 입어야겠어요 ♥️,Free
nahy******,,24.12.14,블랙,1장만 구매,정사이즈예요,아주 만족해요,화면과 비슷해요,157,46,55,너무만족하게 입고있습니다 소재도 톡톡쫀쫀하고 좋네요,Free
nzGBbGWi,,24.09.28,오트밀,1장만 구매,정사이즈예요,아주 만족해요,화면과 비슷해요,,,,날씬해보이고 진짜 너무 예뻐요ㅎㅎ 핏도 색상도 완전 만족!!,Free
U8CCvtOJ,,24.09.14,블랙,화이트(1장 더 구매시 추가할인!),작아요,보통이에요,화면과 비슷해요,158,49,44,"부유방까지 커버해주는 건 좋으나, 속옷을 입지 않고 착용했음에도 너무나 타이트한 핏이라 속옷까지 입으면 블편할 수도 있겠다는 생각이 드네요~",Free
joyIYqmD,,24.07.02,크림,무드카키(1장 더 구매시 추가할인),작아요,아주 만족해요,화면과 비슷해요,170,52,44,생각보다 타이트하지만 색감이나 디자인은 너무 예쁩니다!,Free
cUAEpODN,상위 25%,24.06.15,화이트,화이트(1장 더 구매시 추가할인!),정사이즈예요,보통이에요,화면과 비슷해요,153,49,55,"ㄴ나시 없어허 삿서요,,후기도 많고 원플원 할인 들어가길래 삿슴다 올여름 잘입을겡용 ,, 안입어바서 사이주는 모르겟사용",Free
3hNcYrhc,,24.06.13,오트밀,1장만 구매,정사이즈예요,보통이에요,화면과 비슷해요,160,48,44,유교걸로쏘 사이즈가 어마어마하게 작아서 너무 놀라부렸어요 ㅋㅋㅋ 그래도 어떻게 잘 입고 다니고 있답니당 💖,Free
Ahps5WXn,상위 30%,24.05.29,크림,화이트(1장 더 구매시 추가할인!),정사이즈예요,아주 만족해요,화면과 비슷해요,158,45,55,왜 여러장 사라는지 알겠어요 기본우로 가지고 있기 딱이고 완전 쫀득해서 안에 겹쳐입기 너무 조아용 깔별로 가지고싶어요!!,Free
atdxrQEu,,24.05.22,블랙,블랙(1장 더 구매시 -2000원 할인!),정사이즈예요,보통이에요,화면과 비슷해요,161,48,55,재질이 좋고 배송도 빠르고 핏에 맞아서 이뻐요 ㅎㅎ,Free
sykl**,,24.05.01,크림,블랙(1장 더 구매시 추가할인!),정사이즈예요,아주 만족해요,화면과 비슷해요,160,47,44,고민하다 구매했는데 너무 만족스러워서 다른 색도 구매할까봐요! 생각보다 더 유용하고 고민말고 구매해야합니다!!,Free
keeeX23h,,24.04.24,크림,블랙(1장 더 구매시 -2000원 할인!),정사이즈예요,보통이에요,화면과 비슷해요,163,55,66,생각한 색상과 다르긴한데…만족해여! 레이어드해서 입기도좋아여,Free
fRtXcQW1,,24.04.21,크림,1장만 구매,정사이즈예요,아주 만족해요,화면과 비슷해요,,,,색이 좀 노란빛이 많이 돌아요 연노랑 나시라 생각하면 될듯.. 짱짱한건 마음에 듭니다,Free
ZBRoWMyW,,24.04.21,화이트,1장만 구매,작아요,보통이에요,화면과 비슷해요,164,57,55,뜯고 나서 옷이 거의 한줌이라 놀랐습니다..ㅋㅋㅋㅋ 들어갈까 걱정했는데 잘 들어가긴 해요. 이 짱짱함이 오래갔으면 좋겠어요,Free
tvpzHV60,,24.04.21,블랙,화이트(1장 더 구매시 추가할인!),정사이즈예요,아주 만족해요,화면과 비슷해요,168,53,55,"배송이 오래 걸려서 좀 그랬지만 옷은 맘에 들어요
급하신 분들는 미리미리 주문하세요 맘에들어요
맘에들어요 맘에들엉 ◡̎",Free
ckOC346d,,24.04.19,화이트,블랙(1장 더 구매시 추가할인!),정사이즈예요,보통이에요,화면과 비슷해요,,,,쫀쫀하고 좋아요! 겨드랑이 살 잡아줘서 날씬해보여요.,Free
JbNymtFg,,24.04.07,블랙,화이트(1장 더 구매시 -2000원 할인!),정사이즈예요,보통이에요,화면과 비슷해요,158,53,55,2***트로 주문햇어요 첨에 봣을때 넘 작아보였는데 입어보니 이쁘게 잘 맞아요 ! 누브라하고 입으면 딱입니다 검정이랑 흰색 삿어요,Free
0OZCjk23,상위 15%,24.04.07,무드카키,무드카키(1장 더 구매시 -2000원 할인!),정사이즈예요,보통이에요,화면과 비슷해요,167,50,55,바보같이 같은색으로 두개 시킨나ㅠㅜㅜ그라듀 이쁘니오 엄청 작아보였는데 막상 입으니까 딱 핏되거 이쁘네오 잘닙을게오,Free
oroVOJwg,,24.03.31,화이트,1장만 구매,정사이즈예요,보통이에요,화면과 비슷해요,164,60,66,가격과 비슷한 재질. 빳빳한 소재 입니다. 몸에 맞게 늘어나는 옷.,Free
U26z3uXO,,24.03.26,오트밀,블랙(1장 더 구매시 -2000원 할인!),작아요,보통이에요,화면과 비슷해요,167,54,55,"부유방은 확실히 잘 잡아주는거같은데 제가 찌찌가 좀 살이 쪘나 찡기네요,,,, 그래도 안에 이너로 입고 가디건이나 뭐입기 좋아요",Free
2VuAZZPc,,24.03.25,크림,1장만 구매,정사이즈예요,아주 만족해요,화면과 비슷해요,154,41,44,아 진짜 이 나시 넘 쫀쫀해요 ㅠㅠ 다른색상도 사야겠어요 ㅠㅠ 너무예뻐요,Free
PFw9fwTu,,24.03.21,무드카키,1장만 구매,정사이즈예요,아주 만족해요,화면과 비슷해요,161,65,66,엄청 쫀쫀한 핏이에요 딱 잡아주는 느낌이라 재질도 좋아요,Free
oAeozVeP,,24.02.18,크림,화이트(1장 더 구매시 -2000원 할인!),정사이즈예요,보통이에요,화면과 비슷해요,160,47,44,코디하신 세트가 너무 예뻐서 저도 그대로 구매했어요! 이너는 휘뚜루 마뚜루 입기 딱이랍니다:) 어디에나 입어도 예쁨~~,Free
선이,,24.07.15,블랙,1장만 구매,정사이즈예요,보통이에요,화면과 비슷해요,155,60,88,옷 안에 입으려고 샀는데 여름에 입기에는 많이 더울거 같애요. 잘 놔뒀다가 늦가을 겨울에 입으면 이쁠거 같네요ㅎㅎ,Free
FbFYYdO2,,24.06.26,오트밀,블랙(1장 더 구매시 추가할인!),정사이즈예요,보통이에요,화면과 비슷해요,163,63,66,부유방 커버 나시인데 제 흉통에는 끼는 사이즈라서 오히려 부유방이 더 부각되어 슬프지만.. 그래도 예뻐요!,Free
23E984A5,,24.05.13,화이트,살구베이지(1장 더 구매시 추가할인),정사이즈예요,보통이에요,화면보다 어두워요,155,45,44,살구베이지는 그냥 어두운베이지에요.. 제가 회사로 받아서 회사사람들 다 같이 봤는데 똑같이 어두운베이지아니냐고ㅜㅜ 차라리 밝은 베이지였다면 그나마 나을텐데,Free
PKZWdevR,,24.04.12,크림,블랙(1장 더 구매시 -2000원 할인!),정사이즈예요,보통이에요,화면과 비슷해요,165,47,55,할인할때 싸게 잘 구매한 거 같아요!! 쫀쫀하게 잡아주는데 살짝 타이트한감이 있어요!,Free
xEIAwc16,,24.03.31,오트밀,1장만 구매,정사이즈예요,아주 만족해요,화면과 비슷해요,166,50,55,"퀄리티가 생각했던거보다 훨씬 좋네요
부유방 싹 덮어주고 길이도 너무 좋습니다",Free
QYqUnOzN,,24.03.29,살구베이지,무드카키(1장 더 구매시 -2000원 할인!),정사이즈예요,아주 만족해요,화면과 비슷해요,,,,"너무만족하고 이쁘고 좋아요
잘입을께요~^^
살구베이지 카키구매했는데 색감도이뻐여",Free
ㅎ하이,상위 20%,23.09.14,화이트,1장만 구매,정사이즈예요,보통이에요,화면과 비슷해요,155,45,44,"벌써 세번째 구매에요! 기본적인 색은 다 있는 것 같아요ㅎㅎ오트밀, 크림도 예뻤는데 이번에꺼도 좋어요",Free
ToDWOgJt,,23.07.28,블랙,1장만 구매,정사이즈예요,아주 만족해요,화면과 비슷해요,,,,아주 쫀쫀한 기본 슬리브리스이에용 여기저기 이너로 받쳐입기 좋아여,Free
h3zOgIJy,,24.07.09,살구베이지,크림(1장 더 구매시 추가할인!),정사이즈예요,보통이에요,화면과 비슷해요,163,50,55,"쫀쫀하고 색감도 좋아요 
건조기 돌리면 많이 작아져요",Free
oh2a19CY,,24.06.21,크림,1장만 구매,정사이즈예요,아주 만족해요,화면과 비슷해요,169,46,55,몸을 타이트하게 잡아줘서 섹시해보이면서도 편하게 입기 좋아요!,Free
PKp05CKc,,24.06.02,화이트,블랙(1장 더 구매시 추가할인!),정사이즈예요,아주 만족해요,화면과 비슷해요,,,,제가 찾던 길이감이고 체형도 적당히 커버해줘서 좋아요,Free
uin3**,,24.05.22,살구베이지,1장만 구매,작아요,보통이에요,화면보다 어두워요,160,46,55,"사진상 핑크베이지 같지만 
그냥 어두운 베이지색이에요 
베이지색으로 컬러명 변경해야 할듯...",Free
sx9lSf0R,,24.05.19,화이트,화이트(1장 더 구매시 추가할인!),정사이즈예요,아주 만족해요,화면과 비슷해요,160,50,55,생각보다 탄탄해서 몸에 착 감기고 좋아요!! 근데 바지에 넣어 입기에는 조금 짧은 거 같아용,Free
올영n년차알바생,,24.05.04,블랙,크림(1장 더 구매시 -2000원 할인!),정사이즈예요,보통이에요,화면과 비슷해요,168,54,55,부유방 잘 잡아줘여 짱짱하니 좋습니당. 다만 아쉬운게 있다면 조금 두껍습미다,Free
CZv9GeYk,,24.04.25,오트밀,화이트(1장 더 구매시 -2000원 할인!),정사이즈예요,보통이에요,화면과 비슷해요,149,50,55,"여름 다와가서 나시를 샀는데 직잭에서 샀던 나시들 중에 좀 짧은 듯해요
그래도 잘 늘어나고 부유방은 잘 가려줘서 하이웨스트랑 입어야할것같습니다",Free
QoVnmzHJ,,24.04.18,크림,1장만 구매,정사이즈예요,아주 만족해요,화면과 비슷해요,163,48,44,쫀쫀하고 길이도 적당해서 이너로 입기 좋아요 만족합니다,Free
xwHRt000,,24.04.17,화이트,1장만 구매,정사이즈예요,보통이에요,화면과 비슷해요,160,47,44,쫀쫀하고 좋아요 흰색은 살짝 비침이 있어서 속옷을 잘입어야해요,Free
gFEyqvuz,,24.04.15,화이트,크림(1장 더 구매시 추가할인!),정사이즈예요,보통이에요,화면과 비슷해요,161,43,44,크림색이 생각보다도 더 노랑노랑해요 핏 자체는 괜찮아요,Free
matVAA9C,,24.04.13,크림,블랙(1장 더 구매시 -2000원 할인!),정사이즈예요,보통이에요,화면과 비슷해요,153,48,44,끈이 늘어날까봐 걱정되긴하지만 핏되게 이쁩니다 추천해용,Free
1gOcZt6F,상위 5%,24.04.12,블랙,크림(1장 더 구매시 -2000원 할인!),작아요,아주 만족해요,화면과 비슷해요,157,47,44,왜 부유방을 커버해주는지 입자마자 완전 납득이 됐습니다! 봄여름에 뽕 뽑아서 입을것 같아요!!! 이거 진짜 깔별로 다 사고싶네요 ㅎㅎㅎ,Free
Qek6s1HL,,24.04.07,크림,블랙(1장 더 구매시 -2000원 할인!),작아요,보통이에요,화면과 비슷해요,160,49,55,딱 맞는 핏이에요. 가격이 저렴해서 좋아요. 굿,Free
4z591g8z,,24.04.06,블랙,화이트(1장 더 구매시 -2000원 할인!),작아요,보통이에요,화면과 비슷해요,160,50,55,"끈 부분을 조절할수없어서 불편햇어요, 그리고 생각보다 저에게 작아서 오히려 부유방이 더 만들어지는것같더라구요 ㅠㅠ 반퓸 할까하다가 입다보면 늘어날거생각해서 그먕 입으려규요,",Free
4z591g8z,,24.04.06,화이트,크림(1장 더 구매시 -2000원 할인!),작아요,보통이에요,화면과 비슷해요,160,50,55,"끈 부분을 조절할수없어서 불편햇어요, 그리고 생각보다 저에게 작아서 오히려 부유방이 더 만들어지는것같더라구요 ㅠㅠ 반퓸 할까하다가 입다보면 늘어날거생각해서 그먕 입으려규요,",Free
Qn4c2sVR,,24.04.01,크림,1장만 구매,작아요,보통이에요,화면과 비슷해요,,,,"처음엔 받고 이게 몸통에 들어가는지 의문이였는데 들어가네여!!
하지만 밥 먹고 나면 옷이 제 몸을 옥 죄어와요ㅎ 그건 제 몸 잘못이겠져
하지만 그만큼 부유방 커버 빵빵하게 됩니다!!",Free
FHpAKX8C,,24.03.20,블랙,1장만 구매,정사이즈예요,아주 만족해요,화면과 비슷해요,158,46,44,쫀쫀하게 잘 잡아주고 약간 크롭 기장이라 딱 좋아요!,Free
jl6PKfdu,,24.03.20,블랙,1장만 구매,정사이즈예요,아주 만족해요,화면과 비슷해요,162,61,66,쫀쫀하고 핏 잘 맞습니다! 부유방 잘 가려줘서 예뻐요,Free
4otASS1h,,24.03.20,화이트,1장만 구매,정사이즈예요,아주 만족해요,화면과 비슷해요,159,44,55,색감도 이쁘고 질이 너무 좋아요!! 퍼빗 첫구맨데 완전만족입니닷,Free
