아이디,리뷰어 등급,작성 날짜,옵션1,옵션2,상품 사이즈,퀄리티,색감,키,몸무게,사이즈,리뷰내용,제품_사이즈
Os2MpBED,,23.09.01,코튼블랙,,정사이즈예요,아주 만족해요,화면과 비슷해요,165,58,55,배송이 조금 느려서 그렇지 옷은 아주이뻐요… 팔뚝살 개부자인데 팔뚝살 가려줘서 넘 좋아요… 퉁실이도 나시 도전할 수 있게 해쥬ㅓ서 좋아여,Free
화이트릴리,상위 5%,23.09.01,딥핑크,FREE,정사이즈예요,보통이에요,화면과 비슷해요,154,58,55,엄청 귀여워요 근데 핏이 조금 부하기는한데 어쨌든 깜찍해요 연두색이랑 검정색도 예뻐서 사고싶은데 이제 여름이 다 지나가니까 애매해서 아쉬워요ㅠㅠㅠ,Free
p3P8rnhF,상위 1%,23.08.31,라이트그린,FREE,정사이즈예요,아주 만족해요,화면과 비슷해요,160,49,55,"약간 짧은 느낌 있긴한데 
크롭이라 다리 길어보이고 좋아요! 
시원한 소재고 편해요:) 

평소 55사이즈구 잘 맞아요
글구 녹차컬러 넘나 이뻐용:)",Free
byur**,,23.08.31,라이트그린,FREE,정사이즈예요,보통이에요,화면과 비슷해요,162,46,44,"색상이 상큼해서 예뻐요 
조금 생각했던거보다는 파스텔톤은 아니긴한데 핏이 귀엽습니다 여름에 잘 입을거 같아요 길이는 크롭 될까말까합니다!",Free
U3qwndCg,,23.08.31,베이비화이트,FREE,정사이즈예요,아주 만족해요,화면과 비슷해요,165,51,55,제주도 여행 가서 입었는데 아주 만족스러웠어요! 적당히 뜨는 느낌이라 크게 부해보이지도 않았고 팔 부분 깊게 파이지 않아서 부담없이 움직일 수 있었습니당!,Free
tMJ8P937,,23.08.30,코튼블랙,FREE,정사이즈예요,아주 만족해요,화면과 비슷해요,154,55,66,"가슴도 있고, 팔뚝살때문에 나시는 처음 도전해보는데 너무 만족스럽게 입고 있습니다 :)
아무래도 마른 사람이 입으면 더 이쁘겠지만 어느정도 체형보정도 되는 것 같고, 가슴이 C컵인데도 맞더라구요~
더 크신 분들은 조금 답답하실 것 같아요!
그래도 올 여름 예쁘게 입었네요^^",Free
82aHTxB3,상위 10%,23.08.30,코튼블랙,FREE,정사이즈예요,보통이에요,화면과 비슷해요,164,57,55,"부유방 잘 가려주고 크롭기장인데 어깨쪽이나 다 불편하지 않고 좋더라구요 
후기 좋은건 이유가 있는 것 같아요 
다른 색상도 추가 구매할려구요",Free
Aiq0bJYz,,23.08.28,코튼블랙,FREE,정사이즈예요,아주 만족해요,화면과 비슷해요,157,30이하,33 이하,"바스락거리는 재질이 좋았고, 넥 부분?? 옷 안감이 살짝쿵 거슬렸지만 다니는데에는 지장없었어요!
그리고 신축성이 없어서 입고 벗을 때 약간 불편한거 말고는 아주 만족합니다잇",Free
YE84DUdm,,23.08.27,딥핑크,FREE,정사이즈예요,보통이에요,화면과 비슷해요,171,56,66,바스락 거리고 컬러도 화면이랑 같이 쨍하고 예뻐요 근데 가슴부분 마감이 애매해요...가슴 사이즈 있고 몸통 둘레가 좀 있으신 분들은 입고 벗기 어려울 수 있을 것 같아용,Free
nBHh6q5i,,23.08.23,라이트그린,FREE,정사이즈예요,보통이에요,화면과 비슷해요,162,48,55,"해외여행가서 잘 입었어요 ~!!!
연두색 검정색 두개 샀어용
확실히 나시가 시원하고 좋네욤
질이 좋은편은 아니지만 저렴하게 휙휙 입기 조아요",Free
nBHh6q5i,,23.08.23,코튼블랙,FREE,정사이즈예요,보통이에요,화면과 비슷해요,162,48,55,"해외여행가서 잘 입었어요 ~!!!
연두색 검정색 두개 샀어용
확실히 나시가 시원하고 좋네욤
질이 좋은편은 아니지만 저렴하게 휙휙 입기 조아요",Free
nSnBjVwR,,23.08.23,딥핑크,FREE,정사이즈예요,아주 만족해요,화면과 비슷해요,161,51,55,마음이 드는 디자인과 색상으로 입자마자 만족입니다! 어깨의 끈이 두꺼워서 팔뚝도 가려주어서 사진 찍었을 때 더 여리여리항 느낌으러 나올 거 같아요!,Free
MFrqd322,,23.08.22,코튼블랙,FREE,생각보다 커요,보통이에요,화면과 비슷해요,,,,바스락이라고 해서 기대했는데 그냥 무난하고 구김도 잘가고 프리사이즈라 앞뒤 여분이 엄청나요 평퍼침해요 그치만 배송이 당일에 왔고 편하게 입을 수 있어서 만족합니다!,Free
cNs2jxTL,,23.08.21,코튼블랙,FREE,정사이즈예요,아주 만족해요,화면과 비슷해요,170,66,66,생각보다 팔뚝살 부각이 잘 안되서 너무 만족하는 제품입니다 소재도 바스락 소재라 아주 시원하고 지금 같은 날씨에 입기 아주 좋습니다!,Free
GVhqH5j4,상위 10%,23.08.21,라이트그린,FREE,정사이즈예요,아주 만족해요,화면과 비슷해요,168,56,55,"여행가서 편하게 입고싶어서 산건데 생각보다 더 맘에들었어요! 색도 탁한 색이 아니라서 사진에서 더 예쁘게
나왔어요 부유방도 잘 가려주고! 가성비 최고입니당",Free
1i3CVnBm,,23.08.21,라이트그린,FREE,정사이즈예요,보통이에요,화면과 비슷해요,166,62,66,"실밥 나오는거나 마감같은건 딱 가격만큼이지만
색감이 이뻐서 사진찍긴 좋아요.
인간 양배추가 된 기분 ㅎㅎ
조금 짧은듯한데 안에 나시입고 입으니 괜찮았어요.",Free
wAtVLWYD,,23.08.21,라이트그린,FREE,생각보다 커요,별로예요,화면과 비슷해요,154,49,55,"불량이 와서 환불하고 재구매햇는데 전에 산 가격대보다 더 주고 새로 구매햇슴니당,,
옷은 퀄이 떨어지긴 하지만 한철 귀엽게 입을수잇어유",Free
QzogWsDI,,23.08.18,라이트그린,FREE,생각보다 커요,보통이에요,화면보다 어두워요,160,57,66,"생각했던 라이트 그린은 아니었어요 
메로나 색이라했는데 그것보단 좀 더 어두운 색이고
세탁 한 번 해봐야 할것 같지만 뭔가 어벙한 느낌•••? 잘 입어볼게요오",Free
BH2Vgi5G,,23.08.18,코튼블랙,FREE,생각보다 커요,보통이에요,화면과 비슷해요,161,50,55,"적당히 여성스러우면서 가볍게 입기 좋아요 
통이 생각보다 넓긴한데 큰 불편함 없이 입을 수 있어요
질은 딱 가격정도..?인거 같습니다",Free
glor******,,23.08.17,베이비화이트,FREE,정사이즈예요,아주 만족해요,화면과 비슷해요,160,50,55,너무 이뻐요 ㅎㅎㅎ 맘에들고 잘 샀다고 생각드네요!! 길이는 짧은 듯한데 그래도 크롭같지는 않아수 만족 했습니다 ㅎㅎㅎ 재질도 코튼ㅇㅣ라 딱 조와요!!,Free
xBOJqZUU,,23.08.16,코튼블랙,FREE,정사이즈예요,보통이에요,화면과 비슷해요,155,45,44,"여행 마지막날에 입었는데
프릴이 조금 부담스럽긴했는데 잘 입었어요 
배송도 빠르구요 근데 냄새는 좀 납니다
길이 적당했고 겨드랑이도 가려줘서 좋았어요",Free
X7h2kX0c,,23.08.12,라이트그린,FREE,생각보다 커요,보통이에요,화면과 비슷해요,159,53,55,생각보다 품이 너무 크고 마감이 깔끔하지 않긴한데 가격이 저렴해서 괜찮아요 ㅎㅎ 귀엽기도 하고 휴양지가서 짧게 입기 좋을 것 같아요! 색감도 쇼핑몰 사진과 동일합니다,Free
kWA06f6S,,23.08.12,베이비화이트,FREE,정사이즈예요,아주 만족해요,화면과 비슷해요,153,41,44,생각보다 옆으로 펑퍼짐해요! 크고 그런건 아닌데 제가 생각한 핏과 조금 달랐어요! 색상은 화면이랑 똑같이 누렇지않은 하얀색이고 재질도 꽤 괜찮습니당,Free
q8WazFk3,,23.08.11,라이트그린,FREE,정사이즈예요,보통이에요,화면과 비슷해요,160,58,66,펑퍼짐한 거 안 좋아하시는 분께는 비추입니당. 뒷부분이 조금 펑퍼짐해서 핏이 안나오고 크롭보다 조금 길어서 길이가 애매해용 편하게 나시 입고 싶은 분들께 추천합니당!!,Free
qbd188Z1,,23.08.11,라이트그린,FREE,정사이즈예요,보통이에요,화면과 비슷해요,159,52,55,생각했던 것보다는 재질이 보통이었는데 사진에 예쁘게 나와서 여행가서 잘 입고왔습니다. 시원하고 이번 여름 화사하게 입기에 그린 추천합니다,Free
youg*****,,23.08.10,라이트그린,FREE,생각보다 커요,별로예요,화면과 비슷해요,167,49,55,"생각보다 옆에가 펑퍼짐하고 안에 마감도 잘 아누되어 있어요ㅠㅠ 근데 색상은 너어무 이뻐요. 얼굴이
훨씬 화사해보이는 느낌!",Free
uvdkal9L,,23.08.09,베이비화이트,FREE,정사이즈예요,보통이에요,화면과 비슷해요,163,52,55,"여행갈때 입을려고 샀는데~배송도빨랐고
냄새가 조금나서 세탁한번해서입었더니괜찮았어요
넉넉한 사이즈고 잘못입으면 살쪄보일수도있어요
디자인은 참예뻐요^^",Free
IVhWHDLW,상위 30%,23.08.09,라이트그린,FREE,정사이즈예요,보통이에요,화면보다 어두워요,163,56,55,"배송은 빨랐어요. 색감이 화면보다 어두운 그린이에요! 그리고 생각보다 길이가 길지 않아요 ㅎㅎ
그리고 입으면 가슴 있는 부분이 살짝 올라온다고 해야하나? 아무튼 쏘쏘합니당",Free
7GMgkGKw,,23.08.09,라이트그린,FREE,정사이즈예요,아주 만족해요,화면과 비슷해요,162,53,55,여름에 편하게 입을 나시가 필요해서 구매했어요 연두색 보자마자 반했는데 색감이 너무 예뻐서 여름에 딱입니다 ㅎㅎ 하나만 툭 걸쳐도 예쁘고 아주 편해요~,Free
YEHOjQAj,,23.08.09,코튼블랙,FREE,정사이즈예요,아주 만족해요,화면과 비슷해요,159,48,55,일본 여행가서 입으려고 큰맘먹고 삿는데!!! 넘 맘에 들어서 평상시에도 입고 싶습니다 ㅋ 입고 있을 땐 몰랐는데 사진 보니까 뒤가 저렇게 길어지네요..?!? 암튼 다들 귀엽다고 해줌!!!,Free
oZB1AmC5,,23.08.08,라이트그린,FREE,정사이즈예요,보통이에요,화면과 비슷해요,155,45,44,"색감 예뻐요! 
차분하면서 화사한 연두에요
바스락 거리는 소재고 구김이 가긴하는데
그것도 나름 멋스러워요 
키 크신 분들은 좀 짧을 수도 있겠어요
저는 대만족",Free
ql10****,,23.08.07,베이비화이트,FREE,정사이즈예요,아주 만족해요,화면과 비슷해요,160,52,44,탄탄하고 잘 비치지않아서 더 좋았고 생각보다 시원하고 디자인도 넘 귀여워서 연청이랑 입으니까 너무 예뻐요!! 어깨쪽 띠가 생각보다 넓어서 쇄골부분 어깨부분이 더 예뻐보입니당,Free
LnFrdZyK,,23.08.07,코튼블랙,FREE,정사이즈예요,보통이에요,화면과 비슷해요,159,53,44,색상 고민하다가 둘다 배송이 빠르게 출발해버려서 둘다 받앗는데 둘다 이뻐서 그냥 둘다입었어요 !! 나시인데 팔뚝이 많이 부각안되서 좋아요,Free
l2kclgFh,,23.08.07,딥핑크,FREE,정사이즈예요,보통이에요,화면과 비슷해요,173,63,77,색감이 너무 이뻐요!!! 다른 색상도 추가 구매하려고 합니다!! 고민하시는분들 추천합니다 ㅎㅎㅎ 강추합니다 66사이즈인 저에게도 찰떡이에요!,Free
gKGiIERM,상위 25%,23.08.06,라이트그린,FREE,정사이즈예요,보통이에요,화면과 비슷해요,,,,가격이 저렴해서 마감은 좋지 않지만 여행갈 때 입으면 예쁠 거 같아요. 색상도 딱 녹치리떼 색상이라서 마음에 들어요. 길이는 짧아서 하이웨스트 바지랑 입어야 될 것 같아오.,Free
XOXsBdmh,상위 20%,23.08.06,라이트그린,FREE,정사이즈예요,보통이에요,화면과 비슷해요,162,50,55,"봄웜인데 잘 받아요 그린컬러가 상큼하니 
마치 밝은 녹차아이스크림 같이 이뻐요 
놀러갈때 기분내기 좋을것 같아요 
사이즈도 낙낙하고 러블리한 프릴슬리브리스",Free
XOXsBdmh,상위 20%,23.08.06,딥핑크,FREE,정사이즈예요,보통이에요,화면과 비슷해요,162,50,55,"톤다운된 진핑크에요 mlbb느낌 이에요 
봄웜이라 안받음 반품할까했는데 만족해요! 
생각보다 어울리는것 같아요 
여성스럽고 사랑스러운 프릴에 컬러감 맘에 듭니다",Free
waxEtlnH,상위 25%,23.08.06,코튼블랙,FREE,정사이즈예요,아주 만족해요,화면과 비슷해요,165,53,55,가격상 실밥이 몇군데 있어서 잘라서 입긴 했습니다 ㅠㅠ 급하게 산건데 배송도 빨리 오고 옷도 귀엽긴 합니당 !! 시원해서 여름에 잘 입고 다닐것 같아요 !,Free
67FuHfcK,,23.08.05,라이트그린,FREE,정사이즈예요,보통이에요,화면과 비슷해요,163,50,44,색은 사진보다 더 이뻐요!!! 파스텔 연두 느낌입니당 제가 평소에 나시를 팔뚝보다는 승모근때문에 잘 입지 않았는데 이거는 끈부분이 두꺼워서 승모근 가려주네요!,Free
1T1mLhSI,,23.08.04,라이트그린,FREE,정사이즈예요,아주 만족해요,화면과 비슷해요,,,,"너무 잘입고 있어요.
길이는 배꼽길이에 떨어지고요
색상은 화면과 비슷
핏은 붙지않고 펑퍼짐해서 더 편하고 좋아요.
소재는 구김은 가는데 네츄럴하게 안 다리고 입고다닐만 해요",Free
EOx0KkAL,,23.08.03,딥핑크,FREE,정사이즈예요,보통이에요,화면보다 어두워요,171,59,66,딥핑크 색깔 예뻐요 사진보단 좀 더 어두운듯 ㅋㅋ 근데 퀄리티는 별로네요 한 철 입기 딱 좋은 정도 ㅠ 그래도 치킨 하나 먹었다 생각하고 놀러다닐 때 입으려구용,Free
VpoQv0ro,,23.08.03,라이트그린,FREE,정사이즈예요,보통이에요,화면과 비슷해요,162,60,55,예뻐요 생각보다 날씬해 보이고 ㅎ 화면이랑 색상같아요 밑이 펄럭거려서 바람불면 상의속옷이 보일거 같아서 나시 입어야할 것 같아요 ㅎ 이쁩니당,Free
JqSO4qIQ,상위 20%,23.08.03,라이트그린,FREE,정사이즈예요,보통이에요,화면과 비슷해요,170,56,55,생각보다 기장이 조금 짧다 싶었는데 제 키가 있으니 어쩔 수 없져 뭐~ 그래도 너무 예뻐서 여행갈 때 잘 입고 돌아다녔어요 색도 흔하지 않은 그린색이라 너무 예뻤습니당,Free
lkh3***,,23.08.03,딥핑크,FREE,정사이즈예요,보통이에요,화면과 비슷해요,163,54,55,좀 벙벙해 보이는듯 하네여 그래서 가디건이랑 같이 입었는데 훨씬 좋아여 프릴 디테일이 안보여서 좀 아쉽지만 이런 색 옷이 찾기 힘든데 귀엽고 좋아요,Free
98SMyf7Y,,23.08.02,딥핑크,FREE,정사이즈예요,아주 만족해요,화면과 비슷해요,162,48,44,여행가서 입었는데 여행 가기 전에 배송 와서 좋았구 사진에도 예쁘게 나오고 편해서 좋아요오~~ 색상은 은근 빨간색에 가까운 딥핑크입니당,Free
JrqWezYa,,23.08.02,라이트그린,FREE,정사이즈예요,아주 만족해요,화면과 비슷해요,167,60,66,"옷 색도 쨍하니 맘에들고 여름과 어울립니다 ㅎㅎ
재질은 아주좋다기보단 문제없이 입을수 있을정도고 나시라서 시원하게 입기 좋아요! 대체적으로 만족스럽습니다 이뻐요",Free
BlpeQHCx,,23.08.02,라이트그린,FREE,정사이즈예요,보통이에요,화면과 비슷해요,158,56,55,부유방을 가려줘서 너무 좋앗어요! 색깔도 거의 비슷해서 여행가서 잘 입었어용~~ 근데 배송 올때 구김이 있어서 조금 다려 입어야햇네요! ㅎㅎ 그래두 이뻐서 만족!,Free
Q7I0sHe7,,23.08.01,코튼블랙,FREE,정사이즈예요,보통이에요,화면과 비슷해요,160,44,44,"너무 귀여운 밴딩의 상의에요!
핑크랑 고민하다가 블랙 구매했는데 잘 산것 같아요.
앞뒤 길이가 언발란스해서 더 예뻐요.
가격대비 만족입니다!",Free
iEsdMQh1,상위 15%,23.07.31,베이비화이트,FREE,정사이즈예요,아주 만족해요,화면과 비슷해요,173,72,66,"우앙,,이 옷 생각했던 거 보다 너무 귀여운 거 같습니다,, 키도 큰 편이고 뼈대가 좀 있는데 살짝 가슴쪽이 끼는? 느낌이 있긴한데 옷 자체가 이쁘니까 감안하고 입을 수 있는 느낌 입니다..! 사장님 저 같은 통통이에게도 입을 수 있게 옷을 만들어주셔서 너무 감사합니다🥺",Free
ss_hyun.e,,23.07.31,라이트그린,FREE,정사이즈예요,보통이에요,화면과 비슷해요,160,48,44,다림질 꼭 해서 입으세요!! 다른 리뷰들처럼 안쪽 가슴부분 안감이 자꾸 올라오는느낌?이 들어요ㅠ 그래서 다리미로 모양 다시 잡아서 입었어요!,Free
meul***,,23.07.31,코튼블랙,FREE,생각보다 커요,보통이에요,화면과 비슷해요,163,58,77,놀러가서 입기 위해 주문했습니당 그린색상이랑 고민하다가 주문했는데 블랙도 괜찮은거같아욥 사이즈는 넉넉하고 무난하게 잘 입을 수 있을것같습니당,Free
2Z3ddxwL,,23.07.31,딥핑크,FREE,정사이즈예요,보통이에요,화면보다 어두워요,155,47,55,검정이랑 핑크 둘다 같이 샀는데 맘에 들어영 부유방 가려져서 좋은듯 합니당 !!! 근데 질은 사실 딱 싼값하는 느낌.. 여행가서 잘 입었어요,Free
2Z3ddxwL,,23.07.31,코튼블랙,FREE,정사이즈예요,보통이에요,화면과 비슷해요,155,47,55,검정이랑 핑크 둘다 같이 샀는데 맘에 들어영 부유방 가려져서 좋은듯 합니당 !!! 근데 질은 사실 딱 싼값하는 느낌.. 여행가서 잘 입었어요,Free
izswHAEX,,23.07.30,코튼블랙,FREE,정사이즈예요,보통이에요,화면과 비슷해요,165,60,55,"신축성 없어요!
그냥 가볍게 여행느낌으러 입을만해요!
가슴 앞쪽?에 옷 마무리가 부족해사 자꾸 안쪽 옷감이
빠져나오네요 ㅎㅎㅎ
그래도 귀엽고 간단라게 입기좋아요!",Free
PiHXVgOJ,,23.07.30,라이트그린,FREE,정사이즈예요,아주 만족해요,화면과 비슷해요,164,48,44,길이는 길지않고 너무 짧지도않고 딱 쥬아요 재질이 구김이 많이 가긴하지만 여름에 시원하게 입을 수 있을거같아요! 색상은 화면과 비슷합니다.,Free
JlMNxHSS,,23.07.30,코튼블랙,FREE,정사이즈예요,아주 만족해요,화면과 비슷해요,170,52,55,이 옷 너무 예뻐용...바스락바스락..적당한 바스락이고 그냥 이쁨 다사사용..저 기회되면 색깔별로 쟁이려구용.ㅎㅎ 검은색 질릴때쯤 ?,Free
dlzeIIZF,,23.07.28,베이비화이트,FREE,생각보다 커요,보통이에요,화면과 비슷해요,164,45,44,"실물이 더 여성스럽고 이뻐요, 완전 가성비가격에 득템했어요! 여름에 시원하게 막 입기 좋을거 같아요! 어느 코디에나 무난하게 잘 어울립니다",Free
2QbfJZ8M,,23.07.28,라이트그린,FREE,정사이즈예요,아주 만족해요,화면과 비슷해요,158,47,55,옷 진짜 이뿌네용 귀엽구.. 마감도 다 괜찮은데 레이스가 앞 가슴 쪽에 가끔 잘 고정이 안되어서 불편했지만 옷 자체믄 이쁘고 맘에 들어요 색감도요 다룬색도 사고파요,Free
ta419WCh,,23.07.28,라이트그린,FREE,정사이즈예요,보통이에요,화면과 비슷해요,164,51,55,이런 종류 나시 첨사보는게 너무귀여워요! 분홍색은 퍼스널컬러에 안맞을까봐 그린샀는데 분홍도 그냥 살까바요 가슴부분 덧대어진 천은 자꾸 올라와서 좀 불편한데 다림질하면 괜찮을거같아용,Free
LPEYIkH5,상위 20%,23.07.27,라이트그린,FREE,생각보다 커요,보통이에요,화면과 비슷해요,160,51,55,색은 너무 귀여워요 조금 구깃해지는 느낌이 있지만 또 이 재질과 색감이나 모양이 잘어울려요 흰바지랑 입으려구요 부담없이 데일리로도 가능할거같아요,Free
pG5WU0Hl,,23.07.27,베이비화이트,FREE,정사이즈예요,아주 만족해요,화면과 비슷해요,161,60,55,"완전예뻐요
대박입니다
부유방도없어보이구
하나더사러갑니다
배송빠르고 가격도 심지어
배송비도없어요
구김은좀심한편입니다만
이여름에민소매가제격입니다",Free
cscfdULq,,23.07.26,베이비화이트,FREE,정사이즈예요,아주 만족해요,화면과 비슷해요,159,51,55,놀러가서 입었는데 사이즈도 넉넉하고 아주 예뻐요!! 데님 바지랑 입으면 더 잘 어울릴 거 같아요 마음에 들어서 핑크색도 구매하려고요!,Free
j5dI8Qwc,,23.07.26,라이트그린,FREE,정사이즈예요,아주 만족해요,화면과 비슷해요,160,50,55,휴가갈때 가볍게 입으려고 갔는데 시원하고 좋아요! 색상도 상큼한 그린이라 예쁩니다! 잡아주는게 없어서 허리부분이 뜨긴 하고 약간 짧지만 하이웨스트 바지랑 입으면 딱 예쁜 것 같아요!,Free
v1qOEIpj,,23.07.26,베이비화이트,FREE,정사이즈예요,보통이에요,화면과 비슷해요,153,50,55,"옆통은 딱 좋아요 앞뒤통이 좀 넓구
밴딩이 생각보다 두껍지만 부유방 심한 분들은 가려지실듯 
다른데보다 펑퍼짐이ㅜ없어보여서 리뷰보고 샀어요 여행가서 잘 입을게요 예뻐요",Free
RLDbC12G,,23.07.24,라이트그린,FREE,정사이즈예요,보통이에요,화면과 비슷해요,158,52,55,생각보다 되게 바스락 거리는 재질이라서 딱 가격값하는듯 몸통쪽이 바람불면 후루룩 날라가서 당황스럽지만 여름에 시원하게 한철입긴 좋은듯!,Free
qccKcoRZ,상위 25%,23.07.24,베이비화이트,FREE,정사이즈예요,보통이에요,화면과 비슷해요,159,51,44,여행에 입고 가려고 했는데 직진배송 품절 돼서 늦게 배송 돼서 못 가져갔지만 다음 여행 갈 때 입고 갈 수 있어서 좋아요! 퀄리티도 좋고 귀여워요ㅠㅎ,Free
JLyXYPyo,,23.07.23,라이트그린,FREE,정사이즈예요,아주 만족해요,화면과 비슷해요,163,63,55,좀 짧아서 배까지 올라오는 하의 입고 입으면 예뻐요~ 색도 유니크해서 여행가서 입으려고 샀어요! 팔부분이 드러나서 가디건 걸쳐서 입으면 딱 이쁨 🥰,Free
q2eqVUsQ,,23.07.23,라이트그린,FREE,정사이즈예요,보통이에요,화면과 비슷해요,160,46,55,"여행가서 입었는데 완전 여행룩,,
이런 말차색? 좋아해서 완전 맘에들어요
퀄리티는 가격 저렴하니까 .. 그리 좋진 않지만
여행가서 입긴 좋아유~",Free
gims*****,,23.07.22,라이트그린,FREE,정사이즈예요,보통이에요,화면과 비슷해요,167,52,55,"색감이 카메라에 안담기네요ㅠ 
실패하면 어쩌나 했는데 완전 예쁜 그린애플색입니다 
가격도 만족이에요 
다만 좀 짧아서 하이웨스트랑 입어야할거같습니다!",Free
CzA4QelK,,23.07.21,라이트그린,FREE,작아요,아주 만족해요,화면과 비슷해요,163,55,55,"여름 제주도 여행때 입으려고 주문했어요
역시 색감도 예뻤답니다ㅎㅎ
검정하의, 흰하의 모두 잘 어울렸지만 흰색 반바지에 입으면 더 예쁠것같아요",Free
9PW1uqR6,,23.07.21,라이트그린,,정사이즈예요,아주 만족해요,화면과 비슷해요,160,49,55,"시원한 소재로 되어있어서 한 여름에 입기 괜찮았어요!
팔뚝살 커버도 되고 색감도 예뻐서 놀러가서 잘 입었어요ㅎㅎ 연두색은 밑에 흰바지가 잘 어울렸어요~",Free
eHkh2q6X,,23.07.20,딥핑크,FREE,정사이즈예요,아주 만족해요,화면과 비슷해요,163,52,55,색깔 화면 그대로라 딱 여행가서 화사하게 사진찍을 때 입기 좋아요! 일단 어깨가 프릴 나시로 되어있어서 팔뚝 부담이 없는데 저처럼 어깨 좁은분들은 어깨 한뼘으로 보일 수 있습니다!!,Free
eELV5AHN,,23.07.20,베이비화이트,FREE,정사이즈예요,보통이에요,화면과 비슷해요,163,52,55,붕붕 뜨긴 하는데 예뻐요 바닷가 가서 입으면 좋을듯 어깨랑 팔뚝 때문에 부해보이는 거 걱정되시는 분들 걱정말고 사세요!! 부각 안돼요,Free
DXoyG8i3,,23.07.20,라이트그린,FREE,정사이즈예요,아주 만족해요,화면과 비슷해요,158,47,55,"고민중이시면 당장 지르세요
옷이 너무 귀여워요ㅋㅋㅋ 동남아 여행용으로 찰떡입니다!!
부유방 잘 가려주고 잘 구겨질 소재이긴하지만 귀여워서 만족합니다",Free
vbvdJOmW,,23.07.20,베이비화이트,FREE,생각보다 커요,보통이에요,화면과 비슷해요,162,48,44,"실제로 입으면 좀 벙벙한 핏입니다. 주름이 안지는지는 잘 모르겠으나 바스락 거리는 소재는 맞아요
귀여운 느낌이라 잘 입고 다니구 어깨끈이 넓어서 속옷이 별로 신경쓰이지 않아요 이뿌요",Free
xNj3taC4,,23.07.19,라이트그린,FREE,생각보다 커요,보통이에요,화면과 비슷해요,162,53,55,색이.너무 고급져서 예쁜것 같아요~ 옷이 많이 구겨져서 와서 스팀 다림질이 꼭 필요할것 같고 냄새도 나서 꼭 세탁 후 입어야할것 같아요~,Free
uq0sDpFQ,,23.07.19,라이트그린,FREE,정사이즈예요,아주 만족해요,화면과 비슷해요,164,46,44,너무 귀엽고 핏도 딱이에요! 많이 짧지도 않고 어깨 프릴이 너무 귀여워요 ㅎㅎㅎ 흰색은 좀 흔한 것 같아서 연두색했은데 넘 이쁜 그린티색이라 만족해요 짱,Free
82YJjTuM,,23.07.18,코튼블랙,FREE,정사이즈예요,아주 만족해요,화면과 비슷해요,161,50,44,재질이 바스락거리는 재질입니다! 부유방이 신경쓰여서 나시 잘 못 입는데 너무 좋아요! 밑에 밝은색 바지와 매치하면 짱일듯합니다 다른색도 구매하고 싶어용,Free
