아이디,리뷰어 등급,작성 날짜,옵션1,옵션2,상품 사이즈,퀄리티,색감,키,몸무게,사이즈,리뷰내용,제품_사이즈
iY0jbrpS,상위 20%,24.08.22,핑크,선택안함,정사이즈예요,아주 만족해요,화면과 비슷해요,163,50,55,"저렴한 가격에 질도 길이 조절도 되는데다
예뻐서 정말 잘 입었어요!!😊
입은거 보고 친구들도 ㅋ 다 따라샀어요!!",Free
JqraPcME,,24.08.22,아이보리(i),선택안함,정사이즈예요,보통이에요,화면과 비슷해요,160,48,55,생각보다 딱 달라붙고 스판이 많은 편은 아닌 것 같아용 그래도 핏도 예쁘고 끈 조절 되는 게 좋아요~!! 아무 셔츠나 가디건에 입어줘도 다 잘어울려용,Free
iCg9v7rc,상위 10%,24.08.21,아이보리(i),선택안함,정사이즈예요,아주 만족해요,화면과 비슷해요,160,51,55,"개예쁨니다

사세요
저는 흰색 검정 둘다 있는데
이건 어떤 색이 예브다가 아니라 그냥 둘다존예니까
그냥 둘다 사는게 정답입니다

검정은 언더웨어 필요없습니다 그냥 노브라에 해요 옷이 좀탄탄하고 재질이 조금은 두꺼워서 티안남
저는 사실 노브라 신경안써서 그냥 브라 안하고 입습니다",Free
oVaG66Ya,상위 25%,24.08.21,아이보리(i),선택안함,정사이즈예요,아주 만족해요,화면과 비슷해요,164,52,55,왜 이걸 구매 하늕 ㅈ 알겎어요 넘흐 이쁘고 질도 좋고 가디건 색상에 이 화이트가 다 오울리네요 다들 깔별로 구매허세요 최고예요 다들 구매햐꼬옥!!,Free
mzDsjZjk,상위 20%,24.08.20,아이보리(i),선택안함,정사이즈예요,보통이에요,화면과 비슷해요,160,53,55,탄탄하게 잘 잡아주는느낌? 흉통이 작은편은 아닌데도 괜찮았어요 이너티로 잘 입을것같습니다!! 근데 살찌면 배가 쪼일거같은 그런 느낌,Free
lvd4BryJ,,24.08.18,아이보리(i),선택안함,정사이즈예요,아주 만족해요,화면과 비슷해요,157,51,55,"생각보다 굉장히 쫀쫀해서 놀랐어요! 상체가 마른편이 아니어서 조금 타이트하게 느껴지긴 했지만, 그만큼 라인을 잘 잡아줘서 좋았습니다!",Free
dtvqTr38,상위 10%,24.08.17,아이보리(i),선택안함,작아요,보통이에요,화면과 비슷해요,161,52,55,제가 바스트가 있어서 그런지 조금 작아여… 상체가 좀 크시거나 어깨나 바르트 잇으신 분은 참고하세요 약간 마른 분들처럼 저것만 단독으로 입기엔 가슴이 너무 부각되고 말려올라가서 길이도 짧아지는데 안에 받쳐입기는 딱 좋을 것 같아용!!!,Free
CZR31Kjm,상위 15%,24.08.16,아이보리(i),선택안함,정사이즈예요,아주 만족해요,화면과 비슷해요,157,50,55,가성비 최고네용 약간 잠옷같긴 하지만 요즘 스타일이라 가디건 안에 휘뚜루 입을것 같아요 노출은 있는 편이라 속옷 잘입어야되고 누브라 입으면 비칠것 같긴해요,Free
Vqp482nJ,,24.08.13,아이보리(i),선택안함,정사이즈예요,보통이에요,화면과 비슷해요,163,49,55,생각보다 쫀쫀하게 더 달라붙어요 단독으로 입기엔 에바인 듯요 그래도 끈으로 길이 조절할 수 있어서 좋고 예쁩니다 ㅎㅎㅎ,Free
8J8LIc3K,,24.08.10,아이보리(i),선택안함,작아요,아주 만족해요,화면과 비슷해요,170,55,55,생각보다 좀 작아요! 그리고 조금 많이 파여있어서 안에 나시같은 걸 하나 더 입고 입어야할 거 같아서 불편하긴한데 그래도 너무 이뻐서 만족!,Free
mDFSCB30,,24.08.06,아이보리(i),선택안함,정사이즈예요,아주 만족해요,화면과 비슷해요,156,55,55,뱃살공준데 제 뱃살을 더 부각시ㅣ키진 않아서 좋아용 ㅎㅎㅎ 끈조절 되는 게 진짜 장점인듯!! 넘 예쁘고 잘 활용해서 많이 입고 다닐 것 같아용,Free
MzzCLX0w,상위 20%,24.08.05,아이보리(i),선택안함,정사이즈예요,아주 만족해요,화면과 비슷해요,162,60,55,처음 왔을때 옷이 작을 줄 알고 걱정했는데 신축성리 있는 옷이라 쫀쫀하고 어깨끈이 조절 되는 제품리라서 좋았습니다 !! 44부터 55까디 추천드려요 ㅎㅎ,Free
찡닝,상위 10%,24.08.05,아이보리(i),선택안함,정사이즈예요,아주 만족해요,화면과 비슷해요,155,53,66,제가 마음이 빈약해서 그렇지 옷은 정말 예쁘고 짱짱해서 제 뱃살도 감춰주고 좋앙용! 이런류의 옷 처음사보는데 넘넘 맘에 들어용~~~,Free
ruMhkGcA,,24.08.05,아이보리(i),선택안함,정사이즈예요,아주 만족해요,화면과 비슷해요,160,50,55,몸에 정말 핏하게 붙어요! 공복일 때 가장 예쁜 핏이 나오구요. 요고 입는 날은 자동으로 소식하게 될 것 같아요ㅎ 하지만 그만큼 예뻐서 전 완전 만족ㅎㅎ 캡내장이 안되어있는게 조금 아쉽긴하지만(속옷보다는 니플패치를 붙이고 착용하는게 예쁜 핏일 것 같다는 개인적인 의견입니다!) 결과적으로는 만족하는 상품이에요☻,Free
닐롱낼롱,,24.07.28,아이보리(i),선택안함,작아요,아주 만족해요,화면과 비슷해요,158,49,44,레이스달린 나시를 찾고있었는데 리뷰도 많고 평도 좋아서 구매했습니다. 저는 어깨가 넓고 흉통이 좀 있는 편입니다. 끈조절할수있는게 큰 장점같고 누브라 하고 착용했는데 좀 내려와서 자칫하면 누브라가보일거같더라구요. 큰 조절 잘해야할 것같고 그렇게 살집이 있는편은 아닌데 완전 딱맞고 신축성이 좋아서 누구나 잘 입을 수 있을거같아요. 처음봤을땐 진짜 강아지옷같긴한데 짱ㅋ장하게 늘어나요.,Free
chhj27,상위 5%,24.07.18,아이보리(i),선택안함,작아요,아주 만족해요,화면과 비슷해요,158,53,55,"여름용 나시탑 찾다가 디자인도귀엽고 가격도 착해서
구입하게 되었어용~
사이즈는 55반 기준으로 스판있어서 타이트하구요
화이트색상 레이스가 귀엽게되있어용
파임이 생각보다 있어서 가슴크심 분들은 작단느낌
들거같네요 원단이 골지쫀쫀 생각보다ㅜ탄탄해서
가성비 좋아요 코디하기도 편합니당",Free
XqbrDPwP,,24.07.18,아이보리(i),선택안함,정사이즈예요,보통이에요,화면과 비슷해요,160,51,66,"나시는 진짜 필수템 ... 사실 아이보리색 하나 더 있는데 이번에 블랙사면서 재구매했어요 .ㅎㅎㅎ 말다햇져?
볼레로입구 나시입으면 이뻐여 !!!! ㅊ츄천",Free
Mcvh6pnH,,24.07.17,아이보리(i),선택안함,정사이즈예요,아주 만족해요,화면과 비슷해요,160,46,44,"이 가격에 요정도 핏감이면 저는 너무나 만족 ෆ̈ 
다른 나시들 많응데 유독 이 나시가 손이 잨구 가더라구요
가슴 쪽 노출이 좀 있는 편 이긴 합니다!",Free
12ZkP8F0,상위 10%,24.07.15,아이보리,선택안함,정사이즈예요,보통이에요,화면과 비슷해요,164,54,,예쁩니다…. 그냥 예뻐요…😳 활용도가 높아서 어떤 상의에 이너티로 입든 무난하게 잘 어울리는 것 같아요! 근데 입었을 때 꽤 핏하게 잡히는 편이라 바스트가 있으신 분들은 살짝 작다고 느끼실 수도 있을 것 같아요,Free
KyW7rFzM,상위 5%,24.07.15,아이보리(i),선택안함,정사이즈예요,보통이에요,화면과 비슷해요,153,53,33 이하,이 나시는 위에 뭔가 굳이 걸칠 필요 없이 그냥 입어도 예뻐요. 그리고 무엇보다 길이가 조절이 잘 되서 체형에 맞게 입을 수 있고 부유방도 적당히 잘 가려줘요.,Free
OTw4PEQH,,24.07.14,아이보리(i),선택안함,정사이즈예요,보통이에요,화면과 비슷해요,163,59,55,흰색 레이스 나시 찾고 있었는데 레이어드 하기도 좋고 너무 촌스럽지도 않은 그런 나시라서 마음에 들어요! 다음에 다른 색상도 구매하려고 합니다~,Free
CrUjdIc1,,24.07.13,아이보리(i),선택안함,작아요,보통이에요,화면과 비슷해요,160,50,44,"매우핏하지만.. 마르신 분들이 입기엔 예쁠 거 같아요
끈 조절이 가능하지만 전체 총장이 짧아서
위 아래 둘 중에 하나는 가리는 거 포기하셔야해요",Free
fupNq7S1,상위 20%,24.07.13,아이보리(i),선택안함,정사이즈예요,보통이에요,화면과 비슷해요,164,50,55,"워낙 싸게 구매해서 퀄은 딱 그 정도인 거 같지만
디자인이 예뻐서 한 철 입기 좋을 거 같아요 ㅎㅎ
실밥 같은 건 제가 정리하고 입으려구요.",Free
7wryQGL1,,24.07.11,아이보리(i),선택안함,작아요,보통이에요,화면과 비슷해요,160,47,55,저렴한 가격에 크게 기대 안했는데 재질이 탄탄하고 흐물텅하지 않아서 좋아요 근데 생각보다 되게 타이트해요 재질이 얇지않아서 더 타이트한 느낌이 드는 것 같아여,Free
X4C3BkXv,,24.07.10,아이보리(i),선택안함,작아요,보통이에요,화면과 비슷해요,165,57,66,"크롭으로 된 디자인인데
밑단이 물걸 모양으로 돼 있어서 빼입는게 더 이뻐용 기슴부분이 좀 파이긴 했지만 가디건이랑 입을거라서 괜츈합니더! 가격대비 만족해용!",Free
alih**,상위 10%,24.07.10,아이보리(i),선택안함,정사이즈예요,보통이에요,화면과 비슷해요,162,44,44,안에를 어떨게입나 고민했는데 하얀색 브라입고 입는에 최선인거같아요. 쫀쫀하게 달라붙는 나시라서 누브라 붙이고 입으면 모양 다 드러나서 안예뻤구요... 잘비쳐서 흰색빼곤 다비챠요.,Free
c90JnWMR,,24.07.08,블랙(b),선택안함,작아요,아주 만족해요,화면과 비슷해요,162,57,55,가슴이 75C 아니면 80B를 입는데 저보다 크신 분들은 절대 못 입을 것 같아요… 옷 뜯어질 뻔 했지만 어떻게든 입었습니다. 뽕브라는 절대 착용 못 하고 패드 없는 브라렛만 입고 겨우 들어갔어요. 하지만 몸매도 좋아보이고 예상대로의 핏이라 만족합니다!! 다른 색상도 사려구요!,Free
Br23oRLT,,24.07.08,아이보리,선택안함,작아요,아주 만족해요,화면과 비슷해요,155,50,55,"엄청 타이트한데 쫙쫙늘어나서 몸에 챡-달라붙는 그런 재질이네요
어깨끈이 미친듯이 늘어나는데, 끊길까봐 불안했지만 마감이 잘 되어있는 덕분에 괜찮네요
예쁘긴한데, 입고 벗을 땐 힘든 것 같아요 ㅎㅎ 그래도 헐렁해서 다 보이는 것보단 타이트하게 군살까지 잡아주는게 좋은 것 같습니다!!! 잘 입을게용 색감은 화면이랑 똑같습니다~!!",Free
iQ4XsCJ8,,24.07.06,아이보리,선택안함,작아요,보통이에요,화면과 비슷해요,164,55,55,어깨끈 조절할 수 있어서 좋고 몸에 착 달라붙습니다 여름에 살안타 가디건이나 셔츠안에 입으면 페미닌하게 입으려고 샀는데 만족합니당,Free
dkfd****,상위 15%,24.07.06,아이보리(i),선택안함,정사이즈예요,아주 만족해요,화면과 비슷해요,165,52,55,안에 레이어드 해서 입기 좋아요 다만 넥라인이 많이 파죠있어소 유교걸분들은 브라렛같은 별도 나시 필수입니다 허리?배? 부분이 자글자글해서 뱃살 없어보이는 효과도 있어요 ㅎㅎ,Free
rlag****,,24.07.05,블랙,선택안함,정사이즈예요,아주 만족해요,화면과 비슷해요,160,49,44,탄탄한 소재에 허리를 잘 잡아줘서 몸매 짱 좋아보여요 ㅋㅋㅋㅋ 어깨끈 조절할 수 있는게 너무 편하고 좋은 것 같아요!! 조금 파이긴 했지만 어깨끈 조절하면 괜찮아용,Free
C4tqDUgz,,24.07.04,아이보리(i),선택안함,정사이즈예요,보통이에요,화면과 비슷해요,158,53,66,"어깨끈이 가슴부분 바로 위이 달려 있어서 개말라 인간 아니고서는 부유방 부각이 있을 수 밖에 없어요. 그리고 싼 값에 끈조절이 가능하다는 장점이..끈이 너무 안쪽에 달려있어서 장점으로 보이지 않아요. 그냥 그렇고, 장점이 발휘되지 않는 디자인..",Free
7DCSfC0p,,24.07.04,아이보리(i),선택안함,정사이즈예요,아주 만족해요,화면과 비슷해요,155,45,44,"이거 입고 위에 볼레로 가디건 걸쳐 입으면 예뻐요 단독으로만 입어도 예쁠것 같음 
끈조절 가능해서 좋구요
몸에 타이트하게 붙는 편입니다",Free
Qmu0fY4K,상위 15%,24.07.03,아이보리,선택안함,작아요,아주 만족해요,화면과 비슷해요,172,58,55,퀄리티는 저렴한 가격에 비해 좋습니다! 꽤 날씬한 편이라고 생각했는데 키가 있어서 그런지 옷이 좀 작은 느낌입니다.. 약간 속옷같기도함 ㅋㅎㅋㅎ 그래서 단독보다는 이너로 입어야할것 같습니다,Free
jX4NYPaw,상위 10%,24.07.02,아이보리(i),선택안함,작아요,아주 만족해요,화면과 비슷해요,165,49,44,최근 산 나시 중에 제일 맘에 들어요 좀 작아서 허리가 따악 맞아요 통통하신 분들은 힘들것 같아여 몸매 진짜 좋아보이고 끈 조절도 가능해서 좋아요,Free
idE0gr5y,,24.07.02,아이보리(i),선택안함,정사이즈예요,아주 만족해요,화면과 비슷해요,160,55,55,진짜 쫀쫀해서 너무 잘 입고 있습니다! 레이스 부분도 예쁘고 탄탄해서 몸통도 잘 잡아줍니다. 저보다 마른 분이 입으면 더 예쁠 것 같고 갑갑한 거 싫어하시는 분들은 불편하실 수도 있을 것 같아요,Free
3XnlScA6,,24.06.30,아이보리(i),선택안함,정사이즈예요,아주 만족해요,화면과 비슷해요,158,48,55,가장 마음에 드는 점은 어깨끈 조절할 수 있다는 거 같아요! 그리고 숙여도 헐렁한 느낌 없이 몸통에 잘 달라붙어있어서 편하게 입을 수 있습니당,Free
zPHekO0C,,24.06.28,아이보리(i),선택안함,작아요,아주 만족해요,화면과 비슷해요,164,54,55,나시 엄청 쫀쫀해요 몸에 딱맞게 핏됩니다. 근데 더 예쁘게 입으려면 살을 좀 빼야 할것같아요..ㅎㅎ 지금은 배에 힘주느라 좀 힘드네요,Free
JnyS6m1O,,24.06.27,아이보리(i),선택안함,정사이즈예요,아주 만족해요,화면과 비슷해요,165,48,44,가슴 작으신 분들이 입으면 여리여리 폭발이에요 가디건이나 셔츠랑 입기도 좋고 단독으로 입어도 예뻐요!! 재질은 손빨래 해야할 거 같아요!,Free
Oa4s2AJo,,24.06.26,아이보리(i),선택안함,정사이즈예요,보통이에요,화면과 비슷해요,155,50,55,디자인은 이뻐요! 밑단도 레이스에 있어서 귀엽 ㅋㅋㅋ 근데 가슴이 조금 있는 사람이 입으니 좀 야한느낌들어서ㅠㅠㅜ 마른 체형이 입으면 러블리할즛,Free
gxvmCGan,,24.06.26,아이보리(i),선택안함,작아요,보통이에요,화면과 비슷해요,,,,살짝 브래지어 … ㅎㅎ 가 상상되는 디자인이어서 고민하다가 구매했는데 후회 없습니다! 여름철에 잘 입고 다닐 것 같습니다 ~! 끈 부분이 얇아서 살짝 아쉽긴 합니다 ㅠ ㅠ,Free
SdTcgpEN,,24.06.25,아이보리(i),선택안함,정사이즈예요,보통이에요,화면과 비슷해요,160,45,55,끈조절이 있어서 노출 별로 안하고 싶은 사람들한테 좋은 것 같아요. 그리고 레이스 디테일이 너무 예뻐요. 이 가격이면 완전 혜자 같아요!!,Free
Msqch9we,,24.06.25,아이보리(i),선택안함,정사이즈예요,아주 만족해요,화면과 비슷해요,160,55,55,실밥만 정리하면 아주 굿 가슴이 있다보니 조이지않을까 했는데 신축성 완전 좋아요 위에 가디건 매치해서 입으면 너무 이뻐서 요즘 자주 입어요,Free
bbopi,,24.06.24,아이보리(i),선택안함,정사이즈예요,보통이에요,화면과 비슷해요,160,45,44,실밥이 좀 많구.. 입다보면 점점 내려와서 수시로 앞 부분을 여며줘야하지만 마음에 들어용 ㅎㅎ 스판기가 좋아서 잘 늘어날거같은데 늘어나면 또 살겁니당 ㅎ 단종시키지 말아주세요 ㅠ!!,Free
j665*****,,24.06.22,아이보리(i),선택안함,작아요,아주 만족해요,화면과 비슷해요,,,,개짱짱하고 화이트!!!예요 오래 입을듯..이뻐요 바스트 있으면 좀 갑갑할 수도 있우에요ㅍㅠㅠ끈 조절해서 입을 수 있어요 굳이에오 ❗️,Free
qo8rFFaJ,,24.06.22,아이보리(i),선택안함,작아요,보통이에요,화면과 비슷해요,157,56,55,"나시 자체는 예뻐요 근데 생각보다 핏이 딱 맞고 제가 바스트가 있어서 절대로 여리해보이지 않아요 ㅠ 오히려 가슴 부분이 늘어나서 속옷 입은 느낌...? 마르신 분들이 입으면 여리여리 할 것 같아용..,,",Free
OmUwRUAu,,24.06.20,아이보리(i),선택안함,정사이즈예요,아주 만족해요,화면과 비슷해요,161,47,55,짱맘에들어용 진짜 짱!!! 비슷한 나시 사고 실패한 적 많은데 끈 조절되고 여러모로 넘 예버용 길이도 적당하고 밑단 셔링이 별론가 싶었는데 나름 예쁘네요,Free
Ggw7q19c,상위 20%,24.06.19,아이보리,선택안함,정사이즈예요,보통이에요,화면과 비슷해요,172,70,66,사진이랑 똑같아요! 길이 조절 가능해서 마음에 들고요 가슴 부분이 생각보다 더 파여서 안에 이너나시를 또 입고 입어야 잘 다닐수있을거같아용 ㅠㅠ,Free
FIP4bRIY,,24.06.18,아이보리(i),선택안함,작아요,보통이에요,화면과 비슷해요,156,46,55,부유방 잘 가려줍니다 조절끈도 있어서 좋아요~ 근데 제가 흉통이 넓어서 그런지 살짝 쪼여요…ㅎ 돼지의 숙명이라 받아들이고 입겠습니다…옷 자체는 귀엽고 이뻐요! 가격대비 퀄리티도 괜찮습니다,Free
eb7urRI1,상위 30%,24.06.16,핑크,선택안함,정사이즈예요,아주 만족해요,화면과 비슷해요,156,45,44,"리뷰대로 생각보다 진짜 짱짱해요
이 디자인에 가격, 퀄리티까지 만족합니다 ㅎㅎ
다만 .. 유교걸인 저는 너무 깊게 파여서 한 번도 입고 나가지 못 했어요 … 🥺
그래도 예뻐요 ㅎㅎ",Free
jang******,,24.06.15,아이보리(i),선택안함,작아요,보통이에요,화면과 비슷해요,163,48,44,"가디건 안에 받쳐있었는데 모양도 괜찮고 맘에 듭니다!
다만 신축성이 생각보다 너무 강해요ㅋㅋㅋ 입다보면 늘어나니까 오히려 좋아인가 하고있습니다~",Free
8LQCaOF0,,24.06.14,핑크,선택안함,정사이즈예요,보통이에요,화면과 비슷해요,163,48,44,"컬러 포인트가 될만한 나시를 찾고 있었는데 디자인이랑 색감 모두 마음에 들어서 구매했어요!
몸에 완전 핏하게 붙는 느낌인데 오히려 들뜸이 없어서 전 좋았습니다:)
레이스 까슬거림 없고 어깨끈 조절 가능한게 넘 조아요",Free
og33ExQ2,,24.06.13,아이보리,선택안함,작아요,보통이에요,화면과 비슷해요,165,50,44,"다 좋은데 생각보다 많아 파여있고, 끈이 좀 부실합니다 ㅠㅠ 곧 금방 끊어질 것 같아용 ㅜ 하지만 이 가격에 휘뚜루 마뚜루 입긴 조을거가타요 잘 입으께요오",Free
CH9GIxOb,,24.06.13,아이보리(i),선택안함,작아요,보통이에요,화면과 비슷해요,166,55,55,"사이즈는 조금 작아서 끼긴 하지만
(바스트가 있으신 분들에게는 굉장히 부담스러울 만한 이너..)
어깨 끈 조절이 가능하다는 점이 매우 좋아요",Free
uiW3SBLU,,24.06.12,아이보리,선택안함,정사이즈예요,아주 만족해요,화면과 비슷해요,166,51,55,가디건 안에 입으려고 구매했어요 비슷한 디자인 있는데 파임이 심해서 끈 조절이 가능한 걸로 다시 구매했어요 원하는 만큼 올리고 내려입을 수 있어서 좋아요,Free
mv4tqpbc,,24.06.11,아이보리,선택안함,정사이즈예요,아주 만족해요,화면과 비슷해요,160,52,55,몸에 착 붙여서 넘 예뻐요! 끈 길이 조절 가능해서 더 좋습니다! 가디건이랑 같이 입으려고 샀는데 조합도 넘 예쁘고 진짜 만족해요 ㅠㅠ !!,Free
syp0***,,24.06.11,아이보리,선택안함,정사이즈예요,보통이에요,화면과 비슷해요,167,58,55,안에 입은건데 무난무난 괜찮아요 레이스가 생각보다 정교해서 싼티도 그닥 안 나고 예뻐여 부유방도 부각되지 않고 길이 조절이 짧다해서 걱정했는데 전 적당했습니다!,Free
izMET2mf,,24.06.09,블랙,선택안함,정사이즈예요,아주 만족해요,화면과 비슷해요,161,54,66,소재가 탄탄해서 몸매라인 잡아주네요~ 끈 퀄리티도 좋아요~~ 속옷 같을까봐 걱정했는데 속옷 같지않아요! 자켓이나 셔츠 속에 입으면 딱일거같아요^^,Free
CPct2JnV,,24.06.08,블랙(b),선택안함,정사이즈예요,보통이에요,화면과 비슷해요,156,45,44,끈조절 기능 있는거 좋아요 근데 조금 높게 하려니 그 삼각형으류 가슴 모양 잡혀있는게 너무 가슴 1/2 지점에 높이 올라와있어서 먼가 핏이 부자연스럽ㅎ.. 골지원단이라 체형보완은 잘 되구 조아요,Free
NQYFM2ol,,24.06.07,아이보리,선택안함,작아요,보통이에요,화면과 비슷해요,171,53,55,화면과 비슷하고 화이트 색상이에요 생각보다 흉통이 조여서 흉통 좁으신 분만 추천드려요 입었을 때 작다는 느낌을 많이 받았거든요! 근데 잘 늘어나서 추턴드립니다,Free
VPCNiInp,,24.06.06,블랙(b),선택안함,정사이즈예요,보통이에요,화면과 비슷해요,167,59,66,얇은 셔츠 속에 잘 입어요! 레이스 부분 예쁘고 길이는 저한테 살짝 짧은 느낌은 있어요 스트레이트 체형이라 조금 긴게 예뻐서 요것만 아쉽고 다 좋어용,Free
Nyahooo,상위 5%,24.06.04,블랙,선택안함,정사이즈예요,별로예요,화면과 비슷해요,165,53,44,정말 예쁜데 마감처리가 잘 안됐는지 여기저기 자꾸 끊어지고 하루만에 끈 한쪽 떨어졋지만 그냥 수선해서 입엇어용 예쁘기는 진심 넘 예쁘고 좀더 날씬해보이게 해줘서 좋습니다,Free
IyTvhBA8,상위 25%,24.06.03,아이보리(i),선택안함,정사이즈예요,아주 만족해요,화면과 비슷해요,162,52,55,끈 조절 되는게 너무 좋았어요 재질도 탄탄해서 몸도 잘 잡아주고 위에 가디건이나 셔츠랑 같이 매치해서 여기저기 잘 입고다닐 것 같아용,Free
eofgg3NA,상위 30%,24.06.03,아이보리(i),선택안함,작아요,보통이에요,화면과 비슷해요,163,60,66,"이뻐요 
근데 엄청 작아요
스판이 좋아서 들어는 가지만
다이어트를 해도 이게 이쁘게 맞을려면 10키로는 빼야할거같은... 옷은 죄가 없죠 
가격이 싸서 실밥정리나 디테일은 좀 떨어져요",Free
rhzqNUXY,상위 30%,24.06.03,아이보리(i),선택안함,작아요,보통이에요,화면과 비슷해요,166,54,55,"일단 끈 조절하는 부분이 있어서 좋아요
다만 가슴둘레가 좀 끼어서 부유방쪽에 살짝 자국나요ㅠ마르신 분들이 입으면 여리여리 할거같아요
노출이 부담스러우면 안에 탑 하나 입고 입어도 이쁠거같아요! 실밥 정리는 잘 안되어있었어요ㅜ",Free
hxTBeBqi,상위 20%,24.06.02,아이보리(i),선택안함,작아요,보통이에요,화면과 비슷해요,164,56,55,"옷은 예뻐여 
상체가 마르거나 통이 작으신 분들이입어야 더 예쁠것 같아영 ㅠㅠ 저는 이너로 입을까 해서 데리고 갑니당
보풀이나 실밥 정리가 필요해오",Free
WTTIJ9XD,,24.05.29,아이보리(i),선택안함,정사이즈예요,보통이에요,화면과 비슷해요,164,50,44,직진배송인데 주문폭주라 좀 지연됐고 받았는데 이상한 노란색 물든 거 같은 이염이 있네요... 일단 빨리 입어야 돼서 환불이나 교환은 안 받을 건데 속상하네여... 다음부턴 검수 잘 하고 보내주세요 ㅠ,Free
cVwdkljy,,24.05.29,블랙(b),선택안함,정사이즈예요,아주 만족해요,화면과 비슷해요,163,58,55,"이 가격에 이 정도 퀄리티 뒤에 끈 조절하는 거까지 있다니
걍 이런 레이스 나시 찾으시는 분들 이거 사세요 추천합니두
밑단도 신경 쓴 거 같아요",Free
monmin,,24.05.27,아이보리(i),선택안함,정사이즈예요,아주 만족해요,화면과 비슷해요,160,48,33 이하,옷이 엄청 짱짱해서 몸에 딱 달라붙어요 기장이 살짝 애매해서 말려올라갈 때도 있긴 한데 예뻐서 만족합니다 다른 색상도 구매하고 싶어요,Free
DxF7GJXO,,24.05.25,아이보리,선택안함,정사이즈예요,보통이에요,화면과 비슷해요,164,53,44,"길이는 딱 배 가려주고 색상도 생각했던 화이트랑 같습니다 이런류의 나시가 끈이 금방끊어진다는 후기를 많이 봤는데 잘 안입어서 그런지 아직은 멀쩡… 끈이 정말 값싸보이는 반질반질 재질이긴 함
가운데 레이스가 귀엽다고 생각했는데 이거입고 찍힌사진보니 속옷입은것 같아보임 잘올려입으세여",Free
G6eai7WQ,,24.05.22,아이보리(i),선택안함,작아요,보통이에요,화면과 비슷해요,,,,옷이.. 좀 작아요.... 흉통 큰 사람은 옷이 힘들어합니다..ㅎㅎ 그래도 신축성 좋고 레이스 포인트가 귀여운 기본에 충실한 옷이네요,Free
