아이디,리뷰어 등급,작성 날짜,옵션1,옵션2,상품 사이즈,퀄리티,색감,키,몸무게,사이즈,리뷰내용,제품_사이즈
EWXDHYcH,,23.10.23,라이트옐로우,,정사이즈예요,아주 만족해요,화면과 비슷해요,,,,"피부톤이 어둡고 가을 웜톤이라 연노랑 색상이 동동 뜰까봐 걱정했는데, 생각보다 화사해보여요! 살 완전 많은뎅 사이즈 여유롭고 핏도 너무 벙벙하지 않아서 이쁨니다;)

다만 한쪽 겨드랑이 박음질이 터진상태로 왔어요,,,,이쁘니까 바느질해서 입을거지만,,,당황했다는점,,,",Free
J7mF7efU,,23.09.27,블루그레이,,생각보다 커요,아주 만족해요,화면과 비슷해요,163,53,55,"처음봤을땐 잉?? 이게 왜 인기가 많았지? 싶었는데 입어보니까 넘나 이뻐요!!
어깨도 약간 오버핏인데 입으니 여리해보이고
엉덩이도 덮어주는 기장이라 너무 맘에 들어요!
다른색도 사고싶어요",Free
AFJXuOL9,,23.09.02,베이지,FREE,정사이즈예요,보통이에요,화면과 비슷해요,170,57,55,"저번에 그레이 사봤는데 핏이 마음에 들어서 하나 더 구매했어요. 이 셔츠는 옷 안이 넣어입기보다는 빼서 입었을때 더 예쁜 것 같아요 

제가 웜톤이라 이번에는 베이지로 구매했는데 생각보다 베이지 색이 덜 보여서 더 기본 셔츠로 잘 입을 수 있겠다 생각했어요 마음에 들어요:)",Free
hs4r**,상위 10%,24.10.25,라이트옐로우,,정사이즈예요,아주 만족해요,화면과 비슷해요,155,44,44,"은은한 연노랑 파스텔색이라 진하지 않아서 예뻐요
가볍게 걸칠 오버핏 셔츠 찾고있었는데 딱 원하던 셔츠예요
두께도 과하게 얇지도 두껍지도 않고 면도 적당히 탄탄해서 만족해요",Free
gpfl******,상위 5%,24.03.27,블루그레이,,정사이즈예요,아주 만족해요,화면보다 어두워요,161,51,44,이런 하늘색이랑 회색 적절히 섞인 색의 셔츠 사고 싶어서 찾아보다가 여기꺼가 제일 퀄리티도 좋아보이고 색도 차분해보이고 예쁜거 같아서 구매했는데 실제로 보니까 퀄리티도 더 좋은거 같아서 넘 만족스러움요 ㅋ 근데 사진보다 실물이 살짝 더 어두운 느낌?,Free
NiqHCZqE,상위 15%,24.02.15,베이지,,생각보다 커요,아주 만족해요,화면보다 밝아요,164,44,55,"98도씨 첨사봤는데 진짜 좋네요.. 포장에 정성이 들어간 느낌?? 옷도 탄탄한 느낌이라 다음에도 사고 싶은데 봄웜인 저에게는 잘맞는 색상이 없어서 속상ㅜㅜㅜ 품은 좀 큰데 간지나서 좋아요ㅋㅋㅋ 여름에 겉옷으로 입기도 좋을 것같아욤
소매는 생각보다 안길고 몸통이 크고 길어요!",Free
knRavgJf,,24.12.25,라이트옐로우,,생각보다 커요,보통이에요,화면과 비슷해요,165,54,55,"정정합니다
오늘 꺼내입어봤는데 옷박음질이 다띁어져있네요
이미 입어서 반품이 안되겠지요 
///박시한 스타일입니다..
레몬보다 약간더 옅은 노랑이구요..
봄되면 입으려고요~.
겨울에 춥네요.",Free
8WAcATul,상위 10%,23.03.13,블루그레이,,생각보다 커요,아주 만족해요,화면과 비슷해요,161,50,55,"면 탄탄하고 좋아요. 단추 디테일도 맘에 들어요.
소매에 단추 두 개 있으니까 접어 입을 때 답답하게 안 말리고 시원시원하게 말려서 좋습니당.
생각보다 큰 감이 있긴해요. 살짝 박시한 느낌.
저는 어깡이라 단추 다 잠그면 완전 어깨 부각되긴 하더라구요.
면이 탄탄한 셔츠는 아무래도 핏이랄까 각이 좀 잡히다보니 저 같은 어깡들은 항상 고민이긴 할듯요...ㅠ
바스락 거리는 질감은 아니구요. 부드럽고 탄탄해요. 입으면 기분 좋아요. 착용감도 편하고.
다른 색도 사고싶네요 :)",Free
d68jjHg0,상위 15%,22.09.29,화이트,,생각보다 커요,아주 만족해요,화면과 비슷해요,163,60,55,무난한 화이트 셔츠 찾다가 박시핏으로 입고싶어서 찾아보던 중에 발견하자마자 바로 구매했어요!! 박시핏 원했어서 아주 만족해용ㅎㅎ 면도 좋고 넘 예쁩니당ㅎㅎ 면이 약간 도톰해서 지금 입기 딱 좋은 옷이에요!,Free
ekdlsl,상위 10%,24.09.01,화이트,,생각보다 커요,아주 만족해요,화면과 비슷해요,162,50,44,"워낙 가성비템이라 취직 전부터 야금야금 쟁이던 앤데 역시 개굿이네요.
갠적으로 바스락거리는 소재보단 옥스포드 소재를 선호해서 그런지 소재도 맘에들고 핏도 넉넉헤서 좋습니다.

가장 좋은 건, 팔 소매에 단추가 2개인거,,, 일할 때 별 생각없이 팔 둘둘 걷어서 작업하는데, 이거입다가 다른 셔츠 입으면 답답해요
갠적으로 색깔 알록달록 더 만들어주셨으면,,",Free
M0pTIfB8,,22.09.28,화이트,,생각보다 커요,아주 만족해요,화면보다 어두워요,,,,역시 구팔 프로젝트는 믿사! 세번째 구매중인 셔츠에요 개인적으로는 바스락 거리는 재질을 안좋아하는데 핏이나 재질이나 색감이 이 셔츠가 제일 인 거 같아요 앞으로 계속 다른 색으로 셔츠 모을 예정^^,Free
lhk9*****,,24.05.24,라이트옐로우,,정사이즈예요,아주 만족해요,화면과 비슷해요,160,55,55,"배송이 엄청 엄청 엄청 느린데 그래도 예쁜건 맞네요..
오버핏이고 색도 파스텔톤의 노란색이라 너무 만족합니다ㅠㅠ 배송이 너무 느린 탓에 몇번 못입을 것같긴해요 너무 더워성..
그래도 엉덩이 다 가려주는 길이에
소재도 고급져서 좋아여",Free
a0p008q2,,24.05.09,블루그레이,,생각보다 커요,별로예요,화면과 비슷해요,166,55,55,"결론적으로 옷 자체는 마음에 들어요! 동생이 맘에 든다해서 그거 동생 줘서 저는 새로 시킬 겁니다…근데 퀄이…실밥 튀어나온 것들은 뭐 자르면 되니깐 별로 신경 안 쓰는데…
사진이 불분명하게 나온 것 같긴한데 단추구멍 실밥이 얼기설기 겁나 많아서 단추 채우면 걸리고 난리난리~ 어차피 타는 거 방지, 여름 아우터로 입으려고 잠궈입을 일은 많이 없을 것 같아서 괜찮지만 육안으로 자세히 보기에 너무 싼티나니깐 그 부분이 아쉽,,, 3만원 짜리라도 마감은 제대로 해쥬셔야죠ㅠ",Free
GctoK3GJ,상위 5%,24.04.29,스카이블루,,정사이즈예요,보통이에요,화면과 비슷해요,,,,"셔츠 되게 부드럽고 괜찮아요
배송이 너무너무 느렸을뿐 ㅠ 배송만 빨리 온다면 다른 색들도 추가로 주문하고 싶어요 아 그리고 저는 좀 박시하게 입고 싶었는데 키가 있어서인지라 엄청 박시하다는 느낌은 못받았습니다",Free
cYQL2T4n,,24.04.08,라이트옐로우,,생각보다 커요,아주 만족해요,화면보다 밝아요,160,50,44,생각보다 박시한 핏에 색감도 밖에서 보니까 그렇게 튀지 않는 상아색이지만 그것도 그것대로 이쁘니까 괜찮습니당..😚 재질은 탄탄한 면이라서 아우터처럼 입어도 괜찮고 다 잠가서 바지 안에 넣어입어도 무난하게 이쁠 것같아용 근데 품이 좀 커서 바지 안에 이쁘게 들어갈지는 잘 모르겠습니당..요령을 잘 터득해서 넣어야 할 것 같아요..!,Free
0owdwQPJ,상위 25%,24.03.05,라이트옐로우,,생각보다 커요,아주 만족해요,화면과 비슷해요,158,52,55,"저는 더 밝은 노란인 줄 알았는데 파스텔인 개나리색?
너무 마음에 들어요 ~~ 
옷은 확실히 오버핏이라 크긴 한데 큰데로 스타일이 나오네요 ^^
박음질 상태도 괜찮고 단추도 완전 흰색도 아니고
살짝 반짝하면서 노란끼가 도는?
잘 입을게요 !",Free
3e0W0qR6,상위 25%,24.02.29,블루그레이,,생각보다 커요,보통이에요,화면과 비슷해요,165,55,55,"실착샷 귀찮아서 대충 색감정도만 보여드리려고 찍었어요
화면이랑 비슷한 블루그레이고
너무 크다는 후기 많았는데 저는 적당히 오버핏이라서 좋았어요
재질 생각보다 탄탄하고 잘 구겨짐 (봄가을용)",Free
PUeIukCA,,24.02.16,스카이블루,,생각보다 커요,아주 만족해요,화면과 비슷해요,160,53,55,"예전에 블루그레이 사고 이번에는 스카이블루 사봤어요!
마냥 얇지는 않아서 딱 봄가을에는 아우터용, 겨울에는 이너용으로 완벽해요 근데 아우터로 괜찮을 정****너로는 오버핏으로 나와요 그래도 예뻐요",Free
zCqTYLvB,상위 25%,24.02.13,블루그레이,,생각보다 커요,아주 만족해요,화면과 비슷해요,165,62,66,한 2년 동안 잘 입다가 작년 10월말 쯤에 잃어버리고 고민하다 재구매했어용! 퀄리티 쇼핑몰 셔츠중에 감히 1등이라고 생각합니다!(색감 포함) 저는 더위를 많이 타서 봄가을에 반팔입고 편하게 걸치는데 오버핏이라 단추 잠가서 입는 것보다 열고 입는 게 더 예쁘다고 생각해용 다른 컬러는 안봐서 잘 모르겠는데 본인은 봄 라이트-소프트에 가까워서 같은 컬러로 재구매 했습니당,Free
62B1XzQL,상위 20%,23.04.10,블루그레이,,생각보다 커요,아주 만족해요,화면과 비슷해요,160,57,66,"소재가 좋아요 약간 시큼한 향이
나긴하지만 소매 롤링해서 입으면 이쁠 것 같아요
길이가 생각보다 길더라구요
색깔은 딱 기본같고 사람들이 많이 사는 이유를 알것같아요",Free
tDnFBlQh,,22.10.06,스카이블루,,생각보다 커요,보통이에요,화면과 비슷해요,163,55,55,"생각보다 전체적으로 좀 더 큽니다!
하지만 핏이 너무 예뻐요! 빼입어도, 넣어입어도 이쁨ㅎㅎ
재질도 무난무난 괜찮은데, 단추부분 마감이 아쉬워요ㅠㅠ",Free
wml4CckG,,22.10.06,라벤더,,생각보다 커요,아주 만족해요,화면과 비슷해요,167,59,66,색 예뻐요! 제가 찍은 사진보다 더 뚜렷한 색감이에요! 조금 뻣뻣한 재질인데 생각보다 품이 컸어요! 가을에 겉에 걸치는 용도로 잘 입을 것 같아요!,Free
I0OSL46Q,,22.09.26,라이트옐로우,,생각보다 커요,아주 만족해요,화면과 비슷해요,163,55,55,"보들보들 입으면 잠 올정도로 감이 좋음
생각보다 크고 두꺼워서 포멀한 핏은 안나옴
거의 아우터수준의 오버핏
색감 좋음
근데 사진보다는 옅은 느낌",Free
rH21XX1A,,22.09.20,화이트,,생각보다 커요,아주 만족해요,화면과 비슷해요,160,52,55,재질도 탄탄하고 좋아요! 다만 화이트보다는 살짝 아이보리가 섞여있어요! 그리고 생각보다 훨씬 커서 놀랬지만 그래도 카라 크기나 핏감 모두 예쁜 것 같습니다 :),Free
HQF8ehYH,,24.11.27,베이지,,정사이즈예요,아주 만족해요,화면과 비슷해요,,,,"안에 입기도 좋고 위에 걸쳐 입기도 좋아서 시리즈별, 컬러별로 하나씩 쟁이고 있네요 ㅋㅋ건조기 안하고 탁탁 펴서 널면 주름도 많이 안 생기고 좋아요!",Free
B7Qgqw3I,상위 25%,24.10.08,블루그레이,,정사이즈예요,아주 만족해요,화면보다 어두워요,173,55,66,더 하늘색은 것을 기대했는데 생각보다 어두운색이라 깜짝놀랐어요..! 그냥 회색인것같아요 그래도 색감은 이뻐서 입으랴구요! 질도 좋아보이고 적당히 루즈핏이예요,Free
UQB2BMxf,,24.10.06,스카이블루,,생각보다 커요,보통이에요,화면보다 밝아요,160,60,55,"저는 좀더 진한 블루인줄 알았는데 연블루였네요! 파스텔 느낌... 하지만 저와 잘 어울려서 만족합니다.
핏은 오버핏이라서 자칫하면 부해보이는 것 같기도 하고...",Free
dWMWxdQu,상위 10%,24.05.11,베이지,,정사이즈예요,보통이에요,화면과 비슷해요,163,60,55,색이 맘에 들어서 구매했어요~ 화면과 비슷하고 채도가 낮은 베이지라 쿨톤이지만 괜찮아요 두껍지않아서 여름 외투로도 입기좋겠어요,Free
3fmSXng0,,24.01.15,스카이블루,,생각보다 커요,아주 만족해요,화면과 비슷해요,170,52,55,"색상도 이쁘고 재질도 탄탄해서 좋아요!
172/54기준 엄청 널널한 사이즈였고 품이 컸어요! 오버핏으로 편하게 입기 좋을것같아요",Free
붐붐이,상위 20%,24.03.28,라이트옐로우,,생각보다 커요,보통이에요,화면과 비슷해요,161,59,66,"폴로 옥스포드 느낌을 기대했는데 그정도는 아니고, 그냥 이가격대 옥스포드 느낌입니다! 가격이 저렴하니까 당연한거겠죠..
그리고 전 어깨가 넓은편인데 이 셔츠를 입으니 더 넓어보였어요 ㅠ.ㅠ ... 이건 뭐 제 체형의 문제니까요... 봄에 종종 입어보겠습니다 잘입을게요",Free
슝늉,상위 10%,23.10.25,블루그레이,FREE,정사이즈예요,아주 만족해요,화면과 비슷해요,170,66,66,품절이어서 재입고 알림 신청해뒀다가 입고 되자마자 주문했어요!! 역시 기대했던 만큼 색감이나 핏이나 야무지네유... 딱 원했던 채도 낮은 블루그레이 색상이라 너무 좋아요! 만족합니다 ㅠㅠ,Free
Ri6lzOph,상위 15%,23.10.05,블루그레이,,정사이즈예요,보통이에요,화면과 비슷해요,165,59,66,편하게 출근룩으로 입으려고 샀어요 색상은 완전 마음에 들어요 자꾸 손이 가게 되더라구요! 길이도 적당히 엉덩이를 덮을만큼의 길이이고 다만 핏이 어벙벙한 느낌 살찍 있어요 그래도 전체적으로 마음에 듭니다!!,Free
밍더,상위 1%,23.09.06,스카이블루,FREE,생각보다 커요,아주 만족해요,화면과 비슷해요,163,40,44,재질도 탄탄하고 퀄리티도 가격대비 만족스러워요 배송도 빨라서 만족스러워요 98도씨 제품은 항상 믿고 구매하는 것 같아요 색별로 쟁여둬도 괜찮을 것 같아요 재질이 가장 만족스러워요 잘 입을게용,Free
TLRf3xKQ,,23.08.30,블루그레이,FREE,정사이즈예요,아주 만족해요,화면보다 어두워요,172,50,55,몇년 전부터 봐뒀는데 이런저런 말이 많아서 포기하다가 결국 샀어요 옥스포드 셔츠를 처음 사보는 입장에서 퀄리티 꽤 좋고 보세옷 치고 낮지 않은 가격값은 한다고 생각해요 블루그레이 색인데 생각보다 푸른빛이 아주 약간만 나고 그레이에 가까워요 여름쿨뮤트-라이트 그레이시가 베스트인 분한테 찰떡일 색상입니다!,Free
grCHugmi,,23.04.14,블루그레이,,생각보다 커요,보통이에요,화면보다 어두워요,160,49,55,"아무리 98도씨 베스트템이어도 보세는 보세네요..마감 처리가 삐뚤삐뚤하고, 단추 주변 마감도 아쉬워요. 셔츠가 살짝만 어디 닿아도 다 구겨지는 재질이네요. 색감도 애매하게 탁해서 시원해보인다는 느낌은 안듦 싼 가격에 옥스퍼드 셔츠 얻고싶다면 추천하는 정도",Free
m76CPLsC,상위 25%,23.04.10,화이트,,생각보다 커요,아주 만족해요,화면과 비슷해요,161,67,66,예전에 블루톤으로 사고 만족해서 화이트로 한 번 더 구매해봅니다! 핏은 오버핏 느낌으로 나서 뒷부분은 빼서 입는게 예쁜 것 같아요! 화이트가 진짜 깨!끗! 한 화이트라서 안더러워지게 잘 입어야할듯 ㅋㅋㅋ 소매는 접어입는게 예쁩니당,Free
jH60ELcL,상위 20%,23.04.09,화이트,,생각보다 커요,아주 만족해요,화면보다 밝아요,159,56,66,"생각보다 구김이 잘 가도 그게 또 자연스러움이지~하고 입어요 빨래하고 건조기 안할때는 세게 털어서 말리면 예쁜 구김이 생기는 편!! 여기저기 매치하기에도 편하고 덩치가 있는데 여리여리하게 보인다는 장점~
스카이그레이? 색도 예전부터 입고 있었는데 그것도 정말 맨날입는데..베이지나 다른 무난한 색도 또 사려구욤",Free
ImIFVzbS,,23.04.04,블루그레이,,정사이즈예요,아주 만족해요,화면과 비슷해요,165,55,66,재질 탄탄하게 좋고 이너 아우터 다 가능한 적당한 두께입니다. 넥부분 각도 잘 잡혀 흐물거림 없습니다. 어깨선이 좀 넓게 빠졌는데 그래서 세미 오버핏으로 입기 좋아요. 색상은 포크그레이는 사진 보다 푸른색이 조금 적고 회색에 가깝습니다.,Free
zFCDR5re,,23.04.03,블루그레이,,생각보다 커요,보통이에요,화면과 비슷해요,160,52,44,역시 셔츠 재질 특성 상 주름 잘 생기는 건 어쩔 수 없네요! 생각보다 품이 큰 건지 길이가 긴 건지 둘 다인지 ㅎ 꺼내서 입으면 참 예쁜데 바지 넣어입으면 어정쩡해요ㅠ 그래도 색이 오묘해서 예쁘네요,Free
IhJ7sSZ5,,23.03.21,화이트,,생각보다 커요,아주 만족해요,화면과 비슷해요,164,49,55,"옥스포드 셔츠는 처음 사보는 거였는데 생각보다 품이 커서 조금 놀랐어요. 박음질이나 단추 같은 것들은 깔끔하게 정돈되어 있었어요. 청바지, 슬랙스 등 아무데나 매치해도 예쁜 아이템입니다.",Free
wJADl54W,,23.02.25,블루그레이,,정사이즈예요,보통이에요,화면과 비슷해요,160,56,55,9일 만에 왔어요 너무 밝은 건 싫은데 또 어두운 건 칙칙해서 블루그레이로 골랐어요 단독으로 입기엔 오버핏이라 좀 어벙?해보이고 여름에 들고 다니면서 에어컨 바람 추울 때 걸치려고 샀는데 딱 좋은 것 같아요 슬랙스에 입으면 잘 어울릴 것 같아요~,Free
cISk50wm,상위 25%,23.02.01,스카이블루,,생각보다 커요,아주 만족해요,화면과 비슷해요,164,61,55,기본템 하나 장만하면 잘 입을 것 같아서 사보았습니다! 제 체형에는 살짝 부해보이긴 한데 단추를 잠그는 것보다 안에 이너티셔츠 입고 다 풀어서 입는 편이 더 낫더라고요! 봄이나 가을에 자주 꺼내 입을 것 같습니당,Free
7kuHx18v,,22.12.17,화이트,,정사이즈예요,아주 만족해요,화면과 비슷해요,160,60,55,"흰색 남방이 급하게 필요해서 직진배송으로 찾아봤는데 
별로 맘에 드는 게 없고,, 집에 있던 98도씨 옥스포드 남방이 제일 좋은데 이건 직진배송이 아니고해서ㅠㅠ 고민많이 하다 결국에는 시켰는디, 아니 이게 웬,, 주문한 담날 바로왔어요
질 좋고 핏 좋고 배송도 완벽하요 ♡♡♡",Free
JHqafhcp,상위 20%,22.12.13,화이트,,정사이즈예요,아주 만족해요,화면과 비슷해요,159,52,55,딱 기본 셔츠인 오버핏이구요 촤르르르아니고 딱 핏잡히는 오버핏 셔츠에용 화이트컬러라 아무곳에 어울리고 딱맞게 입으시려면 좀큰거같네융 재질은 가을겨울봄까지 가능할거같습니다용 재질 조아용,Free
5d7kps0c,,22.12.09,화이트,,정사이즈예요,보통이에요,화면과 비슷해요,158,45,44,오염이 묻어오지도 않았고 소재도 좋은 거 같아요 ! 8만장이나 돌파했다고 해서 샀는데 괜찮은 거 같아요 다음에는 하늘 색 계열로 사보려고요! 체형이 어깨가 넓은 편이 아닌데 핏이 예뻐요,Free
7KoGNKY8,,22.11.03,스카이블루,,정사이즈예요,보통이에요,화면과 비슷해요,,,,167/49인데 많이 박시해요. 원래 상체가 말라서 박시한옷이 잘 안어울리는편인데 구매했어요. 색감 너무이쁘고 재질도 탄탄해서 두고두고 입을것같아요,Free
WHavCSzl,,22.10.30,블루그레이,,생각보다 커요,아주 만족해요,화면보다 어두워요,165,46,55,재구매에요~~ 재질이나 핏이 너무 마음에들어서 잘입다가 재구매했네용 제가 오버핏 좋아하는데 꽤 오버핏이구 모델 화면보다 색상은 약간 어둡지만 그거마저 이뻐요 ~ 나중에 닳으면 또 살거에요,Free
I0OSL46Q,,22.10.19,라벤더,,정사이즈예요,아주 만족해요,화면과 비슷해요,163,55,55,"98도씨는 역시 셔츠죠
진짜 톡톡해서 구김도 지저분하게 안가고
색감도 너무 좋아요
스탠다드랑 오버핏 둘다 샀는데
둘다 각각 마음에 들어요
왼쪽부터 오버핏 라벤더 스탠다드 민트 화이트
근데 오버핏은 넣어입으면 많이 부하긴 해요
핑크를 사고싶었는데 없길래 꿩대신 닭으로 라벤더 샀어요
웜컬러여서 안-심
라벤더 처음인데 예뻐용",Free
lhe7***,,22.10.17,블루그레이,,생각보다 커요,보통이에요,화면과 비슷해요,157,51,44,"개인적으로 생각보다 너무 컸어요… ㅋㅋㅋ
저한테는 너무 어깡이 되는 느낌…?
그치만 못 입을 정도 아님! 그럼에도 불구하고 예쁩니다!
퀄리티는 그냥 그렇고 파란 셔츠는 너무 유행이라 블루 그레이로 산 건데 훨씬 차분한 느낌이 듭니다! 좀 어두워요!
잘 입을 것 같네용",Free
nbj7nwKA,,22.10.16,블루그레이,,생각보다 커요,아주 만족해요,화면과 비슷해요,162,57,55,생각보다 품이 엄청 커요 색감자체는 진짜 이쁜데 너무 커서 입기가 좀 애매해요 재질은 탄탄하고 색감은 사이트 사진이랑 똑같은 것 같아요! 갠적으로 44-55는 진짜 남방이 사람을 가둔것 같이 느껴져서 비추입니다!,Free
MTOCHkB1,,22.10.16,Sky Blue,,생각보다 커요,보통이에요,화면과 비슷해요,164,51,55,"사진 상으론 조끼 안에 입은 모습인데 일단 오버핏 사이즈라 큼직합니다!
그렇게 입으려고 산거라 전 만족해용
소매부분은 접어서 단추 채우면 사진처럼 저정도의 핏이 나와요!
그리고 다른 셔츠랑 다르게 아빠 셔츠같은 재질이라 좋아요:)",Free
FanZnrFl,,22.10.09,화이트,,생각보다 커요,보통이에요,화면과 비슷해요,162,51,55,사진은 좀 어둡게 찍혔는데 실물은 확실한 화이트입니다! 퀄리티는 음..셔츠 끝부분에 실밥이 좀 나와있어서 정리해줘야 해요ㅠㅠ 그래도 무난무난하고 입었을 때 핏이 예뻐요! 다만 옷이 사진을 보고 생각했던 것보다 주름이 잘 생기는 편이었어요,Free
7TxPEqOw,,22.10.07,블루그레이,,생각보다 커요,아주 만족해요,화면과 비슷해요,,,,흰색을 3년째 입고 있는데 너무 튼튼하고 편해서 블루그레이 색상도 구매했어요! 배 블루 색감이 좀 덜하긴해서 거의 그레이 색이라고 보시면 될 것 같아요 배송이 조금 느리긴 했지만 만족합니다!,Free
rkdu*****,,22.10.07,라이트옐로우,,정사이즈예요,보통이에요,화면보다 어두워요,164,57,55,색이 생각보다 더 노란색이었는데 그거 나름 너무 예쁘게 청바지랑 잘 어울려서 좋았어요!! 처음 입었을 땐 길이가 길다 느껴서 바지에 넣어입기 불편할 것 같았는데 넣는데 엄청 편한 건 아니지만 넣어 입을 수 있는 정도고 소재는 튼튼한 편이에요 💗,Free
pyg5j7Q2,,22.10.02,블루그레이,,정사이즈예요,아주 만족해요,화면과 비슷해요,160,55,55,진짜진짜 최고에요 단독으로 입기 제일 예쁜 셔츠 !! 길이도 오버핏과 붙는핏 딱 중간 잘 찾아갔고 얇지도 두툼하지도 않고 딱 !.! 제가 원하던 옷이에요,Free
PY0BVQYP,,22.09.30,라이트옐로우,,생각보다 커요,보통이에요,화면보다 밝아요,163,63,66,진짜 딱 포스트잇 색깔이긴 한데 레몬색이기도 해요!! 색이 많이 튀지 않아서 더 좋아요!!어깨도 많이 안넓어보이구 길이도 적당히 엉덩이 덮는 정도에요!!,Free
bpfBAFmL,,22.09.28,블루그레이,,생각보다 커요,보통이에요,화면과 비슷해요,158,53,55,저번에 산 셔츠는 단추 부분이 덜빳빳(?)해서 빨면 그 부분만 다림질 해줘야할정도로 구깃해져서 곤란했는데 이번 셔츠는 살짝 빳빳한 감이 있어서 좋은 것같아요! 제 키와 덩치가 작다보니 셔츠가 커보이긴한데 귀여워서 맘이듭니다!,Free
zqdFHsAp,,22.09.24,블루그레이,,생각보다 커요,아주 만족해요,화면보다 어두워요,,,,일단 리뷰나 사진으로 봤을때는 거의 블루라 확신 했는데 받고 보니까 왜 블루그레인지 딱 알겠더라구요 ! 블루도 그레이더 아닌 오묘한 ! 제가 생각했던 색은 아니었지만 왜 제일 잘 나가는지 알 수 있는 색이었고 .... 너무너무 만족합니다 ! 핏도 제가 생각한 딱 오버핏이었어요 ! 일단 하나 사보고 핏 마음에 들면 다른 색상도 여러장 구매하려 했는데 얼른 해야겠어요 ㅎㅎ 하나 아쉬운 점은 배송은 진짜 진 ~~ 짜 느려요 ㅠㅠ,Free
ea**,,22.09.23,블루그레이,,정사이즈예요,보통이에요,화면과 비슷해요,163,56,55,배송이 정말 느렸지만 옷은 예쁘니까 용서가 됩니다... 저는 98도씨 워낙 셔츠 퀄리티 ㄱㅊ으니까 목쪽에도 박음질이 돼있는지 알았는데 이 제품은 안 되어 있는 게 살짝 아쉽네요... 리뉴얼 돼서 나왔으면 하는 바람입니다... 색은 진짜 옥스포드 같은 색이에요 블루그레이라는 단어가 딱 어울리는 말이네요 마음에 들어요~~,Free
E2CNshI4,,22.09.23,블루그레이,,정사이즈예요,아주 만족해요,화면과 비슷해요,167,57,66,"배송은 지연됐지만 기다린 보람 있어요.
넘 예쁘네요. 두껍지 않아서 넣어 입기도 편하고 핏도 살고 
부두러워서 어깨도 넘 각져보이지 않아 좋아요.
색도 완전 회색이 아니라 더 고급스러보여요.",Free
