아이디,리뷰어 등급,작성 날짜,옵션1,옵션2,상품 사이즈,퀄리티,색감,키,몸무게,사이즈,리뷰내용,제품_사이즈
uVH18EYE,,22.10.02,라이트옐로우,,생각보다 커요,보통이에요,화면과 비슷해요,166,58,66,오버핏으로 입기 딱 좋아요 색깔도 예쁘고 이 셔츠 가을바전으로다가 채도 높은 색깔도 나오면 좋겠어요 그린이나 네이비… 그럼 재구매 의사 100프로..,Free
O2L55cCh,,22.09.29,스카이블루,,정사이즈예요,보통이에요,화면과 비슷해요,167,56,66,후기보고 색감이 화면보다 밝다길래 걱정이 많았는데 웬걸ㅎㅎ제가 딱원하던 색이어서 개봉하자마자 반했어요!!제 기준에서 핏도 재질도 완벽합니다!!,Free
nKTZRmsh,,22.09.29,라이트옐로우,,생각보다 커요,보통이에요,화면과 비슷해요,165,60,66,생각보다 배송도 얼마 안 걸렸고 색도 실제로보니까 더 이쁘고 좋아요~~~근데 제가 통통한 체질임에도 불구하고 좀 큽니당 그래도 이뻐요,Free
미식가13,,22.09.28,스카이블루,,생각보다 커요,아주 만족해요,화면과 비슷해요,170,51,44,"흰색 셔츠 잘 입고 다녀서 파란색으로 재구매했어요
색은 화면에 보이는색이랑 똑같고
질감도 부들부들하고 여기저기 휘뚜루마뚜루 입기에 좋아요",Free
fGfGM5UF,,22.09.27,라이트옐로우,,생각보다 커요,보통이에요,화면과 비슷해요,168,62,66,색은 생각보다 연하긴한데 소재도 탄탄하고 요즘 같이 날씨 쌀쌀해질때 잘 입을것 같아요! 주름은 잘 생기는 소재같아서 잘 다려입어야할것같아요,Free
keria,상위 20%,22.09.25,스카이블루,,생각보다 커요,아주 만족해요,화면과 비슷해요,157,43,44,157한테는 조금 마니 커서 환불할까말까하다가 입었는데 박시하게입으면 나쁘지않구 질이좋아여. 가을날씨에 이거하나만입으면 안춥고 딱좋아요,Free
S6prwutL,,22.09.18,라이트옐로우,,생각보다 커요,아주 만족해요,화면과 비슷해요,160,60,55,"면 재질도 너무 좋고 색감도 너무 좋아요!!
엉덩이 덮이는 길이가 이쁜것 같습니다!
빨리 살걸 왜 이리 고민했을까요 ㅠㅠ
담엔 다릉 색상으로 재구매하겠습니다",Free
l3VpUemJ,상위 5%,22.09.17,라벤더,,생각보다 커요,아주 만족해요,화면과 비슷해요,154,56,66,적당히 여유있고 색감도 예쁘고 재질도 적당히 튼튼해서 너무 빳빳하지 않아서 좋아요! 색상은 제가 찍은 사진의 색상이 아니라 진짜 딱 딸기우유색처럼 맑은 포도우유색? 느낌!,Free
요동,,22.09.05,라이트옐로우,,생각보다 커요,아주 만족해요,화면과 비슷해요,167,53,55,"똑같은제품 다른색상으로 예전에 구매했었는데
이번엔 노랑이 끌려서 재구매했어요!! 
품이 넉넉하고 탄탄해요 
색감은 물빠진? 포스트잇이 생각나는 노랑입니다",Free
tZJQEh9l,,24.06.10,화이트,,정사이즈예요,보통이에요,화면과 비슷해요,168,52,55,비침이 거의 없고 탄탄한 느낌의 셔츠에요! 저는 단독으로 입기보다는 겉옷으로 입는게 예쁘더라구요! 예전에 퓨른색 샀다가 너무 잘 입어서 흰색도 구매했습니다,Free
n1YIv30c,,24.05.26,라이트옐로우,,정사이즈예요,아주 만족해요,화면과 비슷해요,158,48,44,너무예뻐요!! 아우터로입어도 예쁘고 그냥셔츠로입어도 생각보다 안 부해보이고 딱맞게 이쁘고 재질도 탄탄해서 좋아요!!,Free
bQVRjsgf,상위 25%,24.05.13,라이트옐로우,,생각보다 커요,아주 만족해요,화면과 비슷해요,156,58,66,화면하고 색깔 거의 흡사합니다. 원단도 톡톡하고 길이도 적당. 요즘 아침저녁에 걸치기 좋아요!다른색깔도 고민중입니다.,Free
kKOsBQaG,,24.04.15,화이트,,정사이즈예요,보통이에요,화면과 비슷해요,160,56,66,흰 셔츠가 급하게 필여했는데 가격도 괜찮고 질도 괜찮아보여서 직진배송으로 시켜봤ㄴ어요 무난하게 오버핏으루 잘 입고 다니우,Free
uyy1**,,24.04.05,화이트,,생각보다 커요,아주 만족해요,화면과 비슷해요,166,58,66,생각보다 많이 박시하고 키 167에 엉덩이 다 덮는 기장이에요! 원단은 탄탄해서 변형없이 잘 입을 수 있을 것 같아서 좋네요 :),Free
AAjplyX4,상위 25%,24.03.28,라이트옐로우,,정사이즈예요,아주 만족해요,화면과 비슷해요,,,,사진 색감이 연하게 나왔는데 실제로는 더 진한 노랑색이에요~ 상세화면 색이랑 같아요! 생각보다 두께가 있어서 탄탄하니 좋아요~,Free
gJEfbuY5,상위 10%,24.03.22,화이트,,정사이즈예요,보통이에요,화면과 비슷해요,163,65,66,예전에 블루그레이 ..? 컬러 사입고 화이트로 재구매 했어요. 재질도 탄탄하고 캐주얼하게 입기도 포멀하게 입기도 괜찮은 것 같아요,Free
IYskmiNO,,24.03.21,라벤더,,생각보다 커요,아주 만족해요,화면과 비슷해요,160,65,66,"싼티나지 않고 고급져요. 컬러도 화사하니 봄에 딱입니당

총장이 좀 길어요 엉덩이 덮네용
오버핏!
봄나들이 어서 가고싶어융",Free
mchs**,,24.03.18,블루그레이,,정사이즈예요,아주 만족해요,화면과 비슷해요,165,63,55,몇년전에 블루그레이 구매했는데 잘입다가 오래되어서 재구매했습니다 핏이쁘고 색상도 무난하고 가격대비 너무 좋아요,Free
KJ7ypYid,상위 30%,24.03.16,블루그레이,,생각보다 커요,보통이에요,화면보다 어두워요,161,64,55,핏이 너무 좋아요!! 색깔도 톤다운된 소라느낌이라 차분해보여서 예쁘네용 봄에 너무 잘입고다닐 것 같아요! 배송은 조금 느렸습니당,Free
MMcag5jp,,24.03.13,화이트,,생각보다 커요,아주 만족해요,화면과 비슷해요,158,64,66,"엄청 큽니다,, 그래서 엉덩이 가려줘서 좋아요 니트랑 레이어드 해서 입으면 예뻐요 다만 길이가 길어서 그건 아쉬운 부분입니다ㅠ",Free
gq2f******,상위 30%,24.02.12,라이트옐로우,,정사이즈예요,아주 만족해요,화면과 비슷해요,168,59,55,꼭꼭 사세요 제발.. 재질도 너무 맘에 들고 색깔도 예쁘게 잘 나온 거 같아요 처음 받고 원단이 너무 좋아서 만족스러웠습니다,Free
마이귬뮹이,상위 30%,24.01.28,라이트옐로우,,정사이즈예요,아주 만족해요,화면과 비슷해요,164,51,55,다른색상도 갖고있는데 곧 봄 맞이로 사봤는데 색감이 너무 화사하고 맘에 들어요 퀄리티는 말할 것도 없고 믿고 재구매했어용,Free
t0BNHlsI,,23.03.07,화이트,,생각보다 커요,보통이에요,화면과 비슷해요,158,42,44,셔츠 질이 좋고 핏이 예뻐요. 근데 너무 커서 아우터로만 입을 수 있을 것 같아요. 그냥 상의로도 입고싶어서 더 작은 걸 찾아봐야겠어요 !,Free
NbRI9gOm,,22.12.01,블루그레이,,정사이즈예요,아주 만족해요,화면과 비슷해요,161,56,44,옷 색상도 그렇고 이뻐요 하지만 확실히 큰 것 같아요..ㅋㅋㅋ 남의 옷 입은 느낌이었어요 살짝 마르신 남성분이 입으면 딱 맞을 것 같은 그런 핏이라고 생각합니다 색상은 너무 이뻐서 위에 니트랑이라도 같이 입을지 생각 중입니다 사진이 조금 누렇게 나왔어요,Free
6SanDFcj,,22.09.07,블루그레이,,생각보다 커요,보통이에요,화면과 비슷해요,,,,엄청엄청 큰 것 같아요. 그리고 제가 옛날에 산 셔츠랑 색이 너무 비슷해서 깜짝 놀랐습니다ㅎㅎ 그래도 소재가 다른 느낌이어서 두 개다 이쁘게 입으려고 합니다!,Free
1OSEcvXb,,25.01.09,라벤더,,생각보다 커요,아주 만족해요,화면과 비슷해요,163,60,66,배송도 빠르고 포장도 잘되어 있어서 왔어요! 일단 색상이 너무 이쁘고 재질도 굳입니다! 길이감도 괜찮아서 만족합니당,Free
UZi6XFmq,,24.04.11,블루그레이,,생각보다 커요,아주 만족해요,화면과 비슷해요,163,58,66,너무너무 좋아요!!! 제가 산 셔츠 중에 제일 맘에 들어요!!!! 단독으로 입어도 예쁘고 밖에 걸쳐서 입어도 예뻐요..! 배송이 정말 너무 느렸지만 옷은 예쁘니…넘어갈게요,Free
iUE0vodZ,,24.02.22,스카이블루,,정사이즈예요,아주 만족해요,화면보다 밝아요,168,63,55,"생각보다 탄탄하고 길이감도 좋네요 셔츠 많이 사봤지만 가성비 괜찮은 셔츠라고 생각합니다 
단독으로 입기도 좋고 반팔에 걸쳐입기도 좋겠어요",Free
1ZvEKNKC,,23.10.27,블루그레이,,정사이즈예요,아주 만족해요,화면과 비슷해요,,,,"개인적으로 예전에 즐겨 입던 셔츠재질이 열심히 다리미 다려놓으면 금방 구겨져서 별로였는데 이건 쉽게 구김지는 재질이 아니라서 너무 좋아요👍
뭐니뭐니 해도 색깔이 진짜 대박입니다
색깔도 진짜 하늘색에 회색 두방울 떨어뜨린 느낌🫶🏻
너무 마음에 들어서 다음에 라벤더랑 베이지색 살 예정입니다🙈",Free
jYsDTWdU,,23.10.13,라이트옐로우,,정사이즈예요,보통이에요,화면과 비슷해요,160,55,55,"완전 예뻐요!
사이즈도 오버핏이라 티 밖에 입기도 너무 좋음 
근데 빨면 주름이 좀 많이 지네요
그래도 예뻐서 잘 다려 입습니다 ㅠㅠ",Free
vlzk******,,23.05.17,블루그레이,,생각보다 커요,아주 만족해요,화면과 비슷해요,173,62,55,생각보다 품이 크고 기네요! 엉덩이까지 내려와서 넣어입기보다 안에 나시입고 아우터로 걸치면 예쁠거 같아요. 색상은 소라색에 약간 탁한색 한방울? 맘에 들어용,Free
pvS1yOU4,,23.05.07,스카이블루,,정사이즈예요,아주 만족해요,화면과 비슷해요,160,50,55,좋아요 근래 산 옷 중에 제일 마음에 들어요!! 오버핏 좋아하는데 딱 핏 만족스럽게 적당하고 스카이 색상 너무 밝을까봐 걱정했는데 딱 좋아서 만족합니다!ㅎㅎ,Free
p5qRqapH,상위 20%,23.04.30,블루그레이,,정사이즈예요,아주 만족해요,화면과 비슷해요,170,60,77,이미 하나 샀는데 엄마가 너무 예쁘다고 같이 입자고 해서 하나 사드렸어요! 색 오묘하게 괜찮고 원단도 너무 파스락도 아니고 너무 찰랑도 아닌 적절히 핏 잡아주는 탄탄한 원단이라 추천입니다!,Free
unQu74Pu,,23.04.25,블루그레이,,생각보다 커요,보통이에요,화면보다 어두워요,160,52,55,생각보다 더 그레이색인것 같아요~ 키가 160이라 좀 작은편인지 총 기장도 좀 더 길구요~ 예전에 스카이블루 시켰었던것같은데 잃어버려서 다른 색으로 주문해봤어요~ 근데 그때랑 지금 상세사진이랑 색이 좀 다른것 같아서 블루그레이색으로 샀는데 더 탁해서 살짝 아쉬워용! 그래도 넣어입으면 핏이 이뻐서 입으려구요,Free
hteRWwYR,,23.04.09,블루그레이,,생각보다 커요,보통이에요,화면과 비슷해요,160,50,55,후기에서 본 것처럼 박시한느낌이에요! 소매도 꽤 길고 길이감도 꽤 있어서 넣어입는것보다는 걸쳐서 입는게 더 예쁠것같아요. 퀄리티는 생각보다 좋았습니다!,Free
WO3fZkb8,상위 10%,23.03.30,블루그레이,,생각보다 커요,아주 만족해요,화면과 비슷해요,168,55,55,파란색 셔츠 필요해서 샀아요 생각 보다 엄청 커서 오버핏으로 입기 좋아요 색이 실내랑 실외랑 많이 달라요 회색이랑 파란색이랑 섞여있음,Free
bIv19y5I,,23.03.29,블루그레이,,생각보다 커요,보통이에요,화면보다 어두워요,,,,예쁘게 입으려면 다림질이 필수인 느낌이에요 다림질 안하면 뭔가 그 실들이 돋는? 올라오는? 바스락? 이런 느낌이에요 생각보다 좀 많이 크고 뒷부분이 일자가 아닌 u자라서 다리가 쪼끔 짧아보일 수 있어여….,Free
svm1p721,상위 25%,23.03.29,베이지,,생각보다 커요,아주 만족해요,화면과 비슷해요,155,50,44,"생각했던 핏보다 더 오버핏하지만 오히려 좋습니다!
재질도 튼튼하고 금방 망가지지 않을 것 같아요ㅠㅠ
다른 색상도 주문 예정입니다~
꼭 주문하세요 완전 짱짱🤟🏻🤟🏻",Free
XgT0jrkc,상위 10%,23.03.24,블루그레이,,생각보다 커요,아주 만족해요,화면과 비슷해요,164,48,55,스카이블루랑 블루그레이랑 헷갈려서 주문 잘못 넣었는데 색감이 너무 만족스러워서 그냥 구매확정했어요. 입어보고 만족스러우면 또 살까도 생각중.. 낙낙한 사이즈에 재질도 좋고 해서 자주 입게 될거 같아서 만족입니당.,Free
B3oQDssE,,23.03.21,화이트,,생각보다 커요,보통이에요,화면과 비슷해요,,,,사이즈가 엄청 크네요! 근데 편하게 입기 좋아요! 소재는 제가 생각했던거 보다 조금 얇은 감이 있어요 ! 그냥 셔츠만 입으면 속옷이 보이는 정도?,Free
가을뮤트간호사,상위 5%,23.03.20,화이트,,정사이즈예요,아주 만족해요,화면과 비슷해요,160,54,66,작년에도 다른색상구매했는데 너무 만족스러워서 올해봄에는 화이트 셔츠 갖고싶어 재구매하게되었어요!청바지에도 잘어울리고 치마 면바지에도 딱이예요! 가격도 적당해서 또 재구매 예정입니다~,Free
C6yXxSrm,상위 15%,23.03.09,라이트옐로우,,생각보다 커요,아주 만족해요,화면과 비슷해요,161,64,66,상세페이지 설명 그대로 밝은노란색이에요! 살짝레몬색 같고 소재는 도톰합니다 :) 셔츠 색이 상콤해서 입으니까 봄이 온 것 같은 기분이네요!,Free
Sso._.,,23.03.04,화이트,,정사이즈예요,보통이에요,화면과 비슷해요,160,51,55,"소재자체는 탄탄하구 좋아요!! 기본템으로 활용하기에 죠씁니다ㅎㅎ.
봄가을에 입기 좋은 두께구 
너무 오버핏이 아니라서 오히려 더 마음에 들어요!!
카고바지랑도 회끼도는 청바지랑도 잘 어울릴 거 같아요",Free
wjrOmOFK,,23.03.03,화이트,,생각보다 커요,보통이에요,화면과 비슷해요,170,72,66,"꽤괜! 단독으로 입기보단 흰색 셔츠가 없어서 무난템으로 안에 입고 레이어드로 코디하기 위해 산 건데 품도 그렇고 여러 가지로 괜찮아서 다른 색상도 사보고 싶긴 하네용 ㅎㅎ 근데 지그재그라서 그런지 쇼핑몰이 그런진 몰라도 배송 넘 느려요,,,ㅜㅜ",Free
lbHERq5t,,23.02.25,블루그레이,,생각보다 커요,아주 만족해요,화면과 비슷해요,157,51,55,색 이뻐욥 짱커요 근데 예뻐요 긴 코트에 입으면 죠음 바지에 넣어입르면 너무 바지가 울퉁불퉁해서 빼서 입는 편입니당 봄에 잘 입을듯해용,Free
thVMQxJY,,23.02.01,블루그레이,,생각보다 커요,아주 만족해요,화면보다 어두워요,165,52,55,"생각보다 품이 크고 길어서, 넣어 입기보단 그냥 빼고 입는게 어울리는 옷입니다! 퀄리티는 만족합니다. 
근데 생각보단 좀 더 어두워서 자세히 보지 않으면 그냥 회색같은 느낌입니다.. 색상 선택 시 참고하세요",Free
고데기,상위 20%,23.01.22,화이트,,생각보다 커요,아주 만족해요,화면과 비슷해요,164,51,55,커요! 완전 넉넉..! 크게 바스락거리지않아서 좋았는데 길이도 품도 진짜 커서 당황스러웠어요ㅎㅎ 그래도 잘 접어서 넣어입고 꺼내입고하다보니 활용도는 높네요!,Free
orIn3wYn,,23.01.06,라이트옐로우,,생각보다 커요,아주 만족해요,화면과 비슷해요,,,,"화면상 색감이 너무 예뻐서 구매했는데 실물이 훨씬 예뻐요 ㅜㅠ 오로지 색감만 보고 구매해서 질이
안좋아도 참고 입어야지 했는데 소재도 부드럽고 소매가 자연스럽게 잘 접혀서 다음에 다른 색도 살거에요😂",Free
onAVTk97,,22.12.25,블루그레이,,생각보다 커요,보통이에요,화면과 비슷해요,162,47,44,"오버핏으로 입기 좋고 겨울에는 안에 따뜻한거 입어야 할 거 같아요! 여름철 냉방이 강하거나 간절기에는 아우터 겸용으로도 안성 맞춤일거 같습니다.
 천 퀄리티는 좋으나 단추 실밥 마감이 좀 아쉬워요. 실이 자꾸 풀리더라고요",Free
6BAWRkMP,상위 20%,22.11.13,스카이블루,,생각보다 커요,아주 만족해요,화면과 비슷해요,164,59,66,봄 가을에 입기에 너무 좋은 셔츠입니다. 셔츠는 핏이 중요하다고 생각되는데 진짜 너무 예쁘고 크기도 커서 오부바지나 반바지에 입기도 최고,Free
9JJ6G7mx,상위 20%,22.11.02,블루그레이,,정사이즈예요,보통이에요,화면과 비슷해요,168,50,55,"핏도 무난하니 괜찮고 색도 톤 가릴것 없이 잘 받아요.
근데 추천안하는이유가 다림질 진짜 힘들어요..
제가 서툰탓도 있겠지만 40분동안 다림질했는데 잔주름 안없어져요..ㅎ
핸디형 스팀다리미로는 어림도 없습니다
또 오래다렸더니 슬랙스마냥 맨들맨들해지고... 
주름도 잘져요",Free
짱구야,상위 5%,22.11.02,스카이블루,,생각보다 커요,아주 만족해요,화면과 비슷해요,155,48,44,딱 생각했던 옥스포드 셔츠입니다! 색도 원했던 색이고 길이도 적당히 박시해서 지금은 외투 안에 입고 봄 가을엔 겉에 딱 걸치면 너무 이쁠 것 같아요~,Free
1pNDaDAZ,,22.11.01,베이지,,생각보다 커요,보통이에요,화면과 비슷해요,168,57,55,"168/56
길이는 엉덩이를 덮는 길이이고 소재는 탄탄한 남방느낌이에요.
뒤에 트임이 있어서 어떤 치마랑 입어도 예뻐요! 근데 저한테는 어깨가 많이 크고 허리를 잡아서 입기에는 애매해서 꼭 하의에 다 넣어서 입거나 남방으로 다 빼서 입어야할거같아요
전반적으로는 만족인데 생각보다 커서 당황했어요ㅋㅋ",Free
3JkFsVDe,,22.10.31,라벤더,,생각보다 커요,보통이에요,화면과 비슷해요,174,69,66,"라벤더 셔츠는 처음 구매해봤는데 맘에 들어요!
색은 화면이랑 같은 것 같고 조금 큰 편이라 평소에 크게 입으시는 분들도 입기 좋아요. 소재가 탄탄해서 오래 입을 수 있을 것 같습니당",Free
룰루랄랄라라라,상위 15%,22.10.29,블루그레이,,생각보다 커요,아주 만족해요,화면보다 어두워요,163,49,55,블루톤이 많이 빠진 그레이색상이라서 이곳저곳에 활용해서 코디하기 좋아요 ㅎㅎ 니트 안에 레이어드해서 입기도 좋고 단독으로 입기도 좋아요 :),Free
rqQMigp2,,22.10.28,화이트,,생각보다 커요,보통이에요,화면과 비슷해요,160,50,55,생각보다 사이즈가 좀 크긴해요 셔츠 위에 니트탑 매치하려구 구매했는데 사이즈가 커서 레이어드하면 예쁘진 않아요 근데 아우터처럼 착용하면 남자친구 셔츠 뺏어입은 것처럼 귀엽고 보이시하면서 청순도 하구 넘 예뻐요 잘 입을게요!,Free
gzPqZkqo,,22.10.25,화이트,,생각보다 커요,보통이에요,화면과 비슷해요,160,52,55,"생각보다 두툼한 재질이에요
평소에 오버핏을 많이 크게 입는 스타일이라 그런가 어깨선이 생각보단 위에 있는것같아요
근데 덩치가 있어보이진않아요!
셔츠가 두툼하고 바스락바스락 하는 느낌이라서 넣어입는것 보단 빼서 입는게 더 이쁜 것 같네용!",Free
jzxs9ilG,,22.10.24,스카이블루,,생각보다 커요,아주 만족해요,화면과 비슷해요,161,47,44,생각보다 사이즈가 엄청 컸어요! 색감도 마음에 들고 다 좋은데 단독으로 입기에는 너무 큰 것 같아요 ㅜㅜ 조금 키 크신분이 입거나 걸쳐 입으면 좋을 것 같습니당,Free
pZWdM9U0,,22.10.20,블루그레이,,정사이즈예요,아주 만족해요,화면과 비슷해요,,,,색감이 진짜 미쳤어요 ㅠㅠ 슬랙스에 입어도 청바지에 입어도 너무 예쁘네요!! 오버핏로 나온거라 핏도 넉넉해서 평소에 옷을 넉넉하게 입는 분들이라면 완전 추천입니다! 핏 덕에 날이 따뜻할때는 얇은 아우터처럼 입어도 이쁠거 같아요!,Free
FjwAkili,,22.10.19,화이트,,정사이즈예요,보통이에요,화면과 비슷해요,160,60,66,배송이 오래 걸리긴 했지만 기대한 만큼 너무 만족해요!! 무난하게 입기 좋고 휘뚜루마뚜루 잘 입고 다녔어요 다음에 다른 색상도 구매 예정입니다!!,Free
gcsG1hOJ,,22.10.16,스카이블루,,생각보다 커요,보통이에요,화면과 비슷해요,155,50,55,"옥스포드 흰색 너무 잘입고 있어서 스카이블루도 샀습니다! 제 키 기준으로 엉덩이까지 다 덮습니다!
베이지색 면바지랑 입어도 예쁠거 같아요 오버핏인데 바지안으로 잘 정리해서 입고있어요!",Free
SFVeOhxc,,22.10.14,라이트옐로우,,생각보다 커요,아주 만족해요,화면과 비슷해요,168,70,66,"너무너무너무너무너무 만족스럽스빈다~ 편하고 생각보다 더 부드러워서 여기저기 휘뚜루마뚜루 입고 다닐 수 잇늘 것 같아요 너무 격식잇는 자리만 아니라면 ㅎㅎ 그리고 키가 큰데 길어서 너무 좋앗습니당! 
또 항상 느끼믄 건데 오래 입을 수 잇늘만큼 퀄리티가 좋은 것 같아요!! 많이 파시고 건강하시고 가을옷도 많이많 부탁합니다! 너무 작고 짧은 옷만 나오는데 여기는 아니여서 너무 좋아오 ㅎ",Free
n8eIoTdC,,22.10.12,화이트,,생각보다 커요,아주 만족해요,화면과 비슷해요,165,63,55,매우 탄탄한 소재여서 늘어지거나 구김이 얇은 셔츠에 비해 훨씬 덜합니다! 요즘 같이 쌀쌀한 가을에 이 셔츠 입고 니트나 아우터 걸쳐 주면 코디 걱정 끝이에요:),Free
FanZnrFl,,22.10.09,블루그레이,,생각보다 커요,보통이에요,화면과 비슷해요,162,51,55,"하늘색, 흰색 셔츠만 구매하다가 다른 색깔의 셔츠도 사고싶어져서 이 셔츠를 구매했어요. 블루에 살짝 그레이가 섞여서 더 예쁜 것 같아요. 디자인도 깔끔해서 마음에 들었습니당",Free
bXctm9zh,,22.10.07,블루그레이,,정사이즈예요,보통이에요,화면과 비슷해요,158,60,88,"푸른끼 거의 없는 차분한 회색이고 세탁 후 다려입지 않아도 될 정도로 구김도 심하지 않은 편입니다.
건조기에 돌렸더니 기장이 많이 줄었지만 그래도 제 키엔 엉덩이를 다 커버할 정도로 적당한 기장이네요.",Free
5B70gyzS,,22.09.26,스카이블루,,생각보다 커요,보통이에요,화면보다 밝아요,166,58,55,"처음 봤을 땐 너무 크고 생각보다 밝아서 당황스했지만 제대로 입어보니 핏은 예쁜 거 같아요
색도 보다보니 예뻐요 근데 남자 좀 남자 옷 같기도함",Free
xHLiZhq0,,22.09.26,베이지,,생각보다 커요,아주 만족해요,화면과 비슷해요,164,53,55,"너무너무너무 이뻐요
주름이 생각보다 잘 가긴 하는데 옷걸이에 걸어놓으면 바지 안에 넣어져서 구김갔던 부분도 반나절이면 어느정도 펴지더라구요. 전 하늘색 베이지색 샀는데 둘다 넘 만족합니다.. 레깅스 위에 입어도 이쁘고 검은 슬랙스 위에 바지 안으로 넣어서 입어도 이뻐요",Free
0Aoyzy6c,,22.09.23,블루그레이,,생각보다 커요,보통이에요,화면과 비슷해요,168,51,55,배송은 정말 느렸어요.. 다른 제품이랑 같이 샀는데 이게 그나마 부분배송으로 먼저 온건데도 2주 넘게 걸렸습니다.. 색은 톤다운된 블루 색이라 마음에 드는데 중간중간 보풀이 일어난 것 거처럼 하얀 보풀뭉치? 같은것들이 보여서 퀄리티는 그냥 별로에요,Free
돼.징,상위 10%,22.09.22,라이트옐로우,,정사이즈예요,아주 만족해요,화면과 비슷해요,170,66,77,"일단 면이 너무 맘에 들구요! ㅠㅠ 
저는 키 172, 몸무게 좀 나가고 어깨 넓고 가슴이 좀 있는 편이라서 셔츠 잘 안입구 넘 크면 더 덩치커보이면 어쩌지 하구 걱정햇는데 우선 정핏에서 쪼금 더 커서 잠궜을 때 너무 맘에 들었어요 ㅠㅠ 제 교복 될 예정…",Free
EBP6D66T,,22.09.22,라이트옐로우,,정사이즈예요,보통이에요,화면과 비슷해요,160,50,77,"폴로 랄프로렌 옥스포드 셔츠를 너무 잘 입어서 비슷한 느낌으로 찾아보다가 컬러가 너무 귀여워서 주문했어용
주문할때 배송이 2-3주 걸린다고 했는데 생각보다 빨리 왔어용! 컬러도 너무 귀엽고 재질도 괜찮은거같아용! 군데군데 실밥이 나와있긴한데 잘라서 입으면 될거같아용 ㅎㅎ",Free
AJBz935s,,22.09.20,스카이블루,,생각보다 커요,아주 만족해요,화면과 비슷해요,161,58,55,"일단 색감이 기대하던 거랑 완전 똑같아서 택배 뜯으면서부터 완전 잘 샀다 생각했어요. 핏은 생각한 거보다 약간 더 온 버핏이 긴 하지만 디자인이 너무 이쁘게 잘 나와서 바로 세탁해서 다음날 입고 나갔어요. 주름이 잘 생기는 재질이라 다림질 꼭 해줘야 해요. 소매길이는 두 번 롤업 했을 때 팔을 내리면 손목까지 오고, 전체 길이는 엉덩이를 충분히 덮는 정도예요.",Free
