아이디,리뷰어 등급,작성 날짜,옵션1,옵션2,상품 사이즈,퀄리티,색감,키,몸무게,사이즈,리뷰내용,제품_사이즈
DnyyWvA2,,24.07.24,스카이블루,,정사이즈예요,아주 만족해요,화면과 비슷해요,162,50,55,"인기 많은데에는 이유가 있는법…! 
간절기에 정말 잘 입었어요 
다른 색상으로 추가구매할겁니다 
계속계속 팔아주세효",Free
ssykHpx2,,24.06.05,라벤더,,생각보다 커요,아주 만족해요,화면과 비슷해요,,,,"색감은 사진과 비슷하구요 원단은 탄탄합니다 같은 디자인으로 스카이블루, 그레이 등등 다양한 색으로 여러벌 구매했어요",Free
tLndNIRh,,24.03.25,블루그레이,,생각보다 커요,아주 만족해요,화면과 비슷해요,159,54,55,화이트 색상 구입하고 잘 입고 다녀서 그레이 색상 구매했습니다. 무채색으로 입을 때 좋을 것 같아요! 부드러운 옥스포드여서 좋습니다,Free
3yPOrDX1,상위 25%,24.03.13,블루그레이,,정사이즈예요,아주 만족해요,화면과 비슷해요,166,56,55,언니가 산거 입어보고 핏이 마음에 들어서 따라 샀어요ㅎㅎ 봄 가을에 아우터대용으로 셔츠 많이 입는데 이게 딱이더라구요 카라가 자꾸 벌어지는게 좀 아쉽지만 잘 입을게요,Free
3yPOrDX1,상위 25%,24.03.03,화이트,,정사이즈예요,아주 만족해요,화면과 비슷해요,166,56,55,언니가 산거 입어보고 핏이 마음에 들어서 따라 샀어요ㅎㅎ 봄 가을에 아우터대용으로 셔츠 많이 입는데 이게 딱이더라구요 카라가 자꾸 벌어지는게 좀 아쉽지만 잘 입을게요,Free
uqWIVeMj,,24.02.08,스카이블루,,정사이즈예요,보통이에요,화면과 비슷해요,158,53,55,색상이 진하지도않고 이쁜색상이네요~~ 사이즈도 괜찮고 이쁩니다. 많이 파시고 담에 여기서ㅈ또 재구매할께요~~~,Free
zzmllzz,,23.10.29,블루그레이,,생각보다 커요,아주 만족해요,화면과 비슷해요,168,54,55,색이 차분해서 맘에 드는데 생각보다 사이즈는 엄청 크고 제 키에도 엉덩이 다 덮어요 단독으로 입고다니기엔 너무 추워졋음..,Free
1n0EJ4Ew,,23.10.07,화이트,,정사이즈예요,아주 만족해요,화면과 비슷해요,167,56,66,블루그레이색상? 예전에 산게 맘에들어서 조끼랑 같이 입으려고 화이트로 또 샀어요 역시 너무 예쁘네요 ㅠ 이런 탄탄한 면소재 셔츠 정말 좋아요 잘입을게용,Free
qkrw******,상위 5%,23.10.05,베이지,FREE,생각보다 커요,아주 만족해요,화면보다 어두워요,168,50,55,퀄리티는 좋은데 베이지색을 어디 매치하기 좀 어렵네용 .. 원래 다른 색 여러개 샀어서 색만 보고 샀습니당! 168 기준 엉덩이 다 덮고 탄탄한 핏이라 마음에 들어용,Free
g6cE1szl,,23.09.30,블루그레이,,정사이즈예요,보통이에요,화면과 비슷해요,160,50,55,"탄탄하고 핏도 이뻐요 색깔도 블루그레이에 맞게 잘빠졌어요 160기준 엉덩이 다덮구요 어깨가 넓은편인데요 여리여리하게 만들어쥬는 핏입니다
이뻐요",Free
dvMYwvTJ,,23.09.16,화이트,,정사이즈예요,아주 만족해요,화면과 비슷해요,160,77,88,"기본 셔츠 둘러보다가 찾은건데 잘산것같아요!
오버핏인데 어깨라인은 맞아서 부해보이지 않고 딱 예쁘게 맞아요ㅎㅎ
다른 색도 좀 둘러봐야겠습니당~!",Free
Nil0WFqX,상위 30%,23.09.01,블루그레이,FREE,생각보다 커요,보통이에요,화면보다 어두워요,170,75,77,"블루 그레이보다는 그레이에 더 가까워요 
임산부라서 루즈핏을 샀는데 생각보다 더 커서 만삭까지 입어도 넉넉할거 같아요 소재는 흐물흐물하지 않고 탄탄해요",Free
eN4w7SFN,,23.05.11,라벤더,,정사이즈예요,아주 만족해요,화면과 비슷해요,,,,지금 입기에 이쁜 색상이에요! 크기 적당하고 이뻐요 기본으로 입어도 이쁘고 포인트 주고 입어도 이뻐요! 만족맘족입니당,Free
p5qRqapH,상위 20%,23.04.30,화이트,,정사이즈예요,아주 만족해요,화면과 비슷해요,170,60,77,색이 마음에 들어서 처음에는 블루그레이로 샀었는데 사고 보니까 원단이랑 핏이 너무 예뻐서 화이트도 샀습니다. 여전히 예쁘네요 잘 입고 있습니다!,Free
KlFnzaGC,,23.04.21,스카이블루,,정사이즈예요,보통이에요,화면과 비슷해요,162,52,55,"짱 이쁨 단추가 반짝거리는지는 몰랏는데 그냥 그러고 핏이나 그런건 만족 오버핏에 편하게 입을 수 있는
셔츠라 아주 만족 합니당!",Free
LCACUPR8,,23.04.20,화이트,,정사이즈예요,보통이에요,화면과 비슷해요,158,58,66,"색상이 너뮈예뻐요 재질도 내가 생각했던 그대로 구요
봄 가을 무난하게 입을수있는 옷이에요 
비오는 날이 많은데 툭 걸쳐입기 딱좋아요",Free
LCACUPR8,,23.04.20,블루그레이,,정사이즈예요,보통이에요,화면과 비슷해요,158,58,66,"색상이 너뮈예뻐요 재질도 내가 생각했던 그대로 구요
봄 가을 무난하게 입을수있는 옷이에요 
비오는 날이 많은데 툭 걸쳐입기 딱좋아요",Free
d3flKjCb,,23.04.13,라이트옐로우,,정사이즈예요,보통이에요,화면과 비슷해요,,,,쨍한 노란색이 귀여워요 잘산거같습니다. 다른색상도 구매할 생각 있어요. 뒤에 주름 포인트도 귀여워요 팔은 길긴한데 어차피 접어입을거라...,Free
방탄,,23.04.06,화이트,,생각보다 커요,아주 만족해요,화면과 비슷해요,165,72,66,"여기서 산 셔츠는 다 마음에 들어요
77인 사이즈도 저에게 넉넉하게 잘 맞고 원단도 좋아요
색상은 사진으로 본거랑 비슷합니다.",Free
방탄,,23.04.06,블루그레이,,생각보다 커요,아주 만족해요,화면과 비슷해요,165,72,66,"여기서 산 셔츠는 다 마음에 들어요
77인 사이즈도 저에게 넉넉하게 잘 맞고 원단도 좋아요
색상은 사진으로 본거랑 비슷합니다.",Free
bRdI783E,,23.04.01,라이트옐로우,,생각보다 커요,아주 만족해요,화면보다 밝아요,,,,배송은 좀 걸렸지만 사고싶었던 색이라서 만족스러워요 상세사진보다 더 밝은 거 같은데 봄에 찰떡이에요 실밥처리는 좀 미흡해요,Free
SZ3b7Xx1,,23.03.22,블루그레이,,정사이즈예요,보통이에요,화면과 비슷해요,165,49,44,예뻐요 부들부들하고 입었을때 편하고 사진과 똑같은거같아요 시원하니 통풍도 잘되네요 지금 봄이랑 여름에 입기 딱 좋아요,Free
8Pgvc1so,,23.03.19,블루그레이,,생각보다 커요,보통이에요,화면보다 어두워요,160,56,66,"다른 색깔도 사보고 싶다는 생각이 들어요! 좋아요
근데 이 색이 생각보다 어두워요 
가격에 비해서 옷감이 좋아요!!!!",Free
DiAEnpWm,,23.03.19,블루그레이,,생각보다 커요,보통이에요,화면과 비슷해요,163,58,66,생각보다 퀄리티가 좋지 않아요ㅜㅜ 그리고 좀 많이 커서 놀랐어요 색상은 쿨해서 맘에 들어요~~ 재구매는 안할것깉아요ㅠㅠ,Free
kbgMPuv0,,23.03.16,스카이블루,,생각보다 커요,보통이에요,화면과 비슷해요,165,52,66,소재 톡톡하고 좋아요. 색깔은 사진보다 진하고 예뻐요.^^ 크기는 큰 편이고 예쁘게 입을 수 있는 스타일로 나왔네요.,Free
tbzOtmXS,,23.03.15,블루그레이,,생각보다 커요,보통이에요,화면과 비슷해요,163,50,55,오버핏인거 알고 구매하긴 했지만 평소에 정사이즈나 크롭만 입다가 입어서 그런지 많이 큰 느낌이긴 하네요! 그래도 편하게 걸치는 용도로 좋은것같아용,Free
95_s****,,23.03.14,블루그레이,,정사이즈예요,아주 만족해요,화면과 비슷해요,170,56,66,소라색을 살까 블루 그레이를 살까 고민했는디 그레이 만족해요!! 여기서 작년에 산 흰색도 잘 입고 있어오 ㅎㅎ 사이즈도 좋아요,Free
EOAkWQv5,,23.03.10,스카이블루,,생각보다 커요,아주 만족해요,화면과 비슷해요,164,60,55,겉에 걸쳐 입으려고 산 거라서 오버핏 마음에 들어요. 색상도 봄에 어울리는 화사한 하늘색이라서 좋습니다. 흰티에 같이 입으면 좋을 거 같아요,Free
gTvimWZ5,,23.03.05,라이트옐로우,,정사이즈예요,아주 만족해요,화면과 비슷해요,165,50,66,전에 다른 색상 사서 잘입다가 노란색으로 샀는데 또 마음에 들어요 !! 약간 오버핏으로 입을 수 있어서 좋아요!! 소재도 좋아요,Free
cpcBoMch,,23.02.16,라이트옐로우,,정사이즈예요,보통이에요,화면과 비슷해요,160,50,44,"노랑색이 봄에 입기 딱 조아요 맘에 들어여 다른 색두 구매할 의사 있습니당 
생각보다 사이즈가 큰데 그래도 나쁜 핏은 아닌 것 같아여",Free
qLPuOSfk,상위 20%,23.02.15,스카이블루,,생각보다 커요,보통이에요,화면보다 밝아요,168,58,66,"색은 딱 쿨톤에게 어울리는 화사한 하늘색입니다
탄탄한 재질이고 크기도 낙낙해서 편하게 입을 수 있어요 
생각보다도 큽니다",Free
DyP7TwUW,,23.02.15,라이트옐로우,,정사이즈예요,보통이에요,화면과 비슷해요,160,53,55,색이 화면과 같아요 이너로 기본티셔츠로 잘 입고다나고 있습니다 두께도 적절해요 매우 잘 입고다녀요 매치하기도 쉬워요 굳굳 색이 정말 귀엽네요,Free
DyP7TwUW,,23.02.15,스카이블루,,정사이즈예요,보통이에요,화면과 비슷해요,160,53,55,색이 화면과 같아요 이너로 기본티셔츠로 잘 입고다나고 있습니다 두께도 적절해요 매우 잘 입고다녀요 매치하기도 쉬워요 굳굳 셔츠가 아주 맘에듭니다,Free
POruBhPJ,,23.01.30,라이트옐로우,,정사이즈예요,보통이에요,화면과 비슷해요,165,57,55,"색은 모델사진이랑 똑같아요!! 
스카이블루살려다 색이 넘 이뻐서 사봤는데 진짜 만족합니다
봄에 입으면 딱이쁜 개나리색?입니다",Free
SKqmG7zC,,22.12.30,블루그레이,,정사이즈예요,아주 만족해요,화면과 비슷해요,156,47,55,재질도 좋고 색감도 너무 마음에 듭니다 !! 쿨톤이신 분들께 블루 그레이 색상 추천합니다~~! 오래도록 예쁘게 입겠습니다,Free
2lIPlvL8,,22.12.28,화이트,,생각보다 커요,보통이에요,화면과 비슷해요,,,,키작은분들은 클것 같은데 핏이 예뻐여 추천합니다 품은 같은데 기장만 작은것도 나오면 좋을것같아여 ㅈ키작녀들은 너무 길수도,Free
T3w42WCv,,22.11.26,화이트,,생각보다 커요,보통이에요,화면과 비슷해요,,,,생각보다 엄청크고 핏 예뻐용 넉넉하게 입기 좋습니다! 좀 짱짱한 니트랑 레이어드해서 입기는 어려울거 같아요..ㅠㅠ!!,Free
호주머니,,22.11.07,블루그레이,,생각보다 커요,아주 만족해요,화면과 비슷해요,168,76,77,블루그레이 색감이 흔치 않은 색이라 너무너무 개성있고 예뻐요! 길이감도 적당하고 셔츠만 단독으로 입어도 피부에 거슬리는 거 전혀 없이 너무 예쁩니다~.~ 꼭 사세요,Free
qDXnkb12,,22.11.06,화이트,,정사이즈예요,아주 만족해요,화면과 비슷해요,165,52,55,두께감도 있어서 겨울에도 애용할 것 같아요~~! 정말 무난한 셔츠라서 집에 있으면 휘뚜루마뚜루 유용하게 잘 꺼내입을 옷이에용! 편하고 핏도 이쁘고 좋아요~!!,Free
u3VyYWOv,,22.11.01,라벤더,,생각보다 커요,보통이에요,화면과 비슷해요,168,61,66,색이랑 재질이 너무 이뻐요!! 요즘 옥스포드 셔츠에 빠졌는데 딱 이쁜 오버핏이라서 자주 입을꺼같아요ㅎㅎ 레이어드 하기에도 너무 좋아요!!,Free
ShTzcao5,,22.10.31,화이트,,정사이즈예요,보통이에요,화면과 비슷해요,160,58,44,"여기저기 입기 좋은 기본셔츠네요 소재는 생각보다 두께감이 있어서 가을,겨울 이너로 입기 좋을것같습니다 .
핏도 너무 어벙벙하지 않아요",Free
QHl6Tbhv,상위 15%,22.10.13,블루그레이,,생각보다 커요,아주 만족해요,화면보다 어두워요,,,,"생각보다 더 차분한 색인데 그래서 좋았어옹
그리고 재질이 엄청 탄탄하고 두꺼워요
가격값 하는거 같아요 오래입을 거 같은 느낌 ~",Free
Ga8nn8Nk,,22.10.10,블루그레이,,생각보다 커요,아주 만족해요,화면과 비슷해요,162,63,66,옷은 길이도 그렇고 생각보다 컸어요 탄탄한 느낌의 소재이구요 가격 대비 만족합니다 정리 안 된 실밥이 조금 있었는데 적기도 하고 저는 개의치 않아 하는 부분이라 상관없었어요!!,Free
6RO2shQ5,상위 15%,22.10.08,블루그레이,,정사이즈예요,아주 만족해요,화면과 비슷해요,,,,핏 이뻐요!! 그리고 생각보다 탄탄한 재질이에요 배송은 엄청 늦게와서 이제 단독으로 못입지만.. ㅜ 잘 입겠습니당..,Free
rblHyL64,,22.10.06,화이트,,정사이즈예요,아주 만족해요,화면과 비슷해요,,,,두깨가 엄청 얇지도 않고 탄탄한 재질이라서 지금 입기 딱 좋은 것 같아요! 그리고 깔끔한 흰색이라서 코디하기도 쉬운 것 같아용,Free
xVH9eyyf,,22.10.01,블루그레이,,생각보다 커요,보통이에요,화면과 비슷해요,163,58,66,핏이나 색상 디자인은 마음에 드는데 검수가 문제네요... 소매 걷었다가 깜짝 놀랐어요. 소매 안쪽에 볼펜으로 쓴게 그대로 남아있더라구요. 검수 꼼꼼히 해주세요.,Free
whdm******,상위 20%,22.09.28,화이트,,생각보다 커요,보통이에요,화면과 비슷해요,163,50,55,소재가 빳빳하기 보다는 흐물거려서 평소에 편하게 잘 입을 수 있을 것 같아요 오래걸리긴 했지만 그만큼 예뻐요,Free
F8nwLbDP,,22.09.27,블루그레이,,생각보다 커요,아주 만족해요,화면과 비슷해요,160,50,55,생각보다 커서 오버핏 느낌나는 셔츠에요. 아우터로 입으면 예뻐요!! 일단 색이 오묘하게 예뻐서 아주 만족스러워요.,Free
cact******,상위 15%,22.09.25,스카이블루,,정사이즈예요,아주 만족해요,화면과 비슷해요,161,46,55,"딱 원하던 오버핏 셔츠!
소라색이 어울릴까 고민 믾이하다가 샀는데 너무 예뻐요
재질도 바스락 거리는 얇은 재질 아니고 탄탄해서 좋아요 다른색 구매할만 하네요",Free
Z4XJuC0x,,22.09.25,라이트옐로우,,정사이즈예요,아주 만족해요,화면과 비슷해요,170,65,66,"품질이 좋고 사이즈도 맞아서 너무 좋아요 
회사다니면서 잘 입고 다닐것 같아요 
길이도 적당하고 
색상이 화면과 비슷해요 
너무 맘에 들어요",Free
V0gjl77W,,22.09.24,스카이블루,,정사이즈예요,아주 만족해요,화면과 비슷해요,165,70,66,핏도이쁘고 색감도 원하던 색이고 여리여리해보이고 너무 만족스럽네요 재질도 탄탄하고 얇지않아서 계절마다 입어도 되겠어여 한여름빼고요 ㅎ,Free
YOuZENpr,,22.09.23,라이트옐로우,,생각보다 커요,보통이에요,화면과 비슷해요,161,56,55,색깔도 예쁘고 두께도 좋은데 생각보다 훨씬 크고 마감처리가 좀 아쉬워요..ㅠㅠ 배송도 재주문 전부터도 오래 기다렸고 소매에 까만 뭐가 묻어있네용.. 그래도 예뻐요!,Free
UARomtOF,,22.09.23,베이지,,정사이즈예요,보통이에요,화면과 비슷해요,160,55,55,소라색 셔츠 예전에 샀는데 마음에 들어서 베이지색깔로 주문해봤습니다 역시 탄탄하고 구김도 잘 안가는 편이라 맘에 들어요,Free
S290IqVh,,22.09.16,블루그레이,,생각보다 커요,아주 만족해요,화면과 비슷해요,163,48,44,겉옷으로 입기 좋네요 후기에서 이 색이 좋대서 구매했는데 이 미묘한 색감 매우 만족 👍 요즘같은 간절기에 입고 다니기 좋아요 소매 한 번 접어서 입는게 제일 이쁜듯,Free
8k8IXFmT,,22.09.13,블루그레이,,정사이즈예요,아주 만족해요,화면과 비슷해요,168,70,66,탄탄한 정핏 남방인데 약간 주름이 지네요ㅠㅠ 한 번 착용했는데.. 그래도 왜 98도씨가 유명한지 알게 해 주는 상품입니다 퀄리티 진짜 좋음,Free
9292,,22.09.12,화이트,,생각보다 커요,보통이에요,화면과 비슷해요,159,48,66,셔츠가 생각보다 엄청 커요 ㅋㅋ 그래서인지 엉덩이 덮는 부분에 주름이 생긴다구 해야하나?? 그래도 박시한 핏이 좋아서 계속 입게 됩니다 👏🏻👏🏻,Free
qXjobDgO,,22.09.11,스카이블루,,생각보다 커요,아주 만족해요,화면과 비슷해요,170,77,77,두툼하고 질이너무좋아요 진짜 휘뚜루마뚜루템 색이 스카이블루라서 검은색이랑도 잘어울려요 다른색으로 좀 더 사려고 합니다,Free
nPe28eHt,,22.09.07,화이트,,생각보다 커요,아주 만족해요,화면과 비슷해요,166,57,55,그레이도 사고 만족해서 화이트 또 구매합니다 기본템으로 아주 굳굳 가을에 그레이 정말 많이 입고 다녔거든요 ㄷㄷ 화이트 기대 중임다,Free
9B1M7hHw,,22.09.07,화이트,,정사이즈예요,보통이에요,화면과 비슷해요,155,55,55,배송이 오래걸렸어요. 기다렸던것만큼 와! 이쁘다 하지는 않은것 같아요. 소매통이 생각보다 크고 소매 길이도 길어요. 근데 탄탄해서 오래 입을 것 같아요,Free
9B1M7hHw,,22.09.07,블루그레이,,생각보다 커요,보통이에요,화면과 비슷해요,155,55,55,배송이 오래걸렸어요. 기다렸던것만큼 와! 이쁘다 하지는 않은것 같아요. 소매통이 생각보다 크고 소매 길이도 길어요. 근데 탄탄해서 오래 입을 것 같아요,Free
tWtKjSRi,,22.09.04,블루그레이,,정사이즈예요,아주 만족해요,화면과 비슷해요,,,,색깔도 너무 마음에 들고 두께도 가을에 입기 딱 적당한 것 같아요~ 팔기장은 조금 길어서 접어서 입어야 할 듯 해요! 잘 입을게요!!,Free
juli****,,24.01.17,화이트,,정사이즈예요,보통이에요,화면과 비슷해요,166,55,55,날 풀리면 단독으로도 입어도 좋고 다른 옷들과 같이 입어도 좋은 기본색 셔츠 인 것 같아요!~! 원래 다른 색으로 엄청 잘 입다가 흰 색도 샀어요 ㅎ,Free
7ahvyZCz,상위 25%,23.05.23,화이트,,생각보다 커요,보통이에요,화면과 비슷해요,155,50,55,저는 딱 맞는 핏이 아니라 크게 외투처럼 걸쳐서 입을 생각으로 산거라 사이즈가 맘에 들어요. 근데 딱 맞는 핏을 원하면 크다고 느낄 것 같네요.,Free
gcNYAblN,,23.04.23,블루그레이,,정사이즈예요,아주 만족해요,화면과 비슷해요,161,64,66,"좋은 리뷰가 많이 있어서 구매하게 되었습니다.
한 달 넘게 사용한 것 같은데 질도 좋고 길이도 원하던 길이라 아주 만족하며 사용하고 있습니다!!",Free
gkXrOWB6,,23.03.28,라벤더,,생각보다 커요,아주 만족해요,화면과 비슷해요,153,43,44,사진보다는 밝아요 옷도 진짜 이뻐요 다만 조금 많이 커서 바지안에도 못넣어입을거같아요 겉에 걸치는 용도로나 바지안넣고 입어도 이뻐요!!,Free
gkXrOWB6,,23.03.28,블루그레이,,생각보다 커요,아주 만족해요,화면과 비슷해요,153,43,44,사진보다는 밝아요 옷도 진짜 이뻐요 다만 조금 많이 커서 바지안에도 못넣어입을거같아요 겉에 걸치는 용도로나 바지안넣고 입어도 이뻐요!!,Free
NZnx8PfM,,23.01.26,화이트,,정사이즈예요,아주 만족해요,화면과 비슷해요,167,61,66,몇년전에 하늘색 샀다가 아직도 너무 잘 입고 있어서 화이트도 구매했어요 색깔 하나씩 모아볼까 함. 탄탄해서 좋고 너무 얇지 않아서 더 좋아요. 오래 입을 수 있음,Free
OFvekJKB,,22.11.07,라이트옐로우,,정사이즈예요,아주 만족해요,화면과 비슷해요,154,49,55,"노란색 셔츠 꼭 사고싶었는데
합리적인 가격에 마감도 잘 되어있고
재질도 너무 맘에 들어서 샀어요
굳굳",Free
1SJBn02q,,22.10.27,블루그레이,,생각보다 커요,보통이에요,화면과 비슷해요,174,60,55,"데일리룩으로 편하게 입을 수 있어서 좋아요!
생각보다 크고 낙낙해서 안에 두껍게 입어도 편해요",Free
NtPOtwWs,,22.10.20,블루그레이,,생각보다 커요,보통이에요,화면보다 어두워요,159,45,44,질감도 괜찮고 색상은 생각보다 그레이지만 나쁘지 않고 여러모로 활용 가능한 사이즈 입니다,Free
OcuRhh6y,,22.10.19,블루그레이,,정사이즈예요,아주 만족해요,화면과 비슷해요,160,55,55,기본템 사려고 장만했어요 색은 화면이랑 비슷하고 크기는 오버핏으로 맞네요 재질도 판판해서 좋아요,Free
Fc4NUTpO,,22.10.15,블루그레이,,정사이즈예요,보통이에요,화면과 비슷해요,164,62,77,"옷 핏이 넘 이뻐요. 잘 산 것 같습니다!!
하지만 빨고나면 구김이 좀 심해서 다림질을 엄청 열심히해야해요... 그거 외엔 너무 좋슴다~~~",Free
wuRfnSY4,상위 20%,22.10.15,블루그레이,,생각보다 커요,보통이에요,화면과 비슷해요,165,54,55,진짜 크긴 한데 색감이 예뻐요ㅋㅋㅋ 딱 블루그레이라는 말 그대로예요. 폭닥폭닥 예뻐요~ 적당히 두꺼워요,Free
HEZ6eW78,,22.10.14,블루그레이,,정사이즈예요,보통이에요,화면과 비슷해요,,,,"소재가 탄탄해서 간절기에 겉에 걸쳐입기 좋아요!
셔츠중에 두께감이 좀 있는 편이고 재질이 좋습니다",Free
zjNsU6QB,,22.10.09,베이지,,정사이즈예요,보통이에요,화면과 비슷해요,162,45,55,출근할따 슬ㄹ랙스랑 편하게 코디해서 입기 좋아요 탄탄하고 두껍고 따뜻하고 핏 이쁍니다ㅏㅇ,Free
J9z4cRpA,상위 25%,22.10.08,블루그레이,,정사이즈예요,보통이에요,화면과 비슷해요,160,60,66,이거 색깔이 너무 예뻐요 길이도 적당해서 캐주얼도 가능 약간 차려입은 느낌도 가능이에요 굿굿,Free
39tLPHmk,,22.10.07,라이트옐로우,,정사이즈예요,아주 만족해요,화면과 비슷해요,157,48,55,색깔이 먼가 제가 생각햇던거보단 덜 받긴 한데 그래도 이정도먄 정말 만족함니당 예전에도 여기서 서츠산적 잇는데 퀄리티 넘조아서 다시 사는고에용 구욷~,Free
AcOcPc5H,,22.09.29,블루그레이,,생각보다 커요,아주 만족해요,화면과 비슷해요,,,,"질이 정말 탄탄하고 좋은데
생각보다 너무 크고 길어서.. 바지에 넣으면
불편하기도하네요ㅠ 근데 예뻐요",Free
fGfGM5UF,,22.09.28,블루그레이,,정사이즈예요,보통이에요,화면보다 어두워요,168,62,66,배송이 조금 늦긴했는데 적당히 오버핏이고 지금처럼 쌀쌀해지는 계절에 잘 입어질 것 같아요.,Free
ghbeuFKA,,22.09.24,블루그레이,,정사이즈예요,아주 만족해요,화면과 비슷해요,164,70,66,재질이 탄탄해서 좋아요 마감은 실밥 다 나와있어서 별로인데 원단은 가격대비 쏘굿이에요 사이즈도 넉넉해요,Free
CHAENNEY,,22.09.23,블루그레이,,생각보다 커요,아주 만족해요,화면보다 어두워요,167,65,55,처음에는 뭔가 정핏도 아니고 확 오버도 아니라 애매하다 생각했었는데 넣입 빼입 열입 닫입 다 예쁜 만능셔츠에요 소재도 잘 안구겨지고 너무 좋아요,Free
3DAd89P0,,22.09.22,베이지,,생각보다 커요,아주 만족해요,화면과 비슷해요,160,58,55,색도 이쁘고 약간 오버핏이라 좋아요 길이는 제 키에서 엉덩이 다 덮습니다 다른 색도 구매하고 싶어용,Free
14be5Vo2,,22.09.11,베이지,,생각보다 커요,보통이에요,화면과 비슷해요,163,58,55,원하는 재질의 셔츠에요. 사이즈도 와이드핏이라 맘에들어요. 색은 예상보다 밝은 베이지입니당,Free
857cMSxH,상위 10%,22.09.10,블루그레이,,생각보다 커요,아주 만족해요,화면과 비슷해요,164,53,55,"생각보다 조금 어벙벙한데 오히려 괜찮아요!
퀄리티도 색감도 예쁘고 무난해서 편하게입기 좋네용ㅎㅎ",Free
YNmKPNwU,,22.09.08,라벤더,,정사이즈예요,보통이에요,화면과 비슷해요,170,60,66,"색상은 이쁜데 핏이 좀 애매하네요
호프탄탄셔츠가 더 예쁜거같아요ㅠ 얘는 좀 흐물흐물한 느낌이라 ,, 애매",Free
6ppJIwk7,,22.09.07,라이트옐로우,,생각보다 커요,아주 만족해요,화면과 비슷해요,166,52,55,탄탄하고 가을겨울에 입기 좋은 두께감이에요 색감예뻐요 퀄리티도 나쁘지 않은 것 같아요 가성비!,Free
gwVvm2Wm,,22.09.05,라이트옐로우,,정사이즈예요,보통이에요,화면과 비슷해요,163,60,66,"색깔도 예쁘고 넉넉한 핏이라 좋아요
같이 시킨 조끼랑 입으면 예쁠 것 같네요
조끼도 빨리왔으면 좋겠어요",Free
rjax56U6,,22.08.31,블루그레이,,생각보다 커요,아주 만족해요,화면과 비슷해요,160,52,66,이거격에 이퀄리티 만족합니다 색상도 화면이랑 같아서 좋아요 가을에 잘입고 다닐거 같아서 기대됩니다,Free
KU12l8kJ,상위 15%,24.04.30,스카이블루,,생각보다 커요,보통이에요,화면과 비슷해요,164,47,55,옷이 정말커요 하지만 예뻐요 주변에서 색상예쁘다고 물어봤네요 겉에 두르기좋고 휘뚜루맞뚜루로 좋을 것아오 많이파세요,Free
