아이디,리뷰어 등급,작성 날짜,옵션1,옵션2,상품 사이즈,퀄리티,색감,키,몸무게,사이즈,리뷰내용,제품_사이즈
RqohgtDM,,24.09.22,(85)Brown (24FW),95.0,정사이즈예요,아주 만족해요,화면과 비슷해요,163,53,55,"광택이 살짝있고 재질이 구김도 없을꺼 같아서 좋아요~ 소매 롤업해서 아우터로도 잘입어질꺼같아요.
너무오버핏이 아니여서 넣어서 입어도 될듯해요^^",95.0
44q8RqoM,,24.09.21,(10)White (24FW),90.0,정사이즈예요,아주 만족해요,화면과 비슷해요,,,,구김이 심한것처럼 보이지만 팔 접어서 입으면 원피스앙 매칭하기 예쁩니다 색도 누런 셔츠가 아니라 쨍하느화이트라서 더 맘에 듭니다 예뻐요,90.0
MbmCsVH3,상위 25%,24.09.21,(52)Dark Blue (24FW),90.0,정사이즈예요,아주 만족해요,화면과 비슷해요,159,51,55,"색감도 이쁘고 사이즈도 딱입니다!
연휴가 껴있었는데 배송도 빠르고 가성비 최고입니다.
단추 부분 마감이 살짝 아쉬운데 그건 다듬으면 되니까 신경 안쓰입니다!",90.0
6rnBNvAc,,24.09.21,(15)Gray (24FW),95.0,정사이즈예요,보통이에요,화면과 비슷해요,,,,맘에 들어요! 확실히 구김이 잘 지는 재질이긴 한데요 그래도 예뻐서요~ 입을 듯 두께는 적당하고 회색 스트라이프도 낭낭하니 예쁘네요~,95.0
e3rA0ltg,상위 10%,24.09.20,(10)White (24FW),90.0,정사이즈예요,보통이에요,화면과 비슷해요,156,46,55,재질좋고 오버핏인라 더 멋스럽게 입기좋아요~~^^ 빛날영 착장보고 구매한건데 다른색도 사고싶네요~~화이트색이라 여기저기 코디 잘할수있어요~~,90.0
SW85O4pq,,24.09.10,(03)Dark Navy (24FW),100.0,정사이즈예요,보통이에요,화면보다 어두워요,165,63,77,다크네이비라 되어있는데 블랙느낌이에요 네이비가 아니라 블랙이랑 같이 비춰보면 덜 블랙같은 느낌이랄까? 색이 좀 아쉽지맠 그래도 폼 넉넉하니 좋네요 약간 바스락재질같아요,100.0
CZzHO9T8,상위 10%,24.09.06,(15)Gray (24FW),90.0,정사이즈예요,아주 만족해요,화면보다 어두워요,156,50,55,"핏이랑 재질 둘다 넘 맘에 들어요!! 캐주얼이랑 포멀 다 잘어울립니다. 슬랙스에 입고 하객룩으로, 청바지에 입고 출근룩으로 애용하고 있어요",90.0
imnd*****,상위 30%,24.09.05,(BS)Dark Green (24FW),95.0,정사이즈예요,아주 만족해요,화면과 비슷해요,,,,이거 실제로 보면 너무 초록색 아니고 단정하고 은근 찾기 힘든 색임. 예뻐요 뒤가 보통 카키색이라 하는 셔츠니까 색 참고 하세요 밝기는 훨씬 어두워요 피부색 밝은 딥톤 분들 추천,95.0
AQ04c4D0,상위 15%,24.09.05,(25)Pink (24FW),90.0,정사이즈예요,아주 만족해요,화면과 비슷해요,166,57,55,사진이 보라보라하게 나왔는데 실제로는 약감 톤다운된 베이비 핑크? 같은 느낌이에요. 웜톤분들이 잘 어울릴것 같아요. 핏도 적당하고 완전 마음에 듭니다,90.0
kimbin,상위 5%,24.09.04,(60)Charcoal (24FW),100.0,생각보다 커요,아주 만족해요,화면과 비슷해요,168,70,88,"조금여유있습니다. 어깨선이 밖으로 나와서 살짝 핏이 낙낙한 느낌이에요. 봄,여름에 흰색 파랑색도 구입했는데 사이즈에맞고 재질이좋아서 차콜색으로 구입했습니다. 마음에들어요.",100.0
YS0VQpUv,,24.09.02,(10)White (24FW),90.0,생각보다 커요,보통이에요,화면과 비슷해요,160,53,55,"좀 얇은닠김에요 기본 와이셔츠 필요해서 구매햇는데 사이즈는 오버핏입니다, 안에 나시 입고 착용추천하구요 냄새는 좀 많이나서 스타일러 돌렷는데도 안빠졋어요 세탁해서 입어야하나봐요",90.0
Mh6g6yRc,,24.08.30,(15)Gray (24FW),90.0,생각보다 커요,아주 만족해요,화면과 비슷해요,163,50,55,"살짝 낙낙하게 예쁘게 맞아요
간절기에 입기 좋을 것 같아요
레이어드하기에도 좋고 소재도 부드러우면서도 바스락거리는 느낌!! 마음에들어요",90.0
루카스,,24.08.30,(10)White (24FW),90.0,생각보다 커요,보통이에요,화면과 비슷해요,166,55,55,무난하게 입기좋아요 딱 기본 오버핏 셔츠에요 얇아서 여름 초가을에 입어야댈것같아영 늦가을~ 초봄은 입으면 추울것같아서 위에니트입거나해야댈듯여,90.0
lde9*****,,24.08.28,(52)Dark Blue (24FW),90.0,정사이즈예요,아주 만족해요,화면과 비슷해요,167,52,55,상세페이지 색상이랑 똑같고 핏도 원하던 느낌이라 만족합니다 가격대비 너무 좋네요 다른 색상도 보고 괜찮은 컬러 있으면 추가로 사려구요,90.0
vJRhfssu,,24.04.18,(15)Gray (23FW),95.0,정사이즈예요,아주 만족해요,화면과 비슷해요,160,67,77,재질 좋고 마감도 깨끗하게 왔어요! 박시하게 나와서 상비인에도 예쁘게 잘 맞아요! 직진배송이라 급격히 더워진 날씨에 요긴하게 잘 입었어요 ㅎㅎ,95.0
x9hcoVdU,상위 20%,25.01.13,(50)Blue (24FW),90.0,생각보다 커요,아주 만족해요,화면과 비슷해요,158,42,55,"오프숄도 그레이 니트 안에 받쳐 입으려고 샀습니다~
베이직한 디자인의 예쁜 파랑색 셔츠입니다~ 편하게 잘 입을 거 같아요~",90.0
syrg*****,,25.01.11,(10)White (24FW),95.0,정사이즈예요,보통이에요,화면과 비슷해요,160,55,,가성비이긴한데 팔 소매가 짧고 허리부분이 루즈해서 좀 부해보여요 ㅜㅜ 단독으로는 못입을것같아요 그래도 가격생각하면 잘 입을것같아요,95.0
bobe******,,25.01.10,(10)White (24FW),90.0,정사이즈예요,보통이에요,화면과 비슷해요,158,50,55,카라가 좀 크긴한데 핏은 예쁩니다! 비침 별로없고 소재도 좋아서 아무때나 입기 좋습니다! 잘 입 .겠습니다 감사합니다~,90.0
hwwa1xbt,상위 5%,25.01.08,(15)Gray (24FW),90.0,정사이즈예요,아주 만족해요,화면과 비슷해요,157,49,55,저렴한데 퀄리티는 좋습니다 스프라이트 줄 셔츠가 필요했는데 생각보다 퀄리티도 좋고 핏이 아주 맘에 듭니다 출근룩으로 잘 입고다닙니다,90.0
gxYeFqR6,상위 20%,24.12.25,(10)White (24FW),100.0,정사이즈예요,아주 만족해요,화면과 비슷해요,172,58,55,바스락거리는 소재의 셔츠라서 레이어드해서 입으려고 샀는데 넘 마음에 들었어요 오버핏이라서 넉넉하니 좋습니다!!,100.0
mini_look,상위 10%,24.12.24,(50)Blue (24FW),90.0,정사이즈예요,보통이에요,화면과 비슷해요,,,,화이트 잘 입어서 블루 컬러도 구매했어요! 진짜 무난하고 정핏이라 데일리로 입기 좋아요-~!! 니트안에 입어도 핏이 괜찮움!,90.0
02MZS2OB,상위 10%,24.12.23,(99)Mix (24FW),90.0,정사이즈예요,아주 만족해요,화면과 비슷해요,,,,예쁜 오버핏 셔츠여서 마음에 들고 웜톤에게 잘 어울리는 브라운 색깔의 셔츠여서 좋습니당. 배송도 빠르게 와서 감사합니다~,90.0
0G8wV9Sv,상위 15%,24.12.19,(03)Dark Navy (24FW),95.0,정사이즈예요,아주 만족해요,화면보다 어두워요,170,53,66,음 화면보다 어두워요...사실상 블랙과 다를 바 없는 색입니다ㅠㅠ그래도 입을 때 편하고 퀄리티도 좋아요! 자주 입고 다녀요 :),95.0
o2sx8wsa,상위 10%,24.12.17,(10)White (24FW),90.0,생각보다 커요,아주 만족해요,화면과 비슷해요,166,72,66,기본 셔츠로 좋아요. 대신 오버핏이라 77까지는 S해도 괜찮을 것 같습니다. 카라가 단단하고 커서 레이어드 하기 좋습니다.,90.0
webnpVUb,상위 20%,24.12.10,(03)Dark Navy (24FW),95.0,정사이즈예요,아주 만족해요,화면과 비슷해요,167,68,66,"박시한 느낌이에요 재질도 탄탄하고 신축성 좋습니다 
급하게 네이비 계열 셔츠가 필요했는데 배송도 빠르고 감사합니다!",95.0
zn3Swk3L,상위 15%,24.12.04,(60)Charcoal (24FW),90.0,정사이즈예요,보통이에요,화면과 비슷해요,,,,배송도 빠르고 비닐팩 단독 포장에 옷걸이도 주셔서 기분 좋게 받았어요. 옷 퀄리티도 괜찮아요. 차콜색 이뻐요. 추천합니다.,90.0
9D2lCTpG,상위 10%,24.12.02,(85)Brown (24FW),100.0,정사이즈예요,아주 만족해요,화면과 비슷해요,164,60,66,"딱 제가 원하던 핏과 디자인 입니다. 너무 어벙하지도, 슬림하지도 않아 좋아요. 색깔은 이쁜 나무색입니다. 갈웜에게 추천해요!",100.0
LRuxOl0U,,24.12.01,(BS)Dark Green (24FW),95.0,생각보다 커요,보통이에요,화면과 비슷해요,160,54,66,이정도 색감이에요 생각보다 어둡지만 오히려 단정해보여서 맘에 들어요! 오버핏이라 66입으시는 분들도 90사이즈 구매하셔도 될 듯..,95.0
hese**,상위 15%,24.11.28,(50)Blue (24FW),90.0,정사이즈예요,아주 만족해요,화면과 비슷해요,161,51,55,"기본 셔츠로 딱이에요!! :)
저렴하고 가격대비 질도 좋아서 완전 만족해용
다른 색으로 여러벌 쟁여도 괜찮을 거 같아용 ㅋㅋ",90.0
hyle*****,상위 30%,24.11.27,(50)Blue (24FW),90.0,정사이즈예요,보통이에요,화면과 비슷해요,168,52,55,"셔츠 너무 마음에 들어요 
적당한 소재감, 길이 
가격대도 세일해서 잘 샀어요 
겨울이니까 니트랑 잘 코디해서 입으려구요",90.0
Tj8lWaxv,,24.11.25,(15)Gray (24FW),90.0,생각보다 커요,아주 만족해요,화면과 비슷해요,165,48,55,스파 브랜드인 만큼 마감처리나 질은 보세에 비해서 좋아오 근데 세미 오버핏이어서 그런지 가오리 모양이 되더라고여ㅋㅋㅋ,90.0
건망고,상위 25%,24.11.25,(50)Blue (24FW),95.0,생각보다 커요,보통이에요,화면보다 어두워요,165,52,55,"옷장에 입을 옷이 없어서 구경하다가 발견한 옷이에요~~~
촉감은 빳빳한 느낌??이고 색감도 쨍하면서 핏도 마음에 들어요ㅎ",95.0
an10zlAJ,상위 25%,24.11.21,(99)Mix (24FW),95.0,정사이즈예요,아주 만족해요,화면과 비슷해요,167,57,66,길이도 적당하고 소재도 좋아요 출근할때 가볍게 입기 딱 입니다 저는 안에 목티 입어서 레이어드로 매치하는데...이쁩니다!,95.0
Q6v9Oz3T,상위 15%,24.11.19,(10)White (24FW),90.0,생각보다 커요,아주 만족해요,화면과 비슷해요,167,49,44,오버핏 셔츠라 레이어드 해서 입기 괜찮고 가격대비 나쁘지 않은거 같아요~~~ 배송도 적당히 빠르고 만족합니다아~~!,90.0
Q6v9Oz3T,상위 15%,24.11.19,(50)Blue (24FW),90.0,생각보다 커요,보통이에요,화면과 비슷해요,167,49,44,옷은 생각보다 살짝 큰 오버핏이고 색상은 예쁘네요 니트안에 레이어드 해서 입으려고 샀는데 맘에 들어요 배송도 적당하고 괜츈~~!,90.0
wUEnPPQT,상위 25%,24.11.07,(15)Gray (24FW),90.0,생각보다 커요,보통이에요,화면과 비슷해요,158,48,55,다크 블루 구매하면서 같이 구매했어요 깔끔하니 기본템으로 좋을거 같아요 사이즈는 생각보다 박시한 느낌이긴 합니다 가격대비 만족해요,90.0
v5BB77ls,상위 20%,24.10.29,(60)Charcoal (24FW),90.0,생각보다 커요,아주 만족해요,화면과 비슷해요,158,50,55,오버핏 셔츠입니다! 롱치마 위에 같이 입으려구 샀어요! 색감도 차콜색으로 예쁘고 맘에 들어요 소재도 탄탄하고 좋네요,90.0
uc7WCHEj,,24.10.25,(10)White (24FW),90.0,정사이즈예요,아주 만족해요,화면과 비슷해요,167,53,55,생각보다 더 오버핏이네요..! 넉넉하게 잘 입을거 같습니다. 하얀 화이트 색감이라 깔끔하게 예뻐요~ 어디에나 잘 어울릴듯!,90.0
o4NyWM0I,상위 10%,25.01.07,(50)Blue (24FW),100.0,정사이즈예요,보통이에요,화면보다 어두워요,,,,실제 색감이 훨 더 예쁩니당! 정핏으로 입으려고 딱 맞게 샀더니 예쁘게 딱 떨어져요~ ㅎㅎ 단독으로 입어도 예뻐서 잘 입을 것 같습니다,100.0
89XpKV2v,상위 10%,24.12.17,(52)Dark Blue (24FW),90.0,정사이즈예요,보통이에요,화면과 비슷해요,155,49,44,"실제로는 이것보다 약간 더 밝아요. 개인적으로 색감이 너무 예뻐서 만족했습니다. 레이어드로도 입을 수 있고, 단독으로도 입을 수 있을 것 같아요",90.0
a2KxcEZ2,상위 15%,24.12.14,(10)White (24FW),95.0,생각보다 커요,보통이에요,화면과 비슷해요,,,,"사이즈가 생각보다 많이큽니다. 통상 입는 사이즈보다 하나 혹은 두 사이즈 내려서 사도 될거 같아요. 소재는 주름이 광장히 많이 져서, 이 부분 감안하시면 좋습니다.",95.0
s1U7Wrpy,상위 15%,24.12.08,(10)White (24FW),90.0,정사이즈예요,아주 만족해요,화면과 비슷해요,168,58,55,넥 부분이 잘 잡혀 있어서 좋아요 이너로 자주 입는데 생각보다 사이즈는 크게 나왔어요 오버핏인듯 재질도 맘에 들고 오래 입을 수 있을 거 같아요,90.0
eevy2973,상위 30%,24.12.02,(10)White (24FW),90.0,정사이즈예요,아주 만족해요,화면과 비슷해요,165,48,44,"면접룩으로 필요했는데 블프 기간에 아주 좋은 가격에
잘 샀습니다 ㅎㅎ 기본 셔츠라 검정 슬랙스뿐만 아니라 다양한 하의와 매치해도 잘어울려요!!",90.0
4KqGdOOz,상위 30%,24.11.16,(10)White (24FW),90.0,정사이즈예요,보통이에요,화면과 비슷해요,163,55,55,여름셔츠 잘입어서 긴거도 구매했어요 근데 좀 많이 비쳐요 안에 이너 꼭 필요하고 그래도 비칠듯한 소재라 아쉬워요 카라도 커서 애매합니다,90.0
wHB1dEin,상위 10%,24.10.16,(50)Blue (24FW),95.0,정사이즈예요,아주 만족해요,화면과 비슷해요,168,59,55,매장에서 입어보고 샀는데 오버핏과 정사이즈 그 사이인게 딱 기본으로 입기 좋아요! 카라도 뻣뻣하게 올라오지 않고 목부분 여유있어서 자주 입을 것 같아요!,95.0
0ZIVJWsI,,24.10.11,(50)Blue (24FW),95.0,생각보다 커요,아주 만족해요,화면과 비슷해요,173,62,66,"블루,그레이 두가지 구입. 상의66입어요
요즘 살찐탓에 오버핏 셔츠지만m 구매했어요
키가있는편이라 팔길이랑 생각하면 잘한거 같습니다 s도 입어두될거같아요! 오버핏 셔츠라 
넣어입기. 레이어드 다양하게 깔끔히 입을거 같습니다 할인덕분에 득템-♡!♡",95.0
wLNAZOBc,상위 10%,24.10.10,(10)White (24FW),90.0,정사이즈예요,아주 만족해요,화면과 비슷해요,158,55,55,매장에서 입어보고 마침 온라인에서 세일 중이라 싸게 구매해서 뿌듯하네용... 가격대비 퀄이 좋아서 여기저기 잘 입을 수 있을 것 같음,90.0
4hWlFWn9,,24.10.05,(60)Charcoal (24FW),95.0,정사이즈예요,아주 만족해요,화면보다 밝아요,165,66,66,사이즈는 정사이즈 같아요. 탄탄한데 주름은 마니 갈거같아요. 생각보다 웜한 컬러는 아니여서 덜 어울리긴 하는데 가을에 잘 입을거가타요,95.0
0t3y2i1v,,24.09.25,(60)Charcoal (24FW),90.0,정사이즈예요,아주 만족해요,화면보다 어두워요,155,42,55,색상도 딱 원하던 어두운 그레이 색감에 단추까지 색상 맞추는 디테일이 좋았어욤 ㅎㅎ 개인적으로 셔츠는 넣입보다 빼서 입는 스타일 좋아하는데 그렇게 입었을때 딱 예쁜 박시한 오버핏입니당,90.0
OTYL8TWF,,24.09.24,(50)Blue (24FW),90.0,정사이즈예요,아주 만족해요,화면과 비슷해요,171,56,66,어느 유튜브를 보고 구입했는데 괜찮았던 제품이에오 색상도 생각했던 거랑 비슷하고 핏은 마른 체형에 조금 큰 거 같아요 .. 그래도 잘 산거같아요!,90.0
코코아랏,상위 25%,24.09.22,(10)White (24FW),90.0,생각보다 커요,아주 만족해요,화면과 비슷해요,163,50,55,"구김은 셔츠라 어쩔 수 없는것 같아요
세미오버핏이라고 했는데 그냥 오버핏 같아요
스몰인데도, 굉장히 박시하네요
기본템으로 샀는데, 생각보다 커서 당황했지만, 간절기 외투처럼 입어도 괜찮을것 같네요",90.0
WlUSAqp0,,24.09.21,(10)White (24FW),90.0,정사이즈예요,아주 만족해요,화면과 비슷해요,163,57,66,기본으로 여러 코디에 입을만한 셔츠입니다. 평소에 M사이즈 입는데 리뷰 보고 S로 주문했더니 딱 좋더라구요. 또 구김이 잘 가는 재질이라 잘 다림질 해서 입어야 할 것 같아요,90.0
6VfVGFBZ,,24.09.21,(15)Gray (24FW),95.0,정사이즈예요,보통이에요,화면과 비슷해요,162,55,55,"귀여워 보이는 살짝 오버핏 셔츠에요 
직장에서나 데이트 할때나 어울리게 잘 코디해서 입을 수 있는 무난템입니다! 풀어서 입어도 될것같아요",95.0
0t3y2i1v,,24.09.25,(60)Charcoal (24FW),90.0,정사이즈예요,아주 만족해요,화면보다 어두워요,155,42,55,색상도 딱 원하던 어두운 그레이 색감에 단추까지 색상 맞추는 디테일이 좋았어욤 ㅎㅎ 개인적으로 셔츠는 넣입보다 빼서 입는 스타일 좋아하는데 그렇게 입었을때 딱 예쁜 박시한 오버핏입니당,90.0
OTYL8TWF,,24.09.24,(50)Blue (24FW),90.0,정사이즈예요,아주 만족해요,화면과 비슷해요,171,56,66,어느 유튜브를 보고 구입했는데 괜찮았던 제품이에오 색상도 생각했던 거랑 비슷하고 핏은 마른 체형에 조금 큰 거 같아요 .. 그래도 잘 산거같아요!,90.0
코코아랏,상위 25%,24.09.22,(10)White (24FW),90.0,생각보다 커요,아주 만족해요,화면과 비슷해요,163,50,55,"구김은 셔츠라 어쩔 수 없는것 같아요
세미오버핏이라고 했는데 그냥 오버핏 같아요
스몰인데도, 굉장히 박시하네요
기본템으로 샀는데, 생각보다 커서 당황했지만, 간절기 외투처럼 입어도 괜찮을것 같네요",90.0
WlUSAqp0,,24.09.21,(10)White (24FW),90.0,정사이즈예요,아주 만족해요,화면과 비슷해요,163,57,66,기본으로 여러 코디에 입을만한 셔츠입니다. 평소에 M사이즈 입는데 리뷰 보고 S로 주문했더니 딱 좋더라구요. 또 구김이 잘 가는 재질이라 잘 다림질 해서 입어야 할 것 같아요,90.0
6VfVGFBZ,,24.09.21,(15)Gray (24FW),95.0,정사이즈예요,보통이에요,화면과 비슷해요,162,55,55,"귀여워 보이는 살짝 오버핏 셔츠에요 
직장에서나 데이트 할때나 어울리게 잘 코디해서 입을 수 있는 무난템입니다! 풀어서 입어도 될것같아요",95.0
hL8QqRdm,,24.03.18,(49)Khaki,95.0,정사이즈예요,아주 만족해요,화면과 비슷해요,165,40,44,배송이 일단 빨랐고 구김이 많이 가는 재질이지만 탄탄하게 좋아요! 입기 전 다리미로 다려입으면 좋을 것 같아요. 요즘은 다 오버핏인데 요곤 딱 핏에 맞아서 좋습니다,95.0
NIhloQtR,,25.01.13,(15)Gray (24FW),90.0,생각보다 커요,보통이에요,화면과 비슷해요,168,63,66,"매장에서 보고 샀어요
사이즈가 큰편이라 168인데도 90사도 엉덩이덮어줘서 좋아요
재질이 엄청 뛰어나진않은데 가격대비조아요",90.0
eo3gfB7x,,25.01.12,(99)Mix (24FW),90.0,정사이즈예요,보통이에요,화면보다 어두워요,155,50,55,색감이 약간 애매할 수도 있어요. 단독보다는 잘 레이어드 해서 입으면 좋을 것 같아요. 재질이랑 상태는 좋아요. 포장 상태도 굿,90.0
yphuVt1G,,25.01.10,(99)Mix (24FW),100.0,정사이즈예요,보통이에요,화면과 비슷해요,171,56,,"핏도 예쁘고 화면 그대로 배송이 되어 좋았습니다
불편하지도 않았습니다 배송이 올 때 구겨짐이 
별로 없었고 생각보다 통이 조금 크지만 예쁘게 입을 수 있을걸 같아용",100.0
3fTqfOYV,상위 10%,25.01.07,(19)Black (24FW),90.0,정사이즈예요,아주 만족해요,화면과 비슷해요,163,46,44,"셔츠 깔끔하고 예뻐요
일할 때 잘 입고 있습니다 굿이에용
생각보다 구겨짐 크게 없고 핏이 촤르륵 잘 떨어져요
먼지도 덜 붙는 재질인 거 같아요",90.0
xasEKqvB,상위 30%,25.01.03,(10)White (24FW),90.0,정사이즈예요,아주 만족해요,화면과 비슷해요,155,50,55,"바스락거리는 재질의 셔츠입니다.
무난한 스타일인데 하나 나두면 두루두루 입을 것 같아서 구매해봤어요. 길이는 좀 길긴 합니다",90.0
lhhaCd8o,상위 20%,24.12.16,(10)White (24FW),90.0,정사이즈예요,아주 만족해요,화면과 비슷해요,162,47,55,셔츠는 항상 미쏘에서 삽니다! 정말 무난무난하고 딱 깔끔한 기본 셔츠예요. 저번에도 미쏘에서 파랑 셔츠 샀었는데 색감이 너무 예뻐서 잘 어울린다고 칭찬 받았어요ㅎㅎ,90.0
6t3AQWED,,24.11.28,(10)White (24FW),95.0,생각보다 커요,아주 만족해요,화면과 비슷해요,163,58,55,제가 사이즈를 미스 한건지 생각보다 품이 컸어요 단독으로 입기는 편하게 박시하게 입기 좋구요 위에 레이어드 해서 입기는 어려운 사이즈에요 기본으로 탄탄한 셔츠 입니다,95.0
lUn4sMwH,,24.11.23,(15)Gray (24FW),90.0,정사이즈예요,보통이에요,화면과 비슷해요,166,52,55,자켓 안에 입기에도 좋고 괜찮았어여 생각보다 얇긴 했는데 이것저것 같이 겹쳐 입으면 될듯 합니당 세미 오버핏 길이 맘에 들어영,90.0
sihRVYjZ,상위 30%,24.11.19,(10)White (24FW),90.0,정사이즈예요,아주 만족해요,화면과 비슷해요,170,53,55,"딱 기본 루즈핏 셔츠예요
넣어입기애도 좋고, 
빼서 입기에도 좋아요
적당히 루즈핏이라 뚱뚱해 보이지 않아서 좋아요
두께도 적당해서 좋아요",90.0
9Wkx5IP8,상위 15%,24.11.17,(52)Dark Blue (24FW),100.0,정사이즈예요,아주 만족해요,화면과 비슷해요,,,,"빠른배송에 포장도 옷걸이에 와서 역시 브랜드구나 했습니다
재질은 세탁후 건조기 까지 했는데 그대로 입니다 색상이 너무 이뻐서 데일리템 입니다",100.0
x5Jn0cZ8,,24.11.15,(15)Gray (24FW),90.0,정사이즈예요,보통이에요,화면과 비슷해요,160,58,66,"매장에서 보고 재질 등 마음에 들어서 지그재그로 구매했어요
참고로 이 색깔이랑 다른 색상 제품의 재질이 좀 달라요
어디에나 잘어울리고 유행 안타는 기본템입니다.",90.0
제리퐁,상위 25%,24.10.27,(50)Blue (24FW),90.0,정사이즈예요,아주 만족해요,화면과 비슷해요,160,50,55,불끄고 찍어서 그렇지 컬러가 진짜 무난한 블루에요! 어디에나 매치하기 좋은거요 튀는색도 아니고 너무 연하지도 진하지도 않은~,90.0
MZbAW3Gv,,24.10.19,(03)Dark Navy (24FW),90.0,정사이즈예요,보통이에요,화면과 비슷해요,,,,"진짜 진한 네이비라 거의 검정색입니다. 

촌스럽지 않은 네이비라 색은 맘에 들지만 생각보다 조금 반짝거리는(?) 재질이어서 조금 아쉽네요.",90.0
hbrBPMuh,,24.10.15,(10)White (24FW),95.0,정사이즈예요,보통이에요,화면과 비슷해요,162,50,55,베이직하고 깔끔한 흰색 셔츠라서 기본템으로 쟁여두기 좋은 것 같아요! 오버핏이라 입었을 때 편하고 니트조끼랑 입으니까 예뻐요,95.0
soh0***,상위 15%,24.10.04,(BS)Dark Green (24FW),90.0,생각보다 커요,아주 만족해요,화면과 비슷해요,158,43,44,"가을가을한 초록색이 얼굴색을 더 예뻐보이게 하는 것 같아요 바스락 거리는 재질이고, 소매가 좀 넉넉해서 걷어올릴 때 좋아요",90.0
otARFhFN,상위 25%,24.10.02,(52)Dark Blue (24FW),90.0,정사이즈예요,아주 만족해요,화면과 비슷해요,158,48,44,"색감 쨍하고 예뻐요ㅎㅎ
세미오버인데 생각보다 여유로운 핏이라
레이어드하기는 애매하지만
단독으로 입어도 너무 예뻐서 만족해요 ><!!",90.0
kZIaX58V,상위 25%,24.09.30,(10)White (24FW),90.0,정사이즈예요,보통이에요,화면과 비슷해요,155,43,44,기본 흰색 셔츠입니다. 찰랑이는 소재를 생각했는데 약간 바스락거리는 소재네요.. 레이어드해서 입으려고 산건데 괜찮은거 같아요,90.0
1LCFynZS,,24.09.25,(60)Charcoal (24FW),90.0,생각보다 커요,보통이에요,화면과 비슷해요,158,44,44,"잘 구겨지는 소재이긴 하지만 편하게 툭 걸쳐 입기 좋습니다
색상도 딱 이쁜 차콜색이예요
격식 차릴때 입어도 괜찮을거 같아요",90.0
shin******,,24.09.24,(50)Blue (24FW),95.0,정사이즈예요,보통이에요,화면과 비슷해요,163,53,55,색상은 딱 원했던 블루 색상으로 요즘 날씨에 아우터 대용으로 입기에 좋을 것 같아요 소재 자체는 구김이 많이 갈 것 같긴해요,95.0
4LJcXlps,,24.09.22,(10)White (24FW),90.0,생각보다 커요,보통이에요,화면과 비슷해요,166,66,66,기본템으로 정말 잘 입고 있습니다~! 조금 오바핏이라 팔 조금 걷고 청바지에 매치해도 이뻐요 ㅎㅎ깔별로 데일리 템으로 입고 있어요,90.0
eQq9xBHk,,24.09.22,(15)Gray (24FW),90.0,정사이즈예요,아주 만족해요,화면과 비슷해요,161,50,55,레이어드하기 좋은 옷인 것 같아요 배송도 빨랐습니다 품질도 탄탄하고 만족스럽네요 다른 색상으로 추가 구매하겠습니다,90.0
lvDoNNpF,상위 20%,24.09.21,(15)Gray (24FW),95.0,생각보다 커요,보통이에요,화면과 비슷해요,160,61,66,사이즈 여유있고 기본템으로 여기저기 다 잘 어울려요. 주름이 잘 생겨서 다림질은 필수예요. 저렴하고 배송도 빠르고 만족!,95.0
