아이디,리뷰어 등급,작성 날짜,옵션1,옵션2,상품 사이즈,퀄리티,색감,키,몸무게,사이즈,리뷰내용,제품_사이즈
EDNLuWI4,,23.10.31,화이트,,생각보다 커요,보통이에요,화면과 비슷해요,163,50,44,두꺼운 재질 주름 잘짐 박시함 두꺼운 재질 주름 잘짐 박시함 두꺼운 재질 주름 잘짐 박시함 두꺼운 재질 주름 잘짐 박시함 두꺼운 재질 주름 잘짐 박시함,Free
DMQPiFQo,,23.05.07,화이트,,정사이즈예요,보통이에요,화면과 비슷해요,169,58,33 이하,만족합니다 약간 얇은느낌이었어서 한여름에 걸쳐입어야하나 했는데 오늘 입어보니까 썰렁한 날씨여도 바람불때 빼고 별로 춥지 않더라고요 잘입을게요,Free
4NxbDhQW,상위 30%,23.04.15,블루그레이,,정사이즈예요,아주 만족해요,화면과 비슷해요,,,,프리미엄 옥스포드 셔츠 추천합니다! 블루그레이 색상 너무너무 만족스러워요! 색상 고민하고 계시다면 블루그레니 강추합니다!,Free
hpRyITw7,,23.03.30,스카이블루,,생각보다 커요,보통이에요,화면과 비슷해요,165,61,55,가격대비 쏘쏘해용 봄가을에 잘 입겠네요. 후기많아서 믿고 샀습니다. 감사합니다 잘 입을게요 어러분도 잘 사서 잘 입으세오~,Free
0HC0AzFF,,22.10.19,블루그레이,,생각보다 커요,보통이에요,화면과 비슷해요,160,50,55,"그냥 무난히 잘 입을 것 같아요
사이즈 넉넉하고 퀄리티 나쁘지 않습니다.!!
색상도 화면 그대로에요",Free
qYvDlxpk,,22.10.15,라이트옐로우,,생각보다 커요,아주 만족해요,화면과 비슷해요,163,65,66,딱 상세샷처럼 예쁘고 편합니다 데일리로 많이 입었어요 노랑옷은 첨사는데 괜찮았습니다 비침은 있어요,Free
pKUHfPxJ,,22.10.14,화이트,,생각보다 커요,보통이에요,화면과 비슷해요,,,,니트조끼랑 같이 입으려고 샀는데 정말 잘 산 것 같아요 색상은 화면이랑 비슷해요! 배송이 좀 느렸어요,Free
4MKCJvDM,,22.10.07,블루그레이,,정사이즈예요,보통이에요,화면보다 어두워요,167,61,55,블루그레이 화면보다 색상 어둡고 그레이에 훨씬 가까워요 단추부분에 실밥도 많이 튀어나오네요 핏은 맘에 들어요,Free
Rxt8Ltlj,,22.09.24,블루그레이,,정사이즈예요,아주 만족해요,화면보다 어두워요,157,64,77,사실 블루그레이라곤 하는데 어디서 블루를 찾아야할지는 모르겠어요 그레이 99에 블루 1..? 0.5..? 근데 뭐 기본 셔츠라 여기저기 입기 편해요,Free
Ek5EqJo0,,22.09.20,블루그레이,,생각보다 커요,아주 만족해요,화면과 비슷해요,155,47,44,"작년에 사고 잘 입어서 하나 더 샀어요
질도 가격대비 너무너무 좋고 트레이닝 복, 슬랙스, 데님
이곳 저곳 다 잘 어울려요.. 휘뚤마뚤 최고 만능템 !!",Free
dOAhe0Ez,,23.11.02,화이트,FREE,정사이즈예요,보통이에요,화면과 비슷해요,166,53,55,"빳빳해서 좋아요! 재질이 괜찮고, 두께감이 있어서 가을겨울에 잘 입을 것 같습니당",Free
yuSbmFtp,,23.10.20,블루그레이,,정사이즈예요,아주 만족해요,화면과 비슷해요,155,47,44,예전에 구매했을 때 너무 만족했었는데 잃어버린 후 재구매한 제품이에요.ᐟ 품도 낙낙한데 디자인도 예뻐서 왜 유명한지 알겠는 ..♥️,Free
eaoEPulo,,23.03.23,라이트옐로우,,생각보다 커요,아주 만족해요,화면과 비슷해요,171,63,66,색감 미쳤습니당 .. 딱 원하던 밝은 노랑이에요 ! 봄에 꽃놀이 갈때 넘 이쁠꺼 같아용 근데 생각한것보단 좀 많이 큰거 같아요,Free
1VGt4k9s,,23.03.17,스카이블루,,정사이즈예요,보통이에요,화면과 비슷해요,161,50,44,나쁘지않아용 근데 길이가 좀 길긴함 그래도 머 ㄱㅊㄱㅊ 무난한 템인듯 근데 가격대비는 사실 잘 모르겠어요 무튼 나름 추천,Free
lbHERq5t,,23.02.25,베이지,,생각보다 커요,아주 만족해요,화면과 비슷해요,157,51,55,짱커요 근데 예뻐요 아우터 입기 좀 빡세서 그렇지.. 글고 바지에 넣어입르면 너무 바지가 울퉁불퉁해서 빼서 입는 편입니당 봄에 잘 입을듯해용,Free
Rdd2qtdb,상위 20%,23.01.25,베이지,,정사이즈예요,아주 만족해요,화면과 비슷해요,159,52,55,제 최애 핏 셔츠라 이미 두가지 색상 있는데 지금 세일할때 또 다른 색상 두개 쟁였어요!! 근데 색 다이쁨ㅠ,Free
brnVi78s,,22.11.27,블루그레이,,생각보다 커요,보통이에요,화면보다 어두워요,160,55,66,"출근룩으로 좋아요 자주 자주 입습니다 
상체비만인데 체형보완되고 좋아요 ~! 
다른 색상도 구매할 예정 입니당 ~~~~",Free
4ZmfVv7c,,22.11.14,블루그레이,,정사이즈예요,보통이에요,화면과 비슷해요,,,,인기가 많은 제품이라 기대하면서 샀는데 예상한대로 예쁘네요 넣어 입어도 빼서 입어도 다 예쁜 것 같아요 생각보다 두껍진 않아요,Free
zjNsU6QB,,22.11.02,블루그레이,,정사이즈예요,아주 만족해요,화면과 비슷해요,162,45,55,좋아욪ㅎㅎ아요 탄탕하고 편하게 입기 좋아요 위에 걸쳐입긷 좋아요 좋아요 여름아니면 다 입기가능,Free
apB929Ca,,22.10.27,화이트,,정사이즈예요,아주 만족해요,화면과 비슷해요,160,52,55,"친구 생일성물 줬는데 엄청 맘에 들어해요!!
저도 하나 사려고합당ㅎㅎ
기본 정석 화이트 셔츠같아아요",Free
Y6230T5T,,22.10.15,라벤더,,정사이즈예요,보통이에요,화면과 비슷해요,160,59,66,안에 흰색티입고 입기 딱이에요 날씨 추워지면 셔츠입고 자켓입으면 될 것 같아요!! 강추합니다,Free
min.6_13,,22.10.11,화이트,,정사이즈예요,아주 만족해요,화면과 비슷해요,167,50,44,조끼 안에 이너로 입기도 좋고 나시 위에 아우터로 걸치기 좋은 것 같아요~ 퀄리티도 좋아요,Free
졔졔95,,22.10.08,베이지,,생각보다 커요,아주 만족해요,화면과 비슷해요,165,67,66,"색상도 차분하니 이쁘구 질도 상당히 좋아용~
이쁘게 입고 다닐 생각하니 설레네용
다들 고민하신다면 강추합니당!!",Free
nWgRtIDc,상위 30%,22.10.07,블루그레이,,생각보다 커요,아주 만족해요,화면과 비슷해요,162,55,66,진짜 기대안했는데 소재도 탄탄하고 너무조아용!!! 배송만 빠르다면 다른색상도 구매하고싶네용ㅋㅋ,Free
xHWEEkqb,,22.10.01,라벤더,,정사이즈예요,보통이에요,화면과 비슷해요,160,47,44,여성스러워지는 느낌입니다 예뻐요 근데 제가 생각한걱보다 뭔가 더 밝은 느낌..? 그래도 잘입었습니다 와이서츠는 다 여기서 샀어요,Free
YjOjqKNl,,22.09.30,라이트옐로우,,생각보다 커요,별로예요,화면과 비슷해요,164,65,77,"옥스퍼드라구 해서 주무뇄는데 생각하는 질과 다르고,, 핏도 완전 오버핏이네오,, 프리미엄 잘 모르겠어요 ㅠㅠ
색상은 이뿐대 ㅠㅠ 제가 체격이 좀 있는 편인데도 커요",Free
bK2ANn3O,,22.09.21,스카이블루,,생각보다 커요,보통이에요,화면과 비슷해요,,,,핏이 좀 크지만 더 추워지기 전에 걸쳐입기 좋은거 같아요 단독으로 입기에도 좋을거 같습니다아,Free
E5NFIXg8,,22.09.21,라이트옐로우,,생각보다 커요,보통이에요,화면과 비슷해요,158,47,55,엄청 커요... 생각보다 더 커요... 근데 잘 입어보겠습니다 .간절기에 입기 딱 좋은 두께임,Free
6f**,,22.09.17,베이지,,정사이즈예요,보통이에요,화면과 비슷해요,160,50,44,"깔끔하고 너무 만족합니다
다른 색상으로 셔츠 재구매 할 생각이 너무 완전 있어용ㅎㅎ
다음은 어떤 색을!!",Free
MSiTMGoc,,22.09.04,라이트옐로우,,생각보다 커요,아주 만족해요,화면보다 밝아요,,,,"기존에 샀었는데 이번엔 노란색으로 재구매했어요
모델핏이랑 거의 비슷하게 나옵니다
98도씨 셔츠는 믿고 삽니다",Free
4Z4lzwFK,,22.09.03,스카이블루,,정사이즈예요,보통이에요,화면과 비슷해요,155,60,66,"오래걸릴지 알았는데 생각보다 빨리왔어요 
색상도 생각했던 컬러이고 가을에 잘입을거같아요!!",Free
ULMA1NOM,,24.09.25,베이지,,정사이즈예요,보통이에요,화면과 비슷해요,168,63,66,배송도 빠르고 길이도 마음에 들어요 날씬해 보여서 좋아요,Free
ULMA1NOM,,24.09.24,블루그레이,,정사이즈예요,보통이에요,화면과 비슷해요,168,63,66,배송도 빠르고 길이도 적당하고 날씬해보여서 마음에 듭니다,Free
awHcUCXq,,24.03.30,화이트,,생각보다 커요,보통이에요,화면과 비슷해요,163,54,55,예전에 여기서 샀던 셔츠 잘입다가 너무 잘입어서 색 바래서 샀는데 그때 그 셔츠가 아닌지 바스락 소리가 잘 안나네요 그래두 믿고사는 셔츠입니다!,Free
uPI7SpKq,,24.03.28,블루그레이,,생각보다 커요,아주 만족해요,화면과 비슷해요,166,60,66,"탄탄해서 좋습니다 
색상도 첨에 받았을때는 소화 할 수 있을까 싶었는데
무난히 소화되네요 ㅎㅎ",Free
dvzF4ifk,,23.06.06,라벤더,,정사이즈예요,아주 만족해요,화면과 비슷해요,165,45,44,"안타깝게도 저에게 라벤더색이 어울리지않았지만...
딱 라벤더셔츠!느낌입니다 무난하거 질좋아요",Free
DIC6y43E,상위 15%,23.05.24,블루그레이,,정사이즈예요,보통이에요,화면과 비슷해요,163,58,66,"회색+하늘색이라서 웜톤에게는 약간 색이안맞아요ㅜ
그래도 편한맛으로 휘뚤마뚤입으려구요..
더 많이 더워지기전에 열심히 입는중입니당",Free
F3f38gdx,,23.04.18,블루그레이,,생각보다 커요,아주 만족해요,화면과 비슷해요,170,65,66,"남방으로 입어도 이쁘고 니트조끼에 같이 입어도 이뻐요
넉넉해서 어느정도 쳬형이 있어도 잘맞을것같아요 추천입니다!",Free
n7jETXYu,,23.03.26,블루그레이,,정사이즈예요,보통이에요,화면과 비슷해요,158,65,66,남방살때 여기서만 사고있어요! 그정도로 남방맛집..! 핏도 핏인데 색상이 잘 빠져있어서 데일리탬입니당,Free
Bqdt8qdB,,23.03.03,화이트,,정사이즈예요,보통이에요,화면과 비슷해요,167,52,55,"화이트 셔츠가 너무 이쁘네요 이제 봄이라 잘 입을즛 합니다 마니마니 파시우요 번창하세요.!!
잘 잊을게요 너무 이쁘네요",Free
4JITm3sl,,22.10.24,화이트,,생각보다 커요,아주 만족해요,화면과 비슷해요,155,45,44,"기본템 무난템입니당
좀 크긴한데 어차피 넣어입을거라 괜찮아용
하나쯤은 옷장에 있어야하는 흰 셔츠에요",Free
uE9Jof44,,22.10.13,블루그레이,,생각보다 커요,보통이에요,화면과 비슷해요,162,57,55,옥스포드 셔츠는 깔별로 쟁이고 싶어요 ㅜㅜ 잔햐 마른 편이 아닌데 이 옷만 입으면 여리여리해보인다는 소리 듣습니다 😉,Free
wl60eJm8,,22.10.11,블루그레이,,생각보다 커요,보통이에요,화면과 비슷해요,157,58,66,"옛날부터 사고싶어서 고민하다 세일할때 샀는데
생각보다 셔츠가 크고 어깨랑 팔뚝살이 있는 체형이어서 박시한 느낌은 안났어요",Free
졔졔95,,22.10.08,블루그레이,,생각보다 커요,아주 만족해요,화면과 비슷해요,165,67,66,색상 너무 예쁘구 오버핏이라서 휘뚜루마뚜루 편하게 입고 다닐 수 있어용 너무 만족합니다!,Free
6eNYpFza,,22.10.02,스카이블루,,생각보다 커요,보통이에요,화면과 비슷해요,155,50,55,"배송빼곤 아쉬운게 없는 제품이에요.
저는 오버핏 좋아해서 딱 이만한거 찾았는데 적당하고 좋아요",Free
X88Ibu8N,,22.09.28,블루그레이,,생각보다 커요,아주 만족해요,화면과 비슷해요,165,52,55,사진은 노란끼 있어보이는데 실제로는 노란끼 하나도 없습니다 !! 처음에는 너무 큰가 했는데 입으면 핏이 예뻐용 ㅎㅎ,Free
WoNxXnkl,,22.09.28,화이트,,생각보다 커요,아주 만족해요,화면과 비슷해요,173,50,55,저번에 파란색 사고 마음에 들어서 하얀색도 샀어요 자체제작이라 확실히 퀄리티 짱짱 굿 입니당,Free
EVC6yTZu,,22.09.24,블루그레이,,생각보다 커요,아주 만족해요,화면과 비슷해요,157,58,55,오버핏 좋아하는데 적당한 크기라 마음에 들어요 잘입을게요💛💛 노란색샀었는데 재구매합니다!,Free
Rxt8Ltlj,,22.09.24,라이트옐로우,,정사이즈예요,아주 만족해요,화면과 비슷해요,157,64,77,톡톡한 기본 셔츠에 포인트컬러인 레몬색 셔츠라 파스텔덕후인 저에겐 아주 만족스러운 셔츠였어요,Free
ViS6dj4o,,22.09.22,블루그레이,,생각보다 커요,아주 만족해요,화면과 비슷해요,162,55,66,예전에 샀다가 잃어버려서 재구매했어요!! 전보다 재질이나 마감이 더 좋아진 느낌입니당 아주 죠아요,Free
O4bJQjpI,,22.09.18,화이트,,생각보다 커요,보통이에요,화면과 비슷해요,167,58,66,"생각했던 것보단 옷이 꽤 큽니다!
두껍기도 해서 잘못 입으면 덩치 커보일 것같은 느낌..? 그래도 옷 소재가 좋아 탄탄합니다",Free
4c5CtlzK,상위 25%,24.11.14,베이지,,생각보다 커요,보통이에요,화면보다 어두워요,154,53,55,"생각보다 잘 구겨지구 살짝 뻣뻣해요.
베이진데 약간 진한 베이지라서 아쉬워요.",Free
D9Wpqzks,,24.06.21,블루그레이,,생각보다 커요,아주 만족해요,화면과 비슷해요,163,60,55,배송이 꽤 오래걸렸지만 만족스러운 셔츠 핏이에요 가을 오면 다른 색상도 사야겠어요,Free
QaGzjDIC,,24.04.16,스카이블루,,생각보다 커요,보통이에요,화면과 비슷해요,155,48,44,"생각보다 큰데 예쁜 오버핏이라 오히려 더 말라보임
다만 구김이 좀 있는 편",Free
n4c3iIhV,,24.04.02,블루그레이,,생각보다 커요,아주 만족해요,화면과 비슷해요,161,68,55,색감이 일단 너무 이뻐요. 재질도 마음에 들고! 여기저기 잘 입고 다닐 것 같아요,Free
N05toClJ,,23.10.23,스카이블루,,정사이즈예요,보통이에요,화면과 비슷해요,158,52,55,"막 입기 너무 좋은 아이템이예요!ㅎㅎ
추리링이랑 입기도 편하구 하나씩 있으면 편할 아이템입니다! 색깔듀 너무 예뻐요",Free
dJnToQNE,,23.09.21,스카이블루,,생각보다 커요,아주 만족해요,화면과 비슷해요,161,53,55,생각보다 오버핏이라 놀랐었는데 색도 예쁘고 핏도 생각보다 예뻤어요!! 걸쳐서 입어도 예쁘고 슬랙스랑 입어도 예쁠거같아요!!,Free
HeYCuKxw,,23.05.21,블루그레이,,정사이즈예요,보통이에요,화면과 비슷해요,160,50,55,흰색 샀다가 예뻐서 다른 색도 구매했는데 만족도 정말 높아요!! 오버핏 셔츠 원하시면 구매하는거 추천합니당 ㅎㅎ~~,Free
9smrSmWj,,22.10.03,블루그레이,,생각보다 커요,보통이에요,화면보다 어두워요,159,54,55,색 예쁘고 사이즈는 큰 편입니다 그리 많이 구겨지지 않고 편하게 입기 좋음,Free
h3s2XCnD,,22.10.02,화이트,,생각보다 커요,보통이에요,화면과 비슷해요,165,65,77,사실 전에 한번 구매한적이 있어서 걍 샀어요 화이트셔츠가 좀 톡톡한고 약간 오버핏인 셔츠를 찾다가 괜찮을거 같아서 샀는데 만족해요,Free
ninlwOxv,,22.09.25,베이지,,정사이즈예요,아주 만족해요,화면과 비슷해요,168,56,66,98도애서 신옷중에 제일 맘에들어요. 퀄리티 좋고 핏도 적당히 여유있고 좋아요👍,Free
yUHDjJTC,,22.09.21,라벤더,,생각보다 커요,아주 만족해요,화면과 비슷해요,163,58,66,라벤더 색 샀는데 완전 부담스럽지고 않고 예쁩니다! 다만 저도 덩치가 살짝 있는데 좀 커서 마른 분들이 입으시면 더 크지 않을까 싶어요 물론 오버픽 좋아하시면 상관없을 둣,Free
hvN7O0X6,,22.09.12,스카이블루,,생각보다 커요,아주 만족해요,화면과 비슷해요,155,60,66,화면이랑 비슷하고 오버핏이라서 아주 편해요 굳,Free
zu4RECT5,,24.03.14,블루그레이,,생각보다 커요,보통이에요,화면보다 어두워요,168,63,55,색이 이쁘네요 핏은 이쁜데 배송이 너무 오래걸려요,Free
TLqxzwAi,,24.02.06,블루그레이,,정사이즈예요,보통이에요,화면과 비슷해요,151,57,66,올이 나간건지ㅠ 너무 티나서 교환하고싶었는데 급해서 시킨거라 그냥 입었어요 셔츠는 짱 이뿨요,Free
8KtfHI1h,,23.07.12,스카이블루,,정사이즈예요,아주 만족해요,화면과 비슷해요,163,63,66,너무 예쁜데 지금 입기에는 싱당히 더워요 그래도 재질이 탄탄해서 가을부터는 잘 입을 거 같습니다~,Free
gsSjQ2lT,,23.05.29,화이트,,생각보다 커요,보통이에요,화면과 비슷해요,168,52,55,"역시 와이셔츠 맛집이에요
크기가 좀 크긴하지만 어디에 입기에 딱좋아요!
하프 팬츠에 같이 입기에 좋은 옷이에요 ·͜·",Free
5zV28LLn,,23.05.16,블루그레이,,생각보다 커요,아주 만족해요,화면과 비슷해요,164,64,66,"막 빨아입어도 자연스럽고 좋구요
핏도 큰데 이쁘게 떨어지는 핏이예요
깔별로 다 사려구요",Free
5zV28LLn,,23.05.16,화이트,,생각보다 커요,아주 만족해요,화면과 비슷해요,164,64,66,"막 빨아입어도 자연스럽고 좋구요
핏도 큰데 이쁘게 떨어지는 핏이예요
깔별로 다 사려구요",Free
IF4N6ZPf,,23.03.23,블루그레이,,정사이즈예요,보통이에요,화면과 비슷해요,170,56,55,생각보다 얼굴색이랑 잘 안어울리긴 하지만 박시한 옷이라 편하게 자주 입을 것 같아요~,Free
mYTFuwyV,,23.03.12,스카이블루,,정사이즈예요,아주 만족해요,화면과 비슷해요,162,57,55,진짜 이쁘고 생각했던 것보다 더 만족스러워요 그리고 어디에다가 매치해도 잘 어울려서 저 자주 입을 것 같습니다 강추합니다!!,Free
IG9Uo8XV,상위 15%,23.03.09,블루그레이,,생각보다 커요,아주 만족해요,화면과 비슷해요,163,52,55,너무 좋아허 같은 색으로 다시 구매했어요! 여기저기 코디하기 좋고 질도 괜찮아서 엄청 자주 입어요,Free
j3bV10lB,,23.02.08,스카이블루,,생각보다 커요,아주 만족해요,화면과 비슷해요,150,50,44,가디건 안에 입으려고 구매했습니다. 색도 예쁘고 핏도 예뻐서 봄에 겉옷으로까지 잘 입을거 같아요!,Free
hbJ3Ko4y,,22.11.23,블루그레이,,생각보다 커요,보통이에요,화면과 비슷해요,164,55,55,배송오래걸려서 받았어요ㅠ 생각보다 사이즈가 커서 안에 레이어드하거나 바지안에 넣어입기는 힘들어용,Free
1T1m61l1,,22.10.27,블루그레이,,생각보다 커요,보통이에요,화면과 비슷해요,167,53,55,"보풀이 심해서 한참 정리했어요.
면 퀄리티는 좋아요. 핏이 예뻐서 여기저기 입기 좋습니다.",Free
4JITm3sl,,22.10.24,블루그레이,,생각보다 커요,아주 만족해요,화면과 비슷해요,155,45,44,"제가 키가 작아서 생각보다 많이 크긴한데
넣어입우면 예쁠것같아용
색이 진짜 예쁩니다!!!ㅎ",Free
176DHZqr,상위 20%,22.10.20,블루그레이,,정사이즈예요,보통이에요,화면과 비슷해요,157,48,55,배송은 좀 걸렸지만 그래도 기본템이라 무난하게 입을 거 같아요 어디에나 잘 어울리는 기본템으로 추천합니다,Free
oeRoVInt,,22.10.16,라벤더,,정사이즈예요,보통이에요,화면과 비슷해요,158,60,55,"보라색 옷은 처음 사봤는데 너무 예쁜 연보라 색이에요!! 이 셔츠만 3개째네요,,ㅎㅎ 너무 맘에 들어요~!",Free
3wXYDu4C,,22.09.27,라이트옐로우,,생각보다 커요,아주 만족해요,화면과 비슷해요,165,70,77,"버터색 같은 노란색이 아니구
약간의 쿨끼가 있는 노란색이네용
청바지랑 입으면 예쁠거 같아요ㅎㅎ",Free
mYIrQSWZ,,22.09.18,화이트,,생각보다 커요,아주 만족해요,화면과 비슷해요,154,48,55,흰색 셔츠를 찾고 있었는데 엉덩이를 덮고 어떤 하의랑 매치해도 잘 어울려서 아주 만족스러운 셔츠입니다,Free
DJPiwNIO,상위 10%,22.09.13,스카이블루,,생각보다 커요,보통이에요,화면보다 어두워요,158,57,55,"생각한 질감은 아니지만 옷자체는 예뻐요
처음에 그레이 주문했었는데 색이 너무 어두워 교환했네요",Free
PhLtxVnF,,22.09.08,블루그레이,,생각보다 커요,보통이에요,화면보다 어두워요,162,30이하,55,색이.. 리뷰대로 정말 좀 그렇네요 길이도 생각보다 엄청 길더라구요 넣어서 입으면 딱 핏 예쁠 거 같아요,Free
sP1ol1GZ,,24.04.11,블루그레이,,정사이즈예요,아주 만족해요,화면과 비슷해요,,,,"적당한 오버핏, 남다른 색상,모두 넘 맘에들어요.이쁘게 잘 입을것 .같아요",Free
9j5LRwwW,,23.10.29,블루그레이,,생각보다 커요,보통이에요,화면과 비슷해요,157,39,33 이하,키 157인 저로서는 생각보다 길긴 하더라고요. 근데 너무 예뿌고 옷이 얇아서 바지 안으로 다 집어넣어 입기에도 괜찮았습니다. 추천,Free
HbVfWbJG,,23.10.05,스카이블루,,정사이즈예요,보통이에요,화면과 비슷해요,159,46,55,너무 예쁘고 만족해서 재구매템이에요 배송도 빠르고 너무 만족합니다 추천해요,Free
HbVfWbJG,,23.10.05,라이트옐로우,,정사이즈예요,보통이에요,화면과 비슷해요,159,46,55,너무 예쁘고 만족해서 재구매템이에요 배송도 빠르고 너무 만족합니다 추천해요,Free
4a**,,23.09.21,화이트,,생각보다 커요,아주 만족해요,화면과 비슷해요,,,,지난번 블루그레이 사고 너무맘에들어도 이번에 화이트로 하나 더 재구매했어요 진짜 셔츠많이입는데 만족합니다.,Free
9DVuPHWn,,23.06.18,라벤더,,정사이즈예요,보통이에요,화면과 비슷해요,161,55,66,색깔별로 사게 될 것같아요. 다섯 번째 구매했어요 ㅎㅎ 어디에나 다 잘어울리고 제일 편해요,Free
9DVuPHWn,,23.06.18,베이지,,정사이즈예요,아주 만족해요,화면과 비슷해요,161,55,66,지금 가지고 있는 것만 세가지 색 있는데 또 샀어요. 편하게 어디에나 다 잘 어울려서 좋아요,Free
xZCPwp9U,,23.05.14,블루그레이,,정사이즈예요,아주 만족해요,화면과 비슷해요,158,45,44,"후기가 많고 좋아 사게 되었는데 예쁜 것 같아요.
길이가 조금 길어서 어떻게 입으면 예쁠지 고민이 되지만
자주 잘 입을 것 같아요~🥰",Free
Vs1UHOdk,,23.05.11,스카이블루,,정사이즈예요,보통이에요,화면과 비슷해요,158,72,77,질도 좋고 색도 딱 생각한 색이에요 지금 입기 좋은거같고 한여름엔 좀 더울거같네요,Free
kGHTBX67,,23.03.29,화이트,,생각보다 커요,아주 만족해요,화면과 비슷해요,173,59,55,팔이 긴편인데 손등을 덮습니다. 깔깔하니 좋네요 팔이 긴편인데 손등을 덮습니다. 깔깔하니 좋네요 팔이 긴편인데 손등을 덮습니다. 깔깔하니 좋네요,Free
t2dAy3h4,,22.11.14,화이트,,생각보다 커요,아주 만족해요,화면과 비슷해요,156,48,55,그냥 머 언제나 굳잡임 이거 하늘색도 샀는데 넘 잘입어서 흰색도 사봅니다 근데 전에 샀던거보디 더 큰가같아요... 뭐 버전을 잘못선택했을수도..,Free
y1gxcyhw,,22.10.26,블루그레이,,생각보다 커요,보통이에요,화면과 비슷해요,164,46,44,후기가 많아서 엄청 기대했었는데 생각보다 아쉬워요. 정말 평범한 기본 오버핏 셔츠입니다.,Free
uN8pWPEt,,22.10.24,화이트,,생각보다 커요,보통이에요,화면과 비슷해요,162,50,55,"생각보다 넉넉하네요 하지만 오히려 좋아
탄탄한 소재예요 요새 계절에 딱일듯 가을하면 셔츠 입엊 ㅜ어죠",Free
3c**,,22.10.14,블루그레이,,정사이즈예요,보통이에요,화면과 비슷해요,166,44,44,저번에 한번 샀었는데 뭐 먹다가 묻어서 다시 구매했습니다 그만큼 만족하면서 입었던 옷인 것 같습니당,Free
AC5dY3WP,,22.10.01,블루그레이,,생각보다 커요,보통이에요,화면과 비슷해요,171,57,55,그레이랑 하늘색 섞인 색깔이 넘이뻐요 근데 생각보다 통이 좀 큰느낌이에요..!,Free
HidyR8kM,,22.09.29,화이트,,생각보다 커요,보통이에요,화면과 비슷해요,160,47,44,딱 생각한 크기의 오버핏 와이셔츠라서 맘에 듭니다 앞으로 여러 옷들 레이어드해서 입어보려두용,Free
qkrt******,,22.09.27,라이트옐로우,,생각보다 커요,아주 만족해요,화면과 비슷해요,165,56,66,옷이 생각보다 조금 크지만 길이부터 다 맘에 들네요ㅎㅎㅎ 다른색도 구매예정 입니둥 ~~!!,Free
DwC3hYEq,상위 10%,22.09.25,블루그레이,,생각보다 커요,아주 만족해요,화면과 비슷해요,160,49,55,후기 보고 샀는데 거의 크다는 얘기가 많아서 걱정했는데 딱 제가 원하던 핏입니다!! 걸쳐입으려고 사서 잘 산거 같아 마음에 들어요❗️❗️,Free
XX8lLlb0,,22.09.15,블루그레이,,정사이즈예요,아주 만족해요,화면과 비슷해요,165,60,66,너무너무 잘 입구 있어요 ㅠㅠ 존예!! 스카이블루 입어보고 예뻐서 블루그레이도 샀는데 역시나 이뻐요 강추,Free
