아이디,리뷰어 등급,작성 날짜,옵션1,옵션2,상품 사이즈,퀄리티,색감,키,몸무게,사이즈,리뷰내용,제품_사이즈
강그린,탑리뷰어,24.12.31,블랙,FREE,생각보다 커요,아주 만족해요,화면과 비슷해요,157,48,44,"믿고 사는 베이델리 메이드~.~
최근에도 티셔츠를 사서 집에 벌써 베이델리 옷만 여섯벌인데 요번엔 영하 날씨에 패딩이나 코트 안에 세미아우터로 입을 후드집업도 추가로 사봤어용😇
가디건이나 니트 입고 패딩입기 전 위에 걸치려고 일부러 루즈핏으로 샀습니당!!
확실히 루즈핏이여서 그런지 지퍼를 다 채우면 뭔가 상체가 부푼 느낌이 들어요ㅋㅋㅋ투웨이 지퍼라 다행..밑단 지퍼 쭉 올려서 입으면 살짝 가오리핏 되는데 널널해서 편하긴해요bb
투웨이 지퍼는 첫 시도엔 좀 뻑뻑한 감이 있었는데 몇 번 올렸다 내렸다하니까 금방 매끄러워졌어용 지퍼도 성공적인듯!!
이 후드집업은 후드부분에 베이델리 자수가 들어가서 잘 안보이는데 또 그런 은은한 맛이 있는 거 같아요ㅋㅋ대신 주머니 한 쪽에 라벨이랑 후드 안쪽 부분에 로고 포인트 마감되어 있는게 자수의 심심한 맛을 보완해줘서 귀여워용🫶
후드집업이랑 같이 입으려고 먼저 산 사심 팬츠랑 매치시키니까 세트같아서 아마 이 룩으로 자주 입을거 같네용ㅎㅎ

+
집업이랑 매치한 옷 모두 베이델리입니당!!

이너-쿠앤크 단가라 워머 폴라티(그레이)
하의-오션 와이드 데님팬츠(흑청)/사심 리뉴얼 투시즌 투웨이 조거팬츠(블랙)

워머티 귀여워용 직잭에서 안 샀지만 추천합니당bb",Free
67z9z564,상위 1%,25.01.01,그린,FREE,정사이즈예요,아주 만족해요,화면과 비슷해요,161,55,66,"예뻐요! 가을 웜톤 딥으로서 이런 색깔 정말 좋아하는데 색감 너무 예쁘구요, 루즈한 핏도 너무 예쁘구요, 캐주얼하게 입기도 너무 좋아요! 겨울보단 가을에 입기 좋아요 안에가 기모가 없어서! 그래도 너무 귀엽고 예쁩니다!!",Free
1yNwRbMV,상위 1%,23.12.07,그레이,FREE,정사이즈예요,아주 만족해요,화면과 비슷해요,164,60,66,"생각한 대로 적당한 후드집업이네요
기모는 없어서 안에 좀 껴입어야겠지만 껴입을 수 있을 만큼 품도 낙낙해서 좋습니다
투웨이 지퍼라 더 트렌디하고 좋아요
지퍼는 막 뻑뻑하진 않아요
베이델리 자수가 모자 옆에 있는게 꽤 포인트되는 부분이네요ㅎㅎ",Free
햄찌,상위 15%,23.10.19,옐로우,FREE,정사이즈예요,보통이에요,화면과 비슷해요,157,67,77,"너무 이쁜 노랑색이에요!!! 제가 가방 좋아하는 노란색입니다 너무 쨍하지도 않고 너무 누런 노란색도 아니라서 너무 맘에 들어요!!! 차가운 바람 불때 입으니까 딱이더라구요!! 근데 이제 더 추워지면 못입을거 같아요ㅠㅠ 제발 기모버전도 내주세요!!! 
옷 흐물거리는거 싫어서 기모만 찾아 입으시는 분들 이건 안그러니 걱정말고 구매하세요!! 정말 이뻐요!!!",Free
빙구르,상위 5%,24.10.31,블랙,FREE,정사이즈예요,보통이에요,화면과 비슷해요,164,46,44,"핏 좋아서 손이 자주가는 후드집업이에요
얼마에 샀는지 기억이 안나는데 소재가 막 글케 좋은 편은 아니지만 나쁘지 않습니다~!
팔-겨드랑이쪽은 가오리핏이라서 아우터 안에 입기엔 그다지 편하지는 않지만 그래두 겨울 외투 안에 껴입을 순 있고, 사이즈가 넉넉해서 요 후드집업 안에 맨투맨도 거뜬히 입을 수 있어용ㅎㅎ
지퍼 부분이 고퀄은 아니라 처음 잠글때 잘 물려줘야하는점은 있어욤
후드 부분에 베이델리 자수 새겨진건 귀염뽀짝한 포인트 인 것 같아서 맘에 듭니당!
여기 저기에 편하게 입기에는 적당한 것 같아요~!",Free
xocvqKXL,상위 15%,24.09.27,그레이,FREE,생각보다 커요,보통이에요,화면과 비슷해요,163,52,55,"생각보다는 초큼 무게감이 있는데 모자때문인거 같네요~ 품이 넓은 편이고 도톰해서 꽤 따뜻하게 입는거 가능이요~~~ 아래 바지랑 세트처럼 입는게 가능하네요! 
올 가을 편하게 입을거 같아요~!",Free
BXMegPrG,상위 25%,24.09.21,옐로우,FREE,정사이즈예요,보통이에요,화면과 비슷해요,,,,"옷이 생각보다 도톰하고 무거워요!
모자가 커서 뒤로자꾸 넘어가요 ㅋㅋ 그래도 색감도 핏도 예쁩니다.
다만 실밥정리할게 너무너무너무 마나요...사진찍은건 한개지만 저런게 계속 엄청나게잇어용..",Free
hajm**,상위 20%,24.09.10,그레이,FREE,정사이즈예요,아주 만족해요,화면과 비슷해요,166,55,55,"이 옷 어쫌 이렇게 예쁘죠!
아방한 핏인데 부해보이지 않고
재질이 아주 두툼하진 않지만 얇디 얇지도 않아서 전혀 싼티 나는 느낌 없이 질 좋은 후드집업 입은 느낌입니다
베이직 중의 베이직이라 어느 쇼핑몰에나 다 있는 집업이지만 꼭 여기서 사셨음 좋겠어요 정말 후회 안하십니다",Free
ezklPtea,상위 10%,23.10.20,그레이,FREE,생각보다 커요,아주 만족해요,화면과 비슷해요,168,48,55,"지퍼가 너무 저렴해보일까 걱정했는데 나쁘지 않습니다
옆통 널널하고 생각보다 기장이 더 짧네요 이건 키 때문인것 같은데 소매길이는 짧지않아서 좋아요

옷이 무겁다기보단 모자가 무겁고 커요
모자 안쓰면 어깨를 다 덮어주는 사이즈라 오히려 따뜻하기도..?

제꺼만 그런건지
겉에만 확인하고 입고나왔는데 안쪽에 모자 이음새에 벨리드 자수가 없더라구요?ㅜㅜ 좀 아쉽지만 그냥 입으려구요",Free
owOap3jQ,상위 15%,23.04.21,옐로우,FREE,생각보다 커요,아주 만족해요,화면과 비슷해요,164,58,55,"배송은 일주일 정도 걸린 것 같아요
자체제작이라 기대했는데, 기대이상의 퀄리티를 보여주네요!
세세한 디테일이 정말 감동적…
꼼꼼한 마감, 좋은 원단, 센스있는 투웨이 집업, 컬러와 잘 어우러지는 예쁜 자수로고 상큼한 컬러감!
너무 크지도않고 아방하게 만들어주는 오버핏!!
이 제품에 얼마나 많은 공을 들였는 지가 눈에 보이네요.
심지어 가격도 퀄리티에 비해 합리적이고.. 
처음 이용해보는 브랜드인데 앞으로 자주 이용해야겠어요!!!",Free
ZhiTnhdI,,23.04.07,옐로우,FREE,정사이즈예요,아주 만족해요,화면과 비슷해요,158,45,44,"옐로우 컬러가 보자마자 내거다 싶었는데..받아보니까 실물이 더 예뻐요 진짜 봄에 입기 딱인 컬러!!
원단 톡톡하고 크롭 기장이라 귀염뽀짝합니다😁
벨리드 팬츠랑도 잘 입어질 거 같아서 너무 만족해요ㅠㅠ💛",Free
wUKkVBCw,상위 25%,25.01.14,옐로우,FREE,정사이즈예요,아주 만족해요,화면과 비슷해요,157,57,55,"색깔이 너무 이뻐서 고민을 하다가 결국 구매 결정!
받고 보니 왜 고민했나 싶을 정도로 너무 노랑도 아니고 
사진처럼 귀여운 노랑색이였어요 
입으니 더더 만족! 모자에 하늘자수조차 기엽게 제작된거 같아요",Free
뽀또,상위 5%,24.06.05,그린,FREE,정사이즈예요,아주 만족해요,화면과 비슷해요,,,,"급하게 후드 집업이 필요해서 샀는데
결과적으로 매우 대만족입니다!
초록 초록한 색도 너무 이쁘고 
무엇보다 제가 큰 키가 아니라 그런지
크롭된 핏이 정말 예뻐요!!😢
보풀은 아직 좀 더 입어봐야겠지만!
자주 손이 갈 거 같아요",Free
Dhx6y04o,,24.06.03,옐로우,FREE,정사이즈예요,아주 만족해요,화면과 비슷해요,164,57,66,"기본 회색 후드티와 노란색 후드티를 정말 밤잠 설쳐가며 치열하게 고민후, 조금이라도 어릴때 이런 개나리색 입을 수 있다는 생각에 선택했어요ㅎㅎ

6월에 한낮에 입기는 덥겠다는 생각이 들지만 에어컨 바람 아래가 너무 추운 저는 잘 입을것 같아요~
정말 받자마자 너무 너무 마음에 들어서 평소 잘 안적는 리뷰 바로 작성합니다..!
부담스럽지 않은 예쁜 노란색에 낙낙한 품의 후드 집업이 한순간에 절 너무 귀엽게 만들어줘요ㅎㅎ

지인짜 마음에 듭니다ㅎㅎ
고민하는 분 있으시면 꼭 사세용!",Free
dltp******,상위 5%,24.05.26,그레이,FREE,생각보다 커요,아주 만족해요,화면과 비슷해요,163,46,44,"치마는 지그재그에서 안팔길래 에이블리에서 구매했습니당. 우선 재질이 가격대비 괜찮았어요. 적당한 탄탄함에 꽤 힘있는 재질이 변형없이 오래입을 수 있겠다 싶었어요. 다만 핏이 살짝 애매했는데 저는 어깨가 넓고 허리가 가는 체형이라 허리를 너무 꽉 조여주는 요즘 디자인의 크롭 후드집업은 입으면 어깨가 더더 넓어보이고 부각되더라구요. 그래서 여러군데 둘러보고 찾아본게 이 제품인데 얘도 뭔가 애매하더라구요.

우선 허리가 꽉쪼이지않는건 좋았는데 사알짝 기장이 더 짧았으면 괜찮았을 것 같은? 살짝애매한기장감이라 조금 몸이 부해보이는 느낌이었어요. 그래도 감안하고 겟할만큼 가격대비 재질이 탄탄하고 이만한 핏이면 세트로 안입어도 따로고 자주자주 손이가더라구요.",Free
l7P8B8oZ,상위 5%,24.12.23,블랙,FREE,정사이즈예요,보통이에요,화면과 비슷해요,164,65,66,"옷이 무난하면서도 귀여운 디자인이라 데일리로 입기 정말 좋은 것 같아요. 어떤 스타일에도 잘 어울리고 활용도가 높아 만족스럽습니다. 배송도 빠르게 와서 좋았지만, 먼지가 잘 붙는 점은 조금 아쉬웠어요.",Free
Kic0ghHq,상위 10%,24.12.13,그레이,FREE,정사이즈예요,아주 만족해요,화면과 비슷해요,156,53,55,"그냥 기본 후드집업인데 평소에도 엄청 잘입을거같아요 
세탁후 건조기 돌렸는데도 줄어듬없었어요
재질도 좋고 기모있는걸로 하나더 사려구요",Free
y8Nd14im,상위 10%,24.11.24,그레이,FREE,정사이즈예요,보통이에요,화면과 비슷해요,156,55,55,요즘에 뭐랑 입을때 이것만 입어요 진짜 이뻐요 편하고 소재도 탄탄하구 최고에요 다른 색상도 구매할 예정입니다 키가 작은 편인데 심하게 크롭도 아니고 길지도 않고 딱 적당해서 좋아요!!!,Free
8Cyn7qab,상위 5%,24.10.18,그레이,FREE,정사이즈예요,보통이에요,화면과 비슷해요,161,48,44,"완전 오버핏 후드나 집업밖에 없어서 좀 숏하고 기모없는데 핏은 아방폭닥한 느낌 후드집업 찾고찾다가 구매한 옷입니다! 일단 만족한 점은 배송이 빨랐고 핏 참 이뻐요 적당히 아방하고 크롭도 적당하고 모든면에서 기본이상 합니당 아쉬운점은.. 모자가 생각보다 넉넉하진않아요 저는 후드를 이불마냥 입는걸 좋아해서 모자가 아주그냥 푹 써지는걸 좋아하는데 암튼 좀 아숩 그치만 크롭후집이 모자가 너무 크면 모자무게때매 옷이 뒤로 쏠릴거같긴 해요
데일리템으루 추천합니당",Free
올립듀,상위 5%,24.10.05,네이비,FREE,정사이즈예요,아주 만족해요,화면과 비슷해요,155,46,44,"그레이사고 만족해서 네이비 추가구매
여리여리하고 품 낭낭해서 좋아요!
소매도 탄탄하구요
베이델리는 다 좋은데 마감만 좀 더 깔끔해졋으면하는 바람..!",Free
ilPxWnGY,,23.11.03,네이비,FREE,생각보다 커요,아주 만족해요,화면과 비슷해요,162,63,66,너무 짧지 않은 크롭 기장이라 맘에 들었어요 ! 이쁘게 오버핏으로 잡히고 특히 모자가 크기도 큰데 탄탄하게 유지가 돼서 이번 구매 대만족이요 ㅜ 봄 되면 밝은 컬러로 하나 더 구매 해야겠어욜 😎,Free
4O5zzaS0,상위 10%,23.11.02,그레이,FREE,정사이즈예요,아주 만족해요,화면과 비슷해요,165,70,88,벨리드 자체제작 상품은 한번 구매하면 또 찾게 되실꺼예요! 지난해 우연히 구매하고 이번에도 원하는 스타일의 옷이 있어서 다른곳보다 가격대가 높아도 믿고 구매했어요~ 일단 옷감이 탄탄해서 조아요 디테일한 부분 신경쓴것도 너무 좋구요! 지퍼 뻑뻑한감은 좀 있는데 거슬릴정도는 아니예요! 모자가 큼직해서 뒤로 좀 쏠리는 경향은 있으니 참고하세요!,Free
35OmJAQ3,,23.10.04,그레이,FREE,정사이즈예요,아주 만족해요,화면과 비슷해요,165,53,55,꽤 묵직하고 탄탄한 후드집업이에요! 사진으로는 잘 몰랐는데 드롭숄더인만큼 꽤 가오리핏이에요. 적당한 크롭 기장이고 안감이 매끄럽게 처리된 쭈리원단이라 좋아요! 가끔 너무 싼 옷들은 안감이 까끌까끌하게 남아있어서 실밥 엄청 나오기도 하는데 이건 안그래서 좋아요ㅎㅎ 쇼핑몰 후드집업 치고는 가격대가 조금 있지만 그만큼 퀄이 괜찮아서 추천합니당!,Free
p1xJrs8T,,23.09.23,그레이,FREE,정사이즈예요,아주 만족해요,화면과 비슷해요,165,58,66,"너~~~무 맘에 들어서 당황했습니다. 후드,후드집업,맨투맨은 정말 핏때문에 여러번 실패하면서 구매하는데 이번에 진짜 잘산 것 같아요. 핏 진짜 넉넉 낭낭하니 이쁘게 빠졌습니다!! 회색 하나 더 쟁이고 블랙도 사야겠어요",Free
hw14****,,23.09.05,그레이,FREE,정사이즈예요,아주 만족해요,화면과 비슷해요,160,55,55,"옷은 잠옷입니닷🫣
아무래도 가격대가 있는 편이다 보니까 퀄리티가 엄청 기대됐어요. 기본 회색 후드가 없어서 가을 대비해서 하나 장만했는데 잘샀어요! 

✔️핏이 아방한 스타일이라 전체적으로 귀엽구 
✔️기장이 너무 짧지도 길지도 않아서 딱 좋았어요. 
✔️투지퍼라 여러가지로 연출할 수 있는 점도 좋아요. 
✔️흘러내리는 재질이 아니라 탄탄하게 잡아줘서 좋아요. 
✔️관리만 잘해주면 오래 잘 입을 것 같아요 :)
✔️지퍼가 조금 빡빡한 편이긴 한데 신중히 잘 맞춰주면 어떻게 올라갑니다. 너무 힘줘야 올라가거나 그런 편은 아니에요. 지퍼 때문에 별하나 뺐어요!",Free
bLmepY87,상위 10%,23.06.15,네이비,FREE,생각보다 커요,아주 만족해요,화면과 비슷해요,160,55,66,"첨에 생각보다 무거워서 좀 놀랬는데 그래서 더 핏이 뚝 떨어져서 예쁜 것 같아요! 후드집업 진짜 많이 사봤는데 안감이 이만큼 부드러운건 처음이에요 재질도 최고고, 자수 디테일이 너무 예뻐요 !",Free
afBWt1Yv,,23.06.04,옐로우,FREE,정사이즈예요,보통이에요,화면보다 밝아요,,,,"색감은 살짝 다르지만 이거대로 매력있어서 만족해요!! 사이즈는 딱 맞아용 다만 길이가 조금 짧아요! 169기준 배꼽 바로 아래에 오는 정도에요!! 팔을 내리고 있으면 예쁘지만 만세하는 순간 바로 ★뱃쨜 깎꿍★!!!! 이거 입을 땐 꼭꼭꼭!! 만세 주의하시구 입으셔야대용..그 외엔 아주 만족해요! 특히나 모자가 정말정말 핏이 예쁩ㅂ니다..재질은 여름에 입기엔 덥고 봄, 가을, 초겨울까진 가눙할 거 같아요!!",Free
YYWP2l2z,,23.05.14,옐로우,FREE,정사이즈예요,아주 만족해요,화면과 비슷해요,,,,다른 상품평에서 말한 각진다는게 뭔지 알겠네요 어깨쪽이 좀 그런데 근데 디테일이 너무 귀여워서 안고 갈려구요 색은 연하디연한 노란색이라 너무 귀엽구요 다른곳에서 산 크롭후디랑 다르게 목부분에 테이프로 마감되어있고 후드에 자수가 너무 귀여워요!,Free
Euni,상위 1%,24.10.20,그린,FREE,생각보다 커요,아주 만족해요,화면과 비슷해요,154,55,44,"실제 색상과 비슷하게 해봤어용 
저거보단 살짝 그린색이 들어간색 이에요 !
생각보다 탄탄히게 나왔어요 !
글고 무엇보다 이쁨.. 

⭐️ 추가 후기
몇달 지난 후 추가로 작성합니당
우선 진짜 손이 많이 가는 옷이고, 다른 색상도 사고싶을 정도로 손이 많이가여 ! 
초록색도 너무 이쁘고 ㅠㅠ 두툼하고 길이도 적당하고 투웨이라 더 다양한 스타일로 입을 수 있구.. 지갑 여유될 때 다른 색상도 사보려구여 ㅎ",Free
HlS7uBbi,,24.10.17,그레이,FREE,생각보다 커요,보통이에요,화면과 비슷해요,163,51,55,누구나 하나쯤 잇는 그레이 후드집업이 기모버전밖에 없어서 삿어요 쇼핑할때 너무 꼼꼼하게 따지는 스탈이라 힘들어서ㅠ 그냥 아묻따 리뷰많고 마니 팔리는 애로 삿어요ㅎㅎ 가오리핏이라 가슴둘레부분이 좀 마니 큰가 싶엇는데 입으면 괜찬은거 같아요 맘에들어요 귀여워요,Free
yRQcWnH8,,24.10.16,그레이,FREE,정사이즈예요,보통이에요,화면과 비슷해요,164,63,66,굉장히 마음에 들어요 디테일이 너무 좋고 핏도 기모가 엄청 두껍지 않아서 잫 입을거같아요 모자도 넉넉하구요 다만 저는 66-77인데 저한테 낙낙하게 맞으니 다른분들에게는 좀 클거같아요 그래도 너무 좋아요,Free
q5DuiP4b,상위 10%,24.10.11,그레이,FREE,정사이즈예요,아주 만족해요,화면과 비슷해요,154,48,55,짧을 줄 알았는데 제가 키가 작아서 그런지 크롭한 기장은 아니었고 딱이었습니다 !! 적당히 도톰하고 핏이 정말 예뻐요!! 모자가 큰데도 엄청 무겁지 않아서 핏 망가지지 않고 좋았어요!! 다른 색도 살까 고민 중입니다 너무너무 만족해요!!,Free
YOcB6hec,상위 10%,24.10.08,네이비,FREE,정사이즈예요,아주 만족해요,화면과 비슷해요,159,58,55,"진짜최고!!! 예용
색깔도 예쁜 진한 파란색이고 감이랑 시보리도 탄탄한 편, 마감은 완벽하진않지만 튼튼하게 잘 박혀있어용 다음애 다른 색이나 다른 라인 나오면 재구매의사 무조건 있어요!!!",Free
m0wUiShP,상위 30%,24.10.05,네이비,FREE,정사이즈예요,아주 만족해요,화면과 비슷해요,167,68,66,"진짜진짜 맘에 들어요
이런 옷 못입다가 살 빠져서 사봤는데요
넘모 귀여워요
두툼하니 괜찮네요
모자는 큰 편은 아니네요
모자에 노란색으로 로고 적혀져있는 것도 맘에 들어요
회색도 사고싶네요!!",Free
JvbaxdtP,상위 10%,24.10.01,네이비,FREE,생각보다 커요,아주 만족해요,화면과 비슷해요,164,58,66,"시진보다 실제 색감이 더 어두운 네이비입니당 핏은 딱 세미 크롭에 아방하고 넉넉한 핏이라 예뻐요! 모자가 커서 맘에 들고.. 배송은 예정보다 오래 걸렸지만 만족ㅎㅎ 가을엔 아우터로 겨울엔 여기저기 껴입을 때
좋을 듯!!!",Free
8UO9AS2r,탑리뷰어,24.09.27,옐로우,FREE,생각보다 커요,보통이에요,화면과 비슷해요,158,45,55,그린사고 맘에들어서 옐로우도 픽했는데 완전 이뻐여 색깔 진짜 파스텔노랑노랑ㅋㅋ따듯해보이고 부드러워보임 가을겨울 잘입을거같아여 그린이랑 번갈아가면서 아주ㅋㅋ사이즈도 적당히 넉넉하고 세미오버핏이라 오히려 더좋았어요 배송도 빨랐고 맘에듬 잘입을게용,Free
S2LuSve6,,24.09.25,그린,FREE,정사이즈예요,보통이에요,화면과 비슷해요,170,62,66,키가 크고 체격도 있어서 너무 짧을까 걱정했는데 좋아하는 색이라서 그냥 저질러봤는데 조금만 더 길었으면 좋겠다 싶지만 입는데 불편할정도로 짧은거 아니라서 괜찮은거같아요~,Free
5uJZ68GI,,24.08.24,그레이,FREE,생각보다 커요,아주 만족해요,화면과 비슷해요,162,53,44,베이델리 옷은 추리닝 바지부터 만족스럽게 입고있던 터라 의심 없이 구매했고 이번에도 너무 마음에 들어요! 딱 예쁜 크롭이고 여름이지만 실내가 에어컨 바람때문에 너무 추울때가 간혹 있어 아우터용으로 구매했어요. 다만 냄새가 좀 심해서 몇번 세탁해야 할 것 같습니다.,Free
eUYXtJc1,상위 25%,24.08.22,그레이,FREE,생각보다 커요,아주 만족해요,화면과 비슷해요,158,65,77,"미리 가을준비한다고 바로 2개를 샀어요!
그린이랑 그레이 삿는데
노란색이랑정말 고민많이하다 샀어용
노란색도 넘 색을 잘뽑앗더라구요 그래도 좀 손이 많이가고 자주 입을것같은 색으로 삿습니다! 옷질도 짱짱하고 다좋아요!
근데 냄새가 어후;;; 시큼시큼;; 입기전에 세탁한번하고 입어야겟어용!",Free
eUYXtJc1,상위 25%,24.08.22,그린,FREE,생각보다 커요,아주 만족해요,화면과 비슷해요,158,65,77,"미리 가을준비한다고 바로 2개를 샀어요!
그린이랑 그레이 삿는데
노란색이랑정말 고민많이하다 샀어용
노란색도 넘 색을 잘뽑앗더라구요 그래도 좀 손이 많이가고 자주 입을것같은 색으로 삿습니다! 옷질도 짱짱하고 다좋아요!
근데 냄새가 어후;;; 시큼시큼;; 입기전에 세탁한번하고 입어야겟어용!",Free
0V0RDKhS,,24.06.01,그레이,FREE,생각보다 커요,아주 만족해요,화면과 비슷해요,158,55,44,"생각보다 커요 그래서 잘 매치하면 여리여리할 수 있고 잘못하면 부해보여용 
지퍼가 조금 뻑뻑하긴 한데 요즘처럼 에어컨 바람 나올 때 잘 입고 있어욤",Free
aa4KkdPg,,24.05.24,네이비,FREE,정사이즈예요,아주 만족해요,화면과 비슷해요,150,50,55,"같은 색상 네이비 샀는데 깔끔한 느낌이라서 좋았어요! 옆 라인에 로고라인이 들어가있어서 이뻐요 추천드립니당 ㅎㅎ
키 작을수록 후드티 잘못입으면 펑퍼짐해보이는데
지퍼 두개라서 좋았어요",Free
LNPZLd5Y,,25.01.11,그레이,FREE,생각보다 커요,아주 만족해요,화면과 비슷해요,171,55,55,너무 크롭이지도 않고 적당히 핏좋은 크롭인것 같아서 만족스러워요! 약간 가오리핏이 있어서 위에 두꺼운 패딩같은거 입으면 좀 끼는느낌이 있네요,Free
illiiillli,상위 20%,25.01.06,옐로우,FREE,생각보다 커요,아주 만족해요,화면과 비슷해요,162,46,44,탄탄하고 색감이쁘고 길이감도 적당해서 좋아요! 밝은 컬러라 코디하기 살짝 어려운데 모자 크고 탄탄한 핏이에요 많이 넉넉해서 흘러내리는 핏으로 입고있어요 ㅎㅎ,Free
bJqzhZah,상위 15%,24.12.13,네이비,FREE,정사이즈예요,보통이에요,화면과 비슷해요,163,58,55,한겨울에는 얇아서 레이어드 해서 입기 좋고 투웨이라 더 좋은 것 같아요 봄이나 가을에 단독으로 입기도 편해여 그레이 살까 고민했는데 네이비 이뻐요,Free
Vejd4pkr,상위 20%,24.12.02,그레이,FREE,정사이즈예요,아주 만족해요,화면과 비슷해요,165,62,66,퀄리티가 진짜 남다른거같아여 목안쪽 띠마감이며 작은라벨까지도 브랜드퀄이예여 봄가을에도 입으려고 기모아닌걸로 샀는데 넘 만족스러워여 제가 좀 더 날씬했다면 더 이뻤을거같은..,Free
fVkvd0ef,,24.11.12,옐로우,FREE,정사이즈예요,보통이에요,화면과 비슷해요,158,63,77,"색상도이쁘고 무겁다라는리뷰가많았는데
그렇지않아요 가을 초겨울까지입을수있을꺼같고,그계절에입을꺼면
살짝의두께감은 있어야겠조?ㅎ
가격대비 나름 만족해요",Free
vSp324DA,상위 30%,24.11.09,옐로우,FREE,정사이즈예요,아주 만족해요,화면보다 밝아요,161,66,77,"회색 사서 잘 입다가 노란색도 입고 싶어서 샀어요~
재질,모양 다 넘넘 완벽해요~ 크림아이보리인 줄 알았는데 약간 형광끼가 돌아요ㅎㅎ 로고가 너무 예뻐요 잘 입을게요~!",Free
동글아쥬,상위 15%,24.11.07,옐로우,FREE,정사이즈예요,보통이에요,화면과 비슷해요,167,55,55,"예쁜 연노랑이에요💛 생각보다 품은 크지 않아요 ㅎㅎ
모자가 커서 더 예쁘고 특히 지퍼가 2개 있는게 여러 스타일로 입기 좋아서 마음에 듭니다!! 잘 입을게요!!",Free
Ik68iCr0,,24.10.23,네이비,FREE,정사이즈예요,보통이에요,화면과 비슷해요,156,62,66,"무거운데 솔직히 핏은 이뻐요
제가 키가 156인데 저정도 길이라서 너무 키큰 분들께는 비추입니다. 그리고 모자가 와방하게 커서 모자 핏도 이뻐여",Free
3P6wyJKJ,상위 15%,23.10.14,옐로우,FREE,정사이즈예요,보통이에요,화면과 비슷해요,160,42,44,"딱 생각했던 색감, 핏대로 와서 만족스럽습니다! 박시한 후드집업 하나 필요했는데 휘뚜루마뚜루 입을 수 있을 것 같아요. 옐로우 너무 튀진 않을까 해서 고민했는데 파스텔톤이라 화사해서 좋습니당 다른 색 샀으면 후회할 뻔 ㅋㅋ",Free
ElpHzWgK,,24.09.14,그레이,FREE,정사이즈예요,아주 만족해요,화면과 비슷해요,168,,,"이런 탄탄한 후드집업 갖고싶었는데 너무 맘에들어요
너무 두껍지도 않고 너무 얇지도 않은 딱 적당한 !
그리고 쿠폰도 많이 주셔서 할인도 받고 이 가격에
이런 퀄리티 너무 대박임미다 ,,,",Free
