아이디,리뷰어 등급,작성 날짜,옵션1,옵션2,상품 사이즈,퀄리티,색감,키,몸무게,사이즈,리뷰내용,제품_사이즈
KtEz0EOs,,21.10.27,FREE,백메란지,정사이즈예요,보통이에요,화면과 비슷해요,155.0,75.0,77,옷에서 냄새는 좀 나지만 세탁하면 괜찮을꺼고 보들보들하고 도톰해서 딱 좋아요 다른색깔도 사야겟어여 오랜만에 마음에 드는 기모후드를 발견햇네여,Free
ROSMvsH4,,21.10.20,FREE,크림,정사이즈예요,보통이에요,화면과 비슷해요,163.0,61.0,55,엉덩이를 폭 덮을만큼 길이가 길줄 알았는데 엉덩이 다 덮긴하지만 약간 간당간당한 길이라 조금 아쉽지만 색상도 화면이랑 똑같고 기모도 있어 잘 입겠습니다!,Free
IWGAB1PG,,21.10.15,FREE,블랙,생각보다 커요,아주 만족해요,화면과 비슷해요,157.0,45.0,44,"기모가 두툼하고, 사이즈도 넉넉해서 딱 좋습니다.
키 158인데 엉덩이 딱 덮어요.
그런데 팔이 약간 가오리 핏?느낌이 나요. 참고하세요",Free
iwyplv53,,21.10.13,FREE,백메란지,생각보다 커요,아주 만족해요,화면과 비슷해요,,,,어깨선이 안 맞아서 인지 좀 부해보이는 감이 없지않아 있지만 그것 말고는 이 가격에 이 퀄리티!! 너무 만족스러워여👍🏻👍🏻,Free
txWDYU0H,,21.10.13,FREE,크림,생각보다 커요,보통이에요,화면보다 밝아요,,,,옷 안쪽이 기모여서 되게 폭신하고 부드러워요 다만 옷이 펑퍼져서? 덩치가 커보일 순 있을 것 같아요 그래도 퀄리티는 좋은 편이예요,Free
SVznKArV,,20.11.17,FREE,그레이,생각보다 커요,보통이에요,화면과 비슷해요,157.0,43.0,44,엄청 빵빵~한 기모는 아니고 그냥 적당한 기모에요 크기는 157기준으로 예쁜핏으로 커요..! 데일리템으로 딱이에요,Free
YvJXNMoh,상위 10%,20.11.15,FREE,블랙,정사이즈예요,아주 만족해요,화면과 비슷해요,162.0,69.0,66,기모에다가 넉넉한 핏 아주 만족합니다!! 그냥 청바지에 입어도 찰떡이에요 안에 보들보들해서 너무 좋아요!!,Free
qGGKSvAe,,20.11.07,FREE,그레이,정사이즈예요,아주 만족해요,화면과 비슷해요,,,,"생각보다 질이 너무 좋은것 같아요
부드럽고 따뜻하니 편하게 입기 너무 좋아요!
근데 세탁 후에 살짝 줄어든 느낌이 있긴 한데 그래도 겨울에 입기 너무 좋아요!",Free
kOQ19ZNI,,20.11.03,FREE,그레이,생각보다 커요,아주 만족해요,화면과 비슷해요,163.0,68.0,66,"기모가 엄청 들어있어서 밖에서 입기엔 따듯하고 지하철같이 뛰어갈때는 등에 땀이 나는데 바람이 안통한다는 단점이있어요, 매우 루즈핏이예요. 데일리하게 입기 좋을 것 같아요.",Free
31**,,20.10.26,FREE,블랙,생각보다 커요,보통이에요,화면과 비슷해요,,,,처음에 너무 크길래 건조기에 한 번 돌려서 입었더니 156이 입기에 딱 괜찮았어요!! 후드티 치고 저렴한 가격인데도 퀄리티가 괜찮아서 마음에 들어요 😭,Free
46**,,20.10.25,FREE,블랙,생각보다 커요,보통이에요,화면과 비슷해요,153.0,65.0,66,"시보리 개짱짱
애플워치 차고 잇으면 손목 빼기 힘들어요ㅋㅋㅋ
뚱뚱해서 작으면 어쩔까 걱정했는데
그냥 편하게 막 입기 좋아요
근데 후드끈이 너무 길어서 좀 줄편하네요.,..",Free
49**,,20.10.24,FREE,레드와인,생각보다 커요,보통이에요,화면과 비슷해요,161.0,48.0,44,"노란색 살까 고민하다 와인색 샀는데 이쁨
그리고 따뜻함
기장은 엉덩이 딱 덮고 손 쫙 피면 끝에만 조금 나오는 정도",Free
fn1WvDyW,,20.10.19,FREE,블랙,정사이즈예요,보통이에요,화면과 비슷해요,154.0,46.0,55,기모가 너무 부르드러우ㅜ요 ㅠㅠ 그리고 생각보다 가슴길이가 커서 상체가 좀 커보인다라고 해야하나 ㅋㅋㅋ 다 괜찮아요 예쁘게입겟숩니댕😋,Free
67**,,20.10.17,FREE,레드와인,정사이즈예요,아주 만족해요,화면과 비슷해요,,,,레드와인 후드티가 모델사진에서는 레드와인이 아니라 그냥 레드처럼 밝고 하얀바탕에 있는 사진은 또 어두워서 고민했었는데 하얀바탕에 있는 사진 색이더라고요 색이 진해서 더 예쁜 것 같아요,Free
bexoDFuI,,20.10.16,FREE,그레이,정사이즈예요,아주 만족해요,화면과 비슷해요,,,,저렴해서 기대 안했었는데 기모도 빵빵하고 핏도 제가 원하던 적당한 오버핏이라 완전 만족했어요,Free
EcpLe6F2,,20.10.09,FREE,그레이,생각보다 커요,아주 만족해요,화면과 비슷해요,,,,"이 가격에 이정도 퀄리티라니 너무 좋아요..╰(*´︶`*)╯♡
길이는 164에 옷을 좀더 내리면 엉덩이 덮을수 있네요 제가 생각했던것보다 널널해 핏도 아주예뻐요..🥰",Free
