아이디,리뷰어 등급,작성 날짜,옵션1,옵션2,상품 사이즈,퀄리티,색감,키,몸무게,사이즈,리뷰내용,제품_사이즈
a6fGC56K,,23.10.10,옐로우,FREE,정사이즈예요,보통이에요,화면과 비슷해요,162,56,55,생각보다 두툼하지만 기모는 없어서 엄청 따뜻하게 입고다니지는 못할 거 같아요. 그리고 후드 무게가 무거워서 자꾸 옷이 뒤로 넘어가요.,Free
짜장언니,상위 10%,23.10.08,옐로우,FREE,생각보다 커요,아주 만족해요,화면보다 밝아요,160,50,66,"귀여운 샛노랑입니다.
버터크림느낌은아니에요 병아리색!
올해옐로우가유행컬러라는데 딱 날씨좋은날 기분내기좋음",Free
a5dwajY5,,23.09.21,옐로우,FREE,정사이즈예요,아주 만족해요,화면과 비슷해요,168,55,55,"장문을 썼는데 사진찍고나니 초기화됐네요ㅜㅜ
이쁩니다.
만족합니다.
며칠전 노랑 츄리닝 사서 세트개념으로 사봤는데 딱 좋습니다. 
원단도 지금입기 딱 좋습니다. ~",Free
pQH9kIe6,상위 15%,23.08.25,그레이,FREE,정사이즈예요,아주 만족해요,화면과 비슷해요,158,48,44,생각한 그대로의 핏이에요.. 너무 맘에 듭니다!! 가을 되면 잘 입을 거 같아요 ㅎㅎ 넘 아방하고 귀여워요.. 기모 버전도 살까 고민중이에요ㅠㅠ,Free
T7EvQuHk,,24.12.20,옐로우,FREE,정사이즈예요,아주 만족해요,화면과 비슷해요,153,45,44,완전 연노랑색 병아리같이 넘 귀여워요 ㅎㅎ 개나리색말고 연노란색을 원했는데 진짜 제가 원했던색입니당 ㅜㅜ 귀여워지고싶으면 추천!,Free
qT4Ey3AJ,,24.12.19,네이비,FREE,생각보다 커요,아주 만족해요,화면과 비슷해요,169,58,66,반신반의하면서 사봤는데 맘에드네여 지퍼 뻑뻑하단얘긴 뭔지알것같지만 색이랑 모자도 커서 좋음용,Free
3ye66AEb,,24.11.25,그레이,FREE,정사이즈예요,보통이에요,화면과 비슷해요,169,,55,"도톰하니 만족스러워요 
핏도 가오리핏인데 귀엽습니다 ㅎㅎ
여행갈때 입으려고 구매했습니다~",Free
3IqvEA7A,,24.11.05,옐로우,FREE,정사이즈예요,보통이에요,화면과 비슷해요,,,,"소매에 이물질이 묻어서 왔어요. 색감은 예쁩니다.
귀찮아서 그냥 입기는 할건데 검수를 잘 하고 보내주셨으면 좋겠습니다.",Free
rxU5DwkF,,24.10.08,그레이,FREE,정사이즈예요,아주 만족해요,화면과 비슷해요,,,,"덩치 있어보일 수도 있다고 해서 걱정했는데 부해보이지도 않고, 길이도 너무 길지도 짧지도 않아서 좋았어요. 편하게 잘 걸치고 다닐 것 같습니다.",Free
ERRo2zkf,,24.09.28,그레이,FREE,정사이즈예요,보통이에요,화면과 비슷해요,168,52,44,휘뚤마뚤 입기 좋은거같아요 ㅎ 너무 두껍지도 얇지도 않아서 좋으네오 ! 벨리드 제품 사면 거의 실패는 없는듯해요 ㅎㅎㅎ,Free
iyqYvzGs,,24.08.05,옐로우,FREE,생각보다 커요,아주 만족해요,화면과 비슷해요,164,60,66,톡톡한 원단에 모자핏이 예뻐요! 색감도 딱 예쁜 크림 옐로우라 입을때마다 기분이 좋아집니다!,Free
oA5vl0OZ,,24.05.28,그레이,FREE,정사이즈예요,보통이에요,화면과 비슷해요,158,48,44,옷 귀여워용 ㅎㅎ 살짝 무겁지만 좋아영 ㅎㅎ 라벨이 포인트 되는거 같아서 예쁨거같아용 ㅎㅎ 다른색도 사고싶어요 ㅎㅎ 굳 ㅎㅎ,Free
QT8VEJpJ,,24.03.29,옐로우,FREE,정사이즈예요,아주 만족해요,화면과 비슷해요,161,46,55,따뜻할 때 입기 딱 좋을 거 같아요! 퀄리티 좋네요ㅎㅎ 지그재그에서 산 옷들 중에 여기가 젤 맘에 들어오 또 사러올게요!!,Free
QxyU9eYu,,24.02.05,네이비,FREE,정사이즈예요,보통이에요,화면과 비슷해요,158,58,55,후드집업 너무너무 만족이에요! 퀄리티는 살짝 아쉽긴한데 아주 휘뚜루마뚜루입기에는 좋을거같아요 잘입을게요!!,Free
4YTkl2pI,,24.01.28,그린,FREE,정사이즈예요,보통이에요,화면과 비슷해요,162,45,55,너무 이뻐서 세개 주문했어요 ㅎㅎ 원래 크롭만 입는데 이건 기본인데 기본같지않고 너무 이뻐요 ㅎ너무 이뻐서 세개 주문했어요 ㅎㅎ 원래 크롭만 입는데 이건 기본인데 기본같지않고 너무 이뻐요 ㅎ너무 이뻐서 세개 주문했어요 ㅎㅎ 원래 크롭만 입는데 이건 기본인데 기본같지않고 너무 이뻐요 ㅎ,Free
4YTkl2pI,,24.01.28,네이비,FREE,정사이즈예요,아주 만족해요,화면과 비슷해요,162,45,55,너무 이뻐서 세개 주문했어요 ㅎㅎ 원래 크롭만 입는데 이건 기본인데 기본같지않고 너무 이뻐요 ㅎ너무 이뻐서 세개 주문했어요 ㅎㅎ 원래 크롭만 입는데 이건 기본인데 기본같지않고 너무 이뻐요 ㅎ,Free
u4BGDIR8,,24.01.11,그린,FREE,작아요,아주 만족해요,화면과 비슷해요,166,60,66,"사이즈가 조금 더 컸다면 좋았을 거 같아요
그래도 색상 예쁘고 마감 처리도 예뻐서
마음에 들어요!! 예뻐서 자주 입을 거 같아요",Free
jDORclRC,,24.01.10,그레이,FREE,정사이즈예요,보통이에요,화면과 비슷해요,168,52,44,"알바 출근할때 입으려구 샀어용
아주 막 입고다니는중.. 근데 모자가 너무커서 옷이 자꾸 뒤로 넘어가는건 조금 불편하긴한데
핏은 이뻐요",Free
63uLX2xF,,23.12.22,그레이,FREE,정사이즈예요,아주 만족해요,화면과 비슷해요,164,55,55,입었을때 너무 귀여워요ㅜㅠ 시즌바뀌면 깔별로 구매하고 싶을정도로 핏도 예뻐요. 만족스러운 쇼핑입니다. 계속 팔아주세요,Free
LPEYIkH5,상위 20%,23.11.27,그레이,FREE,정사이즈예요,아주 만족해요,화면과 비슷해요,160,51,55,어깨라인이 좀 크게 나오긴 했지만 오히려 귀여워여 다른색으로 또 구매한거예요ㅎㅎ 넘 귀여워서 다른색으로 또 살 예정입니당,Free
jfMI4MPf,,23.11.03,네이비,FREE,정사이즈예요,아주 만족해요,화면과 비슷해요,160,54,55,후드 화면이랑 똑같이 이뻐요 ~~~! 같이 구매한 아우터랑 레이어드 해서 입어도 이쁘네오.! 색깔도 제가 생각한거랑 같아오,Free
LoSDRvbI,,23.11.02,네이비,FREE,정사이즈예요,아주 만족해요,화면과 비슷해요,168,64,66,77사이즈인데 아방하니 이뻐요! 기장도 딱 좋고 와이드 청바지에 입으니깐 진짜 이쁘네요! 남편이 이쁘다고 엄청 칭츤 햌ㅅ어툐 ㅎㅎ,Free
HPMpLaV2,상위 30%,23.10.21,네이비,FREE,정사이즈예요,별로예요,화면과 비슷해요,164,52,66,"여러가지 후드집업들 중에 후기보고 고른 건데 생각보다 질은 별로예요 ㅠㅠ 지퍼도 열고 닫기 힘들고, 실밥도 이리저리 많이 튀어나와 있어서 가격 값은 못하는 거 같네용",Free
CFbybZLQ,,23.10.13,그린,FREE,정사이즈예요,보통이에요,화면과 비슷해요,159,45,44,음 가격 때문에 조금 아쉬운 것 같아요 어깨 부분이 약간 애매해서 지퍼 잠구면 폼이 되게 하찮아 보이는 …? 2-3만원대면 만족했을 것 같아요 색은 똑같습니다 ㅎㅎ 무난하게 잘 입을 것 같아요,Free
WYNq6bkW,,23.10.09,그레이,FREE,정사이즈예요,보통이에요,화면과 비슷해요,164,53,55,공항에서 딱 입기 편한 추리닝을 찾다가 구매하게 더ㅣ옿어요~! 제가 생각하던 디자인과 색상이라 만독핮키다 추천합니당,Free
lnc8mozD,,23.09.28,그린,FREE,생각보다 커요,보통이에요,화면과 비슷해요,,,,컬러가 산뜻해서 생얼에 입어도 귀엽고 사이즈도 넉넉해서 자주 입게 돼요~ 후드가 커서 뒤집어 쓸때 예뻐서 그것도 좋음!,Free
GQN3AAxT,,23.09.23,그레이,FREE,정사이즈예요,아주 만족해요,화면과 비슷해요,168,60,55,"배송 완전 빨랏고 아방하니 핏이 귀엽네요 ㅎㅎ
어느코디에 다 잘어울릴꺼같아요 !! 
잘 입겠습니다 감사합니당 ㅎㅎ 후드가 좀 많이 커요!",Free
마요미네,,23.09.18,그레이,FREE,정사이즈예요,아주 만족해요,화면과 비슷해요,156,38,44,재질 두툼하고 핏도 예쁘고 오래 입을 수 있을 것 같아요! 간혹 모자 핏이 이상한 후드들이 많은데 이 제품은 그런 걱정 할 필요가 없이 모든 핏이 다 예쁘네요!,Free
bfYulOhA,상위 10%,23.09.13,옐로우,FREE,정사이즈예요,아주 만족해요,화면과 비슷해요,167,53,55,"색상이 너무 예뻐서 산뜻해보여요^^
화면이랑 같아요~~ 사이즈, 퀄리티도 보이는것과 같아서 고민없이 구매하시면 될듯 합니당ㅋㄷ
친언니도 예쁘다고하네요😊",Free
xTPkPfJc,,23.06.10,그레이,FREE,생각보다 커요,아주 만족해요,화면과 비슷해요,165,55,55,"이 곳에서 옷을 처음 구매해본 뒤 옷들 퀄리티가 좋아 연속 구매완료,, 두께감이 있지만 오래 입을 거 같아요! 길이감도 적당!",Free
IfILDsVe,,23.05.14,옐로우,FREE,정사이즈예요,아주 만족해요,화면과 비슷해요,162,45,55,"핏도 아방하니 예쁘고 기장도 딱 좋고 색감도 아주 예쁘고 입이 마르도록 칭친하고 싶어요,, 노랑색이 정말 예뿐 파스텔 노랑이라 노랑색을 원하신다면 고민말고 구매하세요:)",Free
mIKv6ERS,,23.05.13,그린,FREE,정사이즈예요,아주 만족해요,화면과 비슷해요,161,62,44,"역시 벨리드는 퀄리티가 항상 대박인듯
생각보다 조금 크롭한 느낌ㅇ 있지만 아주 뱃살 못가릴정도는 아님 좀만 살 더 빼면 예쁠것같당 힝",Free
PA1lo4TH,,23.05.08,옐로우,FREE,정사이즈예요,아주 만족해요,화면과 비슷해요,160,55,55,"색상 재질 배송까지 너무 맘에들어요
다른색도 살까 고민이에요
추위를 많이타는편이라 한여름전까지 꾸준히 잘 입을꺼 같애요",Free
bguXiSFj,,23.05.04,네이비,FREE,정사이즈예요,보통이에요,화면과 비슷해요,165,52,55,두껍고 탄탄한 편이고 핏도 예뻐서 잘 입을 것 같아요! 지퍼가 좀 뻑뻑해서 잘 안되는데 그거 빼고는 완벽한 것 같아요 ㅎㅎ ㅠㅠ,Free
김두유,,23.04.30,옐로우,FREE,정사이즈예요,아주 만족해요,화면과 비슷해요,150,40,55,색 너무 예쁘고 초여름까진 입을 수 있을 거 같아요 사고 너무 마음에 들어서 다른 색도 구매 하려고 합니다 제 키가 150인데 저한테도 기장이 길지 않은 편이예요,Free
르웰라,,23.04.21,옐로우,FREE,생각보다 커요,보통이에요,화면과 비슷해요,160,47,55,"노랑노랑한 색이 귀엽네요 원래 이런 색감의 옷 잘 안 입는데 예뻐보여서 질렀어요
쿨톤인 저에게도 꽤 잘 어울린다구들 하구요 무난하게 입을 것 같아요",Free
TfXb4ctS,,23.04.06,네이비,FREE,정사이즈예요,아주 만족해요,화면과 비슷해요,,,,옷 배송 진짜 빠릅니다ㅎㅎ 착용 해보니 기대했던거보다 더 예뻐서 대만족입니다 ! 네이비 컬러 샀는데 옐로우도 하나 장만할까 봅니다~,Free
iOBGexWq,,24.12.10,그린,FREE,정사이즈예요,아주 만족해요,화면과 비슷해요,168,60,55,"탄탄한 쭈리면에 퀄리티 좋아요 !
크롭사이즈라 레이어드해서 입으니 이뻐요!!",Free
yha9***,,24.11.12,옐로우,FREE,생각보다 커요,보통이에요,화면과 비슷해요,158,52,55,모자큰거감안하고샀지만 무겁긴하네요 길이는적당한크롭이라이쁩니다지퍼가많이뻑뻑해서아쉬워요ㅎ,Free
PMexeXCV,,24.10.11,그레이,FREE,정사이즈예요,아주 만족해요,화면과 비슷해요,165,63,66,와… 너무 좋아요! 도톰하고 핏도 좋고 자수도 마음에 들고 ㅋㅋㅋㅋ 후드를 또 사야한다몀 또 살 생각 있어요!,Free
VO7NaeaZ,,24.10.04,그레이,FREE,정사이즈예요,아주 만족해요,화면과 비슷해요,148,39,33 이하,모자 포인트로 자수도 이쁘고 적당한 크롭길이에 루즈핏 예뻐요,Free
sooh******,,24.10.02,그레이,FREE,정사이즈예요,아주 만족해요,화면과 비슷해요,159,61,66,드디어 왔어용! 그린이 너무 맘에 들어 그레이 많이 기다렸는데 금방 와서 기분이 좋슴당 똑같이 예쁘고 편해요 감사합니다,Free
tUqm52by,,23.12.20,네이비,FREE,정사이즈예요,아주 만족해요,화면과 비슷해요,158,58,66,핏이 넘 예쁘고 만족스러워요! 후드가 큰데도 불구하고 모양이 예뻐서 괜찮아요. 사길 잘 한거 같아요!! 맘에 듭니다!,Free
DuITdKPT,,23.11.14,네이비,FREE,정사이즈예요,아주 만족해요,화면과 비슷해요,162,61,66,지퍼가 살짝 뻑뻑한데 넘 귀엽고 편하고 좋습니다 편하게 입기 좋아요 옷이 살짝 무겁긴 한데 두꺼워서 그러려니 하고 입는중,Free
dkanehdkfw,,23.11.07,옐로우,FREE,정사이즈예요,아주 만족해요,화면보다 밝아요,165,68,66,사진보다 약간 더 밝은 노란색이에요 165 기준 조금 컸어요 그래도 딱 맞게 큰 느낌이라 예뻤어요 봄웜라이트 분들은 되게 잘 어울릴 것 같은 그런 느낌 ㅎ..,Free
zHib8pLT,,23.10.20,옐로우,FREE,정사이즈예요,아주 만족해요,화면과 비슷해요,169,59,55,"일단 이뻐요
색감도 이쁘고 기장도 예뻐요
모자가 조금 무거운 느낌이 있어서 아래로 떨어져서 더 크롭 느낌이 나요",Free
Gcq7GpGV,,23.10.14,그레이,FREE,정사이즈예요,아주 만족해요,화면과 비슷해요,158,56,55,후드 크기가 너무 마음에 들도 크롭도 적당합니다 색깔도 예뻐서 옆에 남자직원이 남자도 있으면 사고싶다고 했어요 ㅎㅎ 많이 예쁘니까 얼른사세요,Free
1OB2162j,,23.10.11,그레이,FREE,생각보다 커요,아주 만족해요,화면과 비슷해요,161,60,66,노란색 구매하고 너무 맘에 들어서 그레이색으로도 구매했어요! 옷 품리 생각보다 크고 넉넉해서 핏이 아방하게 떨어져서 좋아요,Free
UV0i3Jqu,,23.10.04,네이비,FREE,생각보다 커요,아주 만족해요,화면과 비슷해요,166,68,66,"제발 쟁여놓으세요,, 초록색 사고 모자핏이랑 너무 예뻐서 색깔별로 시켰습니다👍🏼",Free
aGQI3mAF,,23.09.27,그린,FREE,정사이즈예요,보통이에요,화면과 비슷해요,160,54,55,기본 후드집업이 필요해서 샀는데 너무 맘에 들어요!! 두툼에서 지금 날씨에는 반팔 위에 입기 좋은거 같아요. 색상도 너무 이뻐요!!,Free
NWrZVAJp,,23.09.19,네이비,FREE,정사이즈예요,아주 만족해요,화면과 비슷해요,153,63,66,예뻐요~가격대가 있어서 그런지 퀄리티 좋습니다. 좀 두꺼워서 지금은 못입지만 날이 쌀쌀해지면 잠옷처럼 입고다니려고여 ㅎㅎ,Free
ziggg,상위 10%,23.05.22,그레이,FREE,정사이즈예요,보통이에요,화면과 비슷해요,,,,크롭 후드집업이 필요해서 구매했는데 길이도 적당하고 핏도 마음에 드네요! 단독으로 입어도 예쁘고 코트 안에 레이어드 하기도 예뻐요!,Free
LmGUVoNo,,23.05.08,옐로우,FREE,생각보다 커요,아주 만족해요,화면과 비슷해요,,,,너무 예뻐요 출근할 때 데일리로 입고다니기 좋은 것 같아요 재질도 좋아서 오래 입을 거 같아요 예뿐 가 마니마니 팔아주세영 ㅎㅎㅎ,Free
U0uCpKMY,상위 20%,23.04.19,옐로우,FREE,생각보다 커요,보통이에요,화면보다 밝아요,161,50,55,색은 생각보다 병어리색?! 이에요 🌼 딱요런색?! 그리고 생각보다 통이 좀 크더라구요 그래선지 허리가 좀 안 잡아주는 것 같아욥 그치만 이쁩니당,Free
n3VxLjTs,,23.04.14,그린,FREE,정사이즈예요,보통이에요,화면과 비슷해요,160,50,55,"생각보다 엄청 커요! 제가 작기도 합니다! 
퀄리티는 괜찮고 탄탄해요. 편하게 봄에 여름에 잘 걸치고 다닐고 같아요!!",Free
GzF01sHC,,24.10.22,그레이,FREE,정사이즈예요,보통이에요,화면과 비슷해요,155,53,55,넘나리 맘에 들어유 😊😊😊봄가을겨울 내내 너무 잘입을것같아요 여기서 마니 구매할게용 잘입을세여 ㅎㅎ 감사합니당 !,Free
2em2tCpZ,,24.03.27,그레이,FREE,정사이즈예요,보통이에요,화면과 비슷해요,,,,"배송이 지인짜.... 오래걸렸지만 옷은 마음에 드네요ㅎㅎ
요즘 입기 딱 좋고 생각보다 사이즈도 넉넉하고
기장도 적당하고 좋아요!",Free
eQFwXJAA,,24.02.20,옐로우,FREE,정사이즈예요,보통이에요,화면과 비슷해요,158,50,66,"이 제품은 넉넉한 사이즈가 제일 장점인데요
구입 후 세일이 시작해서 마음이 조금 아팠습니다 ㅋ
그래도 남은 추운 계절 잘 입을게요",Free
eQFwXJAA,,24.02.20,그레이,FREE,정사이즈예요,보통이에요,화면과 비슷해요,158,50,66,"이 제품은 넉넉한 사이즈가 제일 장점인데요
구입 후 세일이 시작해서 마음이 조금 아팠습니다 ㅋ
그래도 남은 추운 계절 잘 입을게요",Free
jhzqhjvp,,23.12.07,옐로우,FREE,정사이즈예요,보통이에요,화면과 비슷해요,157,42,44,색감도 너무 예쁘고 핏도 예뻐서 요즘 잘 입고 있습니다! 겨울에 딱 잘어울리는 것 같아요:) 주변에서도 물어보더라구요!,Free
HDAx9Myf,,23.11.20,그레이,FREE,생각보다 커요,아주 만족해요,화면과 비슷해요,163,56,55,"퀄리티가 좋은 거 같아요 아방한 느낌이고 꾸안꾸로 입기 딱 좋습이다!! 너무 얇지도 않아서 적당한거같아요 가을,봄에 잘입을거같아요 ㅎㅎ",Free
Hf5KuD9J,,23.10.25,옐로우,FREE,정사이즈예요,아주 만족해요,화면과 비슷해요,158,58,55,"진짜 너무너무 예뻐용 ㅠㅠ 
흐물거리지 않아서 핏도 아주 예쁩니댜 … 제가 딱 찾고 있던 색상과 핏의 크롭 후드집업을 찾은 굿 같아서 행복해효",Free
4Viv8UBh,,23.10.19,그레이,FREE,정사이즈예요,보통이에요,화면과 비슷해요,170,62,66,너무너무 잘 맞고 체형에 딱 맞아서 너무 만족해요! 색도 예쁘고 핏이 예뻐서 잘 입고 다닐 거 같아요. 다음번에 다시 구매할 예정입니다!,Free
6rOfEF3H,,23.10.13,그레이,FREE,정사이즈예요,보통이에요,화면과 비슷해요,160,50,55,너무 가볍고 휘두루마뚜루 잘할 것 같아요! 다만 투웨이 밑 지퍼가 자꾸 자기 마음대로 올라가더라구요ㅋㅋ큐ㅠ 이 점이 조금 아쉬워요!,Free
zAqSX2g5,,23.10.09,옐로우,FREE,정사이즈예요,보통이에요,화면과 비슷해요,156,55,66,"색감 귀여워요 뼝아리 가타요
이제 슬슬 차가워진 바람에
입을수 있을거 같네요
살땐 따뜻했는데 ㅎ
모자도 커서 조하용 ㅎㅎ ❤️",Free
rqEG3lO2,,23.09.18,그레이,FREE,정사이즈예요,아주 만족해요,화면과 비슷해요,160,57,55,"딱 생각했던 핏 그대로에용! 완전 귀요밍 스타일이에요!
휘뚜루마뚜루 가을에 입고 다닐수있을듯용😁
다만...지퍼가 잘...ㅎㅎ 그래도 예뻐서 잘입고 있습니당!",Free
YElkQwrR,,23.04.29,옐로우,FREE,정사이즈예요,아주 만족해요,화면과 비슷해요,169,30이하,66,지인짜 퀄 뭐조 개맘에듬 배송은 5일인가 만에 오긴 했는데 고것조차 용서하게 만드는 하드캐리 옷임 개이쁨 진짜루요 ㅠㅠ,Free
bllcuh6t,,23.04.14,그레이,FREE,생각보다 커요,보통이에요,화면과 비슷해요,150,43,55,모자가 엄청 크긴하네요.. 일단 소매가 너무 길면 어떡하지 걱정했는데 150 밖에 안되는 제게 잘 맞네요 꽤 두꺼워서 봄에 자주 입고 다닐 것 같아요!,Free
Ig1IHRSm,상위 15%,24.11.19,그레이,FREE,정사이즈예요,아주 만족해요,화면과 비슷해요,163,58,55,무난한 후드집업이에요. 핏도 골반 걸쳐져서 예쁜 핏이 나옵니다. 추천!,Free
V8pIoqes,,24.10.12,그레이,FREE,정사이즈예요,보통이에요,화면과 비슷해요,161,52,55,"재질 빳빳 완벽 그잡채 ! 
회색 구매하고 다른색도 구매할 예정입니당 !! 
다들 고민하지말고 구매하세오 짱짱 
오늘 입고 나가야쥥",Free
wSkH0s3L,,24.02.10,그레이,FREE,정사이즈예요,아주 만족해요,화면과 비슷해요,164,65,66,요새 가장 유용하고 입고 있은 옷이에요 정말 편하게 어디 가든 입을 수 있고 옷이 너무 이뻐요 모자도 적당히 큰편인거 같아서 만족스럽습니다!,Free
hHVwOgIk,상위 15%,24.01.09,그레이,FREE,생각보다 커요,아주 만족해요,화면과 비슷해요,154,48,55,낭낭한 핏이라 괜찮구용 패딩안에 입으면 약간 두툼해질 거 같긴한데 포인트 주기 괜찮고 휘뚜루 마뚜루 입기 괜찮습니당!,Free
ZNv5M0UQ,,23.11.11,네이비,FREE,생각보다 커요,아주 만족해요,화면과 비슷해요,,,,"후드집업은 회색밖에 없어서 남색 하나 장만했는데 너무 만족합니다! 
모자도 생각보다 크고 자수 적혀져있는게 귀여워요ㅠㅠ",Free
02sqbYEM,,23.11.09,옐로우,FREE,생각보다 커요,아주 만족해요,화면보다 밝아요,163,55,55,좀 더 크롭한 느낌일 줄 알았는데 그렇진 않아서 아쉬워요. 하지만 컬러가 .. 너무 예뻐서 입으려구요 ㅋㅋ 아주 예쁘고 선명한 레몬색입니다!,Free
jX4Oqndp,,23.10.12,그레이,FREE,정사이즈예요,보통이에요,화면과 비슷해요,168,66,66,"1일에 주문해서 이제서야 받았는데
가격만큼 퀄리티인지는 모르겠는데 핏이 이뻐요
잠궈서 입어야 모지 핏이 이쁘게 나와요",Free
PbfpmPsA,,23.10.12,네이비,FREE,정사이즈예요,아주 만족해요,화면과 비슷해요,164,54,55,"정사이즈 오버핏이고 모자가 커서 맘에들어요 
핏도 예쁨~~ 깔별로 사고싶네여 ㅎㅎ
예쁜 후드티 많이 만등너주세요",Free
MQjHMBxd,상위 30%,23.09.23,옐로우,FREE,정사이즈예요,아주 만족해요,화면과 비슷해요,160,48,44,색감이 너무 맘에 들어요~~~ 병아리색이라 피부가 하얀 사람은 완전 화사해 보여요~~ 핏도 여기 사진이랑 가타요,Free
awGzsz4X,,23.09.22,그레이,FREE,정사이즈예요,보통이에요,화면과 비슷해요,164,60,66,"가오리를 생각하지 않았던터라
조금 당황스럽긴하지만ㅎㅎㅎ
예뻐요 잘입을듯 해요~!
후드도 크고 재질도 탄탄할거 같구요
세탁 잘해서 입어보게요~",Free
wxV1USsi,,23.09.07,그레이,FREE,정사이즈예요,보통이에요,화면과 비슷해요,158,55,66,"다른후기에서 본것처럼 확실히 빳빳한 제질인거같아요
158키 기준으로 위로 왕 만세하면 배꼽까지는 보이는거같아요(사람마다 상체길이는 다르겠지만!)
두께도 생각보다는 있어서 더 가을날씨가 되면 입을려구요! 아직은 더워요",Free
n1UNad8i,,23.09.06,네이비,FREE,정사이즈예요,보통이에요,화면과 비슷해요,163,55,66,생각보다 옷이 무거웠는데 막상 입으면 그런 느낌은 없고 원단이 탄탄하고 두께감도 살짝 있어서 오히려 너무 좋아요!,Free
따룽,,23.05.17,옐로우,FREE,정사이즈예요,아주 만족해요,화면과 비슷해요,165,51,44,"색도 너무 이쁘고 핏도 아방 하니 너무 귀엽습니다!!
생각보다 살짝 두께가 있어요 그래도 핏이 너무 이쁘네요!",Free
Wf0yUhe4,,24.11.15,옐로우,FREE,정사이즈예요,보통이에요,화면보다 밝아요,165,53,55,"색감 장난아니에요!! 뭐죠? 
제가 이런 파스텔톤 노랑 엄청 좋아하는데!!
이런 거 찾다가 구매했는데 너무 예뻐요!!
이런 색감 어디없어요!ㅠㅠ",Free
VNzqeMc6,,24.10.07,블랙,FREE,정사이즈예요,보통이에요,화면과 비슷해요,160,60,66,굿굿 완전크롭말고 약간 새미찾았는데.길이 아주 맘에들고 핏도아주좋아용 제가 딱 원하던옷이에오ㅜ,Free
qrsbPOvL,,23.11.01,옐로우,FREE,정사이즈예요,아주 만족해요,화면과 비슷해요,150,51,55,색깔도 너무 예쁘고 핏도 완벽해요!! 다른색 또 사려구요! 친구들이 예쁘다고 어디서 샀냐고 물어보네요~~ 사진찍으니까 사진도 잘 나와요,Free
7mdMgqpp,상위 15%,23.10.17,그레이,FREE,정사이즈예요,아주 만족해요,화면과 비슷해요,158,51,55,초5 딸 입힐려고 샀는데 딸이 아주 만족합니다 요즘 날씨에 입기에도 딱이라 교복처럼 입더라구요 ㅎㅎ 옷이 도톰해서 모자 써도 이쁘다고 만족하며 입고 있습니다,Free
0LoZUCVA,,23.10.15,옐로우,FREE,정사이즈예요,보통이에요,화면과 비슷해요,164,50,55,색깔 미쳤어요ㅎㅎ 남자친구가 병아리 색 귀엽다구 그러네용ㅎㅎ 상큼 그 자체 색깔이에요! 약간 뒤로 끌리는게 있는데 예뻐서 괜찮아요,Free
1BzFgszF,,23.09.24,그린,FREE,정사이즈예요,아주 만족해요,화면과 비슷해요,157,46,44,숏인데도 안 짧아서 오히려 좋았어요 리뷰에 생각보다 숏만큼 안 짧고 길대서 일부러 샀는데 적당히 골반윗선까지 와서 이뻐요,Free
QbGF3ERP,,23.05.06,그레이,FREE,생각보다 커요,보통이에요,화면과 비슷해요,165,53,55,이뻐요~밑에 자크가 첨엔 좀 뻑뻑한데 계속하다보면 잘올라갑니다.. 무난템!! 휘뚜루마뚜루 입을만합니닿ㅎㅎㅎㅎ,Free
S0h3Fogw,,23.05.01,그레이,FREE,정사이즈예요,아주 만족해요,화면과 비슷해요,164,65,66,모자가 무겁다는 후기가 많았는데 진짜 모자가 무겁긴해요 지퍼 안잠구면 옷이 뒤로 넘어가는데 지퍼잠구면 그나마 나아요 그래도 옷은 이뻐요,Free
