아이디,리뷰어 등급,작성 날짜,옵션1,옵션2,상품 사이즈,퀄리티,색감,키,몸무게,사이즈,리뷰내용,제품_사이즈
fITGb6Xr,,24.07.08,아이보리,one size,정사이즈예요,아주 만족해요,화면과 비슷해요,166.0,56,55,"이거 올여름 제일 만족스러운 소비입니다 ㅋㅋㅋㅋ 출근할때 입을 티셔츠 고민많이하다 샀는데, 과하게 붙지 않으면서도 후줄근한 느낌도 아니고, 일단 면이 너무 좋아요! 보들보들 톡톡하고 진짜 잘 안 늘어날 것 같아요. 많이 파이지도 않고... 팔뚝 부각 진짜 없어요!! 넘 맘에들어서 깔별로 쟁였습니다",Free
6NO5Hkgj,상위 25%,24.07.07,아이보리,one size,정사이즈예요,아주 만족해요,화면과 비슷해요,158.0,43,44,핏이 예뻐요 길이는 살짝 애매하긴 한데 넣어입거나 하면 될 거 같아요 약간 속옷이 비치긴 하는데 신경쓰일 정도는 아니에요 두께는 좀 있고 근데 예쁩니당,Free
기미스리,,24.07.05,블랙,one size,정사이즈예요,보통이에요,화면과 비슷해요,,,,블랙은 아직 입고 찍지 못해서 화이트로 후기를 남겨봅니다..!! ㅎ꙼̈ 생각보다 팔둑 핏 가려줍니다!! 어느정도 부담없이 입기 좋아요,Free
zBH3ljPX,,24.07.05,그레이,one size,정사이즈예요,아주 만족해요,화면과 비슷해요,158.0,55,55,"이거....대박템이에요ㅎㅎ
원단이 텐션좋은데 쫀쫀해서 
챡 잡아주는느낌이고 
예쁘게 핏되서 괜히 날씬해보이고 그래요ㅎ
그레이 먼저 주문해입다가 화이트 재구매합니다^^
전컬러 만들어주세요",Free
4CvNjQ3H,,24.07.05,그레이,one size,작아요,아주 만족해요,화면과 비슷해요,175.0,78,,제키와덩치에 비해서 소매가 너무 짧아서 제 팔뚝살을 ㅜㅜ 다 가려주진못했지만 정면에서 보면 나름 커버해주는것같아요! 재질도 탄탄해서 오래입을것같아요,Free
dlgm*****,상위 20%,24.07.05,블랙,one size,정사이즈예요,아주 만족해요,화면과 비슷해요,159.0,43,44,생각보다 많이 얇지는 않아요! 근데 쫀쫀하고 길이도 요즘은 너무 짧은게 많이 나오는데 적당해서 좋아요 ㅎㅎ 색상3가지 구매했어요 !,Free
dlgm*****,상위 20%,24.07.05,블루,one size,정사이즈예요,아주 만족해요,화면과 비슷해요,159.0,43,44,생각보다 많이 얇지는 않아요! 근데 쫀쫀하고 길이도 요즘은 너무 짧은게 많이 나오는데 적당해서 좋아요 ㅎㅎ 색상3가지 구매했어요 !,Free
qCQUPmMn,,24.07.04,아이보리,one size,작아요,보통이에요,화면과 비슷해요,159.0,48,44,아주 그냥 쫜득쫜득한 느낌을 넘어서서 텁텁하게 몸을 옥죄어 오는 느낌도 있긴해요 근데 왠만한 세탁기에 안 늘어날듯하긴 해요 그만큼 재질이 강력하고 살짝 두껍슴다,Free
qlFY2PZ4,,24.07.03,그레이,one size,정사이즈예요,아주 만족해요,화면과 비슷해요,159.0,47,55,"목이 좀 조이는 느낌에요.
사진 상으로는 나풀 거리는 재질 인 줄 알았는데
두께감이 좀 있어요.
습하고 뜨거운 여름에는 못 입을 거 같아여.",Free
dZGIbkm7,,24.07.02,그레이,one size,정사이즈예요,보통이에요,화면과 비슷해요,158.0,47,55,그냥 저냥 맘에 글어요 겨드랑이에 좀 껴요 팔뚝이 엷아 보여요 찰랑찰랑한 느낌이라 여름에도 별로 안더움 느낌? 살을 좀더 빼야 할드ㅛ,Free
ruPrW92W,,24.07.02,그레이,one size,정사이즈예요,아주 만족해요,화면과 비슷해요,158.0,49,55,"후기대로 정말 정말 좋어요
폴리라 걱정했는데 뷰드럽고 변형도 적을 것 같습니다! 저는 이미 두색 샀는데 다른색도 사러구요.왕추천합니다. 데일리 출근룩 다 가능",Free
Qba8WR7c,,24.07.02,아이보리,one size,작아요,보통이에요,화면과 비슷해요,167.0,53,55,"팔뚝살이 슬림해보이는 효과가 있어서 
매우 좋아했습니당 근데 빨래 몇번 돌리니 보풀이 전반적으로 일어나네여 ㅠㅠ
그래서 곧 재구매 들어갑니다",Free
1PKbw1zl,,24.07.01,그레이,one size,정사이즈예요,아주 만족해요,화면과 비슷해요,153.0,45,44,옷 재질이 짱장해서 완전 좋아요 스판이 있어서 잘 늘어나요 팔뚝 길이도 적당하고 넣어입어도 빼내서 입어도 예뻐요 요즘 아주 잘 입고 있습니다.,Free
9V2BNfgu,,24.07.01,그레이,one size,정사이즈예요,아주 만족해요,화면과 비슷해요,165.0,50,44,어깨부터 팔까지 떨어지는 라인이 진짜 예쁘고 너무 붙지 않으면서 적당히 잡아주니 여기저기 입기 좋아요 목이 생각보다 올라와서 살짝 답답해보이긴 하지만 목걸이 하나 해주면 예뻐요,Free
d8oQLT8Q,상위 25%,24.07.01,그레이,one size,정사이즈예요,보통이에요,화면과 비슷해요,,,,"생각보다 많이 도톰했어요! 그래서 한 여름에 입기보단 봄 가을에 입으면 딱일 것 같아요
목 라운드 부분이 좀 올라와 있어서 목 짧으면 답답해 보일수도 있다는 점 참고해주세요",Free
9BCFCOti,,24.06.30,아이보리,one size,정사이즈예요,보통이에요,화면보다 어두워요,162.0,53,55,"모양새는 아주 만족스러운데 재질이 생각했던 느낌이 아니네요 쫀득한 원단이라는 말이 틀린건 아니지만 탄성이 떨어지는 비교적 덜 촘촘한 원단이고 순면느낌과 거리가 먼 느낌이에요 그래서인지 잘 비치기도 하네요
몇번 입고 세탁하면 톤이 어두워질 것 같아요 그치만 가격이 적당하니 필요한 만큼 입을 수 있을 듯 해요
좋은 재질이 아니라는 것은 참고하시면 좋을 것 같아요",Free
Ir16Qumf,,24.06.29,그레이,one size,정사이즈예요,아주 만족해요,화면보다 어두워요,158.0,48,44,가격대비 퀄리티 미쳤어요;; 너무 싸서 별 기대 안했는데 정말 맘에 듭니다!!! 빨아도 안늘어나고 짱짱해요! 몇벌 더 쟁여도 좋을 것 같아요,Free
UDIe7Q7U,,24.06.29,아이보리,one size,정사이즈예요,보통이에요,화면과 비슷해요,163.0,46,55,"예뻐요 블랙사고 너무 잘입어서 화이트도 구매했어요
핏이 아주 딱 붙지도 않고 그렇다고 헐렁하지도 않아서 딱 예쁜 핏이고 색감은 크림색이에요 화이트는 아닙니다",Free
kNSY8iTv,,24.06.29,그레이,one size,정사이즈예요,보통이에요,화면과 비슷해요,162.0,49,55,"톡톡하고 부드럽고 소재 좋아요 ㅎㅎ 날씬해보이더라고요 
다른컬러도같이 사볼걸 그랫어요 ㅎㅎ 그래도 군살은 있어서 단독으론 안입을둣 😂",Free
IvsEKwEC,,24.06.29,그레이,one size,정사이즈예요,아주 만족해요,화면과 비슷해요,170.0,60,66,핏이 예쁘게 잡혀요 은근히 팔뚝 부각될 것 같았는데 정말 예쁘게 몸에 착 붙습니다!! 다만 핏에 신경을 쓰다보니까 어깨라인이 조금 불편하긴 해요ㅜㅜ,Free
jrspe7SC,,24.06.28,그레이,one size,정사이즈예요,아주 만족해요,화면과 비슷해요,160.0,47,55,"반팔티의 정석
스탠다드핏
소재감 아주 훌륭해요
만져보고 놀랬어요ㅋㅋ쫀득한 티셔츠들은 참 많지만
이렇게 톡톡한 소재에 쫀득말랑해요
두께감이 꽤 있어서
레이온 소재의 찰랑이랑은 거리가 멀구요
하여튼..좀 입어보고 깔별로 재구매해야겠어요",Free
OwCHGb0U,,24.06.28,아이보리,one size,정사이즈예요,아주 만족해요,화면과 비슷해요,160.0,55,55,오홍 저는 팔뚝이 ㅋㅋㅋ 하하 근데 뭐 괜찮아요 네 . . . 그 허리라인이 좀 더 들어갓음 좋았을거같은데 ㅋㅋㅋ 음 암튼 크롭입니다,Free
fWo3mG5G,상위 15%,24.06.26,블루,one size,정사이즈예요,보통이에요,화면과 비슷해요,163.0,53,55,"신축성이 좋아서 막 입기 좋아요
청바지랑 입어도 좋고 츄리닝이랑 편하게 입어도 좋아요
팔 소매 부분이 짧은데 그래도 부담스럽지 않아서 예쁩니다",Free
b9aDg1Am,,24.06.26,그레이,one size,정사이즈예요,보통이에요,화면과 비슷해요,160.0,52,55,"세탁하기전에는 소재좋습니다 보풀난다는말있는데 세탁해봐야알겟네요
두툼해서 어깨핏은좋은데 허리가 얇아보인다거나 하진않아요 
팔뚝살 살짝!아주살짝 가려주는거같아요 또 구매할 의향은 없습니다 여름옷인데 두꺼워서 비추해요",Free
LxGUIdbk,,24.06.26,그레이,one size,정사이즈예요,아주 만족해요,화면과 비슷해요,160.0,48,44,"몸매 라인이 드러나는 이런 티셔츠들은 대부분 팔뚝이 너무 부각되어서 팔뚝이 더 뚱뚱해보였는데 , 어깨라인이나 팔 끝단 라인이 팔뚝살을 보완해주게끔 디자인되었는지 이 티셔츠는 팔이 날씬해보여요 . 아주 마음에 듭니다. 총장도 딱 적당해요!",Free
ylmOheAU,상위 20%,24.06.25,그레이,one size,정사이즈예요,아주 만족해요,화면과 비슷해요,160.0,48,44,세상에 기대 전혀 안했는데 핏 대박이에요 엄청 날씬해보이고 이븝니다 ㅠㅠ 이건 깔별로 다 쟁여야해요 색 더 다양하게 내주세여 !! 팔뚝살 커버도 잘됩니당 굿굿,Free
sung******,상위 20%,24.06.25,그레이,one size,정사이즈예요,보통이에요,화면과 비슷해요,166.0,53,44,핏 진짜 이쁘네용 팔뚝살 나온 부분 딱 가려주고 슬림핏으로 이쁘게 연출되네용! 위에 탑이나 블라우스 레이어드 해서 입으면 이쁠 것 같아용,Free
d3mz99Cq,,24.06.25,아이보리,one size,정사이즈예요,아주 만족해요,화면과 비슷해요,158.0,50,44,입었을 때 생각보다 조금 두꺼웠는데 쫀쫀하고 핏이 너무 예뻤어요! 색은 백색은 아니고 약간 아이보리 느낌? 이었고 길이감도 너무 짧지도 길지도 않은 적당해서 빼서 입어도 예쁘고 넣어입어도 예뻐요!,Free
zFVnvTke,,24.06.24,아이보리,one size,정사이즈예요,아주 만족해요,화면과 비슷해요,169.0,55,55,"퀄은 정말 좋은거 같아요!!
제가 팔뚝에 살이 없는 편인데도 기장감이 조금 부해 보이는 느낌이 들더라구요ㅠ 
아예 마른 분이 입으면 이쁠거 같아요 
그리고 색은 하얀색 아니고 딱 아이보리 색입니다!",Free
0dzyKOMq,,24.06.22,그레이,one size,정사이즈예요,아주 만족해요,화면과 비슷해요,170.0,52,55,"회색티는 땀났을때 티가 많이 나는게 부담스러워서 못입었는데 이 티는 그렇게 티 안나요ㅎㅎ 
그리고 찰랑거리는데 딱 안달라붙어서 좋아요ㅋᩚㅋᩚㅋᩚ 다른색도 재구매하고픔ㅎㅎ",Free
zMomZ9lg,상위 30%,24.06.22,아이보리,one size,정사이즈예요,아주 만족해요,화면보다 어두워요,165.0,62,77,쫀쫀해서 맘에 들어요 근데 생각보다 팔이 많이 짧아서 팔뚝이 살짝 부각되려는 느낌? 살짝만 더 길었으면 좋았을거 같은데 그거 빼고 만족합니다,Free
zMomZ9lg,상위 30%,24.06.22,블랙,one size,정사이즈예요,보통이에요,화면과 비슷해요,165.0,62,77,쫀쫀해서 맘에 들어요 근데 생각보다 팔이 많이 짧아서 팔뚝이 살짝 부각되려는 느낌? 살짝만 더 길었으면 좋았을거 같은데 그거 빼고 만족합니다,Free
0SQYxwyP,,24.06.22,그레이,one size,정사이즈예요,아주 만족해요,화면과 비슷해요,160.0,48,55,"저 가성비충인데 이거진짜 가격 퀄리티 핏 색상 단점이 1도 없는 옷이예요..
무채색말고 다양한컬로가 나왔으면 좋겠어요 깔별로 쟁이게요!!!",Free
g0JQmFho,,24.06.21,그레이,one size,정사이즈예요,아주 만족해요,화면과 비슷해요,163.0,53,55,"그레이 약간 톡톡한 사이즈 길이 색상 정55사이즈 잘맞아요
그레이 맘에들어서 검정 추가주문했는데 그레이보다 전체적으로 좀 작아서 아쉬웠어요",Free
Bl4VWFLo,,24.06.20,그레이,one size,정사이즈예요,아주 만족해요,화면과 비슷해요,166.0,57,55,"와 제가 원하는 딱 기본티 그대로에요..
앞으로 티는 여기서만 주문할 듯 하네요
여름 더운 날씨에 회색티셔츠..
겨땀이 너무 걱정되긴하는데 도전해봅니다",Free
rlaa*****,탑리뷰어,24.06.20,아이보리,one size,작아요,보통이에요,화면과 비슷해요,160.0,53,55,"아이보리 사고 맘에 들어서 추가 구매했어요!
질이 나쁘진 않지만 그래도 한 철 입을 수 있는 수준인 거 같아서 휘뚜루마뚜루 막 입으려구요ㅎㅎ
기본티로는 짱인 것 같습니다!",Free
WmCmjTuU,상위 15%,24.06.20,아이보리,one size,정사이즈예요,보통이에요,화면과 비슷해요,164.0,50,55,제품명 그대로 쫀득 찰랑 스판 티셔츠네요. 뷔스티에 안에 레이어드해서 입으려고 샀는데 품도 딱 맞고 잘 어울려요. 직진배송이라서 빠르게 받았습니다.,Free
6EETYMyH,,24.06.19,그레이,one size,정사이즈예요,보통이에요,화면과 비슷해요,169.0,53,55,"마감 정리가 좀 필요헌데 핏이 이쁘고 좋아요!!
몰랐는데 다른 스토어에서 산 거랑 똑같은 도매처 제품이더라구요! 더 저렴하게 구매할 수 있어서 다음에는 여기서 더 사려구요",Free
tz3BTB4G,,24.06.18,그레이,one size,정사이즈예요,보통이에요,화면과 비슷해요,161.0,43,44,"회색 쫀쫀티가 필요해서 구매했어요
리뷰보고 괜찮아보여서 구매했어요
딱 찾던 디자인 소재네요
입고 빨아봐야 알겠지만 지금까진 만족이네요",Free
AobUqU9L,,24.06.18,아이보리,one size,정사이즈예요,아주 만족해요,화면과 비슷해요,160.0,50,55,"기본템 정석 중의 정석.. 여기서 처음 구매해봤는데 아주 만족해서 깔별로 쟁이려구요;; 걍 여름 필수템, 직장인 필수템,,, 기본템의 정석,, 저렴한 가격에 감사합니다ㅜ",Free
zJOOQ7Gj,상위 5%,24.06.17,블랙,one size,정사이즈예요,아주 만족해요,화면과 비슷해요,157.0,48,44,예뻐요 ㅎㅎ 팔뚝살이 조금 쪄서 그런지 부각이 되긴 하지만 .. 그래도 핏 자체는 아주아주 만족스럽습니당 ㅎ 다른 컬러도 사보고 싶어옹,Free
M7tv6lyV,상위 25%,24.06.16,블랙,one size,정사이즈예요,아주 만족해요,화면과 비슷해요,156.0,50,55,딱 제가 원하던 스탈입니다!! 재질도 맘에 들고 스판기 있어요~ 리뷰보고 두개 구매하면서 괜찮을지 고민 많이 했는데 너무너무 잘 산거 같아요:),Free
M7tv6lyV,상위 25%,24.06.16,그레이,one size,정사이즈예요,아주 만족해요,화면과 비슷해요,156.0,50,55,딱 제가 원하던 스탈입니다!! 재질도 맘에 들고 스판기 있어요~ 리뷰보고 두개 구매하면서 괜찮을지 고민 많이 했는데 너무너무 잘 산거 같아요:),Free
iwit**,,24.06.14,그레이,one size,정사이즈예요,아주 만족해요,화면과 비슷해요,169.0,55,55,"기본티는 항상 유니** 에서 구매했는데 
비교해봐도 품질 안 떨오지고 오히려 핏은 더 괜찮고 아주 만족합니다! 청바지 반바지 다 어울릴듯",Free
4o0UQILH,,24.06.14,아이보리,one size,정사이즈예요,보통이에요,화면과 비슷해요,162.0,53,55,"핏, 길이감, 재질 다 좋습니다
실밥 조금 있긴한데 가격 생각하면 모든 측면에서 가성비 갑이네요! 아이보리랑 회색 샀는데 아이보리가 질감이 더 도톰?하게 느껴져요. 더 더운 재질 같달까? 아 글구 아이보리는 택도 없던데 걍 입습니다. 가성비는 갑이니까요~!",Free
4o0UQILH,,24.06.14,그레이,one size,정사이즈예요,보통이에요,화면과 비슷해요,162.0,53,55,"핏, 길이감, 재질 다 좋습니다
실밥 조금 있긴한데 가격 생각하면 모든 측면에서 가성비 갑이네요! 아이보리랑 회색 샀는데 아이보리가 질감이 더 도톰?하게 느껴져요. 더 더운 재질 같달까? 아 글구 아이보리는 택도 없던데 걍 입습니다. 가성비는 갑이니까요~!",Free
MbqA0BW3,,24.06.14,블랙,one size,정사이즈예요,보통이에요,화면과 비슷해요,176.0,52,44,재질이 약간 싼 티 나긴 하는데 실제로 가격이 싸니까요~~ 은근 두꺼워서 여름에 입으면 좀 더울 것 같긴 한데 뭐 그래도 잘 입을 것 같아요.,Free
rsH01Fai,,24.06.13,아이보리,one size,정사이즈예요,아주 만족해요,화면과 비슷해요,168.0,55,55,어깨가 좀 넓은 편인데 너무 딱 붙지는 않고 적당히 몸매 잡아주는 적당히 소매 짧은 옷을 계속 찾아다녔는데 딱 이 티셔츠에요 안 부담스럽게 핏이 너무 이뻐서 바로 검은색도 샀습니다 추천,Free
naky******,상위 25%,24.06.12,그레이,one size,정사이즈예요,아주 만족해요,화면과 비슷해요,170.0,52,55,야들야들하고 저렴함👍 너무 크롭인건 싫은데 안그래서 좋아요 빼입어서 편하게 입기 좋아요 다만 겨가 좀 낀다는거? 근데 소매 짧은 옷은 어쩔 수 없는거 같아요 입다보면 적응돼용,Free
SM3qL86j,상위 20%,24.06.11,아이보리,one size,정사이즈예요,아주 만족해요,화면과 비슷해요,156.0,41,44,"이런 기본 반팔이없어서 구매해봤어요! 탄탄해서 마음에들고 요즘 자주 입고있습니당! 
너무팔이 짧지않아서 팔뚝부각이 덜해요 ! 
보들보들한 소재라 마음에듭니다",Free
LtmoJpyP,,24.06.05,블랙,one size,정사이즈예요,보통이에요,화면과 비슷해요,164.0,51,55,테무이런데서 사다가 한국에서 사니까 질이 다르긴하네요 ㅋㅋㅋ 거긴 그냥 스판만 잇고 면이 하나도아니더라구요 옷은 한국게 짱 ..,Free
EJkYmsEg,,24.06.03,그레이,one size,정사이즈예요,아주 만족해요,화면과 비슷해요,163.0,51,55,"진짜 쫀쫀하고 가격대비 너무 마음에 들어요
길이가 빼입기에는 애매해서 바지 안에 넣어서
입는데 그러면 딱 적절해요 어깨 라인도 예뻐오",Free
daunni,상위 30%,24.06.01,아이보리,one size,정사이즈예요,보통이에요,화면과 비슷해요,,,,"부들부즐 재질은 좋은데 그만큼 탄탄한 느낌은 전혀 없고 좀 입으면 보풀이 금방 생길것 같아요 다른곳은 다 널널한데 조금 바스트 있는 분들은 네 낍니다
주름져서 안이뻐요 손이 진짜 안가요 ㅜㅜ",Free
vIM3A04B,,24.05.27,블랙,one size,정사이즈예요,보통이에요,화면과 비슷해요,164.0,50,44,옷을 입은 사진은 없지만 너무 예쁩니다 진짜. 매일 입고 싶을 정도예요. 어느정도 신축성은 있으면서 라인을 딱 잡아줘요 ㅜ 아이보리색도 시켰습니다🩷,Free
eIQAJa5n,,24.05.26,블랙,one size,정사이즈예요,아주 만족해요,화면과 비슷해요,160.0,47,44,살짝 두꺼운 소재이고 더울수도 있을거같지만 탄탄해서 좋아요 근데 길이가 짧지는 않아요 애매한 기장인거같아요 그래도 여기저기 잘 입을거같아오,Free
S4kSrbWw,,24.05.25,블랙,one size,정사이즈예요,아주 만족해요,화면과 비슷해요,155.0,44,55,핏이 엄청 좋아요. ㅁ그치만 쫌 짧은 느낌이 있어서 불편해요ㅠㅠ 전 오버핏은 아니지만 구래도 쫌 긴 티를 갖고싶었는데 너무 짧아서 아쉬뤄료,Free
9701****,,24.05.25,블루,one size,정사이즈예요,보통이에요,화면과 비슷해요,155.0,45,44,"목 둘레 시보리 이음새의 박음질이 목 옆에 있어서 좀 당황스럽고 
어긋나게 박음질 되어있어서 신경쓰여요
목이 좀 조이는 느낌이 있습니다",Free
b6udbYtM,,24.05.21,그레이,one size,정사이즈예요,아주 만족해요,화면과 비슷해요,,,,"세탁 후 건조 중 입니다.
건조기에는 무서워 못돌리겠고 ㅋㅋ
자연건조 시키는 중입니다
회색 먼저 구입했는데 대박이라 나머지 색 몽땅 구입 완료 했어요 
너무 이뻐요",Free
Doridori,탑리뷰어,24.05.17,그레이,one size,정사이즈예요,아주 만족해요,화면과 비슷해요,162.0,53,44,팔뚝살 빵빵한편인데 핏이 예뻐서 아모르갰다하고 입고다녀용 회색티 사고싶었는데 쫀쫀하고 빨아도 목부분 쭈글해지는거 없어서 매우 만족중입니당,Free
cL5p28u7,,24.05.14,그레이,one size,정사이즈예요,보통이에요,화면과 비슷해요,156.0,44,44,"한 여름엔 더율 거 같아요 
은근 두께 있어요 
넘 저렴해서 아이보리 하나 더 샀러욤 
휘뚜루마뚜루 입을수 있음 
팔뚝도 얇아보여서 조ㅗ아요",Free
Bhs4oSc6,,24.05.10,블랙,one size,정사이즈예요,보통이에요,화면과 비슷해요,160.0,50,55,"너무 좋네요 딱 원했던 핏, 기장감이에요
스판끼 약간 있으면서 찰랑찰랑하지 않아서 좋고 늘어나도 뵈기싫게 늘어나지 않을것같아요
일단 핏이 굿입니다 윗팔뚝 가려주는 소매기장이라 더 날씬해보여요 사세요!!",Free
TITlwgBB,상위 10%,24.12.29,그레이,one size,생각보다 커요,보통이에요,화면과 비슷해요,166.0,49,55,"길이가 생각했던 것 보다 조금 길어서 
수선해서 입었더니 예쁘네용~~ 
가격도 저렴하고 기본티 맛집인 것 같아요~~!!",Free
0YgfqbW2,,24.11.09,블랙,one size,정사이즈예요,아주 만족해요,화면과 비슷해요,162.0,54,55,"후뚜류막뚜루 반팔 넘 좋음 한개 사고 한장 더 삼 물건임
기장도 딱 좋구 입었을때 날씬해보이는 느낌 있어여 고민말고 사세오",Free
3vBwWcbc,상위 30%,24.10.25,블랙,one size,정사이즈예요,아주 만족해요,화면과 비슷해요,155.0,50,55,핏이 아주 딱 좋았어요 팔뚝살도 커버해줘서 일주일 내내 입었더니 벌써 보풀이 생걌어요 ㅋㅋㅋ 기본티로 여러장 구매할만해여,Free
qEJ5pGQy,,24.10.13,그레이,one size,정사이즈예요,아주 만족해요,화면과 비슷해요,160.0,48,55,"저렴한데 티셔츠는쫀쫀하니 이뻐요
빨아도 안늘어나는 티셔츠예요 ㅎ
맘에듭니다 ㅎ 여름내내 잘 입구 댕겼어요
강추합니당",Free
UhTHtdgj,상위 25%,24.10.13,블랙,one size,정사이즈예요,보통이에요,화면과 비슷해요,170.0,62,55,"쫀쫀한 스판 많은 재질
핏되게 입을 수 있어요
색상이야 어떤 옷이든 코디 편한 기본색
세탁 몇번하면 보풀이 빨리 일어날 것 같은 소재
가격이 저렴하니 한철 입을만 합니다!",Free
zkmH3kNc,,24.10.11,Black,One Color size,정사이즈예요,보통이에요,화면과 비슷해요,160.0,47,44,괜찮은데 먼지랑 보풀이 쥼 많이 생기고 있어요..! 기본템으로 무난 무난.. 그냥 안에 받쳐입기 갠차나요 약간 작은 느낌을 빼면 ㅎㅎ,Free
Gd9MfJN5,,24.10.10,그레이,one size,정사이즈예요,아주 만족해요,화면과 비슷해요,,,,"회색 반팔티 잘 못입으면 잠옷 같고 아저씨 같아서 나름 신중 하게 골랐는데, 너무 얇지도 두껍지도 않고 핏도 괜춘하고 마음에 들어요.",Free
229ZHhqL,,24.10.04,그레이,one size,정사이즈예요,아주 만족해요,화면과 비슷해요,170.0,50,55,퀄리티 굿 건조기까지 돌렸는데 상함 거의없음 이정도 가격에 이정도 상태? 거기다 세탁기 건조기에 살아남았다? 퀄리티 장난 없네요 당장 색깔별로 갑니다,Free
rhdt******,상위 30%,24.10.03,아이보리,one size,정사이즈예요,보통이에요,화면과 비슷해요,163.0,56,55,회색이 너무 맘에 들어서 흰색도 샀는데 이것도 역시 핏이 이쁘네요. 근데 확실히 화이트라 조금 비침이 있어서 스킨색 속옷 입고 입어 줘야 될 것 같아요! 추천합니다!,Free
pC2Jiyw3,,24.09.30,그레이,one size,정사이즈예요,보통이에요,화면과 비슷해요,160.0,53,66,면은 보들하거 신축성있어서 편한데 입었을때 핏이 좀 이상해요 묘하게 상체가 부해보여요 이너로 입기 좋을것같아요,Free
tbpKRLjK,,24.09.29,그레이,one size,정사이즈예요,아주 만족해요,화면과 비슷해요,162.0,49,55,가격이 저렴한 편이라 소재가 안 좋으면 어떡하나 걱정했는데 소재도 부드럽고 여러번 세탁후에도 목늘어남 없어요👍🏻👍🏻👍🏻,Free
kObMggob,,24.09.28,그레이,one size,정사이즈예요,아주 만족해요,화면과 비슷해요,158.0,45,44,반팔티 면이 너무 보들보들해서 좋앟어요 나이니는 옷을 사면 실패한적 없어요 직진배송이라서 다음날 필요할 때 시키면 좋아영,Free
zNTVW4G5,,24.09.25,아이보리,one size,정사이즈예요,보통이에요,화면과 비슷해요,165.0,50,55,이뻐서 또 샀어요 ! 그레이 블랙 아이보리까지 여름에 잘 입어서 내년 여름에도 판매해주세요 !! 기본 템으로 딱입니당 ㅎㅎ,Free
AyIWFXpT,,24.09.24,그레이,one size,정사이즈예요,아주 만족해요,화면과 비슷해요,163.0,50,55,이 가격에 이 퀄리티 말이 안 된다고 생각해요 ㅠㅠ 보드랍고 유연한 소재감에 브랜드 기본티 못지 않은 핏 .. 리뷰 쓰고 다른 컬러 또 사러 갑니다 🫡,Free
et6tup9f,,24.09.21,그레이,one size,정사이즈예요,아주 만족해요,화면과 비슷해요,167.0,57,55,"이거진짜 완전 흐물한 그런티셔츠 아니구 쫀쫀하고 재질 짱짱하고 날씬해보여요 ㅠㅠ
날이 좀 선선해졌지만 이너로 입기에도 좋아서 깔별로 사고싶은 기본티에요 딱",Free
