아이디,리뷰어 등급,작성 날짜,옵션1,옵션2,상품 사이즈,퀄리티,색감,키,몸무게,사이즈,리뷰내용,제품_사이즈
sFVyGJ5Z,상위 30%,24.07.17,그레이,one size,정사이즈예요,보통이에요,화면과 비슷해요,160.0,42,44,여름에 입기는 조금 두꺼운 감이 있지만 재질이 부드러워서 좋아요 날 좀더 시원해지면 다른 뷔스티에랑 레이어드해서 입어도 예쁠 거 같아요,Free
zBR59x6b,상위 15%,24.07.17,그레이,one size,정사이즈예요,보통이에요,화면과 비슷해요,157.0,47,44,두껍다는 리뷰를 봤는데 이정도로 두꺼울지는 몰랐어요 목부분이 좀 답답한 느낌이 들긴해요 색은 화면과 같고 실밥 튀어나오고 그런건 대체적으로 괜찮아요 생각보다 많이 두꺼워요,Free
jhle*****,상위 30%,24.07.17,아이보리,one size,정사이즈예요,보통이에요,화면과 비슷해요,158.0,52,55,아주 쫀득하고 말랑한 티셔츠입니다! 핏이 무진장 예빠여~! 근데 속옷이 좀 비쳐서.. 스킨톤 입어도 속옷 라인이 비쳐서 어떻게 ㄴ입을지 고민 중입니다ㅜ 위에 멀 레이어드 하면 이쁠듯,Free
Tt5GNpsz,,24.07.17,아이보리,one size,정사이즈예요,보통이에요,화면과 비슷해요,170.0,52,44,검정색 티 사보고 재질도 쫀쫀하고 편하게 막 입을 수 있을 것 같아서 다른색으로 샀는데 마음에 드네오 !! 기본티는 이걸로 정착 ..,Free
iNbndCYP,상위 5%,24.07.16,그레이,one size,정사이즈예요,아주 만족해요,화면과 비슷해요,156.0,47,55,"슬림핏인거 같으면서도 신축성이 좋아서
부해보이지않고 소매기장 총기장 모두 
딱 좋아요 단 소재가 한여름에 입기에는
살짝 더울것같은 면소재에요",Free
GCwwLvkb,,24.07.16,아이보리,one size,정사이즈예요,보통이에요,화면과 비슷해요,158.0,48,55,"완전 쫀쫀한 티
넣입 빼입 상관없이 좋은 길이구요
두께가 좀 있어서 … 한여름엔 비추입니당
그리고 어두운 속옷 입으면 약간 비침있어요",Free
l6dtVb4H,,24.07.16,그레이,one size,정사이즈예요,아주 만족해요,화면과 비슷해요,168.0,60,55,입었을때 찍는걸 깜빡해서 그냥 옷 사진만 올리는데 퀄도 아주 만족하고 색감도 이쁩니다 옷감이 쫀득하고 챱 몸에 감싸주는 느낌이 아주 맘에 들어요!!! 담에 다른 색도 사볼려구요!,Free
W5NBcgIB,,24.07.15,그레이,one size,생각보다 커요,보통이에요,화면과 비슷해요,162.0,48,55,"허리 딱붙핏은 아니고 굉장히 널널하긴 해여
보들보들하니 한 철 잘 입을 것은 같아여
보풀은 잘 날 것 같아서 딱 한 시즌용일듯용
그래도 가격대비 전반적으로 만족합니당",Free
NLNQUBKJ,,24.07.15,블루,one size,정사이즈예요,보통이에요,화면과 비슷해요,,,,"소재가 생각보다 부들한 재질이고 물론 데님, 스커트와도 잘 어울리는 찰떡콩떡템입니다! 베이직한 디자인인 기본템이라서 마음에 들어요 !",Free
gj3THeW8,,24.07.13,Gray,One Color size,정사이즈예요,아주 만족해요,화면과 비슷해요,165.0,55,55,"여리미 뿜쁌 ㅋㅋ; 
엄청 쫀쫀하고 좋아요
다른컬러도 사려구여
질 좋은거같구 기본티로 매우좋습니다
고민은 이제 어떤 다른색을 사냐 뿐",Free
8zrOQDlG,,24.07.12,블랙,one size,정사이즈예요,아주 만족해요,화면과 비슷해요,165.0,56,55,"구매하고 블랙 하나 더 구매했어용.. 
너무 좋으요.. 텐션도 좋고, 생각한 길이에 딱 맞아서 잘 입고 다니네유 👍 부들부들한 소재에 회색인데 조오금 땀나도 바로 티나지 않아요 굿",Free
ANYz4Ddl,상위 5%,24.07.12,아이보리,one size,정사이즈예요,아주 만족해요,화면과 비슷해요,160.0,50,55,촉감도 좋고 적당히 두깨감 있어서 안비치고 핏도 이뻐요~! 세탁은 아직 안해봤지만 한번 한다고 망가질 싸구려원단은 아니라 만족스러워용,Free
You,상위 25%,24.07.11,블랙,one size,정사이즈예요,아주 만족해요,화면과 비슷해요,158.0,48,55,"아이보리 샀다가 너무 맘에 들어서 블랙도 샀어요 :) 
좀 핏되는 옷이라서 날씬해보이고 면이 되게 부들부들해요 !
엄청 얇아서 시원한 느낌은 아니지만 만족합니다 🥺",Free
zseJeijh,,24.07.10,그레이,one size,정사이즈예요,아주 만족해요,화면과 비슷해요,152.0,44,44,확실히 튼튼한 소재의 옷이예요! 하도 싸구려 티셔츠를 많이 입고 늘어지는 옷들에 질려서.. 함 구매해봤는데 꽤나 만족중! 특히 직진배송 최고! 바로 입고나옴,Free
itq0sB03,,24.07.10,블랙,one size,정사이즈예요,아주 만족해요,화면과 비슷해요,165.0,53,55,재질도 너무 부드럽고 쫀쫀해요 약간 기장이 짧은 느낌은 있는데 불편할정돈 아닙니다 목 늘어짐도 없고 핏하게 예뻐요 재구매 의사 있습니다,Free
SrWKEPvp,,24.07.10,블랙,one size,정사이즈예요,아주 만족해요,화면과 비슷해요,160.0,52,44,그레이색상사고 너무 맘에 들어서 블랙색상도 바로 구매했는데 역시나 예뻐요 ~ 기본 티셔츠여도 핏이 안예쁘면 안입는데 이거는 핏이 너무 예뻐용,Free
Zp6YsHmJ,,24.07.09,그레이,one size,정사이즈예요,아주 만족해요,화면과 비슷해요,155.0,50,44,잘 입구 있습니당 면도 쫀쫀하니 좋아요 핏도 괜찮은듯 근데 너무 겨드랑이가 끼고 팔뚝부자라 내 팔은 못가려줌 ㅠ ㅠ 가볍게 입기 좋아요,Free
x00uxynw,,24.07.09,그레이,one size,정사이즈예요,보통이에요,화면과 비슷해요,163.0,55,33 이하,기본 티셔츠인데 쫀쫀하고 질이 좋아서 만족하고 있습니다 ! 잘 늘어나는 티셔츠이고 약간 두께감이 있어서 그건 유의하셔야 할 것 같아요 ! 저는 오히려 따숩게 요즘 잘 입고 있어요.,Free
g222p4PN,상위 20%,24.07.09,그레이,one size,정사이즈예요,보통이에요,화면과 비슷해요,167.0,60,55,"기본핏 티셔츠 찾고있었는데 
핏 이쁘네요 ㅎㅎㅎ 다른색상도 사고싶을정도
약간 도톰하고 스판끼잇고 팔뚝도 괜찮고 좋아요 이가격이면 완전",Free
1ZLLrnYF,상위 5%,24.07.09,아이보리,one size,정사이즈예요,아주 만족해요,화면과 비슷해요,165.0,53,55,"살짝 노란끼있는 아이보리색라 더좋고요.. 재질은 뭐 말해뭐해.... 너무너무좋아서 다른색도 살꺼에요!!!! 
ㅠㅠ하나만입기에도좋고 이너도 좋도 활용도너무좋네요ㅠㅠ",Free
MW0NiU2U,,24.07.09,블랙,one size,정사이즈예요,아주 만족해요,화면과 비슷해요,168.0,55,55,"아주 만족해서 다른 컬러로 재구매하려고요!
핏도 예쁘고 팔뚝살 부각도 없어요
무엇보다도 목이 파여있지 않아서 부담스럽지 않게 입을 수 있습니다",Free
t7NsnppS,,24.07.08,블랙,one size,정사이즈예요,아주 만족해요,화면과 비슷해요,168.0,54,55,기본템인데 짱짱하고 천이 도톰해요! 빨아도 변형안될거같고 폭신해서 잘입을거같습니당 맘에들어오 팔 부분이 길진않은데 이게 애매해요 팔이 얇아보이기도하고 두꺼워보이기도하는...,Free
t7NsnppS,,24.07.08,아이보리,one size,정사이즈예요,아주 만족해요,화면과 비슷해요,168.0,54,55,기본템인데 짱짱하고 천이 도톰해요! 빨아도 변형안될거같고 폭신해서 잘입을거같습니당 맘에들어오 팔 부분이 길진않은데 이게 애매해요 팔이 얇아보이기도하고 두꺼워보이기도하는...,Free
SBd3gneT,상위 20%,24.07.08,블랙,one size,정사이즈예요,아주 만족해요,화면과 비슷해요,155.0,55,55,아이보리&검정 둘다 구입했는데 만족!! 보들보들하고 빳빳한면티는 아니에용! 은근 신축성있고 생각보다 타이트하지않다? 상체 55까지 추천!,Free
SBd3gneT,상위 20%,24.07.08,아이보리,one size,정사이즈예요,아주 만족해요,화면과 비슷해요,155.0,55,55,딱 아이보리에요!!! 화이트xx 팔뚝부분 모양이 사선?으로 되어있어서 진짜 약간 날씬해보이는 착시가 있네요ㅎㅎ 약간 통통이인데 만족해요.,Free
Gr0J3ETg,,24.07.08,아이보리,one size,정사이즈예요,아주 만족해요,화면과 비슷해요,155.0,45,55,완전 기본템이지만 부들부들해서 재질 너무 맘에 들어요 !! 자주 입을것 같은 느낌 ㅎㅎㅎ 라인은 있는데 엄청 핏하지 않아서 더 편해요,Free
4rk,,24.07.07,블랙,one size,정사이즈예요,아주 만족해요,화면과 비슷해요,161.0,48,44,"몸에 딱 맞아서 이뻐요! 입었을 때 부들부들하고, 정말로 팔뚝부각이 없어서 좋았어요👍 다른 색깔도 사서 기본티로 돌려입을 예정입니다!",Free
ItxDaP6H,,24.07.07,그레이,one size,정사이즈예요,아주 만족해요,화면과 비슷해요,159.0,46,55,"모델 착용 느낌 고대로 입어 봤어요!
넘 예쁘네요!
옷감 자체도 부드럽고 ㅎㅎ 넘 마음에 듭니다!
땀이 걱정 되지만 너무 가격대비 넘 만족",Free
alsd******,,24.07.06,아이보리,one size,정사이즈예요,아주 만족해요,화면과 비슷해요,156.0,47,44,살짝 도톰하고 쫜득한 재질입니당 넣어 입어도 괜찮고 빼서 입어도 길이가 애매하지 않아서 좋아요 팔뚝살도 잘 가려주고 잘 샀움 ㅠ 기본티로 넘넘 추천~!,Free
heezeee,,24.07.05,그레이,one size,정사이즈예요,아주 만족해요,화면과 비슷해요,163.0,50,55,"동남아 여행가서 편하게 입을려고 급하게 시켰는데 배송도 하루만에 오고 좋았습니다!
소재가 쫀쫀한데 도톰해서 살짝 덥긴 했어요! 그래도 핏이 예쁨니당",Free
Storage,,24.07.05,그레이,one size,정사이즈예요,아주 만족해요,화면과 비슷해요,160.0,49,55,"아이보리 입고 너무 마음에 들어서 그레이도 주문😍
핏 진짜 이쁘고 재질😍😍 완전 사랑해요 최고에요.
입다가 올 여름이 다 가기 전에 또 주문할 수도..ㅎ",Free
ByGm7JTd,상위 10%,24.07.05,아이보리,one size,정사이즈예요,보통이에요,화면과 비슷해요,163.0,50,55,예상한 것 보다 핏이 더 예뻐요! 팔뚝이랑 허리쪽 라인이 너무 예쁘게 떨어져요! 근데 소재가 몇번 세탁하면 보풀 일어날 것 같아서 좀 조심스러워요,Free
GdBLbk0e,,24.07.05,그레이,one size,정사이즈예요,아주 만족해요,화면과 비슷해요,155.0,53,44,"팔뚝이 조금 두꺼운 편인데 옷특성상 잘 잡아줍니다
색깔별로 구매할 예정이에요
저렴한가격에 너무 잘 샀어용!!!
이건진짜 강추합니다 이번여름에 젤 잘 산 상품이에용",Free
tov3YCHN,상위 20%,24.07.05,아이보리,one size,정사이즈예요,아주 만족해요,화면과 비슷해요,158.0,51,55,그레이 컬러랑 같이 주문해서 너무 잘 입고 있어요!:) 부드럽고 쫀쫀하고 좋아요. 부들부들한게 피부에 닿는 느낌에 예민하신 분들도 좋아하실 것 같아요.,Free
tov3YCHN,상위 20%,24.07.05,그레이,one size,정사이즈예요,아주 만족해요,화면과 비슷해요,158.0,51,55,보들보들 쫀쫀하고 아주 좋아요! 소매가 짧은 감이 있는데 오히려 몸에 착 붙는 느낌이라서 좋아요:) 소재랑 가격이랑 다 만족스럽습니다!!,Free
XPM737Cl,상위 15%,24.07.05,블랙,one size,정사이즈예요,보통이에요,화면과 비슷해요,159.0,55,66,"유명한 이유거 있네요!!
진짜 핏 이쁘고 재질 완전 좋아요
엄청 오래오래 입을 수 잇을 것 같아요~~
팔뚝 두꺼운게 어쩔수없기 티나긴 해요",Free
XPM737Cl,상위 15%,24.07.05,아이보리,one size,정사이즈예요,보통이에요,화면과 비슷해요,159.0,55,66,"유명한 이유거 있네요!!
진짜 핏 이쁘고 재질 완전 좋아요
엄청 오래오래 입을 수 잇을 것 같아요~~
팔뚝 두꺼운게 어쩔수없기 티나긴 해요",Free
fobDkpbl,상위 10%,24.07.04,그레이,one size,정사이즈예요,보통이에요,화면과 비슷해요,168.0,59,55,쫀득쫀득한 느낌이구 살짝 두꺼워요!! 그래도 가격대비 퀄리티는 굿입니당 ㅎ 에아컨 틀고 추워서 두께감도 괜찮았어요 다만 키가 170이상인 분들은 팔뚝부분 조금 작을듯,Free
faGnVM7D,,24.07.04,아이보리,one size,정사이즈예요,보통이에요,화면과 비슷해요,,,,기본 반팔티로 갖고 있기 좋아요 핏도 예쁘고 적당한 길이에요 막 시원한 소재는 아니고 땀이 잘 마를 것 같진 않아요 다른 색상도 사고 싶어요,Free
2416**,,24.07.04,아이보리,one size,정사이즈예요,아주 만족해요,화면과 비슷해요,159.0,45,44,"일단 너무 부드러워서 좋아요!
어깨가 좁은편인데 어깨선도 적당히 예쁘게 빠졌어요
생각보다 노란기가 있는편이었고, 스킨색속옷을 입었지만 비치는건 어쩔수없네요..~",Free
m9x6XNII,,24.07.04,아이보리,one size,정사이즈예요,보통이에요,화면과 비슷해요,160.0,45,55,"아이보리 사고 맘에 들어서 그레이 구매 또 했어요 !!
기본티로 입기 좋고 
쫀쫀합니다 !! 
입었을 때 핏 예쁘고 팔뚝살 커버 되요 ㅎㅎ",Free
HWNrTmlM,,24.07.04,그레이,one size,정사이즈예요,아주 만족해요,화면과 비슷해요,,,,뭔가 면 재질일줄 알았는데 찰랑거리는? 그런 소재입니다~이상하게 회색기본티 찾기가 어려워서 여기서 구매했는데 이뻐요~다만 여름티 치곤 살짝 두께가 있어서 더울수도 있을꺼 같아요~,Free
m9x6XNII,,24.07.04,그레이,one size,정사이즈예요,보통이에요,화면과 비슷해요,160.0,45,55,"입었을 때 팔뚝살 커버 되고 
쫀쫀해서 기본티로 입기 좋아요 !!
지금같은 날씨에 휘뚜루 입기 좋아요 !!
배송 빠르게 받았습니다 !!",Free
CXWurtGB,,24.07.04,그레이,one size,정사이즈예요,아주 만족해요,화면과 비슷해요,160.0,44,44,입고 2번 빨았는데 아직 목 늘어남은 없어요 살짝 두꺼운 편이고 찰랑거리는 재질이라 주름은 잘 안생겨요 목도 튼튼해서 오래 입을 수 있을 것 같아요 만족스러워요,Free
CXWurtGB,,24.07.04,아이보리,one size,정사이즈예요,아주 만족해요,화면과 비슷해요,160.0,44,44,입고 2번 빨았는데 아직 목 늘어남은 없어요 살짝 두꺼운 편이고 찰랑거리는 재질이라 주름은 잘 안생겨요 목도 튼튼해서 오래 입을 수 있을 것 같아요 만족스러워요,Free
CFImnD9g,,24.07.04,아이보리,one size,정사이즈예요,아주 만족해요,화면과 비슷해요,,,,원단이 얇은게 아니라 두꺼우면서 탄탄합니다. 그러면서도 부드러워서 아주 좋습니다. 세탁해보진 않았는데 변형이 쉽게 오지 않을거 같은 재질입니다.,Free
O6ECM0Zh,상위 20%,24.07.04,그레이,one size,정사이즈예요,보통이에요,화면과 비슷해요,169.0,55,55,"긴거민가하며 주문했는데 후기대로 입으니 핏이 진짜 예뻐요! 팔부분이 얇아보이고 부담스럽지 않은 길이에요 
근데 조~~~금 두꺼워서 한여름에는 더울 것 같긴해요",Free
Hyeon_._.,상위 20%,24.07.03,블랙,one size,정사이즈예요,아주 만족해요,화면과 비슷해요,165.0,50,44,이가격에 이퀄리티!!! 아주아저 만족합니다 ㅜ 색깔 별로 쟁여놓을려고요 길이도 딱 알맞고 목부분이 쫀쫀하고 두꿔어서 잘안늘어날꺼같아요 굳,Free
hxkrBWJS,,24.07.03,그레이,one size,정사이즈예요,아주 만족해요,화면보다 어두워요,161.0,57,,"생각보다 너무 이쁘고 아주 좋네오 
다른색 또 사려고 함니당 굿굿 
진짜 말라보이고 좋음 소재도 탄탄 목부분이 탄탄해서 좋아요 기장도 딱 아주 나이스👉🏻🩷👈🏻",Free
9neoJfrG,상위 15%,24.07.03,그레이,one size,정사이즈예요,아주 만족해요,화면과 비슷해요,156.0,47,55,"레이어드 원피스에 찰떡이에요 가격에 비해 너무 재질도 좋고 쫀쫀해요! 팔뚝도 여리여리하게 보이는
느낌도 있어서 다른색도 구매하고 싶어요!",Free
5zOXn63R,,24.07.02,그레이,one size,정사이즈예요,아주 만족해요,화면과 비슷해요,163.0,48,44,이게 만원이라구요? 원단 탄탄하고 목 짱짱하고 핏 진짜 이뻐요 팔뚝살 커버 정말 잘 됩니다 지그재그에서 기본 반팔 사고 재구매 한 적 한번도 없는데 이건 바로 깔별로 쟁이려구요!!,Free
ttkf****,상위 20%,24.07.02,블랙,one size,정사이즈예요,보통이에요,화면과 비슷해요,162.0,44,55,"휘뚜루마뚜루 입기 편해요 
저렇게 대충 해놔도 관리하기도 편한 소재여서 정말 좋은 것 같아요 그리도 핏도 이뻐서 대충 휘뚜루마뚜루 입어도 청바지랑 같이 입으면 완전 이쁩니다",Free
sQHeQWL6,상위 20%,24.07.02,블랙,one size,정사이즈예요,아주 만족해요,화면과 비슷해요,160.0,52,55,이건 그냥 요물입니다. 재질도 쫀쫀하이 좋고.. 마감도 가격대비 정말 좋은거같아요. 실밥 하나 나오는거 없구요.. 손이 정말 자주 간답니다…사진은 못찍었지만 핏도 너무 이쁘고요.,Free
N2QeUjJS,상위 15%,24.07.02,그레이,one size,정사이즈예요,아주 만족해요,화면과 비슷해요,165.0,57,66,후기가 좋아서 기본티로 그레이 블랙 구매했는데 만원치고 너무 좋네요!! 비침도 없고 화이트색상도 구매하려구요 이 소재면 비침 없겠죠?,Free
tnwlsals37,,24.07.02,아이보리,one size,정사이즈예요,별로예요,화면과 비슷해요,164.0,49,44,"색감 핏 둘다 너무너무 이쁘구요 질은 별롭니다
그냥 딱 가격 정도긴 해요 근데 한 번 입고 나갔다왔는데 벌써 지저분하게 보풀이 올라오려고 하더라고용
그래두 이뻐서 ㄱㅊ",Free
5Px5JwFn,,24.07.01,아이보리,one size,정사이즈예요,보통이에요,화면과 비슷해요,158.0,55,66,살짝 도톰한 원단의 반팔티셔츠예요.색상은 완전 흰색아니고 아이보리 색이구요.핏은 크지도 작지도 않고 딱 좋아요.기본티셔츠라서 활용도 좋을것같아요,Free
yAKaKtlf,,24.07.01,아이보리,one size,정사이즈예요,아주 만족해요,화면보다 어두워요,165.0,53,,뜯자마자 노란색이 돌아서 살짝 당황했지만 입어보이 핏 좋아서 합격함 근데 한여름에 입긴 더울 거 같음 살짝 두꺼운 감이 있음 핏은 굳,Free
XdLbiLy6,,24.06.30,그레이,one size,정사이즈예요,아주 만족해요,화면과 비슷해요,158.0,46,44,배송도 빨라서 다음날 도착했어요 핏이 정말 예뻐서 팔뚝을 살커버까지 완벽하네요 :) 목늘어짐도 없는것 같구 정말 맘에 듭니다👍 굿굿,Free
KKwHzt9C,,24.06.30,그레이,one size,정사이즈예요,아주 만족해요,화면과 비슷해요,157.0,43,44,사진그대로에요! 158에 길이도 골반정도라 넣어입어도 안빠지고 재질이 쫀쫀해서 목늘어짐도 적을거같아욤 적당히 두툼해서 더 맘에들어요~~~,Free
VDJt6jsS,,24.06.30,아이보리,one size,정사이즈예요,아주 만족해요,화면과 비슷해요,166.0,30이하,55,"와 소재가 너무 부들부들해서 입었는데 딱 그 기분좋게 몸에 감기는 느낌이 짱이네용 ㅠㅠ 감동이에요 ㅋㅋ 배송도 빠르구오,,,, 여기서 자주 구매예약이옴",Free
전애옹,상위 10%,24.06.30,아이보리,one size,정사이즈예요,아주 만족해요,화면과 비슷해요,170.0,62,66,"대박임
이 가격에 이 핏이라니
쫀쫀하고 너무 예쁘고 큰 키에도 배꼽 살짝 가리는 원하던 길이ㅠ
잘 늘어날 거 같긴 하지만 가격대비 최고",Free
DDLkNCQ1,,24.06.29,그레이,one size,정사이즈예요,아주 만족해요,화면과 비슷해요,153.0,44,55,소재가 부드럽고 저한테 잘 맞아요..! 이런 핏 원했는데 길이도 길지않구 넥도 답답하지않고 후기가 좋은 이유가 있어여 화이트도 구매예정..👍,Free
best****,,24.06.28,그레이,one size,정사이즈예요,아주 만족해요,화면과 비슷해요,160.0,48,44,"한여름에입기엔 좀 두껍긴해요 그런데 진짜 쫀쫀하고,, 늘어남 절대 없을거같음 어깨핏 팔뚝핏 완전 맘에들구요.. 좀만 더 얇앗으면 좋앗을거같아요",Free
xDBz5H9E,상위 30%,24.06.28,아이보리,one size,정사이즈예요,아주 만족해요,화면과 비슷해요,157.0,46,44,완전 마음에 들어요 늘어날 것 같은 재질도 아니고 말라보이는 거 인정합니다 넘부들부들 아주주주쥬주둗. 만족 다른색도 살거임 근데 흰색 좀 비칩니다잉,Free
KZudNq9T,상위 30%,24.06.28,그레이,one size,정사이즈예요,아주 만족해요,화면과 비슷해요,165.0,50,55,재질이 아주 짱짱하고 좋습니다. 날씬해보이기도 제격이더라구요 ㅎㅎ 어깨선이 특히 이쁘게 보입니다. 소매는 조금 짧은편이어서 팔뚝을 가리고 싶은 분들에게는 살짝 비추이긴 합니다!,Free
gZu8qZps,상위 15%,24.06.28,그레이,one size,작아요,아주 만족해요,화면과 비슷해요,169.0,55,44,"부드러운 재질의 후들후들한 티셔츠여서 신축성도 좋고 입었을때도 편한 것 같아요! 저한테는 어깨가 작아거 살짝 불편한 점이 있지만 색상도, 재질도 원하던 거라 잘 입을 것 같네요",Free
48jOfmj2,,24.06.27,아이보리,one size,정사이즈예요,아주 만족해요,화면과 비슷해요,168.0,51,55,"부드럽고 좋아요 재질도 짱짱하니 오래입을 수 있을거 같아요 따뜻한 아이보리색상이라 더 예쁩니다
입으면 팔뚝살도 살짝 가려줘서 여리여리해보여요",Free
FfhdUPK6,,24.06.27,그레이,one size,정사이즈예요,아주 만족해요,화면과 비슷해요,,,,편하고 이쁜 티에요! 색감도 이쁜 회색이고 재질도 탄탄하니 좋아요 팔 부분이 짧아서 팔뚝살을 가려주는 디자인이라 그런지 겨드랑이가 답답할 때가 있어요,Free
uXztUFY1,,24.06.27,그레이,one size,정사이즈예요,아주 만족해요,화면과 비슷해요,164.0,53,55,"흰색은 아직 입어보진 못했지만 그레이랑 비교했을때 크기도 같고 재질도 같았어용 쫀쫀하고 날씬해보임 
이런 기본 티 찾고 있었는데 인생템 찾았슴다",Free
rGnNDwQK,,24.06.27,블랙,one size,정사이즈예요,아주 만족해요,화면과 비슷해요,160.0,50,55,소재가 살짝 도톰한 편이지만 그래서 퀄은 더 좋은 것 같고 정말 무난의 정석인 핏이라서 아무데나 입기 좋아요~ 대신 한여름엔 더울것 같아용,Free
Ms9vYWrx,상위 20%,24.06.27,아이보리,one size,정사이즈예요,아주 만족해요,화면과 비슷해요,160.0,49,44,살짝 뻣뻣한 면재질일줄알았는데 생각보다 부들부들해서 몸에 자연스럽게 붙네요. 살짝 도톰한 감이 있긴한것같은데 두껍지는 않아요. 검은색 속옷 입었을때 이정도의 비침정도면 너무 괜찮네요,Free
rzf9gsS6,,24.06.27,아이보리,one size,정사이즈예요,아주 만족해요,화면과 비슷해요,173.0,52,55,생각보다 얇지가 않았어요 그래서 더 탄탄하고 비침이 적은 것 같긴 해요 핏은 겨드랑이가 보이지도 않고 만족스러워요 근데 목이 잘 늘어날지도?,Free
89noENjk,,24.06.26,그레이,one size,정사이즈예요,아주 만족해요,화면과 비슷해요,,,,"화면이랑 완전 똑같고 팔뚝도 가려주는 정말 좋은 티.. 
가격도 착하고 진짜 꼭꼭 구매하세요 기본 이너티가 잘 없어서 고민이였는데 요번 여름 고민거리 줄었습니다",Free
vEGYFFup,,24.06.26,블랙,one size,정사이즈예요,보통이에요,화면과 비슷해요,168.0,60,55,"생각보다 소매가 짧지만 예뻐요!
이너로도 괜찮고 요즘 더워서 단독으로 입어도
좋을 것 같아요 
잘늘어나는 재질이고 색도 마음에 들어용",Free
c5mS9xS8,,24.06.26,그레이,one size,정사이즈예요,아주 만족해요,화면과 비슷해요,165.0,54,44,와 최고에요. 부드럽고 핏 너무 예쁘고 편함. 기장 적당함. 팔 부분 너무 만족!! 질도 생각보다 좋아서 깜짝놀람.. 지전 최고.. 또 삽니다^^,Free
rkgu*****,상위 15%,24.06.26,아이보리,one size,정사이즈예요,아주 만족해요,화면과 비슷해요,156.0,51,44,"살짝 두꺼워서 땀이나도 많이 티가 안나서 좋아요!!
통도 여유있는 핏이라 뱃살부각이 덜하고 소매가 사선으로 되어있어 팔이 얇아보여요!!",Free
rkgu*****,상위 15%,24.06.26,블랙,one size,정사이즈예요,아주 만족해요,화면과 비슷해요,156.0,51,44,"살짝 두꺼워서 땀이나도 많이 티가 안나서 좋아요!!
통도 여유있는 핏이라 뱃살부각이 덜하고 소매가 사선으로 되어있어 팔이 얇아보여요!!",Free
rkgu*****,상위 15%,24.06.26,그레이,one size,정사이즈예요,아주 만족해요,화면과 비슷해요,156.0,51,44,"살짝 두꺼워서 땀이나도 많이 티가 안나서 좋아요!!
통도 여유있는 핏이라 뱃살부각이 덜하고 소매가 사선으로 되어있어 팔이 얇아보여요!!",Free
iAXehsxs,,24.06.26,그레이,one size,정사이즈예요,아주 만족해요,화면과 비슷해요,160.0,52,55,"주문한 다음 날 아침에 바로 받을 수 있어서 좋았어요
살짝 두꺼운 거 같지만 질도 좋고 색깔도 무난해서 잘 입을 거 같아요 핏도 예쁩니다",Free
