아이디,리뷰어 등급,작성 날짜,옵션1,옵션2,상품 사이즈,퀄리티,색감,키,몸무게,사이즈,리뷰내용,제품_사이즈
wv1eeD59,,24.04.10,메란지그레이,,정사이즈예요,아주 만족해요,화면과 비슷해요,160,54,55,가격대비 질도 좋고 팔이나 이런 부분도 딱 날씬해보일수 있는 부분까지의 길이라 넘 좋아요! 완전 만족해요,Free
ZPuDvjLd,상위 10%,24.02.22,메란지그레이,,정사이즈예요,아주 만족해요,화면과 비슷해요,167,60,66,"기본중에기본!!! 너무 싸보이지도않고 너무 이쁘다👍👍
기본티지만 이것만 입어도 전혀~~난닝구 스럽지얺아보이는!!
완전 쫀쫀햐서 다른색도 구매해야겟어여
품절만 안되게 막아주세요~🫢",Free
ZPuDvjLd,상위 10%,24.02.22,아이보리,,정사이즈예요,아주 만족해요,화면과 비슷해요,167,60,66,"기본중에기본!!! 너무 싸보이지도않고 너무 이쁘다👍👍
기본티지만 이것만 입어도 전혀~~난닝구 스럽지얺아보이는!!
완전 쫀쫀햐서 다른색도 구매해야겟어여
품절만 안되게 막아주세요~🫢",Free
aF1UrM1X,,24.12.12,아이보리,,정사이즈예요,아주 만족해요,화면과 비슷해요,162,50,55,후기가 많아 궁금해서 구매하게 됐는데 피부에 닿는 촉감이 부드러워 겨울내내 속에 받쳐 입고 다니려고요~^^ 지그재그 전체서도 상위에 랭킹된 이유가 확실하네요👍🏻,Free
Gpn763li,,24.09.05,메란지그레이,,정사이즈예요,아주 만족해요,화면과 비슷해요,156,44,44,"고민하다가 주문했는데 편하게 입기 좋을 것 같아요! 품이 넉넉하고 달라붙지 않는 핏이에요
자켓 안에나 뷔스티에랑 같이 입을 수 있을 것 같습니다!",Free
k41sClqR,상위 30%,24.08.31,블랙,,작아요,아주 만족해요,화면과 비슷해요,167,60,55,"이번에 두번째 구매에요. 그만큼 재질이 상당히 젛아요. 
겨드랑이쪽이 빵꾸날 정도로 많이 입었어요
이번 여름은 로빈유 반팔티로 보낸 것 같네요. 없었으면 벌거숭이로 다녔을지도",Free
EZ2Dofq9,,24.08.28,메란지그레이,,정사이즈예요,보통이에요,화면과 비슷해요,158,48,44,아직 세탁 두세번해도 늘어짐도 없고 단독으로도 레이어드로도 입기 다 괜찮은거같애요! 그렇게 얇진 않은데 오히려 늘어짐 없어서 더 좋아요!,Free
ExeolvdN,,24.08.27,블랙,,정사이즈예요,아주 만족해요,화면과 비슷해요,162,55,55,"팔뚝살 많은 스트레이트 체형
아 나는 이런 걸 입어야 덜 쪄보이는구나..라는 걸 깨달아서 색상별로 쟁이고 검정은 두개 삼ㅋ 강추하는데 너무 많이들 입으면 흔해지니까 적당히 추천해야겠다",Free
FFsaMzvk,,24.08.20,메란지그레이,,정사이즈예요,보통이에요,화면과 비슷해요,163,60,66,"너무 편흐기 잘입고 있어요
애기가 있어서 대충 휴류륙 입기 좋네요
배송도 빠르고 무엇뷰다 티셔츠가 늘어나지도 않고 건조기 돌려도 줄지 않아요!!@",Free
XeeP71Da,,24.08.07,메란지그레이,,정사이즈예요,아주 만족해요,화면과 비슷해요,,,,"대대대만족!!! 넥 라인도 적당하고 여리여리 해보이는 것이 완전 만족이여요 다른 색상 사려고 들어왔어요 ㅎㅎㅎ
사진은 접혀서 쭈글해보이는 겁니닷",Free
enqp******,,24.08.02,버터옐로우,,정사이즈예요,아주 만족해요,화면과 비슷해요,160,50,55,"색 너무 예뻐요 !!
다른색 먼저 샀는데 핏 예뻐서 버터엘로우 색도 샀습니다 진짜 슬랙스에 입어도 잘어울리고 데님에 입어도 잘어울려요 너무 좋아요",Free
enqp******,,24.07.27,키치핑크,,정사이즈예요,아주 만족해요,화면과 비슷해요,160,50,55,"색 넘 예쁘고요 ! 
딱 입었을때 질 좋은게 티가나요!
그래서 다른색도 바로 주문 했어요 ㅎㅎ
데일리하게 어디에든 잘 입을수있을것같아요",Free
SNmFNCjc,,24.07.25,메란지그레이,,정사이즈예요,아주 만족해요,화면과 비슷해요,161,55,66,"두번째 구매입니다!
기본티는 몇번 입으면 목이 늘어나서 입기 좀 그랬는데
이건 안 늘어나서 조아요!!!
직장동료한테도 추천해줘서 잘 입고 다녀요 ㅎ",Free
hdLIzzUU,,24.07.13,아이보리,,정사이즈예요,아주 만족해요,화면과 비슷해요,,,,정말 일초라도 의심했던 저 .. 너무 반성했습니다 ㅠㅠ 정말 핏은 물론이고 재질도 탄탄하고 부드러워서 정말 만족했습니다 !! 이 가격에 이 퀄리티라니 ㅠㅠ 조만간 그레이랑 블랙 구매하러 가겠습니다 ~,Free
J1W3rKkY,,24.07.09,블랙,,정사이즈예요,아주 만족해요,화면과 비슷해요,157,49,55,여름에 시원하게 입을 수 있고 두껍지 않은 너무 좋은 재질이에요!! 깔별로 소장 ㅆㄱㄴ!! 아직 목 늘어남은 확인 못ㅎㅆ지만 이 가격이면 오케이,Free
Eg2kNO9W,,24.07.07,아이보리,,정사이즈예요,보통이에요,화면보다 어두워요,164,58,55,화면보다 노란끼가 많이 돌아요. 넥라인이 적당해서 휘뚤마뚤 입기 좋습니다. 박음질은 그냥 딱 가격값… 대충 실밥 정리하고 입었어요. 어차피 여름옷은 한철만 입어도 낡으니 가성비 있는 구매 같습니다.,Free
joda******,,24.07.07,아이보리,,정사이즈예요,아주 만족해요,화면과 비슷해요,158,42,44,반바지랑 입을라고 총장 60cm 넘어가는 기본티 계속 찾았는데 질도 좋고 맘에 들어요! 기본티 살 때 치수 다 재보는 편인데 팔길이도 길지 않고 딱 적당하네용,Free
sb8rrQgN,,24.07.05,아이보리,,정사이즈예요,보통이에요,화면과 비슷해요,168,58,55,"무난무난한 기본 흰색 반팔티 찾고 있었는데 완전 딱이에용 넥라인이 파이지 않아서 편하게 이너로도 착용 가능하고 단독으로 입었을때도 예뻐용 
원래는 긴 기장 티셔츠만 입었는데 체형보완하려구 위에는 짧게 밑에는 하이웨스트 통큰바지 입는데 완전 저한테 딱 맞는 기본템임 ㅠ 내년에 또 사러올게요🩶",Free
ssophia,상위 25%,24.07.04,스카이블루,,정사이즈예요,보통이에요,화면보다 어두워요,167,49,55,"화면보다 조금 어두운 색상의 블루에요 
저랑은 색이 잘 안맞지만 고급스러운 색상입니다.
완전 면이구요, 구김은 조금 있지만 한철 입기 나쁘지 않아요 
목늘어남도 없어보이구요 
약간의 탄력이 있는 원단이면 전 깔별로 구매의사 있습니다",Free
e4wmu3AH,,24.07.02,아이보리,,정사이즈예요,보통이에요,화면과 비슷해요,162,47,55,핏도 진짜 예쁘고 다 좋은데 목 부분이 좀 많이 아쉽네요ㅠ 너무 얇게 덧대어져 있어서 좀 추레해 보여요.. 회색 바지랑 대충 입고 집 앞 편의점 가는 느낌..ㅠ 목 부분만 어떻게 하면 진짜 예뻐요!,Free
둥치,상위 10%,24.07.02,아이보리,,정사이즈예요,보통이에요,화면과 비슷해요,169,56,55,생각했던 스탠다드핏 그대로예요. 다만 살짝 쫀쫀하려나 했는데 그렇진 않고 일반적인 면티 생각했을 때 그 재질입니다. 근데 목부분이 늘어날 것 같진 않아서 좋아요,Free
tJn2sb2N,,24.07.01,버터옐로우,,정사이즈예요,아주 만족해요,화면과 비슷해요,162,57,55,진짜 퀄리티 좋은 티셔츠 맞아요! 일단 목부분 자체가 늘어나는 퀄이 아닙니다! 지금 빨래 2번 정도 돌렸는데 목도 안 늘어났고 보풀도 없습니다 무엇보다 핏이 딱 정핏이어서 과하지도 않고 막 너무 작지도 않고 딱 좋아요! 오히려 슬림해보인달까… 다른 색도 사고 싶어요!,Free
chzh*****,,24.06.30,메란지그레이,,정사이즈예요,보통이에요,화면과 비슷해요,164,53,66,기본으로 입기 딱 좋은 것 같아요 슬림한 것만 입다가 좀 널널한 핏을 찾고 있엄ㅅ는데 제가 찾던 아이입니다 흰색도 구매하려고 합니다,Free
OWcOPLT5,,24.06.29,메란지그레이,,정사이즈예요,아주 만족해요,화면과 비슷해요,165,52,55,진짜 너무 맘에들어요! 달라붙지도 않고 적당해서 편하게 입기 좋아요! 그렇다고 막 너무 후줄근하지도 않아서 티셔츠만 입기 딱 좋습니당!,Free
jkKlnP7v,상위 10%,24.06.29,메란지그레이,,정사이즈예요,아주 만족해요,화면과 비슷해요,157,50,55,이거 진짜 저 더 쟁이려고요 데일리로 너무너무 좋아요 티셔츠 질도 소재가 튼튼하고 이게 인쇼 제품이라고? 싶을 정도로 퀄리티 너무 괜찮습니다...핏도 너무 예뻐서 청바지랑 휘뚜마뚜 입기 딱이에요,Free
zrRLzBsd,,24.06.29,블랙,,정사이즈예요,보통이에요,화면과 비슷해요,165,48,55,"블랙색상 구매후 지인의 부탁으로 추가구매했어요.
탄탄한 면인데 입으면 많이 덥지는 않습니다.
좀이 짱짱해서 메이크업전에 입기필수입니다.",Free
IF4Uz3Bs,,24.06.25,아이보리,,정사이즈예요,아주 만족해요,화면과 비슷해요,166,50,55,만원대 반팔치고는 탄탄한 원단이라 늘어짐은 전혀 없을 것 같아요! 사알짝 비침은 있는 것 같고 프리사이즈라고 하기에는 살짝 타이트한편인것같습니당 이너로 입기 딱 좋을 것 같아요,Free
jiyu*****,상위 30%,24.06.25,메란지그레이,,정사이즈예요,아주 만족해요,화면과 비슷해요,166,59,66,딱 이뿐 정석 회색입니드 흰색 사고 너무 마음에 들어서 회색도 갈겼습니다 하늘색도 곧 갈길듯 ㅋㅋ 기장도 넣어입기 빼입기 다 좋은 길이입니당,Free
bFcDZa40,상위 15%,24.06.25,스카이블루,,정사이즈예요,아주 만족해요,화면과 비슷해요,161,62,55,"옷 탄탄쫀득하고 넥라인도 튼튼하고 길이도 좋고 컬러도 시원하니 너무 좋은데
제가 살이 넘 쪘나봅니다 ㅠ.ㅠ 161/63 가슴부분이 아주 사알짝 타이트한 느낌이 있네요
근데 컬러 너무 이뻐요",Free
banz*****,,24.06.24,메란지그레이,,정사이즈예요,아주 만족해요,화면과 비슷해요,160,,,리뷰가 좋아서 샀는데 딱 리뷰대로 좋았어요! 옷이 튼튼하고 길이는 딱 바지 버클 정도?에 와요. 얇고 후들후들한 재질이고 셔츠 안에 입기 딱 좋아요 근데 넥부분이 딱 정핏?이라 조금 더 파지거나 브이넥 버전도 있으면 좋을 것 같아요,Free
BAF8vqkc,상위 30%,24.06.23,메란지그레이,,정사이즈예요,아주 만족해요,화면과 비슷해요,157,53,55,핏 진짜 예뻐요 완전 추천!!!! 팔뚝 부각 하나도 안심하고 허리도 날씬해보임 이너티로도 예쁘고 단독으로 입어도 예쁩니다 🩶🩶 완전 휘뚤마뚤 입는데 정상적인 사진이 업네요ㅜ,Free
CS5o56fK,,24.06.23,블랙,,정사이즈예요,아주 만족해요,화면과 비슷해요,158,47,55,나름 짱짱해요. 튼튼하게 생겼고 마감도 좋았어요. 면은 아닌거 같고 뭔가 어딘가 맨질맨질? 한 느낌이 있어요. 심한건 아니라 전혀 문제없어요. 잘입고다니는중이랍니다,Free
0IMG8jf8,상위 10%,24.06.22,아이보리,,정사이즈예요,아주 만족해요,화면과 비슷해요,,,,"스트레이트형이라 오버핏 금지 당하고 딱 붙는건 싫어서 티셔츠 유목민하고 있었는데, 부해보이지도 부담스럽지도 않은 예쁜 핏 티셔츠여서 너무 좋아요! 세탁기 돌리면 목 늘어날까봐 조마조마했는데 두 줄로 박아놔서 그런지 변형은 거의 없어요. 색깔 별로 사둬야겠어요!",Free
JFPvVicX,상위 25%,24.06.20,메란지그레이,,정사이즈예요,보통이에요,화면과 비슷해요,155,44,44,추천해주는 분이 하도 많아서 일단 화이트랑 그레이색만 구매해봤는데 이 가격에 이퀄리티라니… 너무 맘에 듭니다. 다른 색상도 구매하려구요!,Free
JFPvVicX,상위 25%,24.06.20,아이보리,,정사이즈예요,아주 만족해요,화면과 비슷해요,155,44,44,추천해주는 분이 하도 많아서 일단 화이트랑 그레이색만 구매해봤는데 이 가격에 이퀄리티라니… 너무 맘에 듭니다. 다른 색상도 구매하려구요!,Free
c835*,,24.06.18,메란지그레이,,정사이즈예요,보통이에요,화면과 비슷해요,156,50,55,회색 겨땀 티 날까봐 시도조차 못햄ㅅ엄ㅅ는데 에어리즘이랑 입으니 티 안나게 입는 중이예요..ㅎ 핏도 기장도 너무 길지 않도 딱 예쁘네요!,Free
affN522o,,24.06.16,아이보리,,정사이즈예요,아주 만족해요,화면과 비슷해요,162,58,66,기본적인 흰티가 필요해서 사봤는데 핏이 아주 대박이에요 아주 달라붙지도 않고 그렇다고 되게 벙벙하지도 않아요 딱 알맞은 핏이에요 모든 색깔을 다 쟁여놓고 싶을 정도의 퀄리티예요 !! 목부분도 짱짱하구요 아주 부드럽습니다 굿굿,Free
c5rT04Og,상위 10%,24.06.12,버터옐로우,,정사이즈예요,아주 만족해요,화면과 비슷해요,160,55,55,진짜 휘뚜루마뚜루 입고 다니는 중입니다 라인도 깔끔하게 떨어지고 재질도 탄탄하고 넥라인도 깔끔하고 예뻐요 ! 색깔 세개나 샀는데 야무지게 입고다님,Free
qJkeyKqN,,24.06.09,아이보리,,정사이즈예요,아주 만족해요,화면과 비슷해요,163,62,66,제가 최근 구매했던 옷 중에 가장 맘에 들어요 통통한 체형이라 기본 스탠다드 핏한 무지티를 사는게 참 어려웠는데 여기로 정착. 시착 입어보자마자 블랙 바로 주문 했습니다. 타쇼핑몰 뭐 통통이가 입으면 말라 보인다는 것도 제가 입으면 부해보이고 그랬는데 여긴 진짜 슬림하게 보여요 최고입니다 질도 너무 괜찮고 정말 기본티 치고는 가격대가 있지만 2024년 구매 상의 중에 일등 줍니다 저랑 신체 사이즈 비슷하신 분들 꼭 구매하세요,Free
hiD0008I,,24.06.09,메란지그레이,,정사이즈예요,아주 만족해요,화면과 비슷해요,170,62,66,요즘 반팔을 여기저기서 많이 구매해보고 있어요 여기가 가장 오피스룩에 입을 수 있는 기본 티를 파는 것 같아요 너무 캐주얼하지 않으면서 탄탄한 기본티라 좋아요,Free
eun_******,상위 20%,24.06.08,메란지그레이,,생각보다 커요,보통이에요,화면과 비슷해요,155,46,55,재질 탄탄하고 정핏은 아닌거 같아요 목파임 생각보다 없고 목 부분 잘안늘어 날꺼 같긴한데 한번 빨아보고 늘어나는지 보풀이 나는지 봐바야 할꺼 같아요 레이어드 해서 입으려고 구매했는데 조금 커요 ㅎㅎ 면이라 입었을때도 부드럽네요,Free
bdVTgktB,,24.06.07,키치핑크,,정사이즈예요,아주 만족해요,화면보다 밝아요,163,45,55,"핑크가 약간 형광핑크?라서 좀 놀라긴 했는데 예뿌네용 기본티로 아주 괜찮은 거 같아요 퀄리티도 미쳤고… 너무 잘 산 거 같아요 벌써 몇번이나 입고 나감^^
다음엔 무채색으로 구매하겠습니당 많이 파세요~",Free
RBNX1AhZ,,24.06.05,스카이블루,,정사이즈예요,아주 만족해요,화면과 비슷해요,158,53,55,"와 반팔티 너무 좋아요 편하고 색도 너무 이뻐요 하늘이랑 회색 샀는데 하늘색 너무 이뻐서 매일
입고 다니고 싶어요 ㅎㅎ 잘 산거 같습니다.",Free
48soh1Ey,,24.06.05,메란지그레이,,정사이즈예요,아주 만족해요,화면과 비슷해요,168,55,55,칭찬후기가 많아서 기대했는데 정말 만족스럽습니다! 얇지만 쉽게 늘어짐없는 소재고 무엇보다 배송이 직진 배송이라 빠르게 와서 좋았습니다!,Free
qQ6caUf3,상위 5%,24.06.04,메란지그레이,,정사이즈예요,아주 만족해요,화면과 비슷해요,160,50,55,네 가지 색 구매했는데요 색감이 다 봄스럽게 산뜻하고 재질도 톡톡해서 잘 안 상할 것 같아요 오래 입을 수 있을 것 같고 기본티로 넘 완벽해요,Free
qQ6caUf3,상위 5%,24.06.04,스카이블루,,정사이즈예요,아주 만족해요,화면과 비슷해요,160,50,55,네 가지 색 구매했는데요 색감이 다 봄스럽게 산뜻하고 재질도 톡톡해서 잘 안 상할 것 같아요 오래 입을 수 있을 것 같고 기본티로 넘 완벽해요,Free
qQ6caUf3,상위 5%,24.06.04,버터옐로우,,정사이즈예요,아주 만족해요,화면과 비슷해요,160,50,55,네 가지 색 구매했는데요 색감이 다 봄스럽게 산뜻하고 재질도 톡톡해서 잘 안 상할 것 같아요 오래 입을 수 있을 것 같고 기본티로 넘 완벽해요,Free
qQ6caUf3,상위 5%,24.06.04,아이보리,,정사이즈예요,아주 만족해요,화면과 비슷해요,160,50,55,네 가지 색 구매했는데요 색감이 다 봄스럽게 산뜻하고 재질도 톡톡해서 잘 안 상할 것 같아요 오래 입을 수 있을 것 같고 기본티로 넘 완벽해요,Free
gLabHgcJ,,24.06.04,블랙,,정사이즈예요,보통이에요,화면과 비슷해요,163,56,66,"화이트와 블랙을 주문했는데 블랙이 더 예뻤습니다.
색상이 물감을 짜면 나오는 맑은 블랙은 아니고 살짝 탁한 블랙입니다. 그래서 그런지 색감이 둥둥 뜨기보다는 안정되어 있어서 입었을때 몸에 핏 되는 느낌이 있습니다.",Free
2HRfeDKu,,24.06.04,아이보리,,정사이즈예요,아주 만족해요,화면과 비슷해요,160,55,55,"검은색 구매 후 너무 마으멩 들어서 다시 재구입해요!
탄탄하고 최고입니다..
빨아도 별러 헤이지는 느낌도 멋 받고,
그냥 계슉 입을 수 있을 것 같아요",Free
Kkq28yUa,상위 15%,24.06.03,블랙,,정사이즈예요,아주 만족해요,화면과 비슷해요,160,58,66,갓성비 갑이에요~~ 딱 스탠다드핏 티셔츠에요. 너무 널널하지도 않고 너무 작지도 않아요. 입고 벗을 때 목이 많이 조이고 불편하지만 그만큼 늘어나지도 않을듯요. 왕추천입니다~~,Free
Cz1Py5hb,,24.05.31,블랙,,정사이즈예요,아주 만족해요,화면과 비슷해요,166,52,55,저는 목이 심하게 파인 옷을 안좋아하고 한번 빨면 목들어나는 옷을 진짜 극혐하는데 이 옷은 세탁을 해도 목도 안 늘어나고 판판해요!! 사진은 세탁하고 난 사진이에용,Free
4m0j8tO9,,24.05.29,스카이블루,,정사이즈예요,아주 만족해요,화면과 비슷해요,164,62,55,"Good~~~~
아이보리 산 후에 맘에들어서 검정이랑 스카이도 샀어유
블루는 흰끼있는 컬러인줄알았는데 회색빛 돌아요
그래도 맘에 들어요",Free
qW9ly7Z4,,24.05.29,블랙,,정사이즈예요,아주 만족해요,화면과 비슷해요,158,53,55,"스트레이트체형들 아묻따말 사세요
골반 살짝 위로떨어지는 기장감으로 짧은 허리길이
보완하고
목 라인도 답답하지 않아서 최소 3키로는 빠져보입니다
이 티셔츠에 스탠다드핏이나 부츠컷입으면 걍 핫걸이에요",Free
V3vfFfb4,,24.05.29,아이보리,,정사이즈예요,아주 만족해요,화면과 비슷해요,168,54,55,와 깔별로 쟁여야겠다.. 팔뚝 커버 개 잘 돼용 흰티라 여러장 사서 쟁여야겠어요 길이믄 크롭 아니여요 크롭 아니라사 더 젛아용 짐짜 핏 똑 떨어지구 예쁘니다 다들 사요!!,Free
V0dayTA7,,24.05.28,아이보리,,정사이즈예요,보통이에요,화면과 비슷해요,158,50,44,"이름만 아이보리고 화이트일 줄 알앜ㅅ는데
찐 아이보리입니당
핏 괜찮아요
빼입기에 기장 딱
빨래 몇 번 돌려보고 괜찮으면 다시 사러 올게유",Free
0cXpBqtM,,24.05.27,블랙,,정사이즈예요,아주 만족해요,화면과 비슷해요,156,54,55,핏 미쳤습니당...팔뚝살 많은 부분 딱 가려주면서 엄청 탄탄한 재질이네요 그래도 입었을때 불편하지않고 어느정도 신축성은 있습니다!목도 잘 안 늘어날것같아서 오래오래 입을 수 있을것같네용😘 블랙 사자마자 화이트 장바구니에 담았어요ㅋㅋㅋ,Free
aN8w79Xo,상위 10%,24.05.26,블랙,,정사이즈예요,보통이에요,화면과 비슷해요,172,30이하,55,"배송 빨랐구요
저스트핏이고 어깨 조금이라도 있으면 딱맞는스타일이에요
가격대비 그냥 그래요
하얀색 같이샀는데 뭐묻어서 교환하려는데
교환도안되고 다시 주문만 가능하고
할인혜택도 안된대서 좀 별로였네요",Free
ㅅㅇㅅㅇ,,24.05.26,메란지그레이,,정사이즈예요,아주 만족해요,화면과 비슷해요,151,46,55,"목 부분 너무 쫀쫀하고 좋았어요!
특히 팔 부분이 정말 팔뚝살 부분 딱 커버해줘서 완전 여리여리 해보입니다 ㅠㅠ
반팔티 입으면 부해보이는 느낌을 받아서 과연 잘 맞을까 했는데 전혀 부해보이지 않고 완벽한 핏에 재질도 좋고 가성비 갑이에요 진짜! 꼭 사세요ㅠㅠㅠ 안사면 손해입니다,, ❤️",Free
yNhuBn9Q,,24.05.21,메란지그레이,,정사이즈예요,아주 만족해요,화면과 비슷해요,164,48,55,생각보다 진짜 탄탄해요. 세탁 하고 나서도 재질에 큰 변화가없을거같습니다. 기장도 적당하고. 상체가 빈약한 스타일이라 반팔 잘못입음 없어보이는데 그런점 없어요. 흰색 재구매 하려구요.,Free
d5VQxzLl,,24.05.20,아이보리,,정사이즈예요,아주 만족해요,화면과 비슷해요,170,56,55,"목도 꽤 짱짱하고 팔 길이, 전체 길이 다 적당해서 예쁜 핏이에요 넣어 입어도 예쁜데 빼입어도 애매하지 않은 길이라 휘뚜루마뚜루 입기 좋아용",Free
d5VQxzLl,,24.05.20,블랙,,정사이즈예요,아주 만족해요,화면과 비슷해요,170,56,55,"목도 꽤 짱짱하고 팔 길이, 전체 길이 다 적당해서 예쁜 핏이에요 넣어 입어도 예쁜데 빼입어도 애매하지 않은 길이라 휘뚜루마뚜루 입기 좋아용",Free
d5VQxzLl,,24.05.20,메란지그레이,,정사이즈예요,아주 만족해요,화면과 비슷해요,170,56,55,"목도 꽤 짱짱하고 팔 길이, 전체 길이 다 적당해서 예쁜 핏이에요 넣어 입어도 예쁜데 빼입어도 애매하지 않은 길이라 휘뚜루마뚜루 입기 좋아용",Free
xR1RPywK,,24.05.20,스카이블루,,정사이즈예요,아주 만족해요,화면과 비슷해요,160,62,66,"5점으론 부족한 티셔츠예요. 가격, 사이즈, 퀄리티 다 넘 만족스러워요 !! 좋은 퀄리티, 좋은 가격의 상품 넘 감사합니다. ^^",Free
fSgY5N92,상위 5%,24.05.20,아이보리,,정사이즈예요,아주 만족해요,화면과 비슷해요,168,53,55,핏도 예쁘고 무난 데일리 흰티라 잘 입고 다녀요!! 요즘 흰티 많이 입어서 다양한 사이트에서 사봤는데 여기서 산게 젤 쫀쫀하고 오래입을거같아요!,Free
T5Ta0aft,,24.05.19,아이보리,,정사이즈예요,보통이에요,화면과 비슷해요,160,55,55,큰 기대 안하고 편하게 여기저기 입으려고 샀어요 적당히 낙낙한 핏으로 입을 수 있어요 세탁 안해봐서 잘 모르겠지만 이번 여름 잘 버텨즈면 좋겠어요,Free
Ww71lwSO,상위 20%,24.05.19,메란지그레이,,정사이즈예요,보통이에요,화면과 비슷해요,,,,핏이 너무 예쁜 기본 티셔츠입니다 ㅎㅎ 그레이 티셔츠 계속 찾고 있었는데 여기 티셔츠 너무 예뻐서 다른 컬러도 다 소장하고 싶어요 !,Free
song******,,24.05.19,블랙,,정사이즈예요,아주 만족해요,화면과 비슷해요,,,,"핏 진짜 1등 제가 딱 원했던 군더더기없***끔한 핏이에용ㅎㅎ 이너티로 완전 만족입니당
날씨 완전 여름인데 세탁하고 바로 입을고에염ㅎㅎ 만족큐🤍",Free
song******,,24.05.19,아이보리,,정사이즈예요,아주 만족해요,화면과 비슷해요,,,,"핏 진짜 1등 제가 딱 원했던 군더더기없***끔한 핏이에용ㅎㅎ 이너티로 완전 만족입니당
날씨 완전 여름인데 세탁하고 바로 입을고에염ㅎㅎ 만족큐🤍",Free
sky3***,,24.05.18,스카이블루,,정사이즈예요,보통이에요,화면과 비슷해요,169,60,55,"택배봉지 열자마자 오염부터 눈에 보였어요 
상품 검수할 때 놓칠 수 있는 부분이 아닌 것 같은데 성의가 없는 거라고 밖엔.. 
안쪽에 묻어있는 거라 입었을 때 티는 안나지만 기분이 썩 좋진 않네요. 물티슈로 닦아봐도 지워지지 않아요 반팔 색깔에 맞춰 준비해놓은 게 있어서 교환 없이 걍 입긴 하는데 많이 아쉽네요",Free
b19OVwaS,,24.05.16,메란지그레이,,정사이즈예요,보통이에요,화면과 비슷해요,,,,넥이 너무 답답하지 않은 걸로 찾다가 구매했능데 소재도 탄탄해서 건조기까지 돌려도 변형이 없어서 데일리로 자주 손에 가는 티셔츠에요,Free
b19OVwaS,,24.05.16,아이보리,,정사이즈예요,보통이에요,화면과 비슷해요,,,,넥이 너무 답답하지 않은 걸로 찾다가 구매했능데 소재도 탄탄해서 건조기까지 돌려도 변형이 없어서 데일리로 자주 손에 가는 티셔츠에요,Free
rbfl****,상위 15%,24.05.13,블랙,,정사이즈예요,아주 만족해요,화면과 비슷해요,160,56,66,평점 높은 반팔들 중에 골라서 구매했는데 엄청 탄탄하고 딱 깔끔하게 떨어지는 정핏 반팔이에요. 빨래하고나서는 어떻게 될지 모르겠지만 받아보고나서는 만족도가 높았어요.,Free
