아이디,리뷰어 등급,작성 날짜,옵션1,옵션2,상품 사이즈,퀄리티,색감,키,몸무게,사이즈,리뷰내용,제품_사이즈
yApSnsLX,상위 20%,23.12.28,백메란지(기모ver.),,정사이즈예요,아주 만족해요,화면과 비슷해요,158,48,55,배송 빨라요 핏도이쁘고 색상도 이뿌고 착용감도 좋습니다 많이 무겁지않고 소재도 톡톡하니 오래 잘 입을거 같아요! 고급집니당,Free
hnwCcPVE,,23.12.26,그레이(기모ver.),,생각보다 커요,아주 만족해요,화면과 비슷해요,165,56,55,핏 대환장으로 예뻐요 우리가 원하는 오버핏... 컬러는 엄청 꼼꼼히 보고 산건 아닌데 핑크 자수가 너무 예쁜 색입니다!!!,Free
9BKQp22j,,23.12.22,오트밀(기모ver.),,정사이즈예요,아주 만족해요,화면과 비슷해요,163,51,44,핏이 기대한 것 이상으로 이쁘고 심지어 로고 색상도 맘에 들어요. 로고도 고급스럽게 박혀있어서 보세여도 보세느낌이 전혀 안나요,Free
9BKQp22j,,23.12.22,베이비핑크(기모ver.),,정사이즈예요,아주 만족해요,화면과 비슷해요,163,51,44,오트밀 색상 구매하고 핏이 너무 예뻐서 분홍색상으로 추가 구매했네요~ 분홍색도 넘 이쁘고 무엇보다 핏이랑 길이가 너무 만족이에요,Free
h4nQg1yu,,23.12.20,백메란지(기모ver.),,생각보다 커요,보통이에요,화면과 비슷해요,158,85,66,"로고나 재질은 마음에 드는데
크기가 어벙벙하고 어깨가 엄청커서 완전
어깡뚱이 되어버려서 아쉬워요
그래도 만족합니다ㅎ",Free
nNWyX7aB,,23.12.20,오트밀(기모ver.),,생각보다 커요,아주 만족해요,화면과 비슷해요,167,54,55,"생각보다 오버사이즈고 귀여워요
색이 너무 마음에 들어요 길이가 조금 짧긴한데 안에 레이어드티셔츠 입으면 괜찮을거 같음",Free
sGy27i5E,,23.12.19,오트밀(기모ver.),,생각보다 커요,아주 만족해요,화면과 비슷해요,,,,생각보다 길이는 짧았지만 핏이 어벙벙해서 너무 귀엽고 재질도 부드러워서 좋아요ㅠㅠㅠㅠ 다른 색깔도 사고싶어요 !!,Free
HGnBPLG4,,23.12.18,그레이(기모ver.),,정사이즈예요,아주 만족해요,화면과 비슷해요,168,57,66,"생각보다 배송은 빨랐어요!ㅎ
사진보다 실제로 받아보니 더 이뻐용 !!
색감도 좋구 핏도 이쁘고 두툼해서 따뜻해용 ㅎㅎ",Free
IhZqcNSk,,23.12.17,그레이(기모ver.),,정사이즈예요,아주 만족해요,화면과 비슷해요,169,57,55,"따뜻하고 색조합이 너무 예쁜것 같아요
겨울에 휘뚜루마뚜루 입으려구요
일본 여행가서 입었는데 무난하면서도 핑크때문에 예뻤어요",Free
AGiN8mtO,,23.12.15,오트밀(기모ver.),,생각보다 커요,보통이에요,화면과 비슷해요,158,43,44,"기모라서 부드러워요.
근데 사이즈가 엄청 크네요 가오리라서 통이 정말 커요 
배송은 느렸어요 일주일 넘게걸림 ~ !! ㅜ",Free
8gXKpiK8,상위 20%,23.12.14,그레이(기모ver.),,정사이즈예요,보통이에요,화면과 비슷해요,167,54,55,"밝은 그레이색이고 품이 살짝 커요 핑크 레터링이
포인트되고 예쁩니다! 전체적으로 사진이랑 같아서 만족스러워요!!",Free
1zPplRc1,,23.12.13,베이비핑크(기모ver.),,생각보다 커요,아주 만족해요,화면과 비슷해요,168,55,55,"핑크색을 좋아하는 저에겐 넘 이쁘구여
품이 넉넉해서 입기 편하구여 기모안감 이라 따스하구 포근해여 완전 만족입니다^^",Free
G6INqDur,,23.12.08,그레이(기모ver.),,정사이즈예요,아주 만족해요,,164,50,55,배송이 늦어서 아쉬웠지만 ㅠㅠㅠㅠ 색이 너무 예뻐요 ㅎㅎㅎㅎ 길이도 적당하고 따뜻하고 좋네요 잘 입을게요 감사합니다,Free
JbNS1zKl,,23.12.07,그레이(기모ver.),,생각보다 커요,아주 만족해요,화면과 비슷해요,168,52,55,"낙낙한 핏이고 팔도 길어요
탄탄하고 소재도 좋아영
유행안타고 잘 입을것같아요
167에 52키로 기준 많이 낙낙합니당",Free
sGmXmVly,,23.12.07,베이비핑크(기모ver.),,생각보다 커요,아주 만족해요,화면과 비슷해요,165,60,55,"진짜 부드럽고 핏도 괜찮아요! 기모 추가하는 걸 추천합니다! 편하게 입을 수 있어요~
버건디 컬러랑 매치해도 아주 굿입니당!",Free
Lz8ldJ6E,,23.12.06,베이비핑크(기모ver.),,생각보다 커요,아주 만족해요,화면과 비슷해요,165,50,55,컬러 딱 이 느낌이고 넘 예뻐요 생각보다 더 아방한 핏이긴한데 퀄리티도 좋습니다 배송도 빨라서 좋았어요 다른 컬러도 구매하고싶어요,Free
U7yl4jBB,,23.12.05,그레이(기모ver.)/오늘출발,,정사이즈예요,아주 만족해요,화면과 비슷해요,160,50,55,"이거 너무 편하고 너무 따뜻해서 짱이에오 ㅎㅎㅎㅇ
배송도 짱 빠르고 ! 
따뜻해서 좋네요 ㅎㅎㅎㅎ 
또 다른색으로도사고싶 어여",Free
254UBL2q,,23.12.03,오트밀(기모ver.),,정사이즈예요,아주 만족해요,화면과 비슷해요,160,68,66,편하게 입기 좋은 맨투맨 찾다가 구매했는데 핏도 괜찮고 안부해보이네용 데일리로 입기 좋아요!색도 화면과 비슷해요ㅎㅎ,Free
L32GRe7M,,23.12.03,그레이(기모ver.),,생각보다 커요,아주 만족해요,화면과 비슷해요,163,52,55,"너무 귀엽고 아방한 핏이에요~~ ^^
기모도 괜찮고 예쁘고 맘에 들어서 분홍색도 살까 말까.. 고민중입니다..!!",Free
TtVeSZmS,상위 5%,23.12.03,그레이(기모ver.),,생각보다 커요,보통이에요,화면과 비슷해요,166,62,55,너무너무 예뻐요… 팔이 정말 길어서 약간 부해보일수 있으나 따뜻하고 포근해요 배송도 생각보다 빨리오고 시보리도 탄탄해서 조아요,Free
8kMIQgOk,,23.11.30,베이비핑크(기모ver.),,정사이즈예요,보통이에요,화면과 비슷해요,,,,사이즈 넉넉하고 편하게입기 좋아요 원단도 생각보다 따듯하고 좋아요 자수가 이쁘네요 핑크 컬러도 은은한 딸기우유 컬러라 이뻐요,Free
UYmXBxCM,,23.11.30,베이비핑크(쮸리ver.),,정사이즈예요,보통이에요,화면과 비슷해요,156,49,55,완전 딸기우유 색깔이어서 너무 귀여워서 편하게 자주 손이 갈 것 같아요 배송도 빠르고 근데 너무 추워져서 기모로 살 껄 그랬나봐요,Free
ghdu*****,상위 20%,23.11.30,베이비핑크(기모ver.),,정사이즈예요,아주 만족해요,화면과 비슷해요,160,47,44,"색감부터 레터링 자수 배색, 디테일 포인트까지 너무너무 기여워요ㅠㅠ 아방한 핏도 예쁘고 기장은 제 키에 엉덩이 반정도 덮어요",Free
ucZAugLW,상위 15%,23.11.28,그레이(기모ver.),,정사이즈예요,아주 만족해요,화면과 비슷해요,162,60,66,"핑크자수 컬러 너무 이쁘네요
산뜻산뜻해요
오버핏이라서 꾸안꾸로 스타일링 하기 좋아요
모자나 장갑 코디랑도 넘. 잘 어울려요",Free
OLhOYKpR,,23.11.27,오트밀(기모ver.)(오늘출발),,정사이즈예요,보통이에요,화면과 비슷해요,168,50,44,맨투맨은 거의 모코블링에서 구매한듯요ㅋㅋ 진짜 핏이며 색상이며 딱 원하는 스탈이고 재질도 좋아요! 기모라서 따뜻하니 잘입을게용ㅎ,Free
kAbcUPHZ,상위 25%,23.11.26,백메란지(기모ver.),,생각보다 커요,아주 만족해요,화면과 비슷해요,162,50,55,"목, 소매 시보리 짱짱하고 기모 잘 긁혀있어서 정말 따뜻해요. 배송도 직진 아닌데도 엄청 빨랐어요. 글씨 포인트 귀여워요 추천!",Free
7e8qxCAy,,23.11.25,그레이(기모ver.),,생각보다 커요,아주 만족해요,화면과 비슷해요,159,51,55,생각보다 크고 159 기준 엉덩이 다 덮어요. 짧은 패딩이랑은 못 입을 듯. 기모 들어서 따뜻해요. 핑크 레터링이 포인트로 예뻐요,Free
ervR7ArD,,23.11.24,베이비핑크(기모ver.),,생각보다 커요,화면과 비슷해요,,160,50,66,"색깔도 너무 이쁜 핑크고 
가오리 핏이에요 안에 기모털이 쫌 빠지기는한데 엄청 따뜻하고 좋아요
컬러배색이 너무 이쁜 옷이에여",Free
IZ44PtGJ,,23.11.24,그레이(기모ver.),,정사이즈예요,보통이에요,화면과 비슷해요,171,58,66,"기모가 더 두꺼웠으면 좋았을꺼같아요 
색상이 화면이랑 같은데 핑크가 딸기우유빛이라 
더 이쁜거 같아요 
길이도 만족스러워요",Free
z494y3SJ,,23.11.24,베이비핑크(기모ver.),,생각보다 커요,아주 만족해요,화면과 비슷해요,158,50,55,핑크도 같이 구매했는데 원단탄탄하고 적당히 박시해요 따듯하고 가격에비에 퀄리티가 좋네용!!크롭버전도 만드러주시ㅔ여,Free
scEKAZLG,,23.11.23,그레이(기모ver.),,생각보다 커요,아주 만족해요,화면과 비슷해요,162,46,44,생각보다 폼이 커서 놀라긴 했는데 색감응 화면과 같고 기모도 두툼해서 한 겨울에도 아주 잘 입을 것 같아요. 후회 없는 소비였습니당,Free
gJLpWeYb,,23.11.23,베이비핑크(기모ver.),,정사이즈예요,보통이에요,화면과 비슷해요,160,58,66,"핑크색상에 유행 안탈꺼같고 폼도 크고 좋아요
겉에가 보들보들 했으면 더 좋앗을꺼같지만 다른색상도 사고 싶어요회색도 이쁠듯",Free
e0PPcNOl,,23.11.22,백메란지(기모ver.),,생각보다 커요,아주 만족해요,화면과 비슷해요,167,53,55,"두꺼고 소재도 좋고 주름이짱짱해요 올겨울 손이 자주갈거같아요 모코블링에서 맨투맨 사면 항상맘에드네요
다른 디자인도 구매해야겠어요",Free
와압와압,,23.11.20,오트밀(기모ver.),,생각보다 커요,아주 만족해요,화면과 비슷해요,160,52,55,질은 기모 두껍고 좋아요! 박시해서 입기 편해여 근데 쪼오오금 부해보이는 건 있는거같아요! 편하게 입에게는 만족합니다!,Free
18wHWzzw,,23.11.19,그레이(기모ver.),,생각보다 커요,보통이에요,화면과 비슷해요,156,47,55,생각보다 핏은 크지만 도톰하고 편하고 좋아요 따듯하고 이쁘다고 귀엽다고 하더라구요 이뻐서 좋ㅣ요 ㄷ 또 살게요 ~ ㅎㅎㅎ,Free
94RAusBu,,23.11.19,베이비핑크(기모ver.),,생각보다 커요,아주 만족해요,화면과 비슷해요,160,58,66,"생각보다 재질이 도톰하고 단단해서 좋아요ㅠ 
좀 커서 아방한 핏인데 그래도 이뻐서 입으려고요 색감 진짜 너무 이쁜데..",Free
n0UAVasi,상위 10%,23.11.17,베이비핑크(기모ver.),,정사이즈예요,보통이에요,화면과 비슷해요,163,60,66,작년에 구매할때는 겉에도 피치기모같은 느낌이였는데 이번꺼는 아니네요 ㅎㅎ 그래도 색감이뻐서 너무좋아요 잘입어질거같아요,Free
wcZQJvVY,상위 30%,23.11.16,베이비핑크(기모ver.),,정사이즈예요,아주 만족해요,화면과 비슷해요,172,67,66,기모버전인데 너무 덥지도 않고 답답하지 않아서 만족해요. 색상도 예뻐서 오늘 입고 출근했는데 예쁘다고 말씀도 많이 해주셨어요,Free
j5T1AoY7,,23.11.16,베이비핑크(기모ver.),,생각보다 커요,아주 만족해요,화면과 비슷해요,169,58,55,생각보다 핏이 오버핏이에요 색감은 우유빛 살짝 섞인 핑크라 예쁘고 팔 기장이 좀 긴편이에요 편하게 잘 입고 다닐거같아요,Free
HVtyl9yD,,23.11.16,베이비핑크(기모ver.),,생각보다 커요,보통이에요,화면과 비슷해요,164,47,55,"맨투맨은 목부분이 가장 신경이 쓰이는데여
여긴 쫀쫀하네요^^ 잘 안늘어날 것 같아요! 색상도 이쁜 딸기우유 핑크입니다.",Free
Ws0FWaQw,,23.11.15,그레이(쮸리ver.)(오늘출발),,정사이즈예요,보통이에요,화면과 비슷해요,163,51,55,"많이 크긴한데 오버핏으류 입기 조아요
재질도 좋고 시보리 짱짱
한겨울엔 안에 티 입어야합니당
분홍색 자수포인트듀 이뻥ㅎ",Free
2I1OOcly,,23.11.14,그레이(기모ver.),,정사이즈예요,보통이에요,화면과 비슷해요,172,70,66,너무너무 맘에 들어요! 살짝 박시하면서 길이도 길지않아서 핏도 이쁘고 도톰해서 폭신한 느낌나요 그리고 따뜻합니당~,Free
jy95***,상위 10%,23.11.13,그레이(기모ver.),,생각보다 커요,아주 만족해요,화면과 비슷해요,158,47,44,기모들은 맨투맨이라서 따뜻하고 방벙한 핏이라서 편하게 입기 좋아요.ㅎㅎ 색조합도 딱이고! 핑크바지랑 입으면 아주 예뻐요 ㅎㅎ,Free
P7iDQKEF,상위 30%,23.11.12,그레이(기모ver.),,생각보다 커요,아주 만족해요,화면과 비슷해요,171,68,66,"배송이 늦게왔음
이전에 사고싶었는데 품절이어서 못사고 올해삼
엄청나게 통이 넓은데 그래도 두꺼워서 따뜻했음
자수가 취향저격임",Free
CsJffDKE,,23.11.11,베이비핑크(기모ver.),,정사이즈예요,아주 만족해요,화면과 비슷해요,160,50,55,도톰하고 핏 너무 귀여워요. 색감도 화면이랑 동일. 무시무시한 박스핏 그런거 아니고 적당히 아방한게 귀엽네요,Free
KHAkXXk1,상위 20%,23.11.11,그레이(기모ver.),,정사이즈예요,보통이에요,화면과 비슷해요,156,55,55,"옷은 기모라 따뜻항데 핏이 매우아방해서
부해보인달까요 날씬항사람들에게강추에여 
그래도 잘입을게용 따뜻하니깐 조아여",Free
0X1imejU,상위 15%,23.11.10,오트밀(기모ver.),,생각보다 커요,아주 만족해요,화면과 비슷해요,160,52,55,사진이랑 똑같아요 포근한 오트밀 컬러에 브라운 배색 이쁩니다! 무엇보다 널널한 핏이라서 어좁이인 저한테 딱이에요 기모도 폭닥폭닥해요,Free
IHaWLRe4,상위 25%,23.11.10,그레이(기모ver.)(오늘출발),,생각보다 커요,아주 만족해요,화면과 비슷해요,168,54,55,"170 기준 팔도 길고 만족
보들보들 안감이 기모라서
생각보다 따땃해요
목도리하고 나가도 춥지않아요
한개 더 사고 싶어요",Free
wond******,,23.11.09,그레이(기모ver.),,생각보다 커요,보통이에요,화면과 비슷해요,153,130이상,33 이하,맨투맨은 이쁜데 짱커요. 소매도 길어서 접어 입지않으면 불편합니다 기장도 품도 큼직하니 구훈녀생정 핏으로 입을 수 있네욥,Free
qhsf**,,23.11.08,그레이(기모ver.),,생각보다 커요,아주 만족해요,화면과 비슷해요,155,55,55,"색감 너무 예쁘고 품도 널널하니 좋아요
다만 팔이 꽤나 긴편이라서 걷든가 접듬가 해서 입어야할것같아요!!
안에는 보들하니 좋습니당",Free
yVzxkLSt,,23.11.08,그레이(기모ver.),,정사이즈예요,아주 만족해요,화면과 비슷해요,160,55,55,"자수도 엄청 마음에 들고 짱짱해서 마음에 들어요
밑에가 조여서 밑으로 축 쳐지지않아서 좋아요
너무 편하고 핏도 짱 예쁨 !!",Free
FRH33wls,상위 25%,23.12.20,베이비핑크(기모ver.),,정사이즈예요,보통이에요,화면과 비슷해요,163,58,55,바지가 츄리닝이라 사진은 잼민이 핏이긴 한데... 옷 자체가 너무 귀얍고 보드라워서 완전 만족하고 있습니다!! 다른 색상도 구매할까 고민중이에요,Free
누우오,상위 25%,23.12.14,오트밀(기모ver.),,정사이즈예요,보통이에요,화면과 비슷해요,165,55,66,원래도 어깡이라 아방한 느낌보다는 굉장히 듬직해졌지만 오히랴 좋습니다.. 가격대비 탄탄하고 따수운 맨투맨이라고 생각합니다 굿굿,Free
hees******,,23.12.09,오트밀(기모ver.),,정사이즈예요,보통이에요,화면과 비슷해요,158,48,44,굿굿굿 역시 모코블링 맨투맨 맛집 언니랑 커플로 하나씩 주문했어요 넘 이쁘고 손도 자주가고 다른 보세 맨투맨보다 훨씬 부드럽고 탄탄해용,Free
jnlYNMBz,,23.12.09,그레이(기모ver.),,생각보다 커요,아주 만족해요,화면과 비슷해요,150,55,66,"넘 예뿌요~~ 첨엔 쫌 큰감이 없잖아 있었는데
모르고 건조기 돌렸는데 딱 예쁜 핏 나와서 넘 만족하면서 입고 있어요 !! 젤 손 마니 가는 옷이에용!",Free
jnlYNMBz,,23.12.09,베이비핑크(기모ver.),,생각보다 커요,아주 만족해요,화면과 비슷해요,150,55,66,"진짜 거의 교복템이에요~~~ 넘 편하고 손이 자주가서 편하게 입을때도 좋고 그냥 예뿝니더,,핏도 예쀼고 
한번 건조기에 넣어버렷는데 딱 예쁜핏됐어료!!",Free
Gufg0RHI,,23.12.08,그레이(쮸리ver.),,생각보다 커요,보통이에요,화면과 비슷해요,159,47,44,"생각보다 엄청 엄청 오버핏이에요 ㅠㅠ
옷 ㅂ잘못만든거 왔나 한참 고민했어요 ㅋㅋㅋㅋ
한번 빨고 건조기로 좀 줄여볼까 생각중입니다🥲
자수랑 디자인은 예뻐요!",Free
피곤한간지,,23.12.08,그레이(기모ver.),,생각보다 커요,아주 만족해요,화면과 비슷해요,154,70,77,"핑크구매하고 넘 만족해서
그레이도 또 구매했어요!!
모델분처럼 핑크조거팬츠랑 같이 입으니까
넘 귀엽습니당♡ 기모라 따따해요!",Free
xNvJAZYw,상위 20%,23.11.29,그레이(기모ver.),,생각보다 커요,아주 만족해요,화면과 비슷해요,167,54,55,"후기가 너무 많아서 믿고 구매해요
마음에 들어요
요즘들어 갑자기 추워졌는데 기모후드 정말
딱이예요 ㅎㅎㅎ 다음에 또 다른색도 구매하고 싶오요",Free
DqMAMVhh,,23.11.20,베이비핑크(기모ver.),,생각보다 커요,아주 만족해요,화면과 비슷해요,166,66,77,교복처럼 입고있어요 따뜻하고 폭닥폭닥해요 근데 생각보다 소매가 진짜 더 길어요 그레서 사진도 소매길이 참고하시라구 올려보아요 색상도 너무 귀여워요,Free
PTxdEaZ1,,23.11.12,베이비핑크(기모ver.),,정사이즈예요,아주 만족해요,화면과 비슷해요,160,60,66,귀여워요!!!! 색깔도 너무 마음에 들고 기모라서 따뜻하게 잘 입을 것 같습니당!!! 아직 입고 나가진 않았지만 자주 애용할것 같아요!,Free
oZTuIjKe,상위 20%,23.11.12,오트밀(기모ver.),,생각보다 커요,아주 만족해요,화면과 비슷해요,157,61,66,맨투맨이 필요해서 구매 했는데 화면에서 마음에 들었던 디자인과 실제로 봤을때 비슷해서 너무 놀랬어요!! 입었을때 오불편하지 않고 오버핏이여서 더 마음에 들었어요!! 완전 만족합니다!!!,Free
Slc65hOk,,24.12.11,베이비핑크(기모ver.)(오늘출발),,생각보다 커요,아주 만족해요,화면과 비슷해요,167,54,55,"오버핏맨투맨 찾고있엌ㅅ는디 기모도잘들어있고
넘만족햐요
패쪼랑입으려고 넉넉한거찾고있었는디 딱젛아요
잘입을게요",Free
ew1JFuVJ,,24.11.28,베이비핑크(기모ver.)(오늘출발),,정사이즈예요,아주 만족해요,화면과 비슷해요,173,65,66,다른 색사고 일년 뒤에 핑크 샀습니다. 아주 품이 넉넉하고 귀여운 핏이라 마음에 듭니다,Free
aheANXh2,,24.04.04,3%그레이(쮸리ver.),,생각보다 커요,보통이에요,화면과 비슷해요,166,56,55,"배송은 정말 빨라서 너무 좋아요 
생각보다 조금 커서 당황했지만 이뻐서 바로 입고 나갔어요 
맨투맨은 역시!!!최고입니다",Free
3LWvazrw,,24.01.20,베이비핑크(기모ver.),,생각보다 커요,보통이에요,화면과 비슷해요,171,59,55,"오버핏이지만 핑크컬러가 이뻐서 삿어용ㅇ
핑크핑크 ㅎㅎ 
예쁜핑쿠색입니다ㅎㅎ
다른색도 사볼까 고민해봐야겟어요ㅎㅎ",Free
hjie**,,24.01.11,그레이(기모ver.),,생각보다 커요,보통이에요,화면과 비슷해요,170,56,66,"생각보다 크지만 기장이 조굼 아쉬운편입니다.
키가 커서 그런지 기장이 조금 애매한 부분이 있지만 
맘에 들어요 안감도 뷰들뷰들 촉감도 즇아오",Free
kimj*****,상위 15%,24.01.07,그레이(기모ver.),,정사이즈예요,보통이에요,화면과 비슷해요,,,,화면에 나온거랑 똑같고 목부분은 좀 빨래하고 나면 늘어나게 생겼긴합니다. 안에 기모톡톡하네요 따뜻하게 잘입을게요,Free
ZanMp1kL,상위 10%,23.12.29,백메란지(기모ver.),,생각보다 커요,아주 만족해요,화면과 비슷해요,157,47,44,"옷이 제가 좋아하는핏이였어요!! 가오리핏처럼
살짝 크긴했지만 그래도 핏도좋고 옷도 색상이나 안에 기모도 있어서 좋았어요 !!",Free
9FmOm2Wh,,23.12.14,오트밀(기모ver.),,정사이즈예요,아주 만족해요,화면과 비슷해요,162,62,66,진짜 도톰하고 퀄리티도 좋아요. 또 쟁겨놓고싶은 템 찾았네요. 소매가 많이길고 전제적인 기장은 좀 짧은거같아요.,Free
LhnHL3c9,,23.12.13,그레이(기모ver.),,생각보다 커요,아주 만족해요,화면과 비슷해요,158,53,55,"핑크바지랑 같이입으려고 샀어요
좀 늦게왔는데 이뻐서 용서됐음
사진이랑 똑같고 품이 커서 캐주얼하게 입으먄 딱입니당",Free
qduAktx5,상위 30%,23.12.10,오트밀(기모ver.),,생각보다 커요,보통이에요,화면과 비슷해요,168,54,55,"옷의 색깔은 사진에 있는 색이랑 동일해요
사이즈는 오버핏이라 아주 넉넉하구
옷 안에 이너 입어도 편하게 입을 수 있는 사이즈예요",Free
S0Fs9ZxI,,23.12.10,백메란지(기모ver.),,정사이즈예요,아주 만족해요,화면과 비슷해요,168,50,55,맨투맨 핏이 딱 제가 원하던 핏이에요. 건조기 돌려도 안줄어들어요. 기모가 굉장히 따뜻해서 지금 너무 잘입고 다녀요~,Free
Uqjsc1q5,,23.12.07,베이비핑크(기모ver.),,생각보다 커요,아주 만족해요,화면과 비슷해요,165,56,66,색깔 너무 예뻐요 생각보다 크긴한데 아방 귀욤해서 다른 색으로도 가지고싶음!! 기모도 부드럽고 따뜻해서 착용감 넘넘 좋습니다 맨투맨 맛집이네요,Free
XfYaYvnJ,,23.12.02,베이비핑크(쮸리ver.),,생각보다 커요,보통이에요,화면과 비슷해요,164,55,55,널널한 핏인데 여리여리해보이진 않구여 품이커서 아우터도 큰거 입어야할것 같어오 한겨울엔 단독으로 입기엔 추울것 같구여,Free
0foBp838,,23.12.02,그레이(기모ver.),,생각보다 커요,보통이에요,화면과 비슷해요,163,52,55,귀여워요! 그런데 생각보다는 짧네요! 하지만 핑크 그레이 색감 조합이 넘 귀여워서 마음에 듭니다! 다른색상도 구매할까 고민중,Free
E8ikqXLh,상위 15%,23.11.30,베이비핑크(기모ver.),,정사이즈예요,아주 만족해요,화면과 비슷해요,160,45,44,회색 샀다가 이뻐서 핑크색도 구매했어요 너무 귀엽고 따뜻해요~~ 생각보다 두껍고 오래 입을수 있응고같애요~|~~~,Free
HB4hJIBl,,23.11.23,그레이(기모ver.),,생각보다 커요,아주 만족해요,화면과 비슷해요,170,56,55,맨투맨 완전 만족해요!! 키큰 저한테도 오버하게 떨어지고 핏도 귀엽고 좋아여 ㅠㅠ!! 기모도 폭닥하니 따뜻하고 만족합니다!!,Free
HMc4nefq,,23.11.22,그레이(기모ver.),,정사이즈예요,아주 만족해요,화면과 비슷해요,162,56,66,친구랑 트윈룩으로 입으려고 샀는데 너무 예뻐요 ㅎㅎ 색상도 홈페이지랑 같구요 또 따뜻해요 이렇게 예쁜 옷 만들어주셔서 감사합니다,Free
채채96,상위 30%,23.11.21,그레이(기모ver.),,생각보다 커요,보통이에요,화면과 비슷해요,160,55,55,"핑크목도리랑 같이 코디해서 입으려고 구매했어요!
기모티라서 도톰하고 따뜻해요
그래도 안에 이너는 꼭 입어야해요!!",Free
채채96,상위 30%,23.11.21,베이비핑크(기모ver.),,생각보다 커요,보통이에요,화면과 비슷해요,160,55,55,"생각한거보다 더 사이즈가 크기는 해요
기모티라서 두껍고 핏이 안예쁘지만..
색상이 너무 예뻐서 입고다닙니다!!
존예핑꾸",Free
nFpI99IM,,23.11.20,베이비핑크(기모ver.),,생각보다 커요,아주 만족해요,화면과 비슷해요,161,67,88,"자수예뿜
칼라예뿜
기모 두툼하게 들어가 있어서 따숩고 좋아요! 
겨울맨투맨은 이것만 주구장창 입을꺼같애욬ㅋㅋㅋㅋ",Free
Aha8DOTX,,23.11.19,백메란지(기모ver.)(오늘출발),,정사이즈예요,아주 만족해요,화면과 비슷해요,155,51,55,"톡톡한 재질의 시보리 탄탄맨투맨이고
안에 이너 입을수 있을 정도로 품위가 낙낙해요~!
겨울에 아우터 안입고 이너만 여러개 입고 입으려고 구매했어요! 강추-!",Free
CCWt20DU,,23.11.18,그레이(기모ver.),,정사이즈예요,보통이에요,화면과 비슷해요,160,57,55,맨투맨 진짜이뻐요ㅠㅠ 오버핏이고 기모도 있어서 따뜻한데 겨율에 입을때는 살짝 추울꺼 같아요 근데 안에 패딩이랑 입으면 이뿝니당ㅎㅎ 튼튼하고 다른색아로 주문 더 할려고요,Free
6Jq5nO1K,,23.11.17,베이비핑크(쮸리ver.)(오늘출발),,생각보다 커요,아주 만족해요,화면과 비슷해요,,,,"키가 큰데도 옷이 살짝 크네요
편하게 많이 입힐것 같아요~
색상은 화면과 같아요 아주 예쁜 핑크입니다 ㅎㅎ
맨투맨 맛집이어요",Free
iNBUrR6g,,23.11.15,그레이(기모ver.),,정사이즈예요,아주 만족해요,화면과 비슷해요,177,71,66,완전 맘에 들어요. 원래 맨투맨 잘 안입는데 이건 핏이 너무 예뻐요 ! 키가 커서 짧긴하지만 그래도 시중 맨투맨 중에 제일 핏 예쁜거같아요! 오트밀두 추가로 주문해써용,Free
