아이디,리뷰어 등급,작성 날짜,옵션1,옵션2,상품 사이즈,퀄리티,색감,키,몸무게,사이즈,리뷰내용,제품_사이즈
iWJdEMhe,,23.11.14,그레이(기모ver.),,생각보다 커요,보통이에요,화면과 비슷해요,163,47,44,디자인 딱보고 맘에 들어서 바로 질렀어요ㅎㅎ 근데 옷 핏이 좀 애매하게 웃긴 ..? 느낌 ? 허리 밴딩이 짱짱한데 옷 폭이 많이 넓어서 배 부분이 붕떠서 좀 웃겨요ㅠㅠ,Free
nvpWimzS,,23.11.13,베이비핑크(기모ver.),,정사이즈예요,보통이에요,화면과 비슷해요,166,56,55,트레이닝바지랑 모델이 입은거랑 똑같이 샀는데 화사해보이고 두툼해서 엄청따듯해요 핑크색 잘안입는데 모델핏보고 이뻐서 샀는데 맘에드네용 ㅎㅎ,Free
Bm5GA12z,,23.11.12,베이비핑크(쮸리ver.)(오늘출발),,생각보다 커요,아주 만족해요,화면과 비슷해요,162,54,55,"간절기에도 입고싶어서 기모없는거로 샀는데 왕만족 
사이즈는 생각보다 컸는데 편하게 휘뚜루마뚜루 입기 좋아요 
색깔 예뻐요~~~~",Free
GBeBpNL1,,23.11.11,그레이(기모ver.),,생각보다 커요,아주 만족해요,화면과 비슷해요,163,60,55,"헹 넘 귀여움 왕강추에요

부드럽고 오버핏인데 넘 이뻐요!!!!
다른 맨투맨도 같은 퀄리티면 여러개 사고 싶어요~~~",Free
MMt1BjoI,상위 20%,23.11.11,베이비핑크(기모ver.),,생각보다 커요,아주 만족해요,화면과 비슷해요,,,,"귀여워요!!! 생각보다 더 아방한 핏이고, 기모가 따뜻해요 😊 옷을 두 번 빨았는데도 기모가 묻어나오더라구요 그래도 만족해요",Free
XxlnBcuc,,23.11.10,베이비핑크(기모ver.),,생각보다 커요,아주 만족해요,화면과 비슷해요,165,63,55,몸이 많이 커보여요홓ㅎㅎㅎ 팔은 길어서 좋아요! 마르신분이 입어야 긔여울듯ㅎㅎ그래도 색깔은 진짜 이쁩니당 과하지 않은 핑크에요!!,Free
wXXBCqIW,,23.11.09,오트밀(기모ver.),,생각보다 커요,보통이에요,화면과 비슷해요,166,60,66,"생각보다 더 커서 건조기 한번 돌렸어요 ㅎㅎ
전체적으로 손목이랑 목 부분도 
시보리거 짱짱하고 재질도 죠아효",Free
E1t1jNwY,,23.11.08,베이비핑크(쮸리ver.)(오늘출발),,생각보다 커요,보통이에요,화면과 비슷해요,164,59,66,귀여운 핑크색이에요 두껍지 않아서 겨울에 이너로 입기 좋습니당 근데 생각보다 품이랑 어깨가 크긴하고 저한테는 길이감이 엉덩이가 부각되긴 해오ㅠ,Free
a9TMQd0O,,24.12.10,베이비핑크(기모ver.)(오늘출발),,생각보다 커요,보통이에요,화면과 비슷해요,160,57,55,생각보다 크지만 이렇게 크게 입는것도 나쁘지않은거같아요!!! 색깔도 이쁩니다 ㅎㅎ 다만 한번 빠니까 목이 조금 쭈글쭈글 ㅠㅠ속상합니당 ㅠㅠㅠㅠ,Free
mPvofgXS,,23.12.18,베이비핑크(기모ver.),,생각보다 커요,아주 만족해요,화면과 비슷해요,,,,진짜 너무 도톰하구 기엽구.... 그레이랑 핑크중에 고민하다 핑크 구매했는데 기모없는거로 다른색 구매하려구요.. 진짜 실물 너무 예뻐용ㅠㅠ,Free
L2KPDblJ,,23.12.04,오트밀(기모ver.),,생각보다 커요,아주 만족해요,화면과 비슷해요,153,41,55,"스코트랜드 맨투맨 완전 맘에 들어서
하나씩 사 모으다 보니
전 컬러 다 구입했네요-
그만큼 만족스럽고, 요즘 돌려가며 거의 매일 입고 있어요-",Free
VNVesuxS,,23.12.03,그레이(기모ver.),,생각보다 커요,아주 만족해요,화면과 비슷해요,153,60,66,"아방핏, 따수고 좋아요^^ 핑크색이랑 고민 많이 했는데 그레이 하길 잘한듯용~옷 매치하기 쉬워서^^",Free
크맘,상위 15%,23.12.02,백메란지(기모ver.),,생각보다 커요,아주 만족해요,화면과 비슷해요,158,53,55,딱원하는 컬러구 넘이뻐여 오버핏으로 입기주아유 안에 티입고 낮에는 이것만입어두 안추우워용~~~넘넘추천드립니다,Free
YULsmY2V,,23.12.01,베이비핑크(기모ver.),,정사이즈예요,아주 만족해요,화면과 비슷해요,163,50,55,"색상도 넘 이쁘고 제가 원하던 핏이에요~ 
기모라 지금 입기 딱 이네요 따뜻하고 
좋아요 👍🏻",Free
MVktoZZr,,23.11.25,베이비핑크(기모ver.),,생각보다 커요,보통이에요,화면과 비슷해요,161,48,44,색깔이 너무 예뻐요. 겨울에도 산뜻하게 입을 수 있을 것 같습니다 다른 컬러도 예쁜 게 많아서 또 구입할까 고민이 됩니다. 잘 입을게요,Free
소녀다,,23.11.24,베이비핑크(기모ver.),,정사이즈예요,아주 만족해요,화면과 비슷해요,167,60,66,"시진을
제가 개떡같이 찍었지만 받자마자 오 예쁘다 하고 육성으로 나왓답니다 다른색을 구매해도 좋겟어요 
안에 기모 되어있고 따뜻하네요 감사해요",Free
L2KPDblJ,,23.11.17,그레이(기모ver.),,생각보다 커요,아주 만족해요,화면과 비슷해요,153,41,55,"제 체구에 많이 크긴 한데.. 예쁘게 커서 맘에 들어요-
그리고 컬러가 그냥 예술!!!
넘 맘에 들어서 모코블링의 모든 맨투맨이 갖고싶어지네요-^^",Free
xbDlH15V,,25.01.05,그레이(기모ver.)(오늘출발),,생각보다 커요,아주 만족해요,화면과 비슷해요,,,,"기모아닌 제품도 입고있는중
색상이 많이 없어서 아쉬워요
재질도 좋고 이집 맨투맨 최고!!",Free
4cRK5uIh,,24.11.19,베이비핑크(기모ver.)(오늘출발),,정사이즈예요,보통이에요,화면과 비슷해요,157,49,55,옷이 진짜 크네요 일단 팔도 너무 길고 키작녀에겐 더 키가 작아보이는 효과를 주지만 그냥 따뜻하고 편하게입을수잇어서좋아요,Free
RGmR0KWs,,24.10.12,그레이(기모ver.)(오늘출발),,생각보다 커요,아주 만족해요,화면과 비슷해요,168,53,55,"폼도 넉넉하니 좋아요!!! 이쁘고 좋습니당 암튼
꼭 사시길!!
기모라 따뜻하고 지금입기엔 낮엔.덥고 밤엔 딱 좋아요!",Free
UMOoKuN1,,24.02.03,오트밀(기모ver.),,생각보다 커요,아주 만족해요,화면과 비슷해요,162,50,55,"진짜 잘 입고 있어요
사이즈가 약간 크기는 하지만 색도 마음에 들고 핏도 예쁩니다 꾸쥰히 잘 입도록 할게요
고민하시는 분들 구매하세요~",Free
ZLpMCX27,상위 10%,24.01.30,그레이(기모ver.),,생각보다 커요,보통이에요,화면과 비슷해요,170,55,55,"기모가 들어가있어서 완전 따뜻하고 오버핏 왕왕한 느낌이에용
사진이랑 완전 똑같아요 
완전 만족만족만족입니다요ㅎㅎㅎㅎ",Free
KxS3Uv1x,,24.01.23,그레이(기모ver.),,정사이즈예요,아주 만족해요,화면과 비슷해요,162,53,55,로켓배송 바로 다음날 왔어요 로킷배송이에요 옷도 탄탄하고 너무 좋아요 단 냄새가 조금나거 빨아거 입어야할것같아오!,Free
EJhHNwVU,상위 15%,23.12.21,오트밀(기모ver.),,생각보다 커요,보통이에요,화면과 비슷해요,158,46,44,"쭈리제품 너무잘입어서 기모도 사봤는데
핏은 쭈리가 더 예뻐요 아래시보리로 떨어지는부분이 좀 풍선같아요
잘입을게영",Free
T8trVf6i,,23.12.16,그레이(기모ver.),,생각보다 커요,보통이에요,화면과 비슷해요,,,,색감은 예쁜데 상상하지 못한 완전 가오리 핏이예요 와우 반품하기 귀찮아서 일단 뒀는데 밖에 한번도 못 입고 나갔어요 언젠간 입겠죠….,Free
S0Fs9ZxI,,23.12.10,베이비핑크(기모ver.),,정사이즈예요,아주 만족해요,화면과 비슷해요,168,50,55,엄청 따뜻하고 편해서 요새 계속 이거만 입고 다녀요. 건조기 돌려도 안줄어들어서 좋아요. 후기 좋은건 역시 이유가 있네요~,Free
7S7iB4Nh,,23.12.09,그레이(기모ver.),,생각보다 커요,아주 만족해요,화면과 비슷해요,158,45,44,"후기에 크다는건 마니바서 감안했어용
박시하게 기엽게 입기 좋아용ㅎㅎ
퀼리티도 시보리도 짱짱하고 기모라 따뜻해요~",Free
90**,,23.12.07,베이비핑크(기모ver.),,생각보다 커요,보통이에요,화면과 비슷해요,167,52,55,"옷이 너무 커요...ㅠㅠ
제가 키도 작은편이 아니고 어깨가 넓은편이라 체중에 비해 덩치가 있어보이는데
이거 입으니까 엄마가 옷이 너무 크다고 저 둘셋은 더 같이 입을수 있겠데요ㅋㅋ
팔길이라 총장길이는 괜찮은데 품이크고 가오리핏이라 더커보이고 왕덩치가 되요
너무 크다보니 옷도 붕떠서 바람이 안으로 들어가니 안에 이너 꼭 받쳐입어야하고 겉옷 입으면 안에가 붕뜨고 부해서 불편해요...",Free
8iQ1v7ff,,23.12.02,베이비핑크(기모ver.),,생각보다 커요,보통이에요,화면과 비슷해요,160,45,44,색상은 화면과 비슷한데 원단은 생각보다 부드럽지는 않은 것 같아요~ 그래도 휘뚜루마뚜루 입기엔 괜찮을 것 같습니당 잘 입을게요!,Free
Sigx11kG,,23.12.02,오트밀(기모ver.),,생각보다 커요,보통이에요,화면과 비슷해요,163,51,55,어제 오전인가 주문했는데 바로 다음날인 오늘 도착했어요! 아방하니 포근하고 예뻐요 팔이 꼬ㅐ 길지만 올겨울 잘입을것 같아요,Free
dmsd******,,23.11.18,베이비핑크(쮸리ver.),,정사이즈예요,보통이에요,화면과 비슷해요,154,54,55,이쁩니당 좋아하는 핑쿠핑쿠><ㅋㅋㅋ 사이즈도ㅠ넉넉하고 따뜻해욤 !!! 여러용도로 활용하며 입을 수 있을거같아용,Free
5czLwjlM,,23.11.17,베이비핑크(쮸리ver.),,정사이즈예요,보통이에요,화면과 비슷해요,155,52,44,핑꾸 핑꾸한게 아주 제맘에 쏙 듭니다 제가 핑크를 조아해서 아주 만족하는 옷입니다 ㅎㅎㅎ 이쁘게 코디 할 수 있을것같아요~~,Free
6KsAz6lm,,23.11.16,베이비핑크(쮸리ver.)(오늘출발),,정사이즈예요,아주 만족해요,화면과 비슷해요,161,57,66,"역시 모코블링 맨투맨 맛집!!!디자인 실화인가요?ㅜㅜ
여기서 옷사면 다른데서 못사여 ㅜㅜ
퀄리티 부터 소재까지 대박이에요!!!ㅜㅜ",Free
Tk3p9pDi,,23.11.07,베이비핑크(기모ver.),,생각보다 커요,보통이에요,화면과 비슷해요,164,55,55,"후기보고 따듯한 맨투맨 사고 싶어서 샀는데 어벙한 핏이지만 무난하게 입기에 좋은거 같아요
출퇴근 휘뚜루 마뚜루 입으려고 샀는데 만족합니다
잘입을게요!!",Free
9M3Rk40L,,23.11.07,베이비핑크(기모ver.),,생각보다 커요,아주 만족해요,화면과 비슷해요,160,50,44,"생각보다 품이 너무 커서 사실 조금 어깨깡패에 좀 뚱뚱한 거 같기도 해요‘ㅠ 
그치만 색감이 너무 예뻐서 안 입을수가 없어요",Free
HbPPkO4N,,24.02.07,베이비핑크(기모ver.),,정사이즈예요,보통이에요,화면과 비슷해요,161,55,55,"이런맨투맨 한참입다가 자주빨고입었더니 빳빳해져서 안녕했는데 이건 컬러가미쳐서 안살수가없었어요 아직 실싱활에안입어봣지만 그냥봤을댄 이쁩니다 핑크 너무조아하는디 입어보니깐 다들 니꺼네
하더라고요 핑덕분들 사세요",Free
k8Sk77UY,,24.01.10,그레이(기모ver.),,생각보다 커요,아주 만족해요,화면과 비슷해요,163,49,44,평소 안입는 스타일이라 걱정했는데 너무 이뻐요 . 상체 살이 없어서 맨투맨이나 이런거 입으면 없어보이는데 이건 안그래보여 좋네요 ㅋㅋ 핑크도구매할려구요 ㅋㅋㅋ,Free
xlnNKXk5,상위 15%,23.12.11,베이비핑크(기모ver.),,생각보다 커요,아주 만족해요,화면과 비슷해요,163,50,55,사이즈가 꽤 커요 체구작으신분들은 진짜 너무 클듯 색은 이쁘고 여기저기 출근룩 마실룩 딱 쥬아용,Free
L2KPDblJ,,23.12.01,백메란지(기모ver.),,생각보다 커요,아주 만족해요,화면과 비슷해요,153,41,55,"모코블링의 맨투맨 너무 맘에 들어서
디자인별, 컬러별로 하나씩 야금야금 사 모으고 있어요. 
일주일내내 모코블링 맨투맨만 돌려입고 있는 요즘이에요. ㅋ",Free
YIxefR7r,,23.12.01,베이비핑크(기모ver.),,생각보다 커요,아주 만족해요,화면과 비슷해요,158,49,44,아방오버핏으로 넘 이뻐요 컬러도 딸기우유색으로 맘에 들어요 잘 입을께요 같이 주문한 그레이 컬러도 빨리 왔으면 좋겠어여,Free
불다람쥐,,23.11.26,그레이(기모ver.),,생각보다 커요,아주 만족해요,화면과 비슷해요,158,49,44,"진짜 오버오버핏 아방한 맨투맨입니다
기모가 따뜻하고 전체적으로 여유로워서 편해요
무엇보다 분홍색 실 자수가 예쁩니다",Free
1nXa7yxD,,23.11.26,그레이(기모ver.)/오늘출발,,정사이즈예요,보통이에요,화면과 비슷해요,,,,"마음에 들어요
요즘도 편하게 잘 입고 다니고 있어요
색상도 예쁘고 디자인도 예뻐요
옷도 가볍고 글자디자인도 화면과 똑같아요",Free
ZzsfvLlQ,,23.11.19,베이비핑크(기모ver.),,생각보다 커요,보통이에요,화면과 비슷해요,160,57,66,주문 폭주라서 배송이 좀 느리게 오긴 했는데 상품아주 만족스러워영 기모라서 대박 따듯하고 도톰한 아방핏이라서 입으면 기분이 좋아여,Free
X06CcDQH,,24.11.09,그레이(기모ver.)(오늘출발),,정사이즈예요,아주 만족해요,화면과 비슷해요,163,62,66,모코블링은 맨투맨맛집입니다 완전마음에들어요 기모여서따듯하고요 굳입니다요 요즘너무잘입고있습니당 맨투맨은 무조건 모코블링,Free
dyWBurx6,,24.06.27,3%그레이(쮸리ver.),,정사이즈예요,보통이에요,화면과 비슷해요,158,46,44,"넘나 이뻐서 컬러별로 두벌을 주문했네요
낙낙하게 오버핏으로 입기에 핏이 이쁘게 잘나와서 만족해요",Free
wMdghxBc,탑리뷰어,24.04.06,베이비핑크(기모ver.)(오늘출발),,생각보다 커요,보통이에요,화면과 비슷해요,154,52,55,다음날 바로 받아볼 슈 있어서 좋았어요 사진이 넘 밝게 나와서 연하게 보이지만 딸기우유보다 조금 진한 색상으로 화면과 같아서 이뻐용,Free
X5MfE6e9,상위 30%,24.01.10,그레이(기모ver.),,정사이즈예요,보통이에요,화면과 비슷해요,164,55,66,이뻐요 ㅎㅎ 다른 컬러도 사고 싶을정도로요 길이감도 딱 적당합니당 ^^ 조거팬츠에 입기 딱 좋아요 컬러별 고민 됩니다 !!,Free
cGGJjDAQ,상위 30%,24.01.03,백메란지(기모ver.),,정사이즈예요,아주 만족해요,화면과 비슷해요,163,48,55,전에 같은 옷 회색으로 구매했었는데 넘넘 만족해서 백메란지 색도 구매했어용!! 역시나 예쁘고 질도 좋아서 만족합니당 :),Free
XbGWF6nU,상위 5%,23.12.21,그레이(기모ver.),,생각보다 커요,아주 만족해요,화면과 비슷해요,161,75,66,"복닥하고 사이즈도 훌루루룰 낙낙하고 ~~ 
이뻐서 언니꺼보고 제껄로 하나 더 겟했는데 겨울에 잘 입어질것 같어요~~ 넘 잘입을게요",Free
eajrVXhN,,23.12.07,백메란지(기모ver.),,정사이즈예요,아주 만족해요,화면과 비슷해요,168,54,55,"이 가격에 이 퀄에라니 ….. 두개 살껄!!!!
깔 별로 쟁이고 싳습니다
이런 적당한 기모 찾기가 어려워용",Free
wGbcCgLp,,23.11.27,오트밀(기모ver.),,생각보다 커요,아주 만족해요,화면과 비슷해요,173,60,66,디자인 예뻐서 하나 더 샀어요 빨래 하니까 줄긴 하더라구오 ㅜ 그래도 디자인 굿굿 안에 기모도 거 따뜻해요 ㅔ,Free
YUTmS80B,,23.11.27,그레이(기모ver.),,정사이즈예요,아주 만족해요,화면과 비슷해요,158,55,55,생각했던거보다. 더 귀여워요 조금 짧아서 야악간 아쉬운데 만족 스러뤄요 ♡。·˚˚· ·˚˚ 휘뚜루마뚜루 막 입어질거 같아요,Free
sIKsX45C,,23.11.19,베이비핑크(기모ver.),,,,,,,,와이프 착샷 + 토리 입니다. ㅋㅋㅋㅋ귀여우신분들이 입으면 큐티큐티 합니다. 적극츄천합니다. 겨울이라 기모로 신청하시면 따듯해용,Free
WGtgZTgM,상위 25%,23.11.07,베이비핑크(기모ver.),,생각보다 커요,아주 만족해요,화면과 비슷해요,152,58,66,색감은 판매처와 같은데 제가 찍은 게 좀 더 연하게 나온 듯하네요~ 안에 기모가 한번 세탁했는데 뭉치는 느낌이 있어요!!,Free
AyHXxOwl,,24.11.05,그레이(기모ver.)(오늘출발),,정사이즈예요,아주 만족해요,화면과 비슷해요,161,45,44,너무기엽고 따뜻해요 마감이나 디테일도 좋구요! 다른색상도 구입할 예정이예요,Free
kq9HTonB,,24.02.06,그레이(기모ver.),,생각보다 커요,아주 만족해요,화면과 비슷해요,165,60,66,"화면과 색상은 동일하고 옷 예뻐요~
다만, 팔이 엄청 기네요 ㅋㅋ 
전 크게 입는거 좋아해서 큰 상관없이 잘 입을것같아용~~",Free
YIxefR7r,,23.12.05,그레이(기모ver.),,생각보다 커요,아주 만족해요,화면과 비슷해요,158,49,44,아방오버핏으로 넘 이뻐요 핑크 배색 때문에 핑크 트레이닝 바지랑 너무 잘 어울려요 편해서 손이 자주 갈꺼 같아요 잘 입을께요,Free
BLLBv5JT,,23.11.25,그레이(기모ver.)/오늘출발,,정사이즈예요,아주 만족해요,화면과 비슷해요,155,50,55,"가오리핏에 넘 예뻐요💓💓
따뜻해서 겨울에도 잘 입을것 같아요!
근데 팔 길이가 생각보다 더 길어요 하지만 귀얍습니다^^",Free
mTtDhIcb,상위 15%,23.11.24,베이비핑크(기모ver.),,정사이즈예요,보통이에요,화면과 비슷해요,170,50,44,"색이 왜 이렇게 나와왔지 ㅠㅠ 실제론 훨씬 예쁜 연핑크에요 사진이 색상이 좀 이상하게 나왔는데
이거 그레이 먼저사고 맘에 들어서 핑크 재구매한겁니당 ㅎㅎ",Free
HyUThX2K,,23.11.17,베이비핑크(기모ver.),,정사이즈예요,아주 만족해요,화면과 비슷해요,170,53,55,"색도 너무예쁘고 깔끔하고 소매가좀 긴편이어서 너무만족하게 입는 옷입니다!
색다르게 또사고싶은데 참고있어요.^^",Free
yale*****,,24.11.01,베이비핑크(기모ver.)(오늘출발),,생각보다 커요,아주 만족해요,화면과 비슷해요,174,70,77,"핑크 이뻐요.
품질 좋고
디자인
가격 모두 만족해요.",Free
N09U452k,,24.04.15,소라(쮸리ver.),,생각보다 커요,별로예요,화면과 비슷해요,158,78,55,옷자체 재질이 좋은 건 아니에요 그래도 멀리서 보면 색감이 예뻐서 맘에들어요!!,Free
dqdtfcy4,,24.03.03,그레이(기모ver.),,정사이즈예요,아주 만족해요,화면과 비슷해요,158,57,66,"그레이색 샀는데 중간에 포인트 색이 들어가있어서 귀여운 느낌도 들고, 옷도 핏이 예뻐요",Free
RcCzQiSG,,24.01.13,그레이(기모ver.),,정사이즈예요,보통이에요,화면과 비슷해요,163,47,55,넘 예뻐오 ! 다른색상도 사고플 만큼 이쁩니드 ㅎㅎ히히 핏도 굿입니다용 굿 ㅎㅎ 색감도 구우수우수수ㅜㅜㅜ!! 160입니당,Free
ZOoyAfrt,,24.01.02,그레이(기모ver.),,생각보다 커요,아주 만족해요,화면과 비슷해요,160,49,55,"너무 이뻐서 색 두가지샀어요 
요새 크롭이 많아서 짜증낫는데 길이도 딱좋고 재질도 좋고 핏도 너무좋아요!",Free
uapyycaO,,23.12.20,그레이(기모ver.),,정사이즈예요,아주 만족해요,화면과 비슷해요,160,50,55,"정말 잘산거같아요!
모델이 입고 있는 핑크 바지도 사고싶었는데 없어서 다른곳애서 핑크츄리닝 사서 같이 입고다니는 중입니당
불편한점은 안에 내복입으면 다 달라붙어요 ..ㅠㅠ돌돌이 필수입니다",Free
일랑일랑,상위 5%,23.12.16,그레이(기모ver.),,생각보다 커요,아주 만족해요,화면과 비슷해요,162,58,55,샹각보다 크네요 박시하게 입어야겟습니다.77-88까지도 맞을 듯싶어요 ㅔ진짜 큽니다 퀄리티는 엄청 가격대비 너무 좋은 먄트맨입니다,Free
OG1iN5w8,,23.12.09,오트밀(기모ver.),,생각보다 커요,아주 만족해요,화면과 비슷해요,155,50,55,생각보다 길지만 겨울에 두툼하고 따뜻할것 같아요!!! 자수도 너무 고퀄이라 꾸안꾸로 너무 좋아요,Free
ycjd****,상위 5%,23.12.07,베이비핑크(기모ver.),,정사이즈예요,보통이에요,화면과 비슷해요,160,50,55,왜 핑크가 예뻐보엿는제ㅜㅜㅋㅋㅋ기본 컬러보다 이런 컬러가 갖구싶어서 사봤어용 모코 맨투맨은 느루사진이 넘 이뻐서 갖구싶어여,Free
AFAOSwtc,,23.12.07,그레이(기모ver.),,생각보다 커요,아주 만족해요,화면과 비슷해요,165,58,66,"부드럽고 따뜻해요 편하고 너무 예뻐요
배송도 빨리오고 입으면 엉덩이 덮는 기장이라 딱 좋아요",Free
5mTSi5VU,,23.12.05,베이비핑크(기모ver.),,생각보다 커요,보통이에요,화면과 비슷해요,165,49,55,"짱예쁨! 색도 핏도 아주 조음! 아래 시보도 짱짱함! 뭘 입어도 잘어울릴것같아여
넘 예뻐서 다른색도 구매할까 고민중이에요",Free
05cmtIWt,,23.12.01,베이비핑크(기모ver.),,생각보다 커요,보통이에요,화면과 비슷해요,159,58,55,"생각ㅂㅎ다 크기는 컸지만 마음에들어요 ㅎㅎ잘입을게요^^색상도 너무 마음에들어요~
좀 크게 입는거 좋아하시는분들께도 추천드랴요",Free
34DE1nRd,,23.12.01,오트밀(기모ver.),,생각보다 커요,아주 만족해요,화면과 비슷해요,163,54,66,두툼하니 따뜻하고 아방한 핏이 예뻐요! 다만 사이즈가 너무 크긴해요ㅎㅎ그래도 마음에 듭니다!,Free
jkitkURX,,23.11.30,그레이(기모ver.),,정사이즈예요,아주 만족해요,화면과 비슷해요,166,54,66,똑같은거 오트밀색상도 있어서 그레이/핑크 색상도 구매했어요~진짜 따뜻하고 재질이 좋아요!,Free
R0VfLiLZ,,23.11.18,베이비핑크(기모ver.),,정사이즈예요,아주 만족해요,화면과 비슷해요,164,51,55,"퀄리티 좋아요 색상도 화면이랑 같아요 
오버핏이라 원하던 핏이고 살짝 크롭한기장이라 더맘에들어요",Free
R0VfLiLZ,,23.11.18,백메란지(기모ver.)(오늘출발),,생각보다 커요,아주 만족해요,화면과 비슷해요,164,51,55,"퀄리티 좋아요 색상도 화면이랑 같아요 
오버핏이라 원하던 핏이고 살짝 크롭한기장이라 더맘에들어요",Free
KiqHAzeC,,23.11.12,베이비핑크(기모ver.),,생각보다 커요,보통이에요,화면과 비슷해요,,,,"배송 빠릅니다
기모라서 따뜻하고 사이즈는 생각보다 커서 놀랬지만..
날씨추워지고 안에 여러겹 입을 수 있어서 오히려좋아요",Free
JRyrBOUT,,23.11.11,오트밀(기모ver.),,생각보다 커요,보통이에요,화면과 비슷해요,165,55,55,"질이 진짜 좋네요ㅎㅎ
컬러별로 다 구매하고싶어요!
질이 진짜 좋네요ㅎㅎ
컬러별로 다 구매하고싶어요!
나중에 또 구매할게요!",Free
JRyrBOUT,,23.11.11,베이비핑크(기모ver.),,생각보다 커요,보통이에요,화면과 비슷해요,165,55,55,"질이 진짜 좋네요ㅎㅎ
컬러별로 다 구매하고싶어요!
질이 진짜 좋네요ㅎㅎ
컬러별로 다 구매하고싶어요!
나중에 또 구매할게요",Free
eFRf2vmF,,23.11.11,그레이(기모ver.)/오늘출발,,정사이즈예요,보통이에요,화면과 비슷해요,167,47,55,생각보다 톡톡하고 커요(?)사이즈가 크다기보다 자칫하면 덩치커보여용ㅋㅋ마른편이라 괜찮았는데 통통하신분들께는 비추입니당ㅋㅋ,Free
qg8BEGz6,,24.03.21,그레이(기모ver.)(오늘출발),,정사이즈예요,아주 만족해요,화면과 비슷해요,164,50,55,"모코블링 맨투맨 지난번에 하나 구매하고 가을겨울내내 잘입어서 하나 더 주문햇습니다
핏도 길이도 아방하니 너무 만족스러워요!!",Free
kBKHAjBo,,24.01.15,그레이(기모ver.),,생각보다 커요,아주 만족해요,화면과 비슷해요,166,58,66,"빠른배송도 맘에들고
색상이나 핏 모두좋아요
여유있게 잘 맞아요
여행때 잘 입을것같아요",Free
2mOKUUlf,,24.01.08,오트밀(기모ver.),,정사이즈예요,아주 만족해요,화면과 비슷해요,165,53,55,좋아요 두툼하고 원하던 핏이라 거의 교복임 이거랑 다른맨투맨 삿는데 두개 다 폭닥폭닥거려서 조거팬츠랑 같이 입으먼 꿀귀요미,Free
MSkMfSxt,,23.12.28,그레이(기모ver.)(오늘출발),,생각보다 커요,보통이에요,화면과 비슷해요,172,55,55,"생각보다 좀 많이 박시하네요
퀄리티나 디자인은 괜찮아요
운동갈때나 집 앞에 나갈때 입으려구요
전체적인 품만 조금 줄어도 더 이쁠 것 같아요",Free
scLkhzXT,,23.12.07,베이비핑크(기모ver.),,생각보다 커요,보통이에요,화면과 비슷해요,161,61,66,아들이랑 동생이랑 커플로 입으려고 구매했어요 아이껀 아직 오지않아서 같이 찍어보지못했네요 아직 입어보진않앟지만색감도 예쁘고 아들이랑같이 입을생각하니 벌써부터 설레네요^^,Free
aTUo96PX,,23.11.23,그레이(기모ver.),,정사이즈예요,보통이에요,화면과 비슷해요,158,44,44,"너무너무 마음에 듭니다 다른 색도 사고 싶어요~!
그리고 제 사이즈에 살짝 오버핏이라 더 마음에 듭니당",Free
